Property_ID,Listing_Title,Property_Type,Listing_Type,Created_F,Created,Scraped_F,Scraped,Latitude,Longitude,Airbnb_PID,Airbnb_HID
ab-10458,Whistler Ski Resort Condo,Entire apartment,Entire home/apt,9/5/09,2009-09-05,3-19-18,2018-03-19,50.12143208,-122.9586629,10458,30033
ab-15878,Luxury Whistler Village Town Home by the Village,Townhouse,Entire home/apt,12/13/09,2009-12-13,5-21-19,2019-05-21,50.11927,-122.95899,15878,62115
ab-17178,2 bedrm townhome- Heart o' Whistler,House,Entire home/apt,12/30/09,2009-12-30,8-1-18,2018-08-01,50.11859644,-122.9574391,17178,66580
ab-18389,Alpine Whistler Vacation Rental in the Village,Apartment,Entire home/apt,1/12/10,2010-01-12,5-24-19,2019-05-24,50.11776,-122.95801,18389,70868
ab-18483,Whistler Creekside Skiers/Bikers Townhouse,Townhouse,Entire home/apt,1/13/10,2010-01-13,5-22-19,2019-05-22,50.09801,-122.98589,18483,71182
ab-20633,"Luxury townhome, Walk to everything",Apartment,Entire home/apt,2/6/10,2010-02-06,5-23-19,2019-05-23,50.12156,-122.95444,20633,77624
ab-61742,Mountain/Lakeview Cabin - up to 12,House,Entire home/apt,11/24/10,2010-11-24,8-17-17,2017-08-17,50.11124413,-122.9742805,61742,299349
ab-6520686,WHISTLER PH 406~Ski-In/Ski-Out~Aspens on Blackcomb,Condominium,Entire home/apt,5/22/15,2015-05-22,5-22-19,2019-05-22,50.11634,-122.94507,6520686,23468733
ab-130828,Spacious Whistler Village Studio ,Apartment,Entire home/apt,5/29/11,2011-05-29,12-30-16,2016-12-30,50.11766775,-122.9577093,130828,643862
ab-140424,Glaciers Reach ~ 2BD Village Condo w/Hot Tub,Apartment,Entire home/apt,6/9/11,2011-06-09,5-24-19,2019-05-24,50.1217,-122.95889,140424,683972
ab-9878790,'Sunpath' - 1 Bedroom w/ pool & hot tub access,Townhouse,Entire home/apt,12/7/15,2015-12-07,5-25-17,2017-05-25,50.11645289,-122.9590081,9878790,35393628
ab-9880104,Intrawest Resort Whistler,Condominium,Entire home/apt,12/7/15,2015-12-07,5-23-19,2019-05-23,50.11631,-122.94708,9880104,50834004
ab-15392560,Beautiful Whistler villa for rent,Villa,Entire home/apt,10/5/16,2016-10-05,11-25-16,2016-11-25,50.10615427,-122.9699052,15392560,17964475
ab-9886218,Sunpath 1Br Central Village,Townhouse,Entire home/apt,12/7/15,2015-12-07,5-21-19,2019-05-21,50.11845,-122.9579,9886218,41850542
ab-11337901,The Perfect Mountain Retreat,Apartment,Entire home/apt,2/16/16,2016-02-16,5-25-19,2019-05-25,50.11302,-122.95495,11337901,19254342
ab-162930,"Spacious 3BR Townhouse, Free Shuttle to Skiing",Townhouse,Entire home/apt,7/4/11,2011-07-04,5-24-19,2019-05-24,50.12103,-122.94109,162930,96453221
ab-11338976,Sundance-2,Condominium,Entire home/apt,2/16/16,2016-02-16,5-23-19,2019-05-23,50.09171,-122.9954,11338976,58385754
ab-11342013,Cascade Lodge - i-2,Condominium,Entire home/apt,12/19/16,2016-12-19,5-23-19,2019-05-23,50.11727,-122.95925,11342013,58385754
ab-9907078,1 Bedroom Forested Oasis,Condominium,Entire home/apt,12/9/15,2015-12-09,5-23-19,2019-05-23,50.11792,-122.95961,9907078,50942201
ab-7484228,#411 - Franz at Alpenglow,Condominium,Entire home/apt,7/20/15,2015-07-20,11-12-18,2018-11-12,50.11792875,-122.9569993,7484228,35146399
ab-9918741,Prime Village Location Ski In Ski Out by Harmony Whistler,Condominium,Entire home/apt,12/9/15,2015-12-09,5-23-19,2019-05-23,50.11463,-122.9535,9918741,35393628
ab-7495802,Lovely ski-in/out w pool & hot tub,Apartment,Entire home/apt,7/20/15,2015-07-20,7-21-17,2017-07-21,50.09361501,-122.989661,7495802,503312
ab-9920449,"VIEW, VIEW & more VIEW! Super quiet",Apartment,Entire home/apt,12/9/15,2015-12-09,5-25-19,2019-05-25,50.09423,-122.97961,9920449,30502792
ab-9922430,The Classic Cabin on the Alta Lake,Chalet,Entire home/apt,12/9/15,2015-12-09,3-16-19,2019-03-16,50.10858,-122.97724,9922430,51008208
ab-12611170,WHISTLER  Luxury Ski In/Out + Parking + HotTub,Apartment,Entire home/apt,4/21/16,2016-04-21,5-22-19,2019-05-22,50.09452,-122.99146,12611170,51027293
ab-9929364,Gorgeous Whistler property for rent,Villa,Entire home/apt,12/10/15,2015-12-10,12-13-15,2015-12-13,50.112022,-122.9946748,9929364,47031900
ab-11343749,Whistler Village Studio w.Fireplace,Townhouse,Entire home/apt,2/16/16,2016-02-16,5-21-19,2019-05-21,50.11634,-122.9551,11343749,31767892
ab-12623011,Ski in/ski out at Painted Cliff!,Apartment,Entire home/apt,4/22/16,2016-04-22,7-8-16,2016-07-08,50.11878634,-122.9413023,12623011,6733621
ab-9939538,Ski in Ski out-Apsens 332,Apartment,Entire home/apt,12/10/15,2015-12-10,4-21-19,2019-04-21,50.11644,-122.946,9939538,9450001
ab-12626265,Golden Dreams B&B: Black Bear Room,Bed and breakfast,Private room,4/22/16,2016-04-22,5-23-19,2019-05-23,50.12735,-122.96978,12626265,17046824
ab-9939840,Ski in Ski out-Aspens 444,Apartment,Entire home/apt,12/10/15,2015-12-10,12-25-16,2016-12-25,50.11496278,-122.9439194,9939840,9450001
ab-9940384,Ski in Ski out-Aspens 205,Apartment,Entire home/apt,12/11/15,2015-12-11,12-24-16,2016-12-24,50.11648777,-122.945207,9940384,9450001
ab-9942523,Ski in Ski out-Greystone 103,Condominium,Entire home/apt,12/11/15,2015-12-11,4-21-19,2019-04-21,50.11725,-122.94459,9942523,9450001
ab-9942844,"Ski-In Ski-Out, Greystone Lodge Unit 105",Condominium,Entire home/apt,12/11/15,2015-12-11,4-21-19,2019-04-21,50.11536,-122.94385,9942844,9450001
ab-9942943,Wonderful 3 Bedroom Whistler Chalet,House,Entire home/apt,12/11/15,2015-12-11,10-5-16,2016-10-05,50.12529638,-122.9491006,9942943,28217678
ab-9943058,Ski in Ski out-Greystone 107,Condominium,Entire home/apt,12/11/15,2015-12-11,12-25-16,2016-12-25,50.11585164,-122.9429044,9943058,9450001
ab-9943343,Ski in Ski out-Greystone 110,Condominium,Entire home/apt,12/11/15,2015-12-11,12-27-16,2016-12-27,50.11518925,-122.9447006,9943343,9450001
ab-9944544,Ski in Ski out-Greystone 213,Condominium,Entire home/apt,12/11/15,2015-12-11,12-24-16,2016-12-24,50.11633078,-122.9443737,9944544,9450001
ab-14724919,1 bedroom in Professional home,House,Private room,5/24/17,2017-05-24,5-21-19,2019-05-21,50.12907,-122.95016,14724919,7079554
ab-9945041,Ski in Ski out-Greystone 318,Condominium,Entire home/apt,12/11/15,2015-12-11,4-20-19,2019-04-20,50.11505,-122.94316,9945041,9450001
ab-9945282,Ski in Ski out-Greystone 313,Condominium,Entire home/apt,12/11/15,2015-12-11,12-23-16,2016-12-23,50.11571736,-122.9429172,9945282,9450001
ab-9951941,Creekside Two Bedroom Suite,Condominium,Entire home/apt,12/11/15,2015-12-11,4-11-19,2019-04-11,50.09896,-122.98538,9951941,25777071
ab-9952381,Great newly renovated luxury home,House,Entire home/apt,12/11/15,2015-12-11,7-29-17,2017-07-29,50.14225593,-122.9557138,9952381,25777071
ab-9953789,Ski in Ski out-Woodrun 109,Condominium,Entire home/apt,12/11/15,2015-12-11,12-27-16,2016-12-27,50.115759,-122.9439426,9953789,9450001
ab-9954126,Ski in Ski out-Woodrun 402,Condominium,Entire home/apt,12/11/15,2015-12-11,12-27-16,2016-12-27,50.1148255,-122.9429087,9954126,9450001
ab-9954336,Ski in Ski out-Woodrun 411,Condominium,Entire home/apt,12/11/15,2015-12-11,12-27-16,2016-12-27,50.11480263,-122.9428169,9954336,9450001
ab-9954518,Ski in Ski out-Woodrun 412,Condominium,Entire home/apt,12/11/15,2015-12-11,12-25-16,2016-12-25,50.11511688,-122.9423864,9954518,9450001
ab-14726994,"Heart of Whistler Village, Hot Tub, Parking, WiFi",Apartment,Entire home/apt,8/24/16,2016-08-24,5-23-19,2019-05-23,50.1143,-122.95707,14726994,91683939
ab-190260,Whistler Winter Wonderland,Apartment,Entire home/apt,8/3/11,2011-08-03,5-20-19,2019-05-20,50.11293,-122.97066,190260,918781
ab-7501843,#318 - 7th Heaven at Alpenglow,Apartment,Entire home/apt,7/20/15,2015-07-20,11-12-18,2018-11-12,50.11836129,-122.9562186,7501843,35146399
ab-19194637,3 bedroom Mountain Star for families!,Townhouse,Entire home/apt,6/7/17,2017-06-07,7-7-17,2017-07-07,50.11392751,-122.9389961,19194637,23973685
ab-14729268,2 bedroom and loft/2 bathroom condo in The Villas,Condominium,Entire home/apt,8/24/16,2016-08-24,1-5-19,2019-01-05,50.12036441,-122.9390501,14729268,33948298
ab-16927676,Heart of Whistler Studio-Free Parking,Apartment,Entire home/apt,1/23/17,2017-01-23,2-11-19,2019-02-11,50.11500397,-122.9546983,16927676,17197633
ab-16928237,7094 Nesters Road Main House,House,Entire home/apt,1/23/17,2017-01-23,4-14-17,2017-04-14,50.12573594,-122.9589293,16928237,113088210
ab-12630018,Bright 1bdr with Mountain views,Apartment,Entire home/apt,4/22/16,2016-04-22,1-27-17,2017-01-27,50.12079488,-122.9556658,12630018,68581273
ab-1861367,"1-Bedroom, Whistler, Cascade Lodge",Other,Entire home/apt,10/29/13,2013-10-29,8-26-17,2017-08-26,50.11654772,-122.9588201,1861367,661691
ab-1861391,1-Bedroom in Whistler at Sundance ,Other,Entire home/apt,10/29/13,2013-10-29,8-28-17,2017-08-28,50.09266342,-122.9930732,1861391,661691
ab-1861454,"1-Bedroom Plus, Whistler - Sundance",Other,Entire home/apt,3/20/17,2017-03-20,8-27-17,2017-08-27,50.09316129,-122.9925291,1861454,661691
ab-1861466,2-Bedroom in Whistler at Sundance,Other,Entire home/apt,1/12/17,2017-01-12,8-27-17,2017-08-27,50.09326555,-122.9944351,1861466,661691
ab-1861478,"2-Bedroom Plus, Whistler - Sundance",Other,Entire home/apt,1/12/17,2017-01-12,8-26-17,2017-08-26,50.09101413,-122.9929145,1861478,661691
ab-9977539,'Glacier Lodge' Ski in Studio with Pool & Hot Tub next to Adventure Zone!,Condominium,Entire home/apt,12/13/15,2015-12-13,4-6-18,2018-04-06,50.1166093,-122.9478606,9977539,35393628
ab-9978237,Whistler Mountain View Home,Chalet,Entire home/apt,10/21/17,2017-10-21,5-24-19,2019-05-24,50.1438,-122.96943,9978237,51273682
ab-19196574,Northstar by Elevate Real Estate Management,Entire apartment,Entire home/apt,6/7/17,2017-06-07,3-7-18,2018-03-07,50.11915331,-122.9599666,19196574,134284463
ab-18610290,Bright south facing chalet in excellent location,Chalet,Entire home/apt,5/5/17,2017-05-05,5-24-19,2019-05-24,50.12384,-122.94783,18610290,80282357
ab-12633406,Village Stroll 2 Bedroom 2 Bathroom 410,Apartment,Entire home/apt,4/22/16,2016-04-22,7-23-17,2017-07-23,50.11575555,-122.9539412,12633406,17197633
ab-9992112,Whistler Chalet,Chalet,Entire home/apt,10/29/18,2018-10-29,5-24-19,2019-05-24,50.13019,-122.96722,9992112,51335699
ab-9993024,Center of Whistler Village Condo,Apartment,Entire home/apt,12/14/15,2015-12-14,11-21-17,2017-11-21,50.11815719,-122.9549774,9993024,25659940
ab-9993135,'Glacier Lodge' Hotel Room w/ Pool & Hot Tub next to Adventure Zone!,Condominium,Entire home/apt,12/14/15,2015-12-14,4-6-18,2018-04-06,50.11676033,-122.9482491,9993135,35393628
ab-1861489,2-Bedroom Loft Whistler at Sundance,Other,Entire home/apt,1/12/17,2017-01-12,8-27-17,2017-08-27,50.09107925,-122.9936561,1861489,661691
ab-9999875,Ski in Ski out-Woodrun 309,Condominium,Entire home/apt,12/14/15,2015-12-14,12-27-16,2016-12-27,50.11617109,-122.9427026,9999875,9450001
ab-13391950,"Free Parking, Hot tub, near village, Valley Trail.",Condominium,Private room,6/6/16,2016-06-06,5-21-19,2019-05-21,50.1183,-122.94256,13391950,76065920
ab-10036101,Supreme Location! Newly updated w/private HotTub,Entire condominium,Entire home/apt,12/16/15,2015-12-16,12-12-17,2017-12-12,50.11668492,-122.9599986,10036101,7761771
ab-10038499,The Aspens 2 Br Ski In Ski Out,Townhouse,Entire home/apt,12/16/15,2015-12-16,10-18-16,2016-10-18,50.11517181,-122.9456932,10038499,41850542
ab-10042051,Creekside Townhouse,Townhouse,Entire home/apt,12/17/15,2015-12-17,1-13-19,2019-01-13,50.09381368,-122.9922405,10042051,10494121
ab-208256,"Lake Placid ~ Spacious Creekside Lofted 1BD, 2BA",Apartment,Entire home/apt,8/26/11,2011-08-26,5-21-19,2019-05-21,50.09302,-122.99102,208256,683972
ab-10042617,Cozy Creekside Getaway,Apartment,Entire home/apt,12/17/15,2015-12-17,5-22-19,2019-05-22,50.09633,-122.99372,10042617,51546447
ab-16932949,"NorthStar 1 bed - Village - hot tub, pool, parking",Townhouse,Entire home/apt,1/23/17,2017-01-23,8-1-17,2017-08-01,50.11921134,-122.9587391,16932949,27668645
ab-10056984,Ski Whistler Blackcomb 2 bathroom,Apartment,Entire home/apt,3/7/17,2017-03-07,4-9-17,2017-04-09,50.12144784,-122.9378022,10056984,13232844
ab-3875021,Alpine Chalet 4 BR & loft home,House,Entire home/apt,3/6/17,2017-03-06,5-24-19,2019-05-24,50.1511,-122.96762,3875021,14013252
ab-19199837,Whistler One BR Deluxe at Mountainside Lodge #02,Condominium,Entire home/apt,10/30/17,2017-10-30,5-21-19,2019-05-21,50.11365,-122.95291,19199837,118085755
ab-10059303,Whistler Town Plaza One Bedroom,Condominium,Entire home/apt,12/18/15,2015-12-18,7-16-17,2017-07-16,50.11656774,-122.9544263,10059303,28317820
ab-212798,Marketplace Lodge ~ Beautifully Updated 1BD Condo,Apartment,Entire home/apt,9/1/11,2011-09-01,5-22-19,2019-05-22,50.1209,-122.95626,212798,683972
ab-10074059,Loft studio in Whistler Creekside.,Loft,Entire home/apt,12/18/15,2015-12-18,11-15-18,2018-11-15,50.09829976,-122.9908272,10074059,51689517
ab-10074706,"Whistler 1 BR CONDO, Slps 4, 2 beds. Cascade Lodge",Condominium,Entire home/apt,1/2/17,2017-01-02,1-12-19,2019-01-12,50.11733748,-122.9578518,10074706,4385059
ab-14029269,Renovated Ski In 1 BRw/ pool & hot tub access!,Condominium,Entire home/apt,7/15/16,2016-07-15,5-27-17,2017-05-27,50.09524926,-122.991794,14029269,35393628
ab-10088879,Private Room walk to lift ski out.,Guesthouse,Private room,1/12/19,2019-01-12,2-12-19,2019-02-12,50.10976,-122.96886,10088879,687269
ab-10089041,"Bright, Clean Whistler studio in great location!",Apartment,Entire home/apt,7/22/17,2017-07-22,5-24-19,2019-05-24,50.097,-122.9915,10089041,33577633
ab-10089644,Fully Renovated ! Ski-in Ski-out,Condominium,Entire home/apt,12/19/15,2015-12-19,5-24-19,2019-05-24,50.11529,-122.94411,10089644,27383344
ab-19205826,Whistler Two bedroom Retreat,Townhouse,Entire home/apt,6/7/17,2017-06-07,7-21-18,2018-07-21,50.1233309,-122.9747145,19205826,134379742
ab-213666,Woods 56 ~ Gorgeous Rustic 2BD Unit,Apartment,Entire home/apt,9/2/11,2011-09-02,7-4-17,2017-07-04,50.12223312,-122.935703,213666,683972
ab-213690,Snowberry ~ Fully Updated & Spacious 2BD + Loft,Apartment,Entire home/apt,9/2/11,2011-09-02,5-20-19,2019-05-20,50.1198,-122.93908,213690,683972
ab-216757,Fantastic Whistler Studio - hot tub,Apartment,Entire home/apt,9/6/11,2011-09-06,8-8-17,2017-08-08,50.11610078,-122.9591495,216757,1118905
ab-12652014,Comfy Alpine Bedroom in Full Suite!,House,Private room,4/23/16,2016-04-23,1-18-17,2017-01-18,50.15604157,-122.9615449,12652014,68725016
ab-3876733,Whistler's favorite B&B - enjoy catered breakfast!,Bed and breakfast,Private room,8/13/14,2014-08-13,5-23-19,2019-05-23,50.12238,-122.94948,3876733,3004958
ab-16944306,whistler village centre walk 128,Apartment,Entire home/apt,1/24/17,2017-01-24,4-25-17,2017-04-25,50.11518205,-122.9532928,16944306,40233896
ab-19767500,Modern 1 Bedroom View Suite,Guest suite,Entire home/apt,7/7/17,2017-07-07,7-24-17,2017-07-24,50.15798913,-122.9541265,19767500,139517926
ab-6555077,"Quiet, Lagoons Stoney Ck 2 brm Townhome",Townhouse,Entire home/apt,5/24/15,2015-05-24,5-22-19,2019-05-22,50.11918,-122.95958,6555077,17102636
ab-12653404,Stoney Creek at Northstar,Townhouse,Entire home/apt,4/23/16,2016-04-23,5-24-19,2019-05-24,50.12036,-122.95862,12653404,68730642
ab-10119177,Creekside Townhouse Loft,Loft,Entire home/apt,12/21/15,2015-12-21,6-8-18,2018-06-08,50.09773558,-122.9882318,10119177,51929472
ab-10122571,Whistler Village Center! 1BR/1BA - 2 Beds Sleeps 4,Apartment,Entire home/apt,12/21/15,2015-12-21,5-21-19,2019-05-21,50.1137,-122.95388,10122571,317618
ab-16944583,Marquise ~ Slopeside Upper Village 1Bdrm Condo,Apartment,Entire home/apt,1/24/17,2017-01-24,5-22-19,2019-05-22,50.11666,-122.94422,16944583,683972
ab-10123819,Steps to Blackcomb w/ Pool & Hot Tub by Harmony Whistler,Apartment,Entire home/apt,12/21/15,2015-12-21,5-23-19,2019-05-23,50.1178,-122.94793,10123819,35393628
ab-10124642,Studio close to Creekside gondola,Apartment,Entire home/apt,12/21/15,2015-12-21,3-18-17,2017-03-18,50.09865989,-122.990394,10124642,51904495
ab-1898641,True Ski-In Ski-Out 4 Bedroom,House,Entire home/apt,11/6/13,2013-11-06,5-22-19,2019-05-22,50.09393,-122.98712,1898641,1616015
ab-11395630,Cascade Lodge-3,Condominium,Entire home/apt,2/19/16,2016-02-19,5-23-19,2019-05-23,50.11726,-122.95825,11395630,58385754
ab-10137686,Whistler Studio in Village Center!,Entire apartment,Entire home/apt,12/22/15,2015-12-22,3-17-18,2018-03-17,50.1152318,-122.9556132,10137686,317618
ab-10138157,Chateau Chardonnay 3 Bedroom 3 Bath,House,Entire home/apt,12/22/15,2015-12-22,5-23-19,2019-05-23,50.15508,-122.96494,10138157,66549
ab-222916,Mountain Star ~ Deluxe Slopeside 3BD w/Hot Tub,Apartment,Entire home/apt,9/14/11,2011-09-14,5-23-19,2019-05-23,50.11394,-122.94017,222916,683972
ab-7518507,"2 bedroom clean, and comfortable",Apartment,Entire home/apt,5/16/17,2017-05-16,7-13-17,2017-07-13,50.10450021,-122.9811534,7518507,28497945
ab-19209493,Marketplace 1 Bedroom + Den. Free Parking And WiFi,Apartment,Entire home/apt,6/8/17,2017-06-08,7-16-17,2017-07-16,50.11822983,-122.95638,19209493,68581273
ab-19209581,Spacious 3 bdrm + 2 bath with mountain views,Condominium,Entire home/apt,8/14/17,2017-08-14,5-21-19,2019-05-21,50.11345,-122.96788,19209581,11528608
ab-10154392,Whistler Village - Dear  Lodge - 2,Apartment,Entire home/apt,12/23/15,2015-12-23,5-22-19,2019-05-22,50.11775,-122.95431,10154392,1747164
ab-1907107,True Ski-In Ski-Out 5 Bed Chalet,House,Entire home/apt,11/7/13,2013-11-07,5-21-19,2019-05-21,50.0958,-122.98536,1907107,1616015
ab-10165937,Whistler Village Northstar - 2 Bedroom Townhouse,Condominium,Entire home/apt,12/24/15,2015-12-24,5-23-19,2019-05-23,50.12077,-122.95784,10165937,52185440
ab-10175081,Marquise 608 2+loft near lifts,Condominium,Entire home/apt,12/24/15,2015-12-24,5-24-19,2019-05-24,50.11649,-122.94341,10175081,22619214
ab-10176628,WEST-in 2bdrm WHISTLER BASE Hotel,Serviced apartment,Entire home/apt,12/24/15,2015-12-24,2-24-19,2019-02-24,50.11245,-122.95437,10176628,7784624
ab-10179121,Whistler Sundance 1 bedroom or 1 bedroom plus unit,Apartment,Entire home/apt,11/21/16,2016-11-21,5-22-19,2019-05-22,50.09114,-122.99447,10179121,103427
ab-10179556,Family Vacation Home,Condominium,Entire home/apt,12/25/15,2015-12-25,11-30-18,2018-11-30,50.11431309,-122.9697443,10179556,52274568
ab-11397876,1BR Condo w/ hot tub right in the Whistler Village,Apartment,Entire home/apt,2/19/16,2016-02-19,5-21-19,2019-05-21,50.11769,-122.95732,11397876,17939866
ab-18618188,Heart of Whistler Village,Resort,Private room,5/6/17,2017-05-06,5-20-19,2019-05-20,50.1154,-122.95269,18618188,40246730
ab-10194040,Two Bedroom Suite in Luxury Chalet,Chalet,Entire home/apt,12/25/15,2015-12-25,5-22-19,2019-05-22,50.09797,-122.99983,10194040,2313433
ab-13398378,"3BR - Cozy Whistler Cabin, 5 min walk to Creekside",Townhouse,Entire home/apt,6/6/16,2016-06-06,5-22-19,2019-05-22,50.09791,-122.98663,13398378,76244091
ab-10211827,The Northstar at Whistler,Apartment,Entire home/apt,1/9/17,2017-01-09,3-15-19,2019-03-15,50.11219,-122.9502,10211827,7784624
ab-10220367,"Spacious 3 Bed, 2.5 Bath Townhome",Townhouse,Entire home/apt,12/27/15,2015-12-27,5-23-19,2019-05-23,50.12165,-122.95875,10220367,52517364
ab-1917744,"Whistler, a 4 Season Resort",Apartment,Entire home/apt,11/10/13,2013-11-10,5-19-17,2017-05-19,50.11904389,-122.9555689,1917744,3495487
ab-10235587,Luxurious Montebello - best views!,Townhouse,Entire home/apt,12/28/15,2015-12-28,5-21-19,2019-05-21,50.12329,-122.95774,10235587,50698162
ab-12657295,Heart of Whistler Private Hot Tub 305,Apartment,Entire home/apt,5/9/17,2017-05-09,8-31-17,2017-08-31,50.11559529,-122.9572282,12657295,17197633
ab-12657557,Heart of Whistler Private Hot Tub,Condominium,Entire home/apt,5/9/17,2017-05-09,8-18-17,2017-08-18,50.11675721,-122.9548338,12657557,17197633
ab-5334095,cozy Whistler cabin with hot tub.,Cabin,Entire home/apt,2/10/15,2015-02-10,9-20-18,2018-09-20,50.14858302,-122.9681391,5334095,2817358
ab-10246918,Whistler Village Centre Studio Size Condo,Condominium,Entire home/apt,3/16/17,2017-03-16,5-20-19,2019-05-20,50.11769,-122.95415,10246918,52651623
ab-10249627,Creekside Casita,Townhouse,Entire home/apt,9/18/17,2017-09-18,5-20-19,2019-05-20,50.09253,-122.99383,10249627,52685042
ab-10251062,4 Bedroom Cabin in the meadows,Chalet,Entire home/apt,12/29/15,2015-12-29,12-11-18,2018-12-11,50.145211,-122.9655122,10251062,52694357
ab-10253022,Creekside Chalet near Alpha Lake,House,Entire home/apt,12/29/15,2015-12-29,10-19-16,2016-10-19,50.0918902,-122.9988365,10253022,52706624
ab-10254915,1BR Condo Whistler Resort and Club,Condominium,Entire home/apt,12/29/15,2015-12-29,3-31-18,2018-03-31,50.09687684,-122.9955093,10254915,26650418
ab-10260474,Beautifully renovated 2 bed unit,Apartment,Entire home/apt,12/29/15,2015-12-29,2-18-17,2017-02-18,50.11479706,-122.9460963,10260474,25751978
ab-17845152,"3 bedroom, spacious, unobstructed mountain views",House,Entire home/apt,3/20/17,2017-03-20,5-22-19,2019-05-22,50.14241,-122.96656,17845152,43826887
ab-16162342,'Glaciers Reach' Modern 2 bedroom in Village,Townhouse,Entire home/apt,11/26/16,2016-11-26,11-9-17,2017-11-09,50.12121398,-122.9556589,16162342,35393628
ab-10272402,"Golf, Bike & Family Adventure Zone",Condominium,Entire home/apt,12/30/15,2015-12-30,9-27-16,2016-09-27,50.1166952,-122.9480843,10272402,46867295
ab-10273331,Modern Industrial Village Studio,Serviced apartment,Entire home/apt,12/30/15,2015-12-30,5-23-19,2019-05-23,50.11773,-122.95711,10273331,23756437
ab-16162614,"Whistler, Alpine Meadows 1 Bedroom Sleeps 2",Apartment,Entire home/apt,11/26/16,2016-11-26,5-24-19,2019-05-24,50.14735,-122.9706,16162614,6641619
ab-10281648,Carleton 506 Platinum - Luxury Penthouse Slopeside,Condominium,Entire home/apt,1/1/16,2016-01-01,5-22-19,2019-05-22,50.11432,-122.95533,10281648,26808890
ab-16164368,"Studio Creekside, Bed Convertible",Apartment,Shared room,11/27/16,2016-11-27,4-11-17,2017-04-11,50.09897235,-122.9897418,16164368,40804603
ab-12671868,#504 Sunset Boulevard at Alpenglow,Apartment,Entire home/apt,4/24/16,2016-04-24,11-12-18,2018-11-12,50.1173901,-122.9565754,12671868,35146399
ab-19786792,Great Townhouse Right Off the Slopes - Ski In/Out,Townhouse,Entire home/apt,7/8/17,2017-07-08,8-30-17,2017-08-30,50.11373209,-122.9403964,19786792,114037450
ab-10312508,Sunny upgraded 1 bedroom condo in The Aspens,Apartment,Entire home/apt,5/18/17,2017-05-18,5-18-17,2017-05-18,50.11505902,-122.9440754,10312508,53042544
ab-15431808,Whistler Sundance 2 Bedroom with Loft Condo,Condominium,Entire home/apt,10/7/16,2016-10-07,5-22-19,2019-05-22,50.09107,-122.99352,15431808,16913110
ab-16173924,1 Bedroom Chateau Blvd,Apartment,Entire home/apt,11/27/16,2016-11-27,12-28-16,2016-12-28,50.11755967,-122.9443528,16173924,25777071
ab-16173938,"New, Luxury Whistler Home",House,Entire home/apt,11/27/16,2016-11-27,5-21-19,2019-05-21,50.14265,-122.95723,16173938,105588226
ab-16174105,2 Bedroom Chateau Blvd Ski In Ski Out,Apartment,Entire home/apt,11/27/16,2016-11-27,1-5-17,2017-01-05,50.11854856,-122.9459794,16174105,25777071
ab-13411795,Lake Placid Lodge 1 Bed,Apartment,Entire home/apt,6/7/16,2016-06-07,1-2-19,2019-01-02,50.09429237,-122.9920194,13411795,25777071
ab-10353329,Ski In/Ski Out! Whistler Resort!,Condominium,Entire home/apt,1/3/16,2016-01-03,8-26-16,2016-08-26,50.11724051,-122.9578672,10353329,25717018
ab-12683084,Private pond.  5 min to ski lift.,House,Entire home/apt,4/25/16,2016-04-25,9-27-16,2016-09-27,50.10236518,-122.9860158,12683084,29896656
ab-1937540,Ski/Bike In-Out Creekside 1 Bedroom,Guest suite,Entire home/apt,11/14/13,2013-11-14,5-23-19,2019-05-23,50.09375,-122.98619,1937540,1616015
ab-8640759,Spring Sale Cozy Condo @ Creekside Village,Condominium,Entire home/apt,6/20/17,2017-06-20,5-23-19,2019-05-23,50.09309,-122.99345,8640759,6113184
ab-11420112,The Aspens 1 Br Ski in Ski Out,Apartment,Entire home/apt,2/20/16,2016-02-20,5-24-19,2019-05-24,50.11526,-122.94468,11420112,41850542
ab-10380052,2BR Condo Rental~Whistler at Lake Placid Lodge,Condominium,Entire home/apt,6/9/18,2018-06-09,5-24-19,2019-05-24,50.09344,-122.99062,10380052,52651623
ab-10382934,Whistler Creekside with views,Condominium,Entire home/apt,12/19/16,2016-12-19,2-12-19,2019-02-12,50.09658328,-122.9883597,10382934,53448200
ab-241137,Whistler Benchlands 2/2 LargeCondo,Condominium,Entire home/apt,10/8/11,2011-10-08,6-12-17,2017-06-12,50.11716424,-122.9410625,241137,68738
ab-10386580,Studio at Whistler Village Centre walk to Gondola,Condominium,Entire home/apt,1/4/16,2016-01-04,12-11-18,2018-12-11,50.11537755,-122.9527718,10386580,26650418
ab-1950763,Whistler Village Steps from Gondola,Apartment,Entire home/apt,11/17/13,2013-11-17,11-29-17,2017-11-29,50.11463751,-122.9530207,1950763,1538268
ab-17847739,Bright 3 Bedroom Townhouse with Amazing Views,Townhouse,Entire home/apt,3/20/17,2017-03-20,9-18-17,2017-09-18,50.12031596,-122.9379376,17847739,122093715
ab-10393504,"Bear Lodge, Heart Whistler Village",Entire apartment,Entire home/apt,1/5/16,2016-01-05,12-26-17,2017-12-26,50.11790637,-122.9583066,10393504,29337762
ab-10394156,Whistler lodging,Apartment,Entire home/apt,1/5/16,2016-01-05,1-5-19,2019-01-05,50.11766824,-122.9563647,10394156,53516018
ab-10398361,Club Intrawest 2 Bedroom Lodge,Apartment,Entire home/apt,1/5/16,2016-01-05,5-22-19,2019-05-22,50.11818,-122.94611,10398361,53538732
ab-10402228,Apt Whistler- ideal family&friends,Apartment,Entire home/apt,1/5/16,2016-01-05,5-22-19,2019-05-22,50.11319,-122.96946,10402228,53560694
ab-11434108,One Bedroom - 10 min Walk to Lift,Apartment,Entire home/apt,2/20/16,2016-02-20,5-22-19,2019-05-22,50.10949,-122.96874,11434108,6630447
ab-8651379,Private bedroom in clean bright condo.,Condominium,Private room,7/4/17,2017-07-04,5-7-19,2019-05-07,50.08906,-122.99969,8651379,5451027
ab-10408640,Fabulous Westin 2 BR - closest to Gondola,Resort,Entire home/apt,1/5/16,2016-01-05,5-23-19,2019-05-23,50.11314,-122.95559,10408640,11522772
ab-10410565,Townhome+Private Hot Tub by Village,Apartment,Entire home/apt,1/5/16,2016-01-05,12-16-16,2016-12-16,50.12050712,-122.9603926,10410565,19254342
ab-10411559,Shared Room in Creekside &gt; 3 months only,Townhouse,Shared room,8/11/17,2017-08-11,8-5-18,2018-08-05,50.09861296,-122.9907016,10411559,4933482
ab-14768332,Town Plaza Whistler Condo~Sleeps 6,Condominium,Entire home/apt,8/27/16,2016-08-27,3-8-19,2019-03-08,50.11748,-122.95559,14768332,52651623
ab-1976392,Whistler - Blackcomb Ski in/out **CHRISTMAS WEEK*,Serviced apartment,Entire home/apt,11/22/13,2013-11-22,5-25-19,2019-05-25,50.1156,-122.94391,1976392,10202294
ab-14056635,Tranquil 2bdrm Getaway!,Condominium,Entire home/apt,7/17/16,2016-07-17,5-22-19,2019-05-22,50.11682,-122.93831,14056635,65305043
ab-15448905,Quiet Whistler Retreat,Townhouse,Entire home/apt,10/9/16,2016-10-09,5-23-19,2019-05-23,50.12269,-122.93417,15448905,99093672
ab-16181036,Modern Nordic Living +Views +Steps to Lift & Shops,Townhouse,Entire home/apt,11/28/16,2016-11-28,5-23-19,2019-05-23,50.09559,-122.99139,16181036,103445631
ab-10425725,4 minute walk to Creekside lifts!,Apartment,Entire home/apt,1/6/16,2016-01-06,5-24-19,2019-05-24,50.09441,-122.99149,10425725,53697425
ab-19790564,Central Whistler Apartment,Condominium,Entire home/apt,7/8/17,2017-07-08,8-25-18,2018-08-25,50.11884194,-122.9580225,19790564,8401535
ab-10434954,"Marquise 1 bdrm condo pool, hot tub",Condominium,Entire home/apt,1/6/16,2016-01-06,12-7-17,2017-12-07,50.11672676,-122.941852,10434954,47254544
ab-10440013,SKI-in-SKI-out :)  Lake Placid 1 Bdrm Condo,Condominium,Entire home/apt,1/7/16,2016-01-07,3-7-19,2019-03-07,50.09376,-122.99187,10440013,7784624
ab-10440297,Central WALK to Everything! 2Bd w Pool & Hot Tub,Apartment,Entire home/apt,1/7/16,2016-01-07,1-10-19,2019-01-10,50.11654203,-122.9584259,10440297,7784624
ab-10450282,PRIME LOCATION - Upscale 2 Bedroom,Apartment,Entire home/apt,1/7/16,2016-01-07,5-24-19,2019-05-24,50.11889,-122.95923,10450282,53838781
ab-12702966,"Large 4 bdrm Townhouse, sleeps 8",Townhouse,Entire home/apt,4/25/16,2016-04-25,3-17-18,2018-03-17,50.11939993,-122.9394676,12702966,69050207
ab-10470156,Beautiful Large Condo with Views!,Condominium,Entire home/apt,1/8/16,2016-01-08,11-4-18,2018-11-04,50.11323072,-122.9714313,10470156,38573316
ab-10474818,Whistler Village Center - 1BR for 4,Entire apartment,Entire home/apt,1/8/16,2016-01-08,3-16-18,2018-03-16,50.11330756,-122.9551267,10474818,317618
ab-13417197,Alta Lake Blueberry Hill Private Lakefront Condo,Condominium,Entire home/apt,6/8/16,2016-06-08,5-21-19,2019-05-21,50.11248,-122.97642,13417197,70977909
ab-10489504,Ski-in/Ski-out Loft Near Gondola & All Activities,Apartment,Entire home/apt,1/9/16,2016-01-09,5-24-19,2019-05-24,50.11458,-122.95035,10489504,6641619
ab-12704427,Chalet Mont Blanc - Mountain Luxury,Chalet,Entire home/apt,4/26/16,2016-04-26,6-2-16,2016-06-02,50.12137167,-122.9642759,12704427,27111892
ab-16189574,Embarc Whistler- BC Canada April,Condominium,Entire home/apt,11/28/16,2016-11-28,9-7-17,2017-09-07,50.11892917,-122.9453288,16189574,13167617
ab-259993,Quiet yet steps to village & slopes,Condominium,Entire home/apt,11/3/11,2011-11-03,5-23-19,2019-05-23,50.11781,-122.95844,259993,1364502
ab-10499638,Divine studio in Whistler Village.,Apartment,Entire home/apt,1/9/16,2016-01-09,5-20-19,2019-05-20,50.11869,-122.9547,10499638,24250596
ab-13417466,Whistler Village Alpenglow,Apartment,Entire home/apt,6/8/16,2016-06-08,7-5-17,2017-07-05,50.11768858,-122.956807,13417466,3200798
ab-14774709,THE MAPLE TREEHOUSE,Condominium,Private room,8/27/16,2016-08-27,5-23-19,2019-05-23,50.09308,-122.98997,14774709,88221884
ab-2011798,Wonderful Condo in Whistler Creek,Townhouse,Entire home/apt,11/29/13,2013-11-29,5-24-19,2019-05-24,50.08852,-122.99519,2011798,10350791
ab-15453724,Le Chamois Ski in Ski out,Condominium,Entire home/apt,10/9/16,2016-10-09,11-20-16,2016-11-20,50.11617697,-122.9477598,15453724,97161383
ab-19791980,Clock Tower Studio,Condominium,Entire home/apt,7/8/17,2017-07-08,4-23-18,2018-04-23,50.11438526,-122.9543009,19791980,117315034
ab-19792074,"Crisp, Clean, Chic and Cozy in the Village",Apartment,Entire home/apt,7/8/17,2017-07-08,5-22-19,2019-05-22,50.11629,-122.9556,19792074,9931070
ab-16194085,'Marquise' One bedroom w/pool & hot tub - Ski In / Out!,Apartment,Entire home/apt,11/29/16,2016-11-29,7-10-18,2018-07-10,50.11599433,-122.94436,16194085,35393628
ab-274927,Marketplace Lodge ~ Cozy Mountain View 1BD Condo,Apartment,Entire home/apt,11/23/11,2011-11-23,5-24-19,2019-05-24,50.12128,-122.95771,274927,683972
ab-10526667,Golden Dreams Town Plaza: DeerLodge,Serviced apartment,Entire home/apt,1/10/16,2016-01-10,5-24-19,2019-05-24,50.11861,-122.95505,10526667,17046824
ab-18637030,Spacious private 1bdr apartm. in Whistler Village,Apartment,Entire home/apt,5/7/17,2017-05-07,8-25-17,2017-08-25,50.11741022,-122.9592651,18637030,129488648
ab-5375149,Clean Quiet Spacious 1 brm w/ pool,Apartment,Entire home/apt,2/14/15,2015-02-14,1-12-19,2019-01-12,50.12304841,-122.9350266,5375149,18884266
ab-10593256,Step outside the village,Apartment,Entire home/apt,1/13/16,2016-01-13,12-17-16,2016-12-17,50.0785314,-123.0415459,10593256,31797981
ab-288841,Deluxe Townhouse  - Marketplace,House,Entire home/apt,12/14/11,2011-12-14,5-24-19,2019-05-24,50.1219,-122.95778,288841,115194
ab-17863024,cozy whistler bedroom with hot tub,House,Private room,3/21/17,2017-03-21,9-9-17,2017-09-09,50.12538138,-122.9578797,17863024,122248423
ab-19226162,"1BR suite, 1 min walk to the Village! Pool/hot tub",Condominium,Entire home/apt,6/9/17,2017-06-09,5-24-19,2019-05-24,50.11774,-122.95821,19226162,32163728
ab-10597624,Whistler Village Updated 2bed Condo,Condominium,Entire home/apt,1/13/16,2016-01-13,5-22-19,2019-05-22,50.11689,-122.95504,10597624,10319459
ab-2028303,NEW 2Bd 1000ft Condo Quiet&Steps from Everything!,Condominium,Entire home/apt,12/3/13,2013-12-03,5-21-19,2019-05-21,50.11357,-122.95048,2028303,10417687
ab-10610329,Woodrun Ski in/out 2 Bdrm Pool & HT,Condominium,Entire home/apt,1/14/16,2016-01-14,5-24-19,2019-05-24,50.11477,-122.94313,10610329,17648830
ab-10616600,Apres Loft in the heart of Whistler Village,Loft,Entire home/apt,1/14/16,2016-01-14,9-6-18,2018-09-06,50.11267022,-122.9544732,10616600,52706624
ab-2036985,Great Holidays in Whistler,Apartment,Entire home/apt,12/5/13,2013-12-05,5-21-19,2019-05-21,50.111,-122.9696,2036985,10282736
ab-6598532,"3 Bedroom Home with Hot Tub, Ski-in/out & Views",House,Entire home/apt,5/28/15,2015-05-28,5-22-19,2019-05-22,50.09387,-122.98011,6598532,34519206
ab-14787131,Ski-in/out 3 Bdrm Condo Above Creekside Village,Condominium,Entire home/apt,8/28/16,2016-08-28,5-23-19,2019-05-23,50.09214,-122.99028,14787131,92329947
ab-15464933,2019 XMAS & NEW YEARS Walk to Everything TownHome!,Condominium,Entire home/apt,10/10/16,2016-10-10,5-24-19,2019-05-24,50.1212,-122.95746,15464933,717007
ab-5385247,Sunpath ~ 3BD Village Condo w/Hot Tub,Apartment,Entire home/apt,2/15/15,2015-02-15,5-22-19,2019-05-22,50.11713,-122.95859,5385247,683972
ab-10659094,Bright double bed + shower by lake,Condominium,Private room,4/6/17,2017-04-06,8-22-18,2018-08-22,50.12177041,-122.9733655,10659094,1196982
ab-14069577,Cozy Whistler Studio Condo in Central Location,Condominium,Entire home/apt,7/17/16,2016-07-17,10-11-17,2017-10-11,50.11633216,-122.9566827,14069577,65790915
ab-15464987,Cozy+Spacious+Private Village Gem!,Apartment,Entire home/apt,10/10/16,2016-10-10,4-5-18,2018-04-05,50.1189491,-122.9604557,15464987,84821274
ab-2045454,Whistler Northstar - 2br/2ba,Serviced apartment,Entire home/apt,12/7/13,2013-12-07,5-23-19,2019-05-23,50.11893,-122.95787,2045454,7054805
ab-10682270,Luxurious ski-in-ski-out condo,Apartment,Entire home/apt,1/17/16,2016-01-17,5-24-19,2019-05-24,50.1149,-122.9462,10682270,41115116
ab-16202597,Ski-in/out Luxury 1 BD in Central Location,Apartment,Entire home/apt,11/29/16,2016-11-29,5-23-19,2019-05-23,50.11755,-122.94919,16202597,105826266
ab-5387153,3Bdrm with Pool | Best Location,Condominium,Entire home/apt,2/16/15,2015-02-16,5-23-19,2019-05-23,50.11759,-122.95878,5387153,27927103
ab-10701935,2 bedroom Aspens Blackcomb Base,Condominium,Entire home/apt,1/18/16,2016-01-18,5-23-19,2019-05-23,50.11473,-122.94394,10701935,36736375
ab-10702192,Ski-in/Ski-out Whistler-Blackcomb*,Condominium,Entire home/apt,1/18/16,2016-01-18,5-24-19,2019-05-24,50.11477,-122.94066,10702192,32550230
ab-10704622,Near Whistler and Blackcomb,Entire house,Entire home/apt,1/18/16,2016-01-18,3-13-18,2018-03-13,50.15412761,-122.9643341,10704622,40974280
ab-10705000,2 Bed Granite Court with VIEWS!!,Townhouse,Entire home/apt,1/18/16,2016-01-18,5-24-19,2019-05-24,50.12166,-122.95557,10705000,8520466
ab-10707526,"Spacious, Bright, Private Room",House,Private room,1/18/16,2016-01-18,4-2-18,2018-04-02,50.14637199,-122.9606437,10707526,51741150
ab-10709349,"Small, bright 1.5-bdrm in Village",Apartment,Entire home/apt,6/17/17,2017-06-17,5-27-18,2018-05-27,50.11910633,-122.9550048,10709349,32311809
ab-12714668,Cozy Whistler Village Studio - Free Parking!!!,Condominium,Entire home/apt,4/26/16,2016-04-26,5-21-19,2019-05-21,50.11917,-122.9574,12714668,58286821
ab-16204517,Cottage in the mountains with hot tub,House,Entire home/apt,12/11/18,2018-12-11,5-21-19,2019-05-21,50.1416,-122.96736,16204517,52694357
ab-15466580,North Star Townhome Near Village,Apartment,Entire home/apt,10/10/16,2016-10-10,8-27-17,2017-08-27,50.12048594,-122.958764,15466580,84821274
ab-10724203,Blackcomb Ski to Lift - with a view!,Condominium,Entire home/apt,1/19/16,2016-01-19,4-14-19,2019-04-14,50.11829,-122.94223,10724203,2857406
ab-2055367,Cozy Tree Top 1BD + Loft Space,Apartment,Entire home/apt,12/10/13,2013-12-10,8-16-17,2017-08-16,50.09217197,-122.9938454,2055367,3788612
ab-10734132,"$180 for one night Wed Feb 10, 2016",Apartment,Entire home/apt,1/19/16,2016-01-19,5-25-19,2019-05-25,50.11865,-122.94714,10734132,55489411
ab-10746826,2 Bdr in Whistler Village Overlooking Olympic Park,Serviced apartment,Entire home/apt,1/20/16,2016-01-20,5-23-19,2019-05-23,50.12014,-122.95465,10746826,52775147
ab-15467986,Private Blueberry Paradise + Hottub,Condominium,Entire home/apt,10/10/16,2016-10-10,5-21-19,2019-05-21,50.11067,-122.97129,15467986,84821274
ab-16974031,"Luxury 4 Bedroom, Walk to Village, Private Hot Tub",Townhouse,Entire home/apt,1/26/17,2017-01-26,5-21-19,2019-05-21,50.12532,-122.95611,16974031,113558314
ab-16974528,Summer in Whistler,House,Entire home/apt,3/4/18,2018-03-04,8-22-18,2018-08-22,50.1586048,-122.931317,16974528,5695475
ab-2056764,Carleton Lodge #405,Condominium,Entire home/apt,12/10/13,2013-12-10,5-21-19,2019-05-21,50.1143,-122.95531,2056764,10531914
ab-2056904,The Perfect Whistler Studio,Condominium,Entire home/apt,12/10/13,2013-12-10,5-24-19,2019-05-24,50.12026,-122.95729,2056904,3460902
ab-10751341,Beautiful Ski-in Luxury Whistler Condo!,Condominium,Entire home/apt,1/20/16,2016-01-20,5-21-19,2019-05-21,50.1216,-122.93925,10751341,51703858
ab-16208076,Our little slice of heaven,Apartment,Entire home/apt,12/1/16,2016-12-01,5-22-19,2019-05-22,50.11773,-122.95712,16208076,105881757
ab-2065859,Snowbird101 4 bedroom 4 bath walk to ski and shops,Townhouse,Entire home/apt,12/12/13,2013-12-12,5-24-19,2019-05-24,50.11788,-122.94121,2065859,10567731
ab-2066830,Whistler 2br Suite at Creekside,Resort,Entire home/apt,12/13/13,2013-12-13,5-21-19,2019-05-21,50.09951,-122.98693,2066830,7054805
ab-2067351,2 bedroom in Whistler Village,Apartment,Entire home/apt,12/13/13,2013-12-13,10-17-17,2017-10-17,50.1210689,-122.9573413,2067351,2665209
ab-3959702,Muk Muk Den | Hotel Room 224 | Whistler BC,Condominium,Entire home/apt,8/24/14,2014-08-24,5-23-19,2019-05-23,50.11715,-122.94756,3959702,3111913
ab-342296,Ski in/out 1bd condo in Whistler!,Condominium,Entire home/apt,2/10/12,2012-02-10,9-16-18,2018-09-16,50.11662853,-122.9447193,342296,1737060
ab-344434,Private Hot Tub - Whistler village - Pool,Apartment,Entire home/apt,2/12/12,2012-02-12,5-21-19,2019-05-21,50.12097,-122.95794,344434,1747164
ab-11480088,Emerald Loft,House,Private room,2/23/16,2016-02-23,3-21-18,2018-03-21,50.15774622,-122.9280954,11480088,23248270
ab-3960082,Miga Retreat | Studio 225 | Whistler BC,Condominium,Entire home/apt,8/24/14,2014-08-24,5-25-19,2019-05-25,50.11533,-122.94716,3960082,3111913
ab-17879415,Homelike 1 bedroom + den Whistler condo *,Apartment,Entire home/apt,3/22/17,2017-03-22,5-24-19,2019-05-24,50.12014,-122.95583,17879415,71985447
ab-19240542,Comfortable Creekside three bedroom home,House,Entire home/apt,6/9/17,2017-06-09,8-24-17,2017-08-24,50.08993788,-122.9962671,19240542,134710343
ab-5396437,Private 2 Bdrm Townhouse in Whistler Village North,Townhouse,Entire home/apt,2/17/15,2015-02-17,11-18-16,2016-11-18,50.11974061,-122.9589597,5396437,27973969
ab-3971941,"Montebello II, Whistler B.C. Canada",Villa,Entire home/apt,8/26/14,2014-08-26,5-22-19,2019-05-22,50.12394,-122.95678,3971941,20586132
ab-359538,Cozy log cabin style 1 bedrm condo,Condominium,Entire home/apt,2/25/12,2012-02-25,5-24-19,2019-05-24,50.0928,-122.99202,359538,1816171
ab-359544,"Large, 2 level, one bedroom condo- Pool & Hot tub",Apartment,Entire home/apt,2/25/12,2012-02-25,5-22-19,2019-05-22,50.09309,-122.99085,359544,1816171
ab-15474460,Privacy and Luxury villa in Whistler,House,Entire home/apt,10/10/16,2016-10-10,7-2-18,2018-07-02,50.09126683,-122.992159,15474460,2366907
ab-2087405,"Derricks Glacier Reach, Whistler",Townhouse,Entire home/apt,7/6/18,2018-07-06,5-24-19,2019-05-24,50.12009,-122.95737,2087405,10656346
ab-2089680,Cozy Alpine Meadows Townhome,House,Entire home/apt,12/18/13,2013-12-18,5-7-16,2016-05-07,50.14530968,-122.962629,2089680,1520447
ab-15477346,Make an offer!3 BR/Jan 18-28/pick 7 to 10 days,Condominium,Entire home/apt,10/11/16,2016-10-11,12-8-16,2016-12-08,50.11703988,-122.944637,15477346,50730949
ab-15477690,Whistler loft 5mins walk to gondola,Loft,Private room,10/11/16,2016-10-11,4-29-17,2017-04-29,50.09465482,-122.9920725,15477690,15547628
ab-15478878,New Years at #1 Ski Resort in NorthAmerica,Condominium,Entire home/apt,10/11/16,2016-10-11,1-2-17,2017-01-02,50.11712552,-122.94545,15478878,92483221
ab-10852490,Cosey Unit on free bus route.1bed&PrivShower.,Apartment,Private room,3/7/17,2017-03-07,3-26-17,2017-03-26,50.12013979,-122.941554,10852490,24037962
ab-12741490,"Valhalla 1,400 sq ft 3 BR private hot tub",Townhouse,Entire home/apt,7/29/17,2017-07-29,8-26-17,2017-08-26,50.12007092,-122.9588055,12741490,17197633
ab-3979650,Whistler Village Center! 1 bedroom Sleeps 4 (2bed),Apartment,Entire home/apt,8/27/14,2014-08-27,3-18-18,2018-03-18,50.11308829,-122.9554304,3979650,317618
ab-376427,Cozy Condo in Whistler,Apartment,Entire home/apt,3/8/12,2012-03-08,9-27-16,2016-09-27,50.10543357,-122.9829054,376427,1892715
ab-10878501,Base of Blackcomb: Club Intrawest,Condominium,Entire home/apt,1/26/16,2016-01-26,5-22-19,2019-05-22,50.11672,-122.94758,10878501,26167761
ab-10880466,Condo in the Heart of Whistler,Condominium,Entire home/apt,1/26/16,2016-01-26,5-23-19,2019-05-23,50.12037,-122.95746,10880466,16543772
ab-385700,Charming Chalet in Whistler,House,Entire home/apt,6/25/18,2018-06-25,7-1-18,2018-07-01,50.12611574,-122.959069,385700,1930360
ab-18656075,5-star Best Mountain View & Location Whistler Ctr,Townhouse,Entire home/apt,5/8/17,2017-05-08,5-22-19,2019-05-22,50.10939,-122.95768,18656075,45189859
ab-2123869,Cozy condo in Heart of Main Village,Apartment,Entire home/apt,12/26/13,2013-12-26,5-21-19,2019-05-21,50.11513,-122.9564,2123869,10831390
ab-8702347,Luxury Whistler Cay Townhouse,House,Entire home/apt,10/2/15,2015-10-02,4-30-16,2016-04-30,50.11695906,-122.9617297,8702347,45683899
ab-8703487,North Star Townhome,Townhouse,Entire home/apt,10/2/15,2015-10-02,5-2-17,2017-05-02,50.11276504,-122.9710487,8703487,42644437
ab-19245076,Studio whistler,Apartment,Entire home/apt,6/10/17,2017-06-10,6-26-17,2017-06-26,50.11975453,-122.9577296,19245076,126516790
ab-16988711,Cozy One-Bedroom Condo in village,Apartment,Shared room,1/27/17,2017-01-27,5-23-19,2019-05-23,50.11712,-122.95596,16988711,20685544
ab-10905239,"Whistler: Cool, Convenient One Bdrm",Guest suite,Entire home/apt,11/8/17,2017-11-08,4-21-18,2018-04-21,50.10394004,-122.9828448,10905239,56503543
ab-10905248,Luxurious 5 Bdrm Chalet w hot tub,House,Entire home/apt,1/27/16,2016-01-27,4-29-19,2019-04-29,50.14693,-122.96586,10905248,56516722
ab-11509317,Alta Lake Chalet,Chalet,Entire home/apt,2/24/16,2016-02-24,5-22-19,2019-05-22,50.11053,-122.97531,11509317,23354084
ab-13447872,"2 Bedroom Townhome, Ski In, Beside Lost Lake Park",Townhouse,Entire home/apt,6/9/16,2016-06-09,4-19-17,2017-04-19,50.12155711,-122.9373329,13447872,76784562
ab-393943,4br+loft Steps to Creekside Gondola,Chalet,Entire home/apt,3/20/12,2012-03-20,5-21-19,2019-05-21,50.08986,-122.9911,393943,1963648
ab-15486171,Ski In/Out. Tranquil & Stylish Creekside Townhome,Townhouse,Entire home/apt,10/11/16,2016-10-11,5-23-19,2019-05-23,50.09166,-122.99242,15486171,4389001
ab-3988324,Whistler Village Studio Townhouse - UG Park / Pool,Entire townhouse,Entire home/apt,8/28/14,2014-08-28,1-15-18,2018-01-15,50.12125483,-122.9587502,3988324,9583676
ab-6616499,Whistler Village - Deer Lodge 342,Apartment,Entire home/apt,5/29/15,2015-05-29,5-22-19,2019-05-22,50.11588,-122.95745,6616499,1747164
ab-10922429,NEW- Jordans Pointe Estate: 117039,Villa,Entire home/apt,1/28/16,2016-01-28,2-1-16,2016-02-01,50.09834531,-122.9973867,10922429,45536328
ab-10922745,Cozy and Modern new renovation,Apartment,Entire home/apt,1/28/16,2016-01-28,5-22-17,2017-05-22,50.11925833,-122.9611534,10922745,8870132
ab-11512184,"Whistler Creekside townhome Ski-in/Walk-out,",Townhouse,Entire home/apt,2/24/16,2016-02-24,5-22-19,2019-05-22,50.09707,-122.97883,11512184,4175684
ab-5429076,Whistler - Westin 2br Suite,Apartment,Entire home/apt,2/20/15,2015-02-20,4-7-19,2019-04-07,50.11144,-122.95545,5429076,7054805
ab-10960504,Private room in Whistler modern rustic townhouse,House,Private room,1/29/16,2016-01-29,5-21-19,2019-05-21,50.09335,-122.99315,10960504,1095587
ab-11522322,Ironwood Whistler BC Condo Rental,Condominium,Entire home/apt,2/25/16,2016-02-25,5-22-19,2019-05-22,50.11377,-122.96856,11522322,52651623
ab-14088943,Mountain view Creekside apartment,Apartment,Entire home/apt,7/19/16,2016-07-19,9-18-17,2017-09-18,50.09377669,-122.9911998,14088943,1229711
ab-19814209,Embark ( Intrawest) 2 bedroom vacation home 4 star,Timeshare,Private room,7/9/17,2017-07-09,8-15-17,2017-08-15,50.11855904,-122.9461972,19814209,3096974
ab-11525711,Whistler suite with a view,House,Entire home/apt,2/25/16,2016-02-25,9-27-16,2016-09-27,50.1558541,-122.9529308,11525711,60772978
ab-10970826,Ski in/Ski Out condo â€“ Whistler Blackcomb - Embarc,Condominium,Entire home/apt,1/30/16,2016-01-30,5-23-19,2019-05-23,50.11669,-122.94703,10970826,56917702
ab-16997820,Home Away from Home in Whistler,Townhouse,Entire home/apt,1/27/17,2017-01-27,3-12-17,2017-03-12,50.07978473,-123.0416278,16997820,113882287
ab-16998160,Whistler Village Cascade Lodge Condo Near Gondola,Serviced apartment,Entire home/apt,11/6/17,2017-11-06,3-12-19,2019-03-12,50.11735,-122.95928,16998160,30307256
ab-11530935,Luxury Townhome Creekside Whistler,Entire townhouse,Entire home/apt,5/10/17,2017-05-10,3-3-18,2018-03-03,50.09700634,-122.9792209,11530935,60814565
ab-5445617,PENTHOUSE Condo - Whistler Village!,Condominium,Entire home/apt,5/9/17,2017-05-09,5-23-19,2019-05-23,50.11689,-122.95511,5445617,9583676
ab-6624057,"Gorgeous 1 bedroom, Sleeps 2-4",Apartment,Entire home/apt,5/29/15,2015-05-29,5-24-19,2019-05-24,50.11607,-122.94424,6624057,8520466
ab-8738926,Hot tub access & mountain views!,Apartment,Entire home/apt,10/4/15,2015-10-04,9-18-16,2016-09-18,50.11825014,-122.9553905,8738926,35393628
ab-16998572,Whistler Village Cascade Lodge Condo,Serviced apartment,Entire home/apt,1/27/17,2017-01-27,3-19-19,2019-03-19,50.11586,-122.95985,16998572,30307256
ab-401867,Whistler Shared Retreat  1 Whistler BC,Hostel,Private room,6/21/18,2018-06-21,9-16-18,2018-09-16,50.11799901,-122.9609312,401867,2005783
ab-14809626,Best Townhouse in Whistler,Townhouse,Entire home/apt,8/29/16,2016-08-29,5-20-19,2019-05-20,50.1229,-122.95596,14809626,2572830
ab-19824733,Comfy Condo near to the Gondola w/Free Parking,Condominium,Entire home/apt,7/10/17,2017-07-10,10-21-17,2017-10-21,50.09695797,-122.989346,19824733,122773552
ab-10995351,WOODRUN SKI IN/OUT Heated pool,Apartment,Entire home/apt,2/1/16,2016-02-01,5-23-19,2019-05-23,50.11564,-122.94294,10995351,56645905
ab-5446452,Whistler Elegance-Designer Mt Home,House,Entire home/apt,2/22/15,2015-02-22,5-22-19,2019-05-22,50.11345,-122.97014,5446452,28250087
ab-14811212,"Ideal location! New, clean, pool, hottub, f/p",Townhouse,Entire home/apt,8/29/16,2016-08-29,5-23-19,2019-05-23,50.11875,-122.9593,14811212,22732499
ab-8739775,Marquise Holidays,Apartment,Entire home/apt,10/4/15,2015-10-04,8-14-18,2018-08-14,50.11789694,-122.9421152,8739775,45850395
ab-16999639,Whistler Village Cascade Lodge Condo,Serviced apartment,Entire home/apt,1/27/17,2017-01-27,3-12-19,2019-03-12,50.11661,-122.95982,16999639,30307256
ab-11544095,Luxurious & affordable ski condo,Apartment,Private room,2/26/16,2016-02-26,3-4-19,2019-03-04,50.113,-122.96996,11544095,60909178
ab-11023614,Cozy little condo steps from Creekside base,Entire condominium,Entire home/apt,12/6/17,2017-12-06,1-9-18,2018-01-09,50.0942031,-122.9940558,11023614,36669168
ab-11026405,Whistler Resort Studio w/amenities!,Condominium,Entire home/apt,2/1/16,2016-02-01,5-21-19,2019-05-21,50.11512,-122.95275,11026405,22267033
ab-408349,Private Cabin - months of NOV.  and APRIL ONLY,Cabin,Entire home/apt,3/29/12,2012-03-29,11-12-18,2018-11-12,50.16406746,-122.92552,408349,2033561
ab-11067857,1BR+Loft at The Village Gate House,Condominium,Entire home/apt,2/3/16,2016-02-03,9-10-18,2018-09-10,50.11639691,-122.9550934,11067857,26650418
ab-19247462,Whistler Escape Ski In/Out 1 Bedroom Hot Tub Pool,Apartment,Entire home/apt,6/10/17,2017-06-10,5-23-19,2019-05-23,50.1164,-122.94678,19247462,9762242
ab-19247478,Perfectly Located Townhome Steps from the Village,Condominium,Entire home/apt,6/10/17,2017-06-10,8-19-18,2018-08-19,50.12083293,-122.9591478,19247478,35043774
ab-11070844,Whistler Sleeping Bear Hideaway 2BR/2BA,Condominium,Entire home/apt,2/3/16,2016-02-03,5-22-19,2019-05-22,50.11705,-122.9546,11070844,57471400
ab-19829908,Slopeside 2 Bedroom Suite on Blackcomb Mountain,Serviced apartment,Entire home/apt,7/10/17,2017-07-10,5-24-19,2019-05-24,50.11692,-122.94418,19829908,140135265
ab-11071296,2BR Lake Placid Lodge Ski-in/Out,Condominium,Entire home/apt,2/3/16,2016-02-03,12-11-18,2018-12-11,50.09336062,-122.9907746,11071296,26650418
ab-5459296,"3BR Chalet, Walk to Village & Lifts",House,Entire home/apt,5/24/17,2017-05-24,5-3-18,2018-05-03,50.12437269,-122.9502549,5459296,28317820
ab-11079983,Twin Peaks Resort - 2 Bed 2 Bath - 103,Apartment,Entire home/apt,2/4/16,2016-02-04,9-28-18,2018-09-28,50.11917783,-122.9578706,11079983,3749031
ab-16221086,Newly updated bright 3rd floor suite w/ views (B),Condominium,Entire home/apt,12/1/16,2016-12-01,5-22-19,2019-05-22,50.09628,-122.99588,16221086,37364898
ab-11086260,Olympic Plaza Views w/ Pool & Hot Tub by Harmony Whistler,Condominium,Entire home/apt,2/4/16,2016-02-04,5-24-19,2019-05-24,50.1191,-122.95491,11086260,35393628
ab-19830173,Newly Renovated Stoney Creek Resort Lagoons,Townhouse,Entire home/apt,7/10/17,2017-07-10,5-23-19,2019-05-23,50.11906,-122.95838,19830173,140138991
ab-11088551,Central Whistler Village Studio,Room in boutique hotel,Private room,2/4/16,2016-02-04,5-24-19,2019-05-24,50.11779,-122.95689,11088551,57574738
ab-11089134,Whistler Village View Studio,Condominium,Entire home/apt,2/4/16,2016-02-04,5-22-19,2019-05-22,50.11549,-122.9577,11089134,57574738
ab-11089304,Tyndal Stone Lodge,Condominium,Entire home/apt,2/4/16,2016-02-04,5-22-19,2019-05-22,50.12001,-122.95779,11089304,7784624
ab-19830653,Slopeside retreat,Serviced apartment,Entire home/apt,7/10/17,2017-07-10,5-23-19,2019-05-23,50.11674,-122.94535,19830653,140135265
ab-12778316,3 Bedroom Whistler Townhome with Hot Tub,House,Entire home/apt,4/29/16,2016-04-29,5-23-19,2019-05-23,50.12251,-122.95794,12778316,65790915
ab-17894398,Whistler 2 bedroom ski-in/ski-out condo,Condominium,Entire home/apt,3/23/17,2017-03-23,5-21-19,2019-05-21,50.11513,-122.9429,17894398,35145092
ab-18657521,"SKI IN SKI OUT, SLOPE SIDE, SPECTACULAR VIEWS.",Apartment,Entire home/apt,5/8/17,2017-05-08,5-23-19,2019-05-23,50.11601,-122.94701,18657521,129659623
ab-428097,Cozy Condo Whistler Village,Condominium,Entire home/apt,4/11/12,2012-04-11,5-23-19,2019-05-23,50.11865,-122.95585,428097,2127770
ab-11106290,Ski in 1 bedroom whistler townhouse.  Quiet&clean,Townhouse,Entire home/apt,2/5/16,2016-02-05,10-10-18,2018-10-10,50.09341513,-122.9911995,11106290,3806828
ab-17902185,Beautifully Renovated Whistler Condo!!!,Condominium,Entire home/apt,3/24/17,2017-03-24,5-22-19,2019-05-22,50.11765,-122.94365,17902185,108885029
ab-11116277,"Ski In Ski Out 1 Bedroom, 1Bath",Condominium,Entire home/apt,2/6/16,2016-02-06,1-9-19,2019-01-09,50.11550189,-122.9444906,11116277,6014817
ab-15497149,Serene Chateau Golf Course Views by Harmony Whistler,Townhouse,Entire home/apt,10/12/16,2016-10-12,5-24-19,2019-05-24,50.1207,-122.93931,15497149,35393628
ab-11119101,Modern 5 Bedroom Whistler Benchlands,Townhouse,Entire home/apt,2/6/16,2016-02-06,5-22-19,2019-05-22,50.11712,-122.94043,11119101,778269
ab-16225513,Great location-10 min walk to Village/on bus route,House,Entire home/apt,12/1/16,2016-12-01,10-7-18,2018-10-07,50.12603782,-122.9576209,16225513,106025837
ab-8764286,"Whistler: Amazing views, close to the Village",Entire apartment,Entire home/apt,10/6/15,2015-10-06,1-17-18,2018-01-17,50.11450883,-122.968836,8764286,45958627
ab-14094465,WHISTLER CHALET RETREAT,Guest suite,Entire home/apt,5/24/17,2017-05-24,5-23-19,2019-05-23,50.12483,-122.96782,14094465,59908012
ab-11146811,The Gables 2 Br Premium Location,Townhouse,Entire home/apt,2/7/16,2016-02-07,5-21-19,2019-05-21,50.11527,-122.94909,11146811,41850542
ab-11147976,LAST MIN SPECIAL! sleeps 6 with Pool & Hot Tub :),Apartment,Entire home/apt,2/7/16,2016-02-07,3-20-19,2019-03-20,50.11796,-122.95916,11147976,7784624
ab-14823256,1 Bedroom available in Professional House,House,Private room,5/24/17,2017-05-24,5-26-18,2018-05-26,50.12947304,-122.9494677,14823256,7079554
ab-11148811,Whistler Chalet - 3 Bedroom Home,House,Entire home/apt,2/7/16,2016-02-07,11-12-18,2018-11-12,50.08835013,-123.0099495,11148811,32897311
ab-11149961,Private Blueberry Paradise + Hottub,Townhouse,Entire home/apt,2/7/16,2016-02-07,2-21-17,2017-02-21,50.10040798,-122.9712178,11149961,19254342
ab-14095140,Whistler Modern Mountain Chalet,House,Entire home/apt,7/19/16,2016-07-19,5-21-19,2019-05-21,50.14143,-122.9672,14095140,84820815
ab-13452841,Updated  2 bedroom family suite/Walk to Village,House,Entire home/apt,6/10/16,2016-06-10,5-24-19,2019-05-24,50.12008,-122.96008,13452841,43035949
ab-16228731,Bluebird Corner @ Whistler Creekside ~ Studio Apt.,Apartment,Entire home/apt,12/1/16,2016-12-01,5-21-19,2019-05-21,50.09719,-122.99034,16228731,106052690
ab-16230442,Modern Mountain Hideaway,Entire apartment,Entire home/apt,12/1/16,2016-12-01,12-23-17,2017-12-23,50.14615281,-122.9680458,16230442,61853098
ab-11163080,"Whistler 1 BR CONDO, Slps4,  2 Bed!",Apartment,Entire home/apt,2/8/16,2016-02-08,5-23-19,2019-05-23,50.11785,-122.95733,11163080,41465682
ab-11163807,Cozy up in our 1 bdr condo :),Apartment,Entire home/apt,2/8/16,2016-02-08,9-9-17,2017-09-09,50.09330349,-122.9932578,11163807,46986324
ab-18667882,Sumi Sanctuary | Hotel Room 114 | Whistler BC,Condominium,Entire home/apt,5/9/17,2017-05-09,5-23-19,2019-05-23,50.11725,-122.94816,18667882,3111913
ab-17015409,Alta Lake Two Bedroom Retreat,House,Entire home/apt,1/28/17,2017-01-28,6-8-17,2017-06-08,50.12340846,-122.9750964,17015409,26375388
ab-7602463,Whistler Village studio suite pool hot tub gym,Apartment,Entire home/apt,7/26/15,2015-07-26,5-24-19,2019-05-24,50.11875,-122.95914,7602463,13232844
ab-11169895,Whistler-Cozy View Cabin,Entire house,Entire home/apt,2/8/16,2016-02-08,2-4-18,2018-02-04,50.08853116,-122.9950451,11169895,40326488
ab-14823887,Whistler Sleeps 6-8,Condominium,Entire home/apt,8/30/16,2016-08-30,5-23-19,2019-05-23,50.11647,-122.95815,14823887,39631194
ab-15498982,Bachelor suite at Glacier Lodge,Apartment,Entire home/apt,10/12/16,2016-10-12,5-24-19,2019-05-24,50.11643,-122.94621,15498982,99546601
ab-11179460,Whiski Jack Whistler Condo Rental,Condominium,Entire home/apt,2/9/16,2016-02-09,5-24-19,2019-05-24,50.09358,-122.99159,11179460,52651623
ab-11186006,Whistler Retreat!,Apartment,Entire home/apt,2/9/16,2016-02-09,5-22-19,2019-05-22,50.11735,-122.95509,11186006,26206769
ab-14103091,Luxurious 6BR/7BA Chalet on Nicklaus North,Chalet,Entire home/apt,7/19/16,2016-07-19,11-16-16,2016-11-16,50.13983956,-122.9533304,14103091,11472769
ab-15500567,Whistler Blackcomb Studio17 Village Hotel,Condominium,Entire home/apt,10/12/16,2016-10-12,11-2-16,2016-11-02,50.11768339,-122.9578709,15500567,96456898
ab-16230871,"2 BR, 2 Bath, Blackcomb Base, Mtn Views & Snow!",Townhouse,Entire home/apt,12/1/16,2016-12-01,5-22-19,2019-05-22,50.11814,-122.94054,16230871,104715485
ab-18671602,"Top Floor, Renovated Condo with Village Views",Apartment,Entire home/apt,5/9/17,2017-05-09,5-22-19,2019-05-22,50.1183,-122.95505,18671602,68581273
ab-18671990,Ski/Ride/Relax central townhouse w hot tub/pool,Condominium,Entire home/apt,5/9/17,2017-05-09,5-21-19,2019-05-21,50.12046,-122.96055,18671990,22991654
ab-18672195,Quatchi House | Studio 115 | Whistler BC,Condominium,Entire home/apt,5/9/17,2017-05-09,5-23-19,2019-05-23,50.11696,-122.94711,18672195,3111913
ab-18672443,Loft at Mountainside Lodge - Whistler Village,Loft,Entire home/apt,5/9/17,2017-05-09,1-9-19,2019-01-09,50.11402998,-122.9532446,18672443,3111913
ab-15501375,Warm Blu berry apartment almost like at home,Apartment,Shared room,10/12/16,2016-10-12,12-8-16,2016-12-08,50.11296485,-122.9682435,15501375,79596336
ab-15501585,Renovated Townhome+Private Hot Tub by Village,Apartment,Entire home/apt,10/12/16,2016-10-12,5-23-19,2019-05-23,50.11922,-122.96016,15501585,84821274
ab-11208074,Luxury modern home short walk to village,Chalet,Entire home/apt,2/10/16,2016-02-10,5-23-19,2019-05-23,50.1184,-122.96261,11208074,58337250
ab-17908674,3 storey townhouse in the Bayshores forest,Townhouse,Entire home/apt,3/24/17,2017-03-24,9-14-17,2017-09-14,50.08906525,-122.9982654,17908674,45907539
ab-13462411,Beautiful Family House Close to the Village,House,Entire home/apt,6/10/16,2016-06-10,11-11-16,2016-11-11,50.10877081,-122.9635658,13462411,62126586
ab-17910110,Gorgeous Ski-in Suite at Brio!,Apartment,Entire home/apt,3/24/17,2017-03-24,4-9-17,2017-04-09,50.10854504,-122.9645415,17910110,83196803
ab-11222575,Unique and Cozy Condo in Whistler,Condominium,Entire home/apt,2/11/16,2016-02-11,2-14-16,2016-02-14,50.09680453,-122.9874384,11222575,57666925
ab-11223193,Golden Dreams Eagle Lodge luxury!,Apartment,Entire home/apt,2/11/16,2016-02-11,5-22-19,2019-05-22,50.11797,-122.95395,11223193,17046824
ab-11225635,"Cozy 1 BR Condo sleeps 4, FREE Parking, ski in/out",Condominium,Entire home/apt,2/11/16,2016-02-11,5-21-19,2019-05-21,50.11738,-122.94214,11225635,58498930
ab-14827982,Creekside Condo - Short walk to Gondola,Condominium,Entire home/apt,8/30/16,2016-08-30,5-21-19,2019-05-21,50.09138,-122.99499,14827982,92735868
ab-15506184,BEAUTIFUL WHISTLER HIDEAWAY (PEAK),Chalet,Entire home/apt,5/24/17,2017-05-24,10-19-18,2018-10-19,50.12439069,-122.9663045,15506184,59908012
ab-2249323,Inn at Clifftop Lane - Whistler B&B,Bed & Breakfast,Private room,1/19/14,2014-01-19,5-1-17,2017-05-01,50.09003493,-123.0129095,2249323,11487888
ab-2249354,Whistler's Top Rated B&B Lodge.,Bed & Breakfast,Private room,1/19/14,2014-01-19,5-1-17,2017-05-01,50.09015316,-123.0118563,2249354,11487888
ab-11238822,1 BR apt by Olympic plaza in villag,Serviced apartment,Entire home/apt,2/11/16,2016-02-11,5-24-19,2019-05-24,50.11866,-122.95572,11238822,312204
ab-11242593,Private Room with Sunny Deck in Whistler,House,Private room,5/24/17,2017-05-24,5-6-18,2018-05-06,50.08929786,-123.0005665,11242593,41779907
ab-11250034,Northstar Condo Whistler 2BR,Condominium,Entire home/apt,5/20/17,2017-05-20,5-23-19,2019-05-23,50.0938,-122.99205,11250034,52651623
ab-18675972,Ski-in/Ski Out Near Gondola  & Fitzsimmons Creek,Apartment,Entire home/apt,5/9/17,2017-05-09,5-24-19,2019-05-24,50.11409,-122.95067,18675972,6641619
ab-17027133,Modern Whistler Townhome!,Townhouse,Entire home/apt,1/29/17,2017-01-29,5-24-19,2019-05-24,50.11773,-122.95868,17027133,17887528
ab-11262384,Cascade Lodge,Condominium,Entire home/apt,2/12/16,2016-02-12,5-22-19,2019-05-22,50.11567,-122.95905,11262384,58385754
ab-14109256,Exquisite 3 Bedroom Whistler Townhome,Townhouse,Entire home/apt,7/20/16,2016-07-20,11-23-17,2017-11-23,50.11820425,-122.9596138,14109256,65790915
ab-18682799,"Studio Suite, Whistler Village",Apartment,Entire home/apt,5/9/17,2017-05-09,5-21-19,2019-05-21,50.11885,-122.95696,18682799,126849376
ab-11272741,Sundance - 1BR,Condominium,Entire home/apt,2/13/16,2016-02-13,5-23-19,2019-05-23,50.09135,-122.99306,11272741,58385754
ab-17911055,"Fantastic Condo in Whistler, BC",Condominium,Entire home/apt,3/24/17,2017-03-24,7-29-17,2017-07-29,50.1179241,-122.9568118,17911055,122773552
ab-17911532,Cozy studio w/ hot tub in Whistler Village,Apartment,Entire home/apt,3/24/17,2017-03-24,7-16-17,2017-07-16,50.1177954,-122.9577888,17911532,56846406
ab-11573605,"Whistler - Sundance, BC 1 Bedroom",Condominium,Entire home/apt,2/27/16,2016-02-27,11-13-16,2016-11-13,50.09305803,-122.9937426,11573605,55037716
ab-11573710,Room in Lake Front Cabin,House,Private room,3/9/17,2017-03-09,7-11-17,2017-07-11,50.11011245,-122.9854203,11573710,28437772
ab-11573806,WorldMark Whistler 1 Bedroom Plus,Condominium,Entire home/apt,2/27/16,2016-02-27,11-13-16,2016-11-13,50.09170227,-122.9937403,11573806,55037716
ab-11573942,WorldMark Whistler 2 Bedroom Plus,Condominium,Entire home/apt,2/27/16,2016-02-27,11-13-16,2016-11-13,50.09153988,-122.9938265,11573942,55037716
ab-11281764,North Village studio w/kitchen & Hot-tub,Townhouse,Entire home/apt,2/13/16,2016-02-13,5-23-19,2019-05-23,50.11978,-122.957,11281764,58927989
ab-11294551,"Location, Location, Location!!!",Condominium,Entire home/apt,2/14/16,2016-02-14,5-22-19,2019-05-22,50.11727,-122.95791,11294551,52346850
ab-14835617,Luxury House - 12 People - Whistler,House,Entire home/apt,8/30/16,2016-08-30,12-2-16,2016-12-02,50.11897998,-122.9379172,14835617,92613703
ab-456542,Studio suite in the heart of Whistler Village,Condominium,Entire home/apt,5/1/12,2012-05-01,5-22-19,2019-05-22,50.11743,-122.95601,456542,1816171
ab-12792569,Heart of Whistler Queensize Bedroom,Apartment,Private room,5/1/16,2016-05-01,10-8-18,2018-10-08,50.121063,-122.9598155,12792569,69657375
ab-11301760,"Ski In-Ski Out, 2BR, Pool/HT",Condominium,Entire home/apt,2/14/16,2016-02-14,5-22-19,2019-05-22,50.11618,-122.94737,11301760,59072060
ab-2268749,Ski-In 2 BR & Den Upper Village w/ Private Hot Tub,Townhouse,Entire home/apt,12/5/16,2016-12-05,3-23-19,2019-03-23,50.117,-122.94252,2268749,8821150
ab-2269519,Amazing Whistler Rental!! Sleeps 8!,House,Entire home/apt,5/18/17,2017-05-18,5-18-17,2017-05-18,50.12331592,-122.9543002,2269519,11589966
ab-11303003,La Casa de Whistler. 1bd/1bth,Condominium,Entire home/apt,2/14/16,2016-02-14,5-5-17,2017-05-05,50.09322427,-122.9912208,11303003,59082269
ab-17027967,Great location with pool and hot tub! Renovated!,Condominium,Entire home/apt,1/29/17,2017-01-29,5-22-19,2019-05-22,50.11776,-122.95793,17027967,114226955
ab-6657881,Best Whistler Village 2 Bdrm Luxury Ski-In Ski-Out,Serviced apartment,Entire home/apt,6/1/15,2015-06-01,5-21-19,2019-05-21,50.11691,-122.94577,6657881,5552737
ab-15509719,BEAUTIFUL WHISTLER HIDEAWAY,Chalet,Entire home/apt,5/24/17,2017-05-24,5-23-19,2019-05-23,50.12363,-122.96784,15509719,59908012
ab-12794106,Cozy 2 Bedroom in The Village!,Apartment,Entire home/apt,5/1/16,2016-05-01,5-21-19,2019-05-21,50.11944,-122.95779,12794106,19254342
ab-14835972,Relax in Modern Luxury - A Whistler Village Escape,Townhouse,Entire home/apt,8/30/16,2016-08-30,5-22-19,2019-05-22,50.11702,-122.95678,14835972,14138534
ab-11324097,The Ironwood. Whistler B.C.,Condominium,Entire home/apt,2/15/16,2016-02-15,5-24-19,2019-05-24,50.11032,-122.97012,11324097,29345634
ab-14837799,Whistler Mountain Town House,Townhouse,Entire home/apt,8/30/16,2016-08-30,5-24-19,2019-05-24,50.09356,-122.97925,14837799,15869567
ab-6661180,Bright & Quiet Private Room,Apartment,Private room,6/1/15,2015-06-01,5-10-17,2017-05-10,50.09919652,-122.9805986,6661180,23676895
ab-2296525,Whistler Sundance 2 bedroom condo,Condominium,Entire home/apt,1/27/14,2014-01-27,5-22-19,2019-05-22,50.09114,-122.99181,2296525,103427
ab-8796550,"Whistler Village, condo, sleeps 4",Apartment,Entire home/apt,10/7/15,2015-10-07,6-8-16,2016-06-08,50.11594467,-122.9583726,8796550,17876150
ab-13471135,Fantastic SKI In/Out 4+ BDR Newly Renovated Chalet,Chalet,Entire home/apt,1/23/17,2017-01-23,2-19-17,2017-02-19,50.11261523,-122.9488291,13471135,77063271
ab-17922873,Cute & Cozy Condo in Whistler-Walk to the Gondola!,Condominium,Entire home/apt,3/25/17,2017-03-25,6-4-17,2017-06-04,50.0989902,-122.990966,17922873,122773552
ab-13474815,1 BR Suite in the Heart of the Village,Condominium,Entire home/apt,6/11/16,2016-06-11,5-29-18,2018-05-29,50.11467056,-122.9553213,13474815,52706624
ab-16241914,Spacious studio steps to the lake/ slopes,Condominium,Entire home/apt,12/2/16,2016-12-02,5-24-19,2019-05-24,50.09679,-122.99515,16241914,54643820
ab-11584547,Whistler Creekside Cozy Studio !,Apartment,Entire home/apt,2/27/16,2016-02-27,7-10-17,2017-07-10,50.09940333,-122.9908031,11584547,3180342
ab-15511696,Accommodation in Whistler Village,Condominium,Shared room,10/13/16,2016-10-13,12-5-16,2016-12-05,50.11755549,-122.9562153,15511696,6411460
ab-4049895,Celebrate New Years in Whistler!,Apartment,Entire home/apt,9/3/14,2014-09-03,5-21-19,2019-05-21,50.11384,-122.95485,4049895,7441198
ab-16242853,Whistler - family ski chalet,Entire house,Entire home/apt,12/2/16,2016-12-02,11-30-17,2017-11-30,50.15164053,-122.9624374,16242853,31539882
ab-2314636,Whistler Slumber,Townhouse,Entire home/apt,1/30/14,2014-01-30,5-24-19,2019-05-24,50.12208,-122.93573,2314636,11819262
ab-13476379,"Upscale two bedroom in Whistler, BC.Jan.28-31,2018",Apartment,Entire home/apt,6/11/16,2016-06-11,5-21-19,2019-05-21,50.11977,-122.95957,13476379,9405845
ab-19270422,"Creekside Lodge, Shared House, Private 1 Bdrm/Bath",Private room in condominium,Private room,6/11/17,2017-06-11,12-12-17,2017-12-12,50.09487025,-122.9915115,19270422,96570619
ab-2320161,"Mountain Side Townhome, ski in/out, bike in/out",Townhouse,Entire home/apt,2/1/14,2014-02-01,5-24-19,2019-05-24,50.09582,-122.98063,2320161,4048878
ab-4058424,LARGE 1 BEDROOM W/PRIVATE HOT TUB AND AMAZING VIEW,Apartment,Entire home/apt,9/3/14,2014-09-03,5-24-19,2019-05-24,50.12127,-122.95655,4058424,21048569
ab-4058453,1B apt Creekside Lake Placid Lodge 3min to gondola,Apartment,Entire home/apt,9/3/14,2014-09-03,5-22-19,2019-05-22,50.09303,-122.99156,4058453,21048625
ab-12798248,"GlacierNest- Executive Lofted Unit- Pool,hot tub",Apartment,Entire home/apt,5/1/16,2016-05-01,5-22-19,2019-05-22,50.11618,-122.94621,12798248,16330328
ab-14841763,Embarc / Club Intrawest - Upper Village,Condominium,Entire home/apt,9/1/16,2016-09-01,5-21-19,2019-05-21,50.11673,-122.9458,14841763,92872867
ab-13476890,Whistler Village Luxury Condo Ski In Walk Out,Townhouse,Entire home/apt,6/11/16,2016-06-11,5-22-19,2019-05-22,50.11091,-122.95901,13476890,57206409
ab-18687745,Whistler Village Studio - MarketPlace Lodge 310,Condominium,Entire home/apt,5/10/17,2017-05-10,5-23-19,2019-05-23,50.1195,-122.95668,18687745,67281627
ab-18687834,"Cozy, quiet and close to Whsitler village",Cabin,Entire home/apt,5/10/17,2017-05-10,5-24-19,2019-05-24,50.12148,-122.97552,18687834,96596032
ab-11589682,Golden Dreams River View,House,Entire home/apt,11/19/16,2016-11-19,11-19-16,2016-11-19,50.14098932,-122.9693879,11589682,13232844
ab-2333516,Whistler Ski In/Ski Out 2br/2ba,Condominium,Entire home/apt,2/3/14,2014-02-03,5-24-19,2019-05-24,50.11664,-122.94245,2333516,7054805
ab-6677513,Whistler Village Studio with Pool,Apartment,Entire home/apt,6/2/15,2015-06-02,6-14-17,2017-06-14,50.1174756,-122.9559148,6677513,34949998
ab-17043348,Inviting Mountain Home with Pool and Hot Tub.,Townhouse,Entire home/apt,1/30/17,2017-01-30,10-30-17,2017-10-30,50.09759439,-122.9807846,17043348,778269
ab-17044478,"Grand 4-Bedroom Chalet, Hot-tub, Mountain Views",House,Entire home/apt,1/30/17,2017-01-30,5-22-19,2019-05-22,50.14244,-122.95148,17044478,96453221
ab-17044723,Ski-in-ski-out 3 Bedroom Condo at Blackcomb Base,Condominium,Entire home/apt,1/30/17,2017-01-30,5-23-19,2019-05-23,50.11709,-122.94877,17044723,96453221
ab-486720,condo in whistler,Apartment,Entire home/apt,5/17/12,2012-05-17,5-23-19,2019-05-23,50.11742,-122.9588,486720,103427
ab-486722,second condo property in whistler,Apartment,Entire home/apt,5/17/12,2012-05-17,9-22-17,2017-09-22,50.09265671,-122.992353,486722,103427
ab-4075389,Whistler Center Village Studio -Steps from Gondola,Entire apartment,Entire home/apt,9/5/14,2014-09-05,3-17-18,2018-03-17,50.11493223,-122.9547687,4075389,317618
ab-15521765,Renovated Condo with Pool & Hot Tub,Condominium,Entire home/apt,10/14/16,2016-10-14,5-25-19,2019-05-25,50.1158,-122.94201,15521765,99783075
ab-18692788,PSWhistler,Townhouse,Entire home/apt,5/10/17,2017-05-10,5-22-19,2019-05-22,50.1182,-122.95961,18692788,45871227
ab-489996,BnB & EBike or Guided Mtn Adventure,Bed and breakfast,Private room,5/19/12,2012-05-19,5-23-19,2019-05-23,50.12169,-122.93756,489996,919089
ab-14122437,Best Whistler Townhome 4Bdrm 3Bth @Gondola base,Townhouse,Entire home/apt,7/21/16,2016-07-21,5-21-19,2019-05-21,50.11563,-122.94852,14122437,5552737
ab-499669,2 Bedroom Private Village Townhouse,Townhouse,Entire home/apt,5/25/12,2012-05-25,8-25-17,2017-08-25,50.12022839,-122.9574778,499669,2465899
ab-11603917,1 bdrm at WorldMark Whistler Cascade Lodge,Serviced apartment,Entire home/apt,2/28/16,2016-02-28,1-7-19,2019-01-07,50.11722904,-122.959591,11603917,56490293
ab-17942811,Cozy studio on Main Street with hot tub and pool,Condominium,Entire home/apt,3/26/17,2017-03-26,5-20-19,2019-05-20,50.11742,-122.95843,17942811,11166244
ab-15522921,Embarc Whistler(formerly Club Intrawest),Apartment,Entire home/apt,10/14/16,2016-10-14,5-22-19,2019-05-22,50.11752,-122.94471,15522921,48908163
ab-15523166,Excellent Ski In/Out 2 BDRM on Blackcomb Mountain,Apartment,Entire home/apt,10/14/16,2016-10-14,5-22-19,2019-05-22,50.11714,-122.94508,15523166,99799600
ab-17047639,The Beach House,Apartment,Entire home/apt,2/1/17,2017-02-01,3-29-17,2017-03-29,50.12897841,-122.9548769,17047639,74613392
ab-17049476,Modern Alpine Meadows Two Bedroom Suite,Apartment,Entire home/apt,2/1/17,2017-02-01,3-9-17,2017-03-09,50.14482979,-122.9671268,17049476,84613430
ab-508615,"Whistler Shared Retreat 4 Whistler, BC",House,Private room,8/2/18,2018-08-02,9-13-18,2018-09-13,50.11605336,-122.9606285,508615,2005783
ab-11609179,"Sundance, Whistler, Canada, 1-Bedroom #1",Condominium,Entire home/apt,3/1/16,2016-03-01,5-23-19,2019-05-23,50.09129,-122.99388,11609179,10981379
ab-11609256,"Sundance, Whistler, Canada, 1-Bedroom #2",Condominium,Entire home/apt,3/1/16,2016-03-01,5-24-19,2019-05-24,50.0928,-122.99332,11609256,10981379
ab-11609315,"Sundance, Whistler, Canada, 1-Bedroom Plus #1",Condominium,Entire home/apt,11/24/16,2016-11-24,5-24-19,2019-05-24,50.09278,-122.99511,11609315,10981379
ab-11609365,"Sundance, Whistler, Canada, 1-Bedroom Plus #2",Condominium,Entire home/apt,3/1/16,2016-03-01,5-21-19,2019-05-21,50.09176,-122.99358,11609365,10981379
ab-13491862,Beautiful Townhome with Private Hot tub,Condominium,Entire home/apt,6/12/16,2016-06-12,5-24-19,2019-05-24,50.12013,-122.9549,13491862,58628415
ab-11609431,"Sundance, Whistler, Canada, 2-Bedroom #1",Condominium,Entire home/apt,3/1/16,2016-03-01,5-24-19,2019-05-24,50.09133,-122.99463,11609431,10981379
ab-11609559,"Sundance, Whistler, Canada, 2 Bedroom Plus #1",Condominium,Entire home/apt,3/1/16,2016-03-01,5-21-19,2019-05-21,50.0919,-122.995,11609559,10981379
ab-11609629,"Sundance, Whistler, Canada, 2 Bedroom Plus #2",Condominium,Entire home/apt,11/18/16,2016-11-18,5-22-19,2019-05-22,50.09152,-122.99367,11609629,10981379
ab-16253784,Whistler Creek Lodge (at Creekside),Condominium,Entire home/apt,12/3/16,2016-12-03,5-23-19,2019-05-23,50.09134,-122.99121,16253784,74304573
ab-17945785,Blueberry,Townhouse,Entire home/apt,3/26/17,2017-03-26,5-24-17,2017-05-24,50.11141721,-122.9707288,17945785,123128367
ab-11619574,FANTASTIC townhome!! Spacious for 8 people,Townhouse,Entire home/apt,3/1/16,2016-03-01,5-21-19,2019-05-21,50.08657,-122.99872,11619574,61532022
ab-14848183,Quiet Woodland Houseshare in Creekside,House,Private room,9/1/16,2016-09-01,9-15-16,2016-09-15,50.0984465,-122.9878118,14848183,92939489
ab-12814690,Upper Village bench lands 2 bedroom,Entire apartment,Entire home/apt,5/1/16,2016-05-01,3-15-18,2018-03-15,50.11546261,-122.9455955,12814690,6307461
ab-12815390,Clean and cozy one bedroom apartment,Condominium,Entire home/apt,5/1/16,2016-05-01,5-24-19,2019-05-24,50.09221,-122.99335,12815390,45481206
ab-519181,Family Ski Pad -Slopeside 2 bedroom,Apartment,Private room,6/4/12,2012-06-04,5-31-17,2017-05-31,50.11686946,-122.9447326,519181,2555197
ab-2380790,Cozy Creekside 2min walk to gondola,Apartment,Entire home/apt,2/11/14,2014-02-11,5-22-19,2019-05-22,50.0924,-122.99166,2380790,12162786
ab-8833557,Amazing Ski In/Out Family Chalet,House,Entire home/apt,10/9/15,2015-10-09,1-27-19,2019-01-27,50.09344891,-122.98663,8833557,24943039
ab-19872818,"Quiet one bedroom, beautiful neighborhood",Townhouse,Private room,7/12/17,2017-07-12,5-22-19,2019-05-22,50.09267,-122.98074,19872818,38655764
ab-14127480,Mountainside Lodge - Whistler Lodge Sleeps 4,,Entire home/apt,7/21/16,2016-07-21,8-2-16,2016-08-02,50.1134931,-122.9545455,14127480,85202511
ab-536460,"Whistler Cay, Sleeps 6A/2C, Hot Tub",Cabin,Entire home/apt,6/13/12,2012-06-13,12-14-18,2018-12-14,50.12651553,-122.9679587,536460,2635485
ab-12825740,"Sun and Shade Oasis, Alpine Meadows",House,Entire home/apt,5/2/16,2016-05-02,5-24-19,2019-05-24,50.14807,-122.96574,12825740,13546868
ab-19874956,Spacious 1 bedroom with Free parking and Cable TV,Condominium,Entire home/apt,7/13/17,2017-07-13,5-21-19,2019-05-21,50.12112,-122.95643,19874956,36434969
ab-2392207,WALK to Village: 2BR w/ BBQ & View of Mountains,Condominium,Entire home/apt,2/13/14,2014-02-13,5-21-19,2019-05-21,50.11293,-122.96919,2392207,12219491
ab-16259240,Cozy One Bedroom Benchlands ski-in Townhome,Townhouse,Entire home/apt,12/4/16,2016-12-04,1-28-19,2019-01-28,50.1219516,-122.9340333,16259240,57208861
ab-11635920,Sundance - 2BR,Condominium,Entire home/apt,3/1/16,2016-03-01,5-23-19,2019-05-23,50.09306,-122.99463,11635920,58385754
ab-11636007,Sundance - 2BR Plus/Loft,Condominium,Entire home/apt,3/1/16,2016-03-01,5-22-19,2019-05-22,50.09107,-122.99366,11636007,58385754
ab-545773,Beautiful Whistler Townhome ,Apartment,Entire home/apt,6/18/12,2012-06-18,5-22-19,2019-05-22,50.1198,-122.93797,545773,2646598
ab-550991,Alpine Meadow Studio,Apartment,Entire home/apt,6/21/12,2012-06-21,11-16-17,2017-11-16,50.14226591,-122.9680531,550991,2705645
ab-8845507,'Glaciers Reach' Pet Friendly - 2 Bdrm & Hot Tub,Townhouse,Entire home/apt,10/10/15,2015-10-10,7-9-17,2017-07-09,50.12024291,-122.9556153,8845507,35393628
ab-8846010,"'Glaciers Reach' 2 bdrm,private hot tub in Village",Townhouse,Entire home/apt,10/10/15,2015-10-10,11-7-17,2017-11-07,50.11985945,-122.9569064,8846010,35393628
ab-19876696,Whistler for Labour day week- (Aug 28-Sept 4),Condominium,Entire home/apt,7/13/17,2017-07-13,6-9-18,2018-06-09,50.09243621,-122.9952625,19876696,7705790
ab-16260876,Whistler Luxury Home w/ Spa & Walk into Village,House,Entire home/apt,12/4/16,2016-12-04,7-22-17,2017-07-22,50.12377989,-122.9632119,16260876,57004187
ab-17094152,"Whistler Creek, Sundance, Reno, 3Bd, Views",Townhouse,Entire home/apt,2/2/17,2017-02-02,5-20-19,2019-05-20,50.09121,-122.99332,17094152,41850542
ab-13500863,Luxury Mountain Slope Side Chalet Ski in/Out,House,Entire home/apt,6/13/16,2016-06-13,5-24-19,2019-05-24,50.09251,-122.98268,13500863,77439987
ab-18707199,Whistler Ski In/Out - One Bedroom,Chalet,Entire home/apt,5/11/17,2017-05-11,7-7-17,2017-07-07,50.11699453,-122.9457224,18707199,3111913
ab-13505195,Cozy new Alpine Meadows Coach House,Guesthouse,Entire home/apt,6/13/16,2016-06-13,4-18-17,2017-04-18,50.14623427,-122.9655336,13505195,11803391
ab-8849291,"2 BR, 2 level townhome in Whistler&#x27;s Creekside",Townhouse,Entire home/apt,10/10/15,2015-10-10,2-1-17,2017-02-01,50.09802318,-122.9899111,8849291,46339296
ab-8850256,"2BR Suite in Private Club - Waterslide, Theatre...",Serviced apartment,Entire home/apt,8/2/17,2017-08-02,5-23-19,2019-05-23,50.11742,-122.94756,8850256,63830
ab-17096944,Cosy Wood Cabin,House,Entire home/apt,2/3/17,2017-02-03,11-11-17,2017-11-11,50.10878097,-122.9720493,17096944,44621160
ab-2413878,"2 Bed/2 Bath Villa - Walk to Lifts, Hot Tub/ Pool",Townhouse,Entire home/apt,2/16/14,2014-02-16,3-3-19,2019-03-03,50.11852,-122.95808,2413878,7761771
ab-2414021,Master Bedroom walking distance from village,House,Private room,12/19/16,2016-12-19,5-20-19,2019-05-20,50.11007,-122.9668,2414021,12339473
ab-15538127,Whistler's Best - Luxury Townhome,Townhouse,Entire home/apt,10/15/16,2016-10-15,5-21-19,2019-05-21,50.12301,-122.9579,15538127,99964831
ab-564267,"Walk to lake & town, hottub, long term dates avail",Condominium,Entire home/apt,6/28/12,2012-06-28,5-20-19,2019-05-20,50.11697,-122.94306,564267,2774661
ab-5592539,Beautiful Condo in Whistler Creekside,Loft,Entire home/apt,3/8/15,2015-03-08,5-24-19,2019-05-24,50.09574,-122.99151,5592539,26180186
ab-17098174,Blackcomb view hot tub and pool,Apartment,Private room,2/3/17,2017-02-03,4-20-17,2017-04-20,50.11873957,-122.960444,17098174,114750412
ab-17098310,whistler Gondola 5minutes walk,Townhouse,Private room,2/3/17,2017-02-03,4-21-17,2017-04-21,50.12013703,-122.9600868,17098310,114750412
ab-5593553,Cozy Townhouse On The Lake,House,Entire home/apt,9/11/17,2017-09-11,10-21-17,2017-10-21,50.09185473,-123.0081781,5593553,873937
ab-12844484,Ski In/Out Penthouse Private Hot Tub and Views,Apartment,Entire home/apt,5/3/16,2016-05-03,11-12-18,2018-11-12,50.11630304,-122.9490932,12844484,7761771
ab-19294872,"Charming, spacious Whistler Village 1BR, sleeps 6",Condominium,Entire home/apt,6/12/17,2017-06-12,5-24-19,2019-05-24,50.12086,-122.96039,19294872,135114811
ab-2431061,Symphony Townhouse - Whistler Village,Apartment,Entire home/apt,2/19/14,2014-02-19,5-21-19,2019-05-21,50.11988,-122.95921,2431061,3269011
ab-2436313,"Lorimer Ridge Lodge-Whistler,Canada",Chalet,Entire home/apt,2/20/14,2014-02-20,5-23-19,2019-05-23,50.12647,-122.96359,2436313,12451905
ab-18711873,"BEAUTIFUL modern Whistler studio, 5 min from lifts",Apartment,Entire home/apt,5/11/17,2017-05-11,5-24-19,2019-05-24,50.0972,-122.99044,18711873,128805625
ab-2442251,The Cabin - Home in the mountains,Apartment,Entire home/apt,2/21/14,2014-02-21,5-21-19,2019-05-21,50.0948,-122.99194,2442251,6531398
ab-16274930,"Large Village apt- Hot tub,pool,car space,sleeps 4",Apartment,Entire home/apt,12/5/16,2016-12-05,3-16-17,2017-03-16,50.12066309,-122.9595179,16274930,27857322
ab-17106496,"Whistler Village ""NorthStar"" 2 Bed/2 Bath Townhome",Townhouse,Entire home/apt,2/3/17,2017-02-03,7-12-18,2018-07-12,50.1200714,-122.959395,17106496,21328412
ab-14140356,Whistler Vacation Club at Twin Peaks 2BR,Condominium,Entire home/apt,7/22/16,2016-07-22,5-22-19,2019-05-22,50.12002,-122.95951,14140356,52651623
ab-16276014,Sleeps 5 3Beds/2bath Whistler Village HotTub UGPrk,Townhouse,Entire home/apt,12/5/16,2016-12-05,2-27-19,2019-02-27,50.12157,-122.95648,16276014,26789820
ab-17108154,Cosy wood cabin,House,Private room,2/3/17,2017-02-03,11-10-17,2017-11-10,50.10866324,-122.9714205,17108154,44621160
ab-17108415,5min walk to gondala+parking CREEKSIDE#SpringSale!,Apartment,Entire home/apt,2/3/17,2017-02-03,5-23-19,2019-05-23,50.09514,-122.99421,17108415,1744507
ab-8869025,Whistler Cozy Cabin High up,Apartment,Entire home/apt,10/11/15,2015-10-11,5-23-19,2019-05-23,50.09298,-122.99322,8869025,13238122
ab-8869226,The Hucking Hut,Guest suite,Entire home/apt,5/9/17,2017-05-09,12-13-18,2018-12-13,50.14708165,-122.9637712,8869226,39062114
ab-17964355,"Whistler Village Studio, Pool & Hot Tub",Serviced apartment,Entire home/apt,3/28/17,2017-03-28,5-22-19,2019-05-22,50.11761,-122.95796,17964355,28815703
ab-17968464,Beautiful 2 Bedroom Condo with Private Hot Tub,Condominium,Entire home/apt,3/28/17,2017-03-28,8-26-17,2017-08-26,50.11999301,-122.9551953,17968464,65790915
ab-19891362,Goldenbear Home away from Home,House,Entire home/apt,7/13/17,2017-07-13,6-17-18,2018-06-17,50.14217014,-122.9572505,19891362,66924504
ab-17109307,5minWalktoGondola+FREEPARKING+Hottub#springskiing!,Apartment,Entire home/apt,2/3/17,2017-02-03,5-23-19,2019-05-23,50.09483,-122.99414,17109307,1744507
ab-16283297,Cozy Whistler Village Reindeer Retreat,Apartment,Entire home/apt,12/6/16,2016-12-06,5-23-19,2019-05-23,50.12087,-122.95773,16283297,84821274
ab-4136516,Central Studio with Hot Tub/Pool,Apartment,Entire home/apt,9/9/14,2014-09-09,5-23-19,2019-05-23,50.11946,-122.95706,4136516,14907600
ab-17112077,"Whistler Village - 2BR, 2 bath, & private hot tub.",Townhouse,Entire home/apt,9/6/17,2017-09-06,4-7-18,2018-04-07,50.12005558,-122.9567773,17112077,7952281
ab-16286558,Beautiful Studio - Steps away from Blackcomb Lifts,Condominium,Entire home/apt,12/6/16,2016-12-06,10-13-17,2017-10-13,50.11610467,-122.9485414,16286558,65790915
ab-19297699,Large Chalet  - Perfect for families or groups,House,Entire home/apt,6/12/17,2017-06-12,8-5-17,2017-08-05,50.08692408,-123.0020302,19297699,1616015
ab-15544275,Ski In/Out Townhouse in Creekside Village,Townhouse,Entire home/apt,10/15/16,2016-10-15,5-21-19,2019-05-21,50.09038,-122.99349,15544275,8759515
ab-2483939,Whistler Village Gem,Apartment,Entire home/apt,3/1/14,2014-03-01,5-21-19,2019-05-21,50.11884,-122.95738,2483939,12709926
ab-16290210,"Room with qn. bed and desk, shared washroom.",House,Private room,12/6/16,2016-12-06,12-27-16,2016-12-27,50.15744008,-122.9320247,16290210,87353684
ab-13515625,Beautifully renovated home in  Alpine meadows,House,Entire home/apt,6/14/16,2016-06-14,4-18-17,2017-04-18,50.14475158,-122.9644322,13515625,11803391
ab-16290598,Luxury 3 bdrm condo in the upper village.,Apartment,Entire home/apt,12/6/16,2016-12-06,5-24-19,2019-05-24,50.11718,-122.94771,16290598,91683939
ab-19895993,Bright Studio on Main Street w pool/hot tub,Condominium,Entire home/apt,7/14/17,2017-07-14,5-24-19,2019-05-24,50.11937,-122.95854,19895993,11166244
ab-8898875,Wildwood Lodge 105 Near lifts,Condominium,Entire home/apt,10/13/15,2015-10-13,5-21-19,2019-05-21,50.11801,-122.94335,8898875,22619214
ab-8905658,Carleton 202 Bronze - Slopeside Mountain View,Condominium,Entire home/apt,10/13/15,2015-10-13,5-22-19,2019-05-22,50.11313,-122.9533,8905658,26808890
ab-8906349,creekside location ski in ski out,Townhouse,Private room,10/13/15,2015-10-13,5-24-19,2019-05-24,50.09015,-122.99199,8906349,46584643
ab-6713233,#404 - Peak to Creek at Alpenglow,Apartment,Entire home/apt,6/4/15,2015-06-04,11-12-18,2018-11-12,50.11904183,-122.9569022,6713233,35146399
ab-8915733,Village-1 Bedroom+2 Sofa beds,Serviced apartment,Entire home/apt,10/14/15,2015-10-14,5-24-19,2019-05-24,50.11964,-122.95514,8915733,46625431
ab-14860747,One bedroom apartment with pullout,Apartment,Entire home/apt,9/1/16,2016-09-01,4-4-18,2018-04-04,50.12000793,-122.9574756,14860747,27814919
ab-17134304,"""2018"" Whistler Village - February 20th-25th",Entire boutique hotel,Entire home/apt,2/5/17,2017-02-05,3-6-18,2018-03-06,50.11360465,-122.9554294,17134304,51212990
ab-17135524,"Luxury Estate 5BR,3.5 bath 2 level 3,600sq/ft home",House,Entire home/apt,2/5/17,2017-02-05,5-24-19,2019-05-24,50.14206,-122.9518,17135524,96573513
ab-16304132,Blackcomb/Whistler - Steps to Lift,Condominium,Entire home/apt,12/7/16,2016-12-07,1-2-19,2019-01-02,50.11849551,-122.9444968,16304132,106680485
ab-8923117,Carleton 203 Silver - Mountain View Slopeside,Condominium,Entire home/apt,10/14/15,2015-10-14,5-23-19,2019-05-23,50.11285,-122.9555,8923117,26808890
ab-8923525,Carleton 204 - Spacious Two Bedroom,Condominium,Entire home/apt,10/14/15,2015-10-14,5-22-19,2019-05-22,50.11428,-122.95482,8923525,26808890
ab-16304383,ã…¤!Benchlands Townhouse 3 bdrm 2 bath 2 Free Prking,Resort,Entire home/apt,12/8/16,2016-12-08,5-23-19,2019-05-23,50.11869,-122.94015,16304383,17197633
ab-2488317,Beautiful Whistler Loft 2 Bdrm/Private Hot Tub,Townhouse,Entire home/apt,3/1/14,2014-03-01,5-24-19,2019-05-24,50.12009,-122.95686,2488317,7761771
ab-7697038,Holistic Cooking class,Bed and breakfast,Private room,5/9/17,2017-05-09,11-18-18,2018-11-18,50.14589331,-122.9700967,7697038,6149231
ab-16309809,Entire home in whistler,House,Entire home/apt,12/8/16,2016-12-08,12-12-16,2016-12-12,50.12609593,-122.957132,16309809,106722340
ab-16309950,"Village Square, Perfect condo in Whistler",Apartment,Entire home/apt,12/8/16,2016-12-08,10-8-18,2018-10-08,50.11433659,-122.9556011,16309950,106406848
ab-16311064,Spectacular/Mountain/Lake view house in Whistler,House,Shared room,12/8/16,2016-12-08,5-4-17,2017-05-04,50.10830943,-122.9872991,16311064,79596336
ab-11659553,Closest B&B to Whistler Village,Bed and breakfast,Private room,3/2/16,2016-03-02,5-24-19,2019-05-24,50.12407,-122.94864,11659553,37735687
ab-19909310,1 Bedroom Whistler Village,Condominium,Entire home/apt,7/14/17,2017-07-14,5-24-19,2019-05-24,50.11124,-122.95526,19909310,138639163
ab-5659616,Village Gatehouse central w PRIVATE HotTub!,Apartment,Entire home/apt,3/14/15,2015-03-14,12-16-18,2018-12-16,50.11555931,-122.9564949,5659616,7784624
ab-5661765,2BR at The Whistler Town Plaza in Village North,Condominium,Entire home/apt,3/14/15,2015-03-14,1-27-19,2019-01-27,50.1159474,-122.9571451,5661765,26650418
ab-5661982,The Aspens Ski-In/Ski-Out 2BR Condo,Apartment,Entire home/apt,3/16/17,2017-03-16,9-10-18,2018-09-10,50.11601641,-122.9433552,5661982,26650418
ab-17139532,"Canada Sundance Whistler for 4 Blackcomb Mountain,",Apartment,Private room,2/5/17,2017-02-05,4-6-17,2017-04-06,50.09294474,-122.9931167,17139532,106786090
ab-4152321,Glaciers Reach-Hot Tub-U. Village,Apartment,Entire home/apt,9/11/14,2014-09-11,12-12-16,2016-12-12,50.12033541,-122.9565522,4152321,1747164
ab-14869781,#322 - Little Slice of Heaven,Apartment,Entire home/apt,9/1/16,2016-09-01,12-30-16,2016-12-30,50.11714312,-122.9553901,14869781,90493146
ab-4156499,PRIME Ski in/out  w POOL & HOT TUB,Apartment,Entire home/apt,9/11/14,2014-09-11,3-30-19,2019-03-30,50.11403,-122.94326,4156499,7784624
ab-16315233,Stunning Open Concept Log Cabin With Epic Views,House,Entire home/apt,12/8/16,2016-12-08,10-15-17,2017-10-15,50.15755223,-122.9295051,16315233,84821274
ab-4157353,Clean and Cute in Creekside- 1 bed,Condominium,Entire home/apt,9/11/14,2014-09-11,5-24-19,2019-05-24,50.0936,-122.99204,4157353,2496859
ab-19913747,1 bdrm Heart of Whistler Village parking + hot tub,Condominium,Entire home/apt,7/15/17,2017-07-15,5-28-18,2018-05-28,50.11944849,-122.9578825,19913747,9722408
ab-2501127,"Luxurious 3 Bedroom and Den, Sleeps 10",Townhouse,Entire home/apt,3/3/14,2014-03-03,5-24-19,2019-05-24,50.1251,-122.95608,2501127,7761771
ab-14873563,Cozy Family Cabin,Entire Floor,Entire home/apt,9/2/16,2016-09-02,11-9-16,2016-11-09,50.15397845,-122.9642112,14873563,40974280
ab-16321603,Gorgeous Whistler Studio Mins to Lifts,Apartment,Entire home/apt,12/9/16,2016-12-09,5-23-19,2019-05-23,50.09674,-122.99449,16321603,66676446
ab-17140647,Private room in shared house,House,Private room,2/5/17,2017-02-05,5-23-19,2019-05-23,50.10901,-122.96705,17140647,7020069
ab-17140722,Canada Whistler European Cascade Lodge  for 4~WOW,Apartment,Private room,2/5/17,2017-02-05,4-6-18,2018-04-06,50.11626453,-122.9587581,17140722,106786090
ab-18009804,Think Whistler - 2 bed/2 bath - 1 Free Parking!,Serviced apartment,Entire home/apt,3/30/17,2017-03-30,5-21-19,2019-05-21,50.11721,-122.95673,18009804,42856656
ab-4163868,"Lake Placid Whister,BC  Condo   #402",Condominium,Entire home/apt,9/12/14,2014-09-12,5-22-19,2019-05-22,50.09001,-122.99019,4163868,20111056
ab-2520507,1 BR Townhome with Private Hot Tub - FREE PARKING,Townhouse,Entire home/apt,3/6/14,2014-03-06,5-21-19,2019-05-21,50.12175,-122.95704,2520507,3916735
ab-18718871,"Large studio downtown whistler, parking, hot tub",Serviced apartment,Entire home/apt,5/11/17,2017-05-11,4-13-18,2018-04-13,50.1189342,-122.9580229,18718871,60449844
ab-5692211,Whistler Village Family size home 3 bdrm + hot tub,Townhouse,Entire home/apt,3/17/15,2015-03-17,5-21-19,2019-05-21,50.1175,-122.96051,5692211,29510934
ab-6725782,#415 - West Cirque at Alpenglow,Apartment,Entire home/apt,6/5/15,2015-06-05,11-12-18,2018-11-12,50.11886783,-122.9556636,6725782,35146399
ab-12872793,Luxury Townhome -Steps to Ski IN,Townhouse,Entire home/apt,5/5/16,2016-05-05,6-2-16,2016-06-02,50.11081992,-122.9586442,12872793,27111892
ab-14882022,NYE in luxurious 1100sq ft 2BR (6 max) Dec30-Jan2,Condominium,Entire home/apt,9/2/16,2016-09-02,2-8-19,2019-02-08,50.11676851,-122.9447167,14882022,5510458
ab-17155023,Desirable 2 BR/3 BA Townhouse in Whistler Village,Townhouse,Entire home/apt,2/6/17,2017-02-06,10-1-17,2017-10-01,50.12015731,-122.9571432,17155023,114731073
ab-8954226,Charming 4 BR Whistler Retreat,Chalet,Entire home/apt,10/16/15,2015-10-16,3-27-19,2019-03-27,50.14639,-122.96886,8954226,7324823
ab-15551456,Whistler Ski Chalet,Chalet,Entire home/apt,10/16/16,2016-10-16,9-3-17,2017-09-03,50.13006282,-122.9645527,15551456,100093921
ab-5706682,True Slopeside Whistler Condo,Condominium,Entire home/apt,3/18/15,2015-03-18,5-25-19,2019-05-25,50.11488,-122.94421,5706682,6176194
ab-16333743,Whistler 2 Bed 2 Bath Private Hot Tub Condo,Townhouse,Entire home/apt,12/10/16,2016-12-10,5-22-19,2019-05-22,50.11953,-122.95698,16333743,106924986
ab-17159486,Bright & Cozy Home - Whistler Creekside Gondola,Condominium,Entire home/apt,2/6/17,2017-02-06,5-24-19,2019-05-24,50.09439,-122.99272,17159486,6563940
ab-606602,Bright & spacious; short walk to Whistler/Blackcmb,Guest suite,Entire home/apt,7/20/12,2012-07-20,5-24-19,2019-05-24,50.03517,-123.00839,606602,3004958
ab-607793,"Large Whistler 1 bdrm suite, w/d, free parking",Guest suite,Entire home/apt,7/20/12,2012-07-20,5-21-19,2019-05-21,50.12472,-122.94749,607793,3004958
ab-14886179,Whistler Upper Village Ski/Bike Retreat,Condominium,Entire home/apt,9/2/16,2016-09-02,6-5-17,2017-06-05,50.11747583,-122.9468184,14886179,8401535
ab-19927302,MODERN+BRIGHT+SLOPE-SIDE+2 Bdrm+HOT TUB,Condominium,Entire home/apt,7/15/17,2017-07-15,5-21-19,2019-05-21,50.11856,-122.94116,19927302,114371452
ab-5708585,The Woodrun 2BR Ski-in/Ski-out,Condominium,Entire home/apt,3/18/15,2015-03-18,10-1-18,2018-10-01,50.11623894,-122.944988,5708585,26650418
ab-15551772,Cozy studio steps from Blackcomb base,Condominium,Entire home/apt,10/16/16,2016-10-16,5-22-19,2019-05-22,50.11677,-122.94696,15551772,61330547
ab-2546411,Ski-in Ski out-Glacier 111,Condominium,Entire home/apt,3/10/14,2014-03-10,4-21-19,2019-04-21,50.11616,-122.9483,2546411,9450001
ab-612697,Whistler Condo - Mountainside Lodge,Apartment,Entire home/apt,7/23/12,2012-07-23,5-22-19,2019-05-22,50.11531,-122.95354,612697,3038949
ab-13525200,Studio- The Westin Resort & Spa,Entire condominium,Entire home/apt,6/14/16,2016-06-14,1-25-18,2018-01-25,50.11160148,-122.9568329,13525200,61532697
ab-13525404,"1 BR- The Westin Resort & Spa, Whistler",Condominium,Entire home/apt,6/14/16,2016-06-14,11-13-16,2016-11-13,50.11267672,-122.9564036,13525404,61532697
ab-17173079,Charming Creekside Chalet,House,Entire home/apt,2/7/17,2017-02-07,3-31-17,2017-03-31,50.095488,-122.9960659,17173079,4202761
ab-16337945,"Bedroom & Ensuite, A+ Location, Actual Home",Townhouse,Private room,12/10/16,2016-12-10,5-21-19,2019-05-21,50.11771,-122.94236,16337945,104715485
ab-16339050,"Bright, top floor condo in a quiet neighbourhood.",Condominium,Entire home/apt,12/10/16,2016-12-10,11-25-17,2017-11-25,50.09634601,-123.001371,16339050,48109231
ab-16346819,Whistler Village 2 Bdrm - Slopeside,Condominium,Entire home/apt,12/11/16,2016-12-11,5-26-18,2018-05-26,50.11428576,-122.9535408,16346819,7079554
ab-2570403,Beautiful villa for rent,Villa,Entire home/apt,3/13/14,2014-03-13,9-26-16,2016-09-26,50.11375267,-122.997468,2570403,8411181
ab-12874812,Quiet Townhome in Whistler Village - newly reno'ed,Apartment,Entire home/apt,5/5/16,2016-05-05,5-21-19,2019-05-21,50.11864,-122.96008,12874812,33700829
ab-11689880,1 Bedroom Lake Placid Lodge,Apartment,Entire home/apt,3/4/16,2016-03-04,4-11-19,2019-04-11,50.09307,-122.99166,11689880,25777071
ab-627797,"SKI-IN, Cozy Chalet, sleeps 4, 2bd/2ba,",Chalet,Entire home/apt,7/30/12,2012-07-30,5-22-19,2019-05-22,50.12,-122.9386,627797,919089
ab-18026593,Whistler peak hotel 158,Apartment,Entire home/apt,4/1/17,2017-04-01,4-26-17,2017-04-26,50.11486066,-122.9531839,18026593,40233896
ab-16350459,Lakeshore Cottage,Cabin,Entire home/apt,12/11/16,2016-12-11,8-25-17,2017-08-25,50.15918021,-122.9246786,16350459,34410655
ab-16350947,Whistler Lakeside Cottage,Cabin,Entire home/apt,12/11/16,2016-12-11,8-27-17,2017-08-27,50.15963771,-122.9268751,16350947,34410655
ab-19316950,"Whis 2bd/1.5bath,Free parking,ski-out 5 min walk!",Townhouse,Entire home/apt,6/13/17,2017-06-13,5-22-19,2019-05-22,50.0967,-122.98828,19316950,63985828
ab-16351601,Townhouse with Private Hot Tub & Free Parking,Apartment,Entire home/apt,12/11/16,2016-12-11,5-21-19,2019-05-21,50.12187,-122.95568,16351601,106752851
ab-19317145,Whistler Village Condo,Condominium,Entire home/apt,6/13/17,2017-06-13,5-24-19,2019-05-24,50.12116,-122.95631,19317145,135301310
ab-16354133,Whistler Creek Studio,Condominium,Entire home/apt,12/12/16,2016-12-12,5-22-19,2019-05-22,50.09699,-122.99127,16354133,68388749
ab-14896146,2 Bedrooms close to everything (free wifi/parking),Townhouse,Entire home/apt,9/3/16,2016-09-03,6-10-18,2018-06-10,50.11835832,-122.9586061,14896146,93486300
ab-14896776,Luxury and privacy villa in Whistler,Villa,Entire home/apt,12/6/16,2016-12-06,12-6-16,2016-12-06,50.091591,-122.9909085,14896776,28618522
ab-16362891,"Whistler Suite, sleeps 2",Condominium,Entire home/apt,12/12/16,2016-12-12,5-24-19,2019-05-24,50.09883,-122.9889,16362891,107155298
ab-16364058,Whistler Luxury Chalet,Entire house,Entire home/apt,12/12/16,2016-12-12,2-2-18,2018-02-02,50.11086808,-122.9787349,16364058,25777071
ab-16365560,The Cosmo Whistler: Modern Ski-in/out on Blackcomb,Serviced apartment,Entire home/apt,12/13/16,2016-12-13,4-16-19,2019-04-16,50.11539,-122.94531,16365560,107175287
ab-16366165,"Whistler Diamond Resorts/ Embarc 2 Bed, 2 Bath",Serviced apartment,Entire home/apt,12/13/16,2016-12-13,9-15-18,2018-09-15,50.11336057,-122.946484,16366165,107179939
ab-16366400,Village Stroll One Bedroom One Bath-Free Parking,Apartment,Entire home/apt,12/13/16,2016-12-13,4-19-18,2018-04-19,50.11777858,-122.9554219,16366400,107181548
ab-16366874,Whistler Club Intrawest condo,Apartment,Entire home/apt,12/13/16,2016-12-13,12-29-16,2016-12-29,50.11685733,-122.9463479,16366874,107179939
ab-18721041,Studio with view of Rainbow Mtn. Free Wi-Fi!,Apartment,Entire home/apt,5/12/17,2017-05-12,3-29-19,2019-03-29,50.11784,-122.95567,18721041,68581273
ab-2584465,Whistler Village Gables 3 bedroom BBQ golf beach,Apartment,Entire home/apt,3/15/14,2014-03-15,5-20-19,2019-05-20,50.11564,-122.94881,2584465,13232844
ab-19328747,PRIVATE Beautiful 1 Bedroom Suite,Apartment,Entire home/apt,6/14/17,2017-06-14,8-9-18,2018-08-09,50.14817068,-122.9625083,19328747,128629357
ab-19328812,Luxury Home w/ Private Hot Tub by Harmony Whistler,Townhouse,Entire home/apt,6/14/17,2017-06-14,5-23-19,2019-05-23,50.09285,-122.97816,19328812,35393628
ab-19328854,1 bed near Village - hot tub/parking,Guest suite,Entire home/apt,6/14/17,2017-06-14,8-30-17,2017-08-30,50.12093222,-122.9618231,19328854,3884355
ab-19328884,PRIVATE Studio apartment w/full kitchen,Apartment,Entire home/apt,6/14/17,2017-06-14,8-9-18,2018-08-09,50.14813902,-122.9618498,19328884,128629357
ab-16369225,3 minutes drive from village Gondi,Apartment,Entire home/apt,12/13/16,2016-12-13,3-23-17,2017-03-23,50.12471922,-122.9587407,16369225,106722340
ab-18721494,Modern comfort adventure seekers! Private room,Apartment,Private room,5/12/17,2017-05-12,7-15-18,2018-07-15,50.11746561,-122.9584826,18721494,51153638
ab-16369631,Blackcomb view hot tub pool,Townhouse,Private room,12/13/16,2016-12-13,4-20-17,2017-04-20,50.11989365,-122.9581575,16369631,106722340
ab-16369750,Blackcomb view hot tub and pool,Townhouse,Private room,12/13/16,2016-12-13,4-20-17,2017-04-20,50.12034058,-122.9594637,16369750,106722340
ab-6744437,Studio at Village Gate House in Whistler Village,Condominium,Entire home/apt,6/6/15,2015-06-06,5-13-19,2019-05-13,50.11494,-122.95504,6744437,26650418
ab-15565493,Whistler Cascade Studio,Condominium,Private room,10/16/16,2016-10-16,11-1-16,2016-11-01,50.11619007,-122.9594187,15565493,96456898
ab-7733704,Luxurious Whistler Village Paradise,Condominium,Entire home/apt,8/2/15,2015-08-02,5-22-19,2019-05-22,50.11807,-122.9456,7733704,19254342
ab-14899786,Beautiful Whistler Chalet near Village,House,Entire home/apt,9/3/16,2016-09-03,9-9-17,2017-09-09,50.11012006,-122.9771802,14899786,19713983
ab-14900711,MAIN VILLAGE SQUARE = Super central location!,Apartment,Entire home/apt,9/3/16,2016-09-03,5-25-19,2019-05-25,50.11439,-122.95632,14900711,4213878
ab-7734881,Amazing Chalet minutes from Gondola,House,Entire home/apt,8/2/15,2015-08-02,11-4-15,2015-11-04,50.08984035,-123.0081274,7734881,40651874
ab-2634817,"Gorgeous, high end luxury, walk to Village 4 min",Entire house,Entire home/apt,3/23/14,2014-03-23,1-27-18,2018-01-27,50.11050651,-122.9511735,2634817,13491446
ab-16378148,Whistler Penthouse at the base of the mountain,Condominium,Entire home/apt,12/14/16,2016-12-14,5-22-19,2019-05-22,50.11473,-122.95386,16378148,52706624
ab-6761024,'Aspens' Mountainside 1 bedroom suite w/ pool,Condominium,Entire home/apt,6/8/15,2015-06-08,4-6-18,2018-04-06,50.11670222,-122.945893,6761024,35393628
ab-11695146,Whistler Sundance 1BR Condo - FREE WiFi!,Villa,Entire home/apt,11/24/16,2016-11-24,5-21-19,2019-05-21,50.09242,-122.99394,11695146,10595328
ab-11695403,Whistler Sundance Condo Sleeps 6! FREE WiFi!,Villa,Entire home/apt,3/4/16,2016-03-04,5-21-19,2019-05-21,50.09144,-122.99505,11695403,10595328
ab-2637676,Whistler Village 2 bedroom condo,Apartment,Entire home/apt,3/23/14,2014-03-23,1-2-17,2017-01-02,50.11664518,-122.9538674,2637676,13507264
ab-16380607,Perfect Whistler Rental 2 Bdrm 2 bath kitchen,Apartment,Entire home/apt,12/14/16,2016-12-14,5-25-19,2019-05-25,50.11628,-122.94684,16380607,107293291
ab-2649783,Fitzsimmons Whistler 3 BD (5C),Apartment,Entire home/apt,3/25/14,2014-03-25,7-29-17,2017-07-29,50.11543479,-122.9555077,2649783,3749031
ab-13529587,Beautiful Ski/In/Out 3Bdrm at the Woodrun,Condominium,Entire home/apt,6/14/16,2016-06-14,5-22-19,2019-05-22,50.11628,-122.94485,13529587,30931672
ab-12891140,Private Room with own patio & hot tub access.,House,Private room,3/6/17,2017-03-06,4-21-17,2017-04-21,50.09153531,-122.9946655,12891140,19255333
ab-12891519,Bedroom in shared accommodation.,Apartment,Private room,5/6/16,2016-05-06,5-10-16,2016-05-10,50.11598753,-122.9423179,12891519,2782044
ab-16390728,The holidays in the heart of Whistler village.,Resort,Entire home/apt,12/15/16,2016-12-15,10-22-18,2018-10-22,50.11646137,-122.9573752,16390728,38979337
ab-12892766,Whistler Village Studio @ Eagle Lodge!,Condominium,Entire home/apt,5/6/16,2016-05-06,5-21-19,2019-05-21,50.11699,-122.95603,12892766,26265903
ab-4180896,Lovely 1bdr in Whistler Village w/Free parking,Apartment,Entire home/apt,9/13/14,2014-09-13,3-25-18,2018-03-25,50.11738073,-122.9578094,4180896,9728371
ab-2660159,Classic Log Chalet,Chalet,Entire home/apt,3/27/14,2014-03-27,5-21-19,2019-05-21,50.14519,-122.96936,2660159,1886689
ab-2660270,Slopeside Ski Cabin-BOTH MountainsA,Entire house,Entire home/apt,3/27/14,2014-03-27,1-27-18,2018-01-27,50.1112009,-122.9510132,2660270,13491446
ab-2660391,Slopeside-30 meters-2PrivateHotTubs,Entire house,Entire home/apt,3/27/14,2014-03-27,1-30-18,2018-01-30,50.11040181,-122.9511559,2660391,13491446
ab-14164946,Ski In/Ski Out Luxury Home on Whistler Mountain,Townhouse,Entire home/apt,7/23/16,2016-07-23,5-23-19,2019-05-23,50.09563,-122.98001,14164946,85693376
ab-8972616,Live like a local at Whistler,Apartment,Entire home/apt,10/17/15,2015-10-17,5-24-19,2019-05-24,50.16537,-122.92841,8972616,4426128
ab-18059801,"Walk to Village, Lake & Market, 2 beds in loft",House,Shared room,4/2/17,2017-04-02,8-28-17,2017-08-28,50.12660798,-122.9577007,18059801,81268390
ab-18060329,Falcon Views beautiful house in prestigious area,House,Entire home/apt,4/2/17,2017-04-02,5-23-19,2019-05-23,50.11926,-122.97123,18060329,48806951
ab-19342616,"2 Bedroom /w Private Hot Tub,  Great location!",Townhouse,Entire home/apt,6/15/17,2017-06-15,5-24-19,2019-05-24,50.1203,-122.9585,19342616,8926556
ab-16394751,Great Whistler Village Location!,Entire apartment,Entire home/apt,12/15/16,2016-12-15,1-11-18,2018-01-11,50.11971414,-122.9557677,16394751,107378166
ab-16395251,Whistler chalet (Ski in Ski out!),Townhouse,Entire home/apt,12/15/16,2016-12-15,5-22-19,2019-05-22,50.11358,-122.94098,16395251,107403999
ab-11697172,Whistler Sundance Condo Sleeps 8! FREE WiFi!,Villa,Entire home/apt,3/5/16,2016-03-05,5-21-19,2019-05-21,50.0915,-122.99355,11697172,10595328
ab-13530541,Golden Dreams B&B since 1987: Wild West Room,Bed and breakfast,Private room,6/14/16,2016-06-14,5-23-19,2019-05-23,50.12722,-122.96926,13530541,17046824
ab-19345241,Family Friendly Whistler Village Log Chateau,House,Entire home/apt,6/15/17,2017-06-15,11-8-17,2017-11-08,50.12012161,-122.9616583,19345241,6051130
ab-633193,Whistler big and bright 1 bdrm suite/deck,Guest suite,Entire home/apt,8/3/12,2012-08-03,5-22-19,2019-05-22,50.12503,-122.94971,633193,3004958
ab-16405409,"3 Bedroom and den, 3 bathroom Townhome",Townhouse,Entire home/apt,12/16/16,2016-12-16,12-19-16,2016-12-19,50.11876715,-122.9418036,16405409,68404496
ab-7757098,Whistler,Townhouse,Entire home/apt,8/4/15,2015-08-04,5-24-19,2019-05-24,50.09709,-122.98835,7757098,7195577
ab-8987438,Mountain View Whistler 2 Bedroom Suite,Apartment,Entire home/apt,10/18/15,2015-10-18,5-20-19,2019-05-20,50.11666,-122.94245,8987438,46586585
ab-4184241,A 4.5* Whistler Luxury Resort,Apartment,Entire home/apt,5/15/17,2017-05-15,5-22-19,2019-05-22,50.11639,-122.94701,4184241,21709366
ab-8989681,"Valhalla 4 Bed, Sleeps 8 - Village location!",Townhouse,Entire home/apt,10/18/15,2015-10-18,5-24-19,2019-05-24,50.12004,-122.95812,8989681,8520466
ab-5739128,Cozy Lakefront Mountain Studio,Apartment,Entire home/apt,3/21/15,2015-03-21,9-27-16,2016-09-27,50.12166326,-122.9759366,5739128,9671374
ab-18072838,Beautifully Renovated Whistler Village Townhouse,Townhouse,Entire home/apt,4/3/17,2017-04-03,5-24-19,2019-05-24,50.12156,-122.95548,18072838,124424612
ab-16407547,Fantastic Two-Bedroom at Whistler,Timeshare,Private room,12/16/16,2016-12-16,9-26-17,2017-09-26,50.11684195,-122.9463033,16407547,92483221
ab-16407622,Village Studio w/ Amazing Mountain View + Hot Tub,Apartment,Entire home/apt,12/16/16,2016-12-16,1-18-17,2017-01-18,50.11906426,-122.9571403,16407622,107500706
ab-19347283,Mountain Studio in the Village,Apartment,Entire home/apt,6/15/17,2017-06-15,5-21-19,2019-05-21,50.11798,-122.95873,19347283,71408986
ab-16412496,Whistler Townhouse sleeps 6  - Jan 2-5,Townhouse,Entire home/apt,12/16/16,2016-12-16,1-15-19,2019-01-15,50.09649558,-122.9879768,16412496,8557310
ab-12902835,'Marquise' -1BR w/ Pool & Hot Tub in Upper Village,Entire condominium,Entire home/apt,5/7/16,2016-05-07,2-14-18,2018-02-14,50.11644241,-122.9440873,12902835,35393628
ab-8993074,Foxglove on Painted Cliff,Townhouse,Entire home/apt,10/18/15,2015-10-18,5-24-19,2019-05-24,50.11806,-122.9386,8993074,46974840
ab-16414486,King size bed and private bathroom,House,Private room,7/5/17,2017-07-05,7-29-17,2017-07-29,50.11542069,-122.9618296,16414486,18158280
ab-8995518,Creekside Family Home on Cul-de-Sac with Hot Tub,Townhouse,Entire home/apt,10/18/15,2015-10-18,5-20-19,2019-05-20,50.10225,-122.98954,8995518,46987221
ab-5750442,Gables 4BR - 200 meters from lifts!,Townhouse,Entire home/apt,3/22/15,2015-03-22,5-21-19,2019-05-21,50.11343,-122.9506,5750442,23973685
ab-11701651,Whistler 1BR condo walk to lift,Condominium,Entire home/apt,3/5/16,2016-03-05,11-1-16,2016-11-01,50.11369199,-122.9554776,11701651,16383223
ab-12906638,2 Bedroom Central Location!,Condominium,Entire home/apt,5/7/16,2016-05-07,2-14-19,2019-02-14,50.11965238,-122.956858,12906638,17197633
ab-12906909,ã…¤2 Bedroom Loft Central Location,Condominium,Entire home/apt,5/7/16,2016-05-07,5-24-19,2019-05-24,50.1188,-122.95639,12906909,17197633
ab-11703737,Whistler Village Loft-walk to lift,Loft,Entire home/apt,3/5/16,2016-03-05,11-1-16,2016-11-01,50.11524327,-122.9556688,11703737,16383223
ab-11705138,Whistler Village 2BR Condo LiftSide,Condominium,Entire home/apt,3/5/16,2016-03-05,11-3-16,2016-11-03,50.11459143,-122.9567465,11705138,16383223
ab-18074253,Symphony Studio in Whistler Village,Apartment,Entire home/apt,7/29/17,2017-07-29,5-24-19,2019-05-24,50.12174,-122.95938,18074253,124439784
ab-18075812,Private Master bedroom & Master bath  Jacuzzi,House,Private room,4/3/17,2017-04-03,8-28-17,2017-08-28,50.12719536,-122.957399,18075812,81268390
ab-16416092,Whistler Log Chalet,House,Entire home/apt,12/17/16,2016-12-17,3-22-17,2017-03-22,50.11880404,-122.96445,16416092,25777071
ab-16416371,Beautiful studio just a few steps to Lake/ Slopes,Apartment,Entire home/apt,12/17/16,2016-12-17,5-24-19,2019-05-24,50.09697,-122.99415,16416371,54643820
ab-6782723,Glacier's Reach Corner Unit,Townhouse,Entire home/apt,6/9/15,2015-06-09,5-21-19,2019-05-21,50.12189,-122.95819,6782723,28917785
ab-16417154,Ski Out Townhouse on Blackcomb and Lost Lake,Townhouse,Entire home/apt,12/17/16,2016-12-17,10-1-18,2018-10-01,50.12103095,-122.9365428,16417154,19991826
ab-15576468,Massive Apartment with True Ski in - Ski Out,Condominium,Entire home/apt,10/17/16,2016-10-17,5-22-19,2019-05-22,50.11526,-122.94418,15576468,4287776
ab-14912727,Comfortable Whistler townhouse w/private hot tub,Townhouse,Entire home/apt,3/6/17,2017-03-06,10-15-18,2018-10-15,50.11785548,-122.9580656,14912727,45324420
ab-16418114,TRUE SKI-IN SKI-OUT Modern 1 Bdrm at The Aspens,Condominium,Entire home/apt,12/17/16,2016-12-17,10-23-18,2018-10-23,50.11568387,-122.9449431,16418114,106840292
ab-16418135,Whistler village centre studio,Apartment,Entire home/apt,12/17/16,2016-12-17,12-19-16,2016-12-19,50.11403761,-122.9547089,16418135,41190661
ab-13542036,"2 bed, Amazing Views, Ski-in-Ski-out, Huge Hot Tub",Condominium,Entire home/apt,6/15/16,2016-06-15,5-22-19,2019-05-22,50.11654,-122.94388,13542036,12743234
ab-18076402,Ski-in Ski-out Creekside Gondola,Condominium,Entire home/apt,4/3/17,2017-04-03,6-8-17,2017-06-08,50.09278647,-122.9912691,18076402,123938806
ab-17190881,Cozy Bedroom in Whistler,Apartment,Private room,2/8/17,2017-02-08,6-22-17,2017-06-22,50.14242913,-122.9496382,17190881,1747962
ab-13544532,Updated 2 Bedroom Condo,Condominium,Entire home/apt,6/15/16,2016-06-15,11-10-16,2016-11-10,50.11515524,-122.9443395,13544532,68404496
ab-14915761,Cozy Studio in Whistler Village,Apartment,Entire home/apt,9/4/16,2016-09-04,11-24-16,2016-11-24,50.11812804,-122.9561262,14915761,93715112
ab-17192008,Whistler Vacation Club Twin peaks - in village!,Resort,Entire home/apt,2/8/17,2017-02-08,5-24-19,2019-05-24,50.12131,-122.95758,17192008,24349253
ab-16420705,ã…¤Beautiful Woodrun 2 bedroom 2 bath-Free Parking,Apartment,Entire home/apt,12/17/16,2016-12-17,5-22-19,2019-05-22,50.11537,-122.94424,16420705,17197633
ab-12911953,Sweet Whistler Retreat,Condominium,Entire home/apt,5/7/16,2016-05-07,5-24-19,2019-05-24,50.1218,-122.95668,12911953,70784324
ab-19353715,Delightful Townhouse for perfect Whistler retreat,Townhouse,Entire home/apt,6/15/17,2017-06-15,5-2-18,2018-05-02,50.11389805,-122.9555553,19353715,91152896
ab-9007117,Taluswood The Heights,Townhouse,Entire home/apt,10/19/15,2015-10-19,4-11-19,2019-04-11,50.09407,-122.97868,9007117,25777071
ab-9008599,Carleton 206 - Modern One Bedroom,Condominium,Entire home/apt,10/19/15,2015-10-19,5-22-19,2019-05-22,50.11318,-122.95555,9008599,26808890
ab-18078189,"Central Village Best Value, Great Amenities",Entire condominium,Entire home/apt,4/4/17,2017-04-04,1-5-18,2018-01-05,50.11751122,-122.9569738,18078189,123938806
ab-4200764,3 BED Whistler At Snowbird,Apartment,Entire home/apt,9/14/14,2014-09-14,7-23-17,2017-07-23,50.11813211,-122.9402378,4200764,9296727
ab-19952599,Worldmark Cascade Lodge,Entire condominium,Entire home/apt,7/17/17,2017-07-17,2-9-18,2018-02-09,50.11814699,-122.9584683,19952599,122259032
ab-14180031,Stunning 3 Bedroom Whistler Townhome,Townhouse,Entire home/apt,7/24/16,2016-07-24,11-15-16,2016-11-15,50.10989783,-122.9581945,14180031,65790915
ab-18079131,Spacious 1 Bed Upper Village Ski-in Ski-out,Condominium,Entire home/apt,4/4/17,2017-04-04,11-4-17,2017-11-04,50.11715186,-122.943598,18079131,123938806
ab-11721645,Whistler Deluxe Condo Walk to Lift,Condominium,Entire home/apt,3/6/16,2016-03-06,11-1-16,2016-11-01,50.11359654,-122.9569471,11721645,16383223
ab-11722618,Whistler 2Queen Walk to Lift,Condominium,Entire home/apt,3/6/16,2016-03-06,11-3-16,2016-11-03,50.11465277,-122.956499,11722618,16383223
ab-16424391,2 Bdr Creekside Condo for,Resort,Private room,12/17/16,2016-12-17,5-24-19,2019-05-24,50.09181,-122.99473,16424391,51627902
ab-6793563,2 Bedroom condo 35min south Whistler(in Squamish),Guest suite,Entire home/apt,6/10/15,2015-06-10,5-23-19,2019-05-23,50.11618,-122.95849,6793563,5472668
ab-11725306,Traditional Single Walk to Lift,Condominium,Entire home/apt,3/6/16,2016-03-06,11-8-16,2016-11-08,50.11385072,-122.9554661,11725306,16383223
ab-11725943,Traditional 2 dbl walk to lift,Condominium,Entire home/apt,3/6/16,2016-03-06,11-2-16,2016-11-02,50.11296795,-122.955399,11725943,16383223
ab-11726705,Traditional King Walk to Lift,Condominium,Entire home/apt,3/6/16,2016-03-06,11-8-16,2016-11-08,50.11492742,-122.9555161,11726705,16383223
ab-18087252,2 Bed 2 Bath Luxury Condo Ski-in Ski-Out,Entire condominium,Entire home/apt,4/4/17,2017-04-04,1-6-18,2018-01-06,50.11652772,-122.9434292,18087252,123938806
ab-4205009,"Ski-in Townhome - private hot tub, bring your dog!",Townhouse,Entire home/apt,2/23/18,2018-02-23,5-23-19,2019-05-23,50.12074,-122.93796,4205009,19992813
ab-16425327,Hearthstone Lodge - Hot tub - Village location,Apartment,Entire home/apt,12/17/16,2016-12-17,5-23-19,2019-05-23,50.11512,-122.95696,16425327,1747164
ab-16425797,"A cozy, quiet condo at Nicklaus North Golf Course",Condominium,Entire home/apt,12/18/16,2016-12-18,4-30-19,2019-04-30,50.14309,-122.9488,16425797,107682158
ab-9009207,Carleton 207 - Overlooking Whistler,Condominium,Entire home/apt,10/19/15,2015-10-19,5-21-19,2019-05-21,50.1141,-122.95341,9009207,26808890
ab-14181483,Stunning Old Gravel Lodge Retreat,House,Entire home/apt,7/24/16,2016-07-24,12-11-16,2016-12-11,50.09456173,-123.0031938,14181483,40957344
ab-16426544,"Vale Inn Condo - Whistler, Creekside",Condominium,Entire home/apt,12/18/16,2016-12-18,5-17-18,2018-05-17,50.10145536,-122.9903014,16426544,107688968
ab-4209047,Whistler Village Studio Apartment,Apartment,Entire home/apt,9/15/14,2014-09-15,5-22-19,2019-05-22,50.11838,-122.95601,4209047,12709926
ab-17194160,"1 bedroom apartment in Whistler, Cascade Lodge",Resort,Entire home/apt,2/8/17,2017-02-08,4-24-19,2019-04-24,50.11656,-122.95742,17194160,28901494
ab-9011123,Carleton 301 - Mountain View,Condominium,Entire home/apt,10/19/15,2015-10-19,5-24-19,2019-05-24,50.11263,-122.95479,9011123,26808890
ab-9012076,Carleton 303 Bronze Mountain View - Slopeside,Condominium,Entire home/apt,10/19/15,2015-10-19,5-22-19,2019-05-22,50.11463,-122.9542,9012076,26808890
ab-20453296,"Large White Gold, Whistler 1 bed/bath suite",Guest suite,Entire home/apt,10/20/17,2017-10-20,5-23-19,2019-05-23,50.12732,-122.94933,20453296,145996918
ab-14182841,Greystone Lodge Unit 408,Condominium,Entire home/apt,7/24/16,2016-07-24,10-13-16,2016-10-13,50.11719449,-122.943833,14182841,76332793
ab-18094215,NICE Room! Whistler B.C. Gondola Access,Place,Entire home/apt,4/5/17,2017-04-05,5-21-19,2019-05-21,50.11496,-122.95336,18094215,93369895
ab-16429475,Quiet room in tranquil neighborhood,House,Private room,12/18/16,2016-12-18,12-31-16,2016-12-31,50.08544374,-123.0186881,16429475,107713439
ab-11743132,Traditional 2 Queen Walk to Lift,Condominium,Entire home/apt,3/7/16,2016-03-07,11-8-16,2016-11-08,50.11316145,-122.9552912,11743132,16383223
ab-11743654,Whistler Suite Walk to Lift,Condominium,Entire home/apt,3/7/16,2016-03-07,11-3-16,2016-11-03,50.11343145,-122.9552907,11743654,16383223
ab-11744489,Whistler big room with comfy single & full bthrm,House,Private room,3/7/16,2016-03-07,5-21-19,2019-05-21,50.1261,-122.94766,11744489,3004958
ab-4222881,ENCHANTING BOUTIQUE MOUNTAINSIDE,Apartment,Entire home/apt,9/16/14,2014-09-16,5-24-19,2019-05-24,50.0963,-122.98017,4222881,21915331
ab-18753048,Spacious Family Chalet in Whistler,Chalet,Entire home/apt,5/13/17,2017-05-13,5-24-19,2019-05-24,50.14211,-122.97114,18753048,122049740
ab-20456695,Central Studio with Pool/Hot Tub/Sauna,Place,Entire home/apt,8/14/17,2017-08-14,5-22-19,2019-05-22,50.11846,-122.95806,20456695,127555075
ab-11756247,Studio in Whistler Great Location,Apartment,Entire home/apt,9/4/17,2017-09-04,11-10-17,2017-11-10,50.11360031,-122.9543674,11756247,724377
ab-18097510,Whistler Ski House,Apartment,Entire home/apt,4/5/17,2017-04-05,4-15-17,2017-04-15,50.11543034,-122.9507805,18097510,56844098
ab-699622,"Glacierlodge2Bed,2Bath,Pool,Hottub,NEW YEARS AVAIL",Apartment,Entire home/apt,9/15/12,2012-09-15,12-8-16,2016-12-08,50.1166086,-122.9455475,699622,3588817
ab-17210097,Cozy studio near Creekside,Apartment,Entire home/apt,2/9/17,2017-02-09,6-7-17,2017-06-07,50.10118059,-122.9913812,17210097,87353684
ab-11760818,Luxury King Walk to Lift,Condominium,Entire home/apt,3/8/16,2016-03-08,11-1-16,2016-11-01,50.11350814,-122.956779,11760818,16383223
ab-11761860,Executive Suite Walk to Lift,Condominium,Entire home/apt,3/8/16,2016-03-08,11-2-16,2016-11-02,50.11368009,-122.9566596,11761860,16383223
ab-18107670,2 Bed 2 Bath Central Village Sleeps 6,Entire condominium,Entire home/apt,4/5/17,2017-04-05,1-6-18,2018-01-06,50.11751182,-122.9547652,18107670,123938806
ab-11773934,Sundance - 1BR #2,Condominium,Entire home/apt,3/9/16,2016-03-09,7-18-18,2018-07-18,50.09150583,-122.9948302,11773934,58385754
ab-20471679,Symphony Chalet,Villa,Entire home/apt,3/29/19,2019-03-29,4-9-19,2019-04-09,50.11013,-122.96252,20471679,186509339
ab-20472554,(H) Treetops Chalet,Villa,Entire home/apt,3/25/19,2019-03-25,5-24-19,2019-05-24,50.12836,-122.95954,20472554,18700501
ab-20473445,Totem Chalet,Villa,Entire home/apt,3/29/19,2019-03-29,5-24-19,2019-05-24,50.11858,-122.96799,20473445,18700501
ab-20474692,(H) Crabapple Chalet,Villa,Entire home/apt,3/29/19,2019-03-29,5-24-19,2019-05-24,50.125,-122.97087,20474692,18700501
ab-20474697,Big Timber Chalet,Villa,Entire home/apt,3/29/19,2019-03-29,5-22-19,2019-05-22,50.08731,-122.98904,20474697,18700501
ab-20474775,(H) Skyline,Villa,Entire home/apt,3/29/19,2019-03-29,4-25-19,2019-04-25,50.10848,-122.96492,20474775,18700501
ab-20475551,Snow Ridge Chalet,Villa,Entire home/apt,3/11/19,2019-03-11,5-23-19,2019-05-23,50.0949,-122.98575,20475551,133045016
ab-20475552,Akasha,Villa,Entire home/apt,3/11/19,2019-03-11,4-24-19,2019-04-24,50.10952,-122.96191,20475552,212126215
ab-7784679,Comforts of Home,Townhouse,Entire home/apt,8/6/15,2015-08-06,5-24-19,2019-05-24,50.14672,-122.96104,7784679,40963439
ab-4232161,"Powder Condo, Whistler Village",Apartment,Entire home/apt,9/17/14,2014-09-17,5-10-18,2018-05-10,50.11983381,-122.9577654,4232161,5716209
ab-11776859,Intrawest Resort and Club,Apartment,Entire home/apt,3/9/16,2016-03-09,9-22-17,2017-09-22,50.11878919,-122.9449167,11776859,7784624
ab-11777304,3BR Penthouse Walk to Lift,Condominium,Entire home/apt,3/9/16,2016-03-09,11-9-16,2016-11-09,50.11509661,-122.9553825,11777304,16383223
ab-11777837,3BR Suite Walk to Lift,Condominium,Entire home/apt,3/9/16,2016-03-09,11-3-16,2016-11-03,50.11511598,-122.9550312,11777837,16383223
ab-7787020,Private Chef Vegan organic dinner and breakfast.,Bed and breakfast,Private room,8/6/15,2015-08-06,3-7-19,2019-03-07,50.14661781,-122.9698231,7787020,6149231
ab-721619,Ski in/Ski out / w Swimming pool,Apartment,Entire home/apt,10/1/12,2012-10-01,10-11-16,2016-10-11,50.11851608,-122.9417999,721619,3725474
ab-2709870,Cozy 1 Bedroom and Loft!,Chalet,Entire home/apt,4/2/14,2014-04-02,12-7-18,2018-12-07,50.09222915,-122.9922404,2709870,13868247
ab-725162,Twin Peaks 2 Bedroom Unit Superior Suite - 105,Apartment,Entire home/apt,10/3/12,2012-10-03,9-26-18,2018-09-26,50.11997338,-122.9583227,725162,3749031
ab-18113214,Private Room w/ Queen Size Bed in Blueberry,Condominium,Private room,4/6/17,2017-04-06,4-18-17,2017-04-18,50.11658881,-122.9695763,18113214,122063608
ab-9028831,North Star Townhome Near Village,Apartment,Entire home/apt,10/20/15,2015-10-20,12-28-16,2016-12-28,50.11871255,-122.9586729,9028831,19254342
ab-9030491,Carleton 304 Platinum Two Bedroom Mountain View,Condominium,Entire home/apt,10/20/15,2015-10-20,5-22-19,2019-05-22,50.11449,-122.95526,9030491,26808890
ab-19966011,3-Bedroom house near Whistler village,House,Entire home/apt,11/18/17,2017-11-18,10-2-18,2018-10-02,50.15289173,-122.9615637,19966011,6074944
ab-13559607,Renovated 1 bdrm in Whistler Village in Deer Lodge,Apartment,Entire home/apt,6/16/16,2016-06-16,5-22-19,2019-05-22,50.11738,-122.95624,13559607,45246189
ab-7802393,Whistler Village Week for 11/13/16 to 11/20/16,Condominium,Entire home/apt,8/7/15,2015-08-07,10-12-16,2016-10-12,50.11501865,-122.9534684,7802393,22307295
ab-9033619,The Heart of Village w/ Hot Tub & Mountains Views,Apartment,Entire home/apt,10/21/15,2015-10-21,5-24-19,2019-05-24,50.11468,-122.95723,9033619,6641619
ab-20507030,"Cozy Creekside Condo, Steps to Whistler Mountain",Apartment,Entire home/apt,8/17/17,2017-08-17,5-22-19,2019-05-22,50.09378,-122.99349,20507030,146407567
ab-5806801,Ski in/out 2 BD with hot tub/pool,Serviced apartment,Entire home/apt,12/19/16,2016-12-19,5-20-19,2019-05-20,50.11608,-122.94681,5806801,30223528
ab-6813096,"Small, bright room in the Village",Apartment,Private room,6/11/15,2015-06-11,5-23-19,2019-05-23,50.11943,-122.95768,6813096,32311809
ab-17224299,Whiski Jack,Condominium,Entire home/apt,2/10/17,2017-02-10,8-7-17,2017-08-07,50.09680101,-122.9884624,17224299,115993195
ab-17235661,"WHISTLER Sundance, Studio up to 2 Bdrm, 1-4 BEDS",Timeshare,Entire home/apt,2/11/17,2017-02-11,7-3-17,2017-07-03,50.09082973,-122.9953772,17235661,4385059
ab-20534303,Cascade 222 by Elevate Real Estate Management,Apartment,Entire home/apt,8/18/17,2017-08-18,10-18-18,2018-10-18,50.11728914,-122.9594335,20534303,134284463
ab-20535444,Cozy Boutique 3 Bedroom Condo,Condominium,Entire home/apt,8/18/17,2017-08-18,10-12-17,2017-10-12,50.12059561,-122.9358305,20535444,65790915
ab-20536345,Convenient and Cozy 3 Bedroom Whistler Condo,Condominium,Entire home/apt,8/18/17,2017-08-18,10-12-17,2017-10-12,50.12008623,-122.9362883,20536345,65790915
ab-20538498,Spacious Whistler Mountain Condo w/ Balcony,Condominium,Entire home/apt,8/18/17,2017-08-18,10-12-17,2017-10-12,50.12170911,-122.9369701,20538498,65790915
ab-20539210,Spacious Mountainside Whistler Condo w/ Balcony,Condominium,Entire home/apt,8/18/17,2017-08-18,10-12-17,2017-10-12,50.12221868,-122.9376297,20539210,65790915
ab-20540094,Stunning Whistler Home w/ Balcony and Hot Tub,Townhouse,Entire home/apt,8/19/17,2017-08-19,10-12-17,2017-10-12,50.11524347,-122.9435101,20540094,65790915
ab-20540775,Luxurious Whistler Sundance Condo - 1 Bed/2bath,Serviced apartment,Entire home/apt,8/19/17,2017-08-19,5-22-19,2019-05-22,50.09171,-122.99394,20540775,100605868
ab-20540799,Great 2 Bedroom Family Condo in Whistler + Balcony,Condominium,Entire home/apt,8/19/17,2017-08-19,10-12-17,2017-10-12,50.11204423,-122.968622,20540799,65790915
ab-18757931,Private room 5min walk from Creekside Gondola,House,Private room,5/14/17,2017-05-14,8-1-17,2017-08-01,50.0912096,-122.9938176,18757931,19255333
ab-737293,** 5 BD/5BA ELEGANT EUROPEAN CHALET,Chalet,Entire home/apt,10/11/12,2012-10-11,5-24-19,2019-05-24,50.14501,-122.97019,737293,3849682
ab-16452798,Whistler,Entire chalet,Entire home/apt,12/20/16,2016-12-20,3-18-18,2018-03-18,50.12418847,-122.958768,16452798,31610716
ab-16453639,7094 Nesters Road One Bedroom Accomodation,House,Entire home/apt,12/20/16,2016-12-20,7-29-17,2017-07-29,50.12456869,-122.9584842,16453639,31610716
ab-14187099,The Most Fun Place In Whistler,Apartment,Entire home/apt,7/25/16,2016-07-25,2-19-19,2019-02-19,50.14972302,-122.9693702,14187099,58430343
ab-4249398,"Ski in/out condo pool/hot tub, balcony, views",Apartment,Entire home/apt,9/18/14,2014-09-18,5-21-19,2019-05-21,50.09497,-122.99156,4249398,5789600
ab-741231,Whistler Get Away,Townhouse,Entire home/apt,10/14/12,2012-10-14,5-21-19,2019-05-21,50.11982,-122.95394,741231,3878825
ab-20553878,"Christmas Find! Private Club, Pools Spa at base",Entire villa,Entire home/apt,9/13/17,2017-09-13,12-19-17,2017-12-19,50.1177539,-122.946417,20553878,95938625
ab-20556374,2 Bed / 2 Bath Townhouse in Northstar Complex,Townhouse,Entire home/apt,8/19/17,2017-08-19,5-24-19,2019-05-24,50.11911,-122.95971,20556374,146680607
ab-20556384,"'Tyndall Stone Lodge' 1.5 Bedroom, amazing location at Celebration Plaza",Condominium,Entire home/apt,8/19/17,2017-08-19,6-13-18,2018-06-13,50.11983854,-122.9565527,20556384,35393628
ab-18766985,Granite Court Townhouse - Whistler Village,Entire townhouse,Entire home/apt,5/14/17,2017-05-14,2-14-18,2018-02-14,50.12008116,-122.9557469,18766985,3269011
ab-16454796,Whistler Creekside Delightful Double!,Townhouse,Private room,12/20/16,2016-12-20,5-20-19,2019-05-20,50.09441,-122.9961,16454796,74729587
ab-16454879,Village Gate House Post and Beam Unit,Resort,Entire home/apt,12/20/16,2016-12-20,5-20-19,2019-05-20,50.11685,-122.95517,16454879,107941136
ab-16457134,Whistler Creekside Quiet Queen!,Townhouse,Private room,12/20/16,2016-12-20,5-24-19,2019-05-24,50.09594,-122.99556,16457134,74729587
ab-11820000,In the heart of Whistler,Apartment,Entire home/apt,3/12/16,2016-03-12,5-23-19,2019-05-23,50.11648,-122.95445,11820000,28531877
ab-20567370,Central Whistler - Studio Apartment,Condominium,Entire home/apt,8/20/17,2017-08-20,9-7-18,2018-09-07,50.11907467,-122.9588196,20567370,8401535
ab-20570440,Woodrun Whistler,Timeshare,Entire home/apt,11/4/17,2017-11-04,11-10-17,2017-11-10,50.09389792,-122.9864707,20570440,31839700
ab-16461663,New Years at Whistler Village!,Serviced apartment,Entire home/apt,12/20/16,2016-12-20,5-21-19,2019-05-21,50.11396,-122.952,16461663,34196980
ab-17241168,Whistler Village! 2 Bed+Den-Private HotTub/2 Pking,Townhouse,Entire home/apt,2/11/17,2017-02-11,5-23-19,2019-05-23,50.12036,-122.95757,17241168,7359961
ab-17242026,Whistler Cascade Lodge,Serviced apartment,Entire home/apt,2/11/17,2017-02-11,3-6-18,2018-03-06,50.12009251,-122.9570969,17242026,23564070
ab-17248097,Whistler Comfortable 2 Bedroom Townhome,Townhouse,Entire home/apt,2/12/17,2017-02-12,4-6-17,2017-04-06,50.12182465,-122.9560692,17248097,65790915
ab-19376909,One bed suite with parking - walk to lifts,Condominium,Entire home/apt,6/16/17,2017-06-16,5-24-19,2019-05-24,50.10031,-122.9908,19376909,27857322
ab-15604192,"One Bedroom Condo, heart of Whistler Village.",Condominium,Entire home/apt,10/19/16,2016-10-19,5-23-19,2019-05-23,50.11662,-122.9553,15604192,100581932
ab-14198568,Ski-in/Ski-out Comfort,Townhouse,Entire home/apt,7/25/16,2016-07-25,5-21-19,2019-05-21,50.11727,-122.94274,14198568,86125801
ab-2747862,Village Location - Top Floor - View,Apartment,Entire home/apt,4/7/14,2014-04-07,5-24-19,2019-05-24,50.11592,-122.9537,2747862,1747164
ab-16464242,Luxury Hotel - Whistler Village,Room in boutique hotel,Entire home/apt,12/21/16,2016-12-21,5-22-19,2019-05-22,50.11318,-122.954,16464242,108025428
ab-20589618,Ski-in Ski-Out - Home - Private Hot Tub - Views,Cabin,Entire home/apt,8/21/17,2017-08-21,5-21-19,2019-05-21,50.09304,-122.98111,20589618,144850270
ab-6837883,"Ski-in, Ski-out Blackcomb Condo",Condominium,Entire home/apt,6/13/15,2015-06-13,5-22-19,2019-05-22,50.11551,-122.94371,6837883,35832568
ab-15605976,Luxury Chalet in Whistler,Chalet,Entire home/apt,10/19/16,2016-10-19,9-5-18,2018-09-05,50.12061363,-122.9708094,15605976,100604266
ab-2755634,Ski-in-out\3 bdrms\Vaulted Ceilings\Steam\Hot Tub,Condominium,Entire home/apt,4/8/14,2014-04-08,5-20-19,2019-05-20,50.11784,-122.94183,2755634,14095536
ab-17252284,"Great location, free parking & wifi.",Apartment,Entire home/apt,2/12/17,2017-02-12,10-24-18,2018-10-24,50.11956164,-122.9573262,17252284,66059080
ab-761881,Lake Placid Lodge Creekside 1 Bedroom apartment,Apartment,Entire home/apt,10/29/12,2012-10-29,11-8-18,2018-11-08,50.09525217,-122.9912376,761881,3749031
ab-13564294,Creekside Condo,Private room in condominium,Private room,6/17/16,2016-06-17,12-18-17,2017-12-18,50.09777971,-122.990184,13564294,45084483
ab-14198841,Modern Designed Whistler Creekside Condo,Condominium,Entire home/apt,7/25/16,2016-07-25,5-24-19,2019-05-24,50.09399,-122.9941,14198841,86129158
ab-11839929,"2 bedroom+queen sofa bed,  pool, hot tub ping pong",Apartment,Entire home/apt,3/13/16,2016-03-13,9-27-16,2016-09-27,50.11270856,-122.9702574,11839929,13232844
ab-20601780,Luxury Fitzsimmons Walk Townhome 4 Beds Sleeps 9,Townhouse,Entire home/apt,9/11/17,2017-09-11,5-23-19,2019-05-23,50.12615,-122.95482,20601780,8520466
ab-20601877,Whistler Cascade by the village,Condominium,Entire home/apt,8/22/17,2017-08-22,5-23-19,2019-05-23,50.1165,-122.95888,20601877,49170887
ab-16466595,"Central, Quiet One Bedroom-Free Parking",Apartment,Entire home/apt,12/21/16,2016-12-21,2-11-19,2019-02-11,50.11715728,-122.9583883,16466595,17197633
ab-14947390,Gorgeous 2 Bed Sleeps 6 Renovated Village location,Townhouse,Entire home/apt,9/6/16,2016-09-06,5-24-19,2019-05-24,50.12194,-122.95992,14947390,8520466
ab-20604727,5 Bedroom Luxury Lakeside Whistler Retreat,House,Entire home/apt,10/21/17,2017-10-21,5-1-18,2018-05-01,50.11285078,-122.9859067,20604727,147251124
ab-4269069,Cozy Whistler Village Studio,Condominium,Entire home/apt,9/20/14,2014-09-20,5-24-19,2019-05-24,50.11931,-122.95733,4269069,22162240
ab-14947552,Nighthawk Lane - Luxury with a view,Chalet,Entire home/apt,9/6/16,2016-09-06,5-22-19,2019-05-22,50.11316,-122.96724,14947552,19857935
ab-7821463,Gables 1 bedroom 150 metres to lifts & Village,Apartment,Entire home/apt,8/8/15,2015-08-08,11-20-16,2016-11-20,50.11520104,-122.9491637,7821463,13232844
ab-17254566,VILLAGE CHALET 3 BED 3 BATH PRIVATE HOT TUB,Chalet,Entire home/apt,2/12/17,2017-02-12,5-23-19,2019-05-23,50.12506,-122.9545,17254566,3091094
ab-2778701,Creekside Townhouse ski in ski out,House,Entire home/apt,4/11/14,2014-04-11,5-24-19,2019-05-24,50.09031,-122.99247,2778701,14211646
ab-14948690,Modern Whistler Family Home,Townhouse,Entire home/apt,9/6/16,2016-09-06,8-2-17,2017-08-02,50.07924278,-123.040059,14948690,18587299
ab-9062997,Wildwood Lodge 309 near lifts,Condominium,Entire home/apt,10/22/15,2015-10-22,5-24-19,2019-05-24,50.1184,-122.94139,9062997,22619214
ab-12950813,"Penthouse Condo Eagle Ldge, Town Ct",Apartment,Entire home/apt,5/10/16,2016-05-10,10-18-16,2016-10-18,50.11631489,-122.955359,12950813,70532098
ab-20618230,Signature Cozy #202 Whistler 1 Bedroom Condo,Condominium,Entire home/apt,8/23/17,2017-08-23,10-12-17,2017-10-12,50.11674124,-122.9471794,20618230,65790915
ab-17255486,2Bedroom/2Bath/Kitchen/Fireplace WALK TO LIFTS!!,Apartment,Entire home/apt,2/12/17,2017-02-12,5-23-19,2019-05-23,50.11779,-122.95739,17255486,21730154
ab-20619837,Lovely Whistler Mountainside 1 Bedroom Condo,Condominium,Entire home/apt,8/23/17,2017-08-23,10-12-17,2017-10-12,50.11702319,-122.9469885,20619837,65790915
ab-20620589,Open-Plan Signature 1 Bedroom Whistler Condo,Condominium,Entire home/apt,8/23/17,2017-08-23,10-12-17,2017-10-12,50.11619293,-122.9471366,20620589,65790915
ab-20621277,Modern Spacious Whistler 1 Bedroom Condo,Condominium,Entire home/apt,8/23/17,2017-08-23,10-13-17,2017-10-13,50.11549118,-122.9487038,20621277,65790915
ab-20621423,Luxury 1 Bedroom Whistler Condo w/ Mountain Views,Condominium,Entire home/apt,8/23/17,2017-08-23,10-13-17,2017-10-13,50.11688536,-122.9474076,20621423,65790915
ab-20621999,Whistler Village Ski-in Ski-0ut Sleeps 10,Entire townhouse,Entire home/apt,8/23/17,2017-08-23,3-6-18,2018-03-06,50.11199123,-122.9516239,20621999,147412924
ab-20622011,Comfortable & Modern 1 Bedroom Whistler Condo,Condominium,Entire home/apt,8/23/17,2017-08-23,10-12-17,2017-10-12,50.11745383,-122.9472399,20622011,65790915
ab-11844907,Blueberry Home with Gorgeous Views,House,Entire home/apt,3/13/16,2016-03-13,4-11-19,2019-04-11,50.11389,-122.96938,11844907,25777071
ab-16469408,"Tranquil with Attention to Detail, WHISTLER 3 bdrm",Townhouse,Entire home/apt,12/21/16,2016-12-21,4-9-19,2019-04-09,50.0888,-123.00025,16469408,63823974
ab-20622288,Fantastic Mountainside Whistler 1 Bedroom Condo,Condominium,Entire home/apt,8/23/17,2017-08-23,10-12-17,2017-10-12,50.11752154,-122.9484216,20622288,65790915
ab-18142886,Bright Whistler Townhouse,Townhouse,Entire home/apt,4/7/17,2017-04-07,5-21-19,2019-05-21,50.09936,-122.98502,18142886,45355097
ab-20622725,Breathtaking 1 Bedroom Mountain Escape in Whistler,Condominium,Entire home/apt,8/23/17,2017-08-23,10-13-17,2017-10-13,50.11630304,-122.9478149,20622725,65790915
ab-20624385,Central Apartment Whistler,Apartment,Entire home/apt,8/23/17,2017-08-23,5-22-19,2019-05-22,50.12114,-122.95942,20624385,71136120
ab-20624892,Modern Studio in Whistler Village,Condominium,Entire home/apt,10/28/17,2017-10-28,5-22-19,2019-05-22,50.118,-122.95483,20624892,147314025
ab-11848013,Cascade Lodge-4,Condominium,Entire home/apt,3/13/16,2016-03-13,7-18-18,2018-07-18,50.11573998,-122.9587709,11848013,58385754
ab-777065,Whistler Ski/ Sky Townhouse,Loft,Entire home/apt,11/7/12,2012-11-07,5-22-19,2019-05-22,50.09179,-122.99425,777065,4098151
ab-16475286,"ã…¤Central, Quiet Two Bedroom-Free Parking",Apartment,Entire home/apt,12/22/16,2016-12-22,5-23-19,2019-05-23,50.11799,-122.95736,16475286,17197633
ab-20634705,Beautiful 1 Bedroom Condo in Whistler,Condominium,Entire home/apt,8/24/17,2017-08-24,10-13-17,2017-10-13,50.11586278,-122.946953,20634705,65790915
ab-20634881,Premiere Ski-In/Ski-Out Deluxe 1 Bedroom,Condominium,Entire home/apt,8/24/17,2017-08-24,10-13-17,2017-10-13,50.11709473,-122.9471033,20634881,65790915
ab-20635604,Compass Pointe Estate,Villa,Entire home/apt,3/25/19,2019-03-25,5-24-19,2019-05-24,50.12468,-122.96025,20635604,142683312
ab-20637061,Ski in Ski Out in prime upper village location,Apartment,Entire home/apt,8/24/17,2017-08-24,9-17-17,2017-09-17,50.11813281,-122.9484448,20637061,27857322
ab-4277978,Blueberry comfy 3BR/2BA Condo opening to outside,Condominium,Entire home/apt,9/20/14,2014-09-20,5-24-19,2019-05-24,50.11222,-122.96846,4277978,22209851
ab-20639144,Ski In / Ski Out Plus Pool & Hot Tub by Harmony Whistler Vacations,Apartment,Entire home/apt,10/14/17,2017-10-14,5-23-19,2019-05-23,50.11807,-122.94258,20639144,35393628
ab-14202958,Private family Chalet style home,Entire house,Entire home/apt,12/19/16,2016-12-19,1-22-18,2018-01-22,50.09658193,-122.9830491,14202958,86180465
ab-11852081,Whistler Village Cabin with Private Hot Tub,House,Entire home/apt,3/13/16,2016-03-13,10-25-17,2017-10-25,50.11274355,-122.9492975,11852081,21664441
ab-20651118,NEW 2.5 BD/2 BTH!Walk to Gondola & FREE Parking!,Apartment,Entire home/apt,8/25/17,2017-08-25,5-23-19,2019-05-23,50.09514,-122.99397,20651118,44202049
ab-20651735,Alta Lake Cabin,House,Entire home/apt,8/25/17,2017-08-25,9-7-17,2017-09-07,50.11330065,-122.9850693,20651735,28437772
ab-16479862,Lake Placid lodge by Creekside Gondola,Apartment,Entire home/apt,12/22/16,2016-12-22,9-20-17,2017-09-20,50.09461264,-122.9916917,16479862,7784624
ab-18777568,1 Bdr Whistler Nordic Condo,Condominium,Entire home/apt,5/15/17,2017-05-15,6-24-17,2017-06-24,50.10233127,-122.9803889,18777568,113487560
ab-20668285,Casa Bella Montagna,Townhouse,Entire home/apt,8/26/17,2017-08-26,5-24-19,2019-05-24,50.12347,-122.95446,20668285,2572439
ab-20678889,Heart of Whistler Village | 1BR Condo,Condominium,Entire home/apt,1/7/19,2019-01-07,5-23-19,2019-05-23,50.11901,-122.95675,20678889,147973356
ab-12956786,Comfortable 3 bedroom house in Alpine Meadows,Chalet,Entire home/apt,5/10/16,2016-05-10,1-26-19,2019-01-26,50.14704487,-122.9649598,12956786,53076782
ab-12957092,Whistler Village. In the heart of it all!,Condominium,Entire home/apt,5/10/16,2016-05-10,5-22-19,2019-05-22,50.11813,-122.95792,12957092,3053436
ab-4287832,Renovated 2 Bdrm+Den - NEW Hot Tub & Free Parking,Townhouse,Entire home/apt,9/21/14,2014-09-21,5-21-19,2019-05-21,50.11984,-122.95571,4287832,7359961
ab-13584728,Stylish and comfortable bedroom,House,Private room,6/18/16,2016-06-18,9-18-17,2017-09-18,50.12788552,-122.9674096,13584728,53838781
ab-801828,Whistler Stay and Play,House,Entire home/apt,11/21/12,2012-11-21,5-24-19,2019-05-24,50.10023069,-122.981816,801828,4220866
ab-20701158,Creekside Rustic Whistler Townhouse,Chalet,Entire home/apt,8/27/17,2017-08-27,11-25-18,2018-11-25,50.09384425,-122.9913642,20701158,1095587
ab-15630386,Simon & Marcella's Deluxe Mountain Serenity Suite,Apartment,Entire home/apt,10/21/16,2016-10-21,5-21-19,2019-05-21,50.11784,-122.95742,15630386,1915700
ab-20706593,Attractive condo in Whistler Creek,Loft,Entire home/apt,8/28/17,2017-08-28,5-24-19,2019-05-24,50.09272,-122.99273,20706593,148233125
ab-9088173,Heart Whistler Village-3bd/2.5bath,Townhouse,Entire home/apt,10/24/15,2015-10-24,5-22-19,2019-05-22,50.11958,-122.95991,9088173,43448637
ab-20712163,"Sundance, Whistler, Canada, 2 Bedroom Loft #1",Condominium,Entire home/apt,8/28/17,2017-08-28,5-21-19,2019-05-21,50.09179,-122.99345,20712163,10981379
ab-20712165,"Sundance, Whistler, Canada, 2 Bedroom Loft #2",Condominium,Entire home/apt,8/28/17,2017-08-28,5-24-19,2019-05-24,50.09129,-122.99476,20712165,10981379
ab-18170187,Heart of the Village -  1 Bedroom + loft,Loft,Entire home/apt,4/9/17,2017-04-09,5-24-19,2019-05-24,50.11883,-122.95684,18170187,43454918
ab-16492140,Beautiful Spacious Ski Chalet by Harmony Whistler,Townhouse,Entire home/apt,12/23/16,2016-12-23,5-23-19,2019-05-23,50.11994,-122.93986,16492140,35393628
ab-20720324,Unique apartment - 4 guests,Apartment,Private room,8/28/17,2017-08-28,10-2-17,2017-10-02,50.11196448,-122.9451392,20720324,148364471
ab-18789469,Idylwood Inn,House,Entire home/apt,5/15/17,2017-05-15,5-21-19,2019-05-21,50.14407,-122.97284,18789469,125184634
ab-16496705,The WoodsÂ by Harmony Whistler Vacations,Condominium,Entire home/apt,12/23/16,2016-12-23,5-23-19,2019-05-23,50.12223,-122.93637,16496705,35393628
ab-20726910,Whistler Monthly Rental Property with great views!,Townhouse,Entire home/apt,10/2/17,2017-10-02,4-15-19,2019-04-15,50.15987,-122.95495,20726910,7597745
ab-16497563,Golden Dreams Deer Lodge Studio,Serviced apartment,Entire home/apt,12/23/16,2016-12-23,5-22-19,2019-05-22,50.11776,-122.9554,16497563,17046824
ab-18790494,The Mountain Retreat at the base of Whistler,Condominium,Entire home/apt,5/16/17,2017-05-16,5-23-19,2019-05-23,50.11448,-122.95474,18790494,52706624
ab-17279290,TRUE SKI IN / SKI OUT- Pinnacle Ridge on Blackcomb,Chalet,Entire home/apt,2/13/17,2017-02-13,5-21-19,2019-05-21,50.11355,-122.9455,17279290,8107418
ab-20730257,"Aspens on Blackcomb, Whistler - ski in / ski out",Condominium,Entire home/apt,8/29/17,2017-08-29,5-22-19,2019-05-22,50.11649,-122.94563,20730257,148445942
ab-20731232,Panorama Chalet,Villa,Entire home/apt,3/25/19,2019-03-25,5-24-19,2019-05-24,50.1518,-122.96951,20731232,142683312
ab-14963340,Beautiful villa for rent,Villa,Entire home/apt,9/7/16,2016-09-07,11-10-16,2016-11-10,50.11441339,-122.9954907,14963340,4124464
ab-5870709,Clean and Modern,House,Private room,4/1/15,2015-04-01,5-22-19,2019-05-22,50.14436,-122.9715,5870709,30482946
ab-14964100,Spectacular mountain view Whistler home,House,Entire home/apt,7/3/17,2017-07-03,5-24-19,2019-05-24,50.15374,-122.96271,14964100,80594873
ab-14964485,3 bedroom Bright Lofted Ski In Cottage Duplex,Cabin,Entire home/apt,9/7/16,2016-09-07,5-21-19,2019-05-21,50.0874,-123.00375,14964485,83630632
ab-5874764,Whistler - February 26 - March 2.,Townhouse,Entire home/apt,2/6/18,2018-02-06,5-21-19,2019-05-21,50.08789,-122.99898,5874764,16949887
ab-12968181,#304 In the Spirit at Alpenglow,Apartment,Entire home/apt,5/11/16,2016-05-11,11-12-18,2018-11-12,50.1171917,-122.958136,12968181,35146399
ab-20744260,"Ski-In/Ski-Out Family Home, Perfect Location",Townhouse,Entire home/apt,11/13/17,2017-11-13,5-21-19,2019-05-21,50.11328,-122.95052,20744260,10511927
ab-815630,Beautiful Whistler-North Star Unit,Apartment,Entire home/apt,11/29/12,2012-11-29,5-24-19,2019-05-24,50.11747,-122.95734,815630,4284915
ab-19999627,Perfect summer get away at Lost Lake,Condominium,Entire home/apt,7/19/17,2017-07-19,8-24-17,2017-08-24,50.12351508,-122.9345478,19999627,122560237
ab-15635818,"Cosy ski-in/out, pool/hot tub, BBQ, Air-con for 4",Serviced apartment,Entire home/apt,10/21/16,2016-10-21,5-20-19,2019-05-20,50.11761,-122.94486,15635818,100838362
ab-823744,Recently Renovated-Village location,Apartment,Entire home/apt,12/4/12,2012-12-04,6-21-16,2016-06-21,50.1185039,-122.9542556,823744,1747164
ab-11885977,Cascade Lodge #5,Entire condominium,Entire home/apt,3/15/16,2016-03-15,2-12-18,2018-02-12,50.11643484,-122.9588894,11885977,58385754
ab-11886126,Cascade Lodge #6,Condominium,Entire home/apt,3/15/16,2016-03-15,7-18-18,2018-07-18,50.11735246,-122.9575023,11886126,58385754
ab-20758511,Whistler Village North: 3 Level Modern Condo!,Townhouse,Entire home/apt,9/1/17,2017-09-01,5-22-19,2019-05-22,50.1218,-122.95795,20758511,148159215
ab-19402800,"Gorgeous Whistler Village Condo! Fireplace, Garage",Condominium,Entire home/apt,6/18/17,2017-06-18,5-24-19,2019-05-24,50.11995,-122.9582,19402800,135919094
ab-15642385,Perfect Whistler Getaway With Hot Tub,House,Private room,10/22/16,2016-10-22,9-3-17,2017-09-03,50.1016173,-122.984028,15642385,100909793
ab-14217101,"Big, Beautiful Lorimer Lodge Whistler Retreat",House,Entire home/apt,7/26/16,2016-07-26,8-20-16,2016-08-20,50.12426811,-122.9637461,14217101,43554256
ab-14967428,Room with 2 double beds can sleep up to 4 (Nordic),House,Private room,9/8/16,2016-09-08,10-5-16,2016-10-05,50.09908491,-122.9816775,14967428,94258636
ab-20764203,"Large, Modern 2 bedroom condo close to village",Condominium,Entire home/apt,1/21/19,2019-01-21,5-21-19,2019-05-21,50.11337,-122.9682,20764203,51631329
ab-20768743,2 bed room accommodation in heart of Whistler!!,Apartment,Entire home/apt,9/1/17,2017-09-01,5-24-19,2019-05-24,50.12119,-122.95792,20768743,27869670
ab-20769763,"Whistler 1 BR CONDO, Slps 4, 2 beds. Cascade Lodge",Resort,Entire home/apt,9/1/17,2017-09-01,1-25-19,2019-01-25,50.11720351,-122.9580437,20769763,46543734
ab-20769764,"Whistler 1 BR CONDO, Slps 4, 2 beds. Cascade Lodge",Resort,Entire home/apt,9/1/17,2017-09-01,1-25-19,2019-01-25,50.11591872,-122.9595463,20769764,46543734
ab-18794600,Spacious Two bedroom apartment,Apartment,Entire home/apt,5/16/17,2017-05-16,6-21-17,2017-06-21,50.11250934,-122.9717653,18794600,1747962
ab-4333772,Best ski in ski out in  Whistler!,Apartment,Entire home/apt,9/25/14,2014-09-25,5-22-19,2019-05-22,50.11453,-122.94048,4333772,20780389
ab-831157,Ski in Ski out Townhouse at Whistler Mountain BC.,Condominium,Entire home/apt,12/9/12,2012-12-09,5-23-19,2019-05-23,50.09443,-122.99169,831157,4353106
ab-11893501,Great Townhouse in Village - 3 bdr,Townhouse,Entire home/apt,3/16/16,2016-03-16,5-21-19,2019-05-21,50.11843,-122.95853,11893501,52707478
ab-14219531,Whistler&#x27;s Montebello Luxury lodge 1,Townhouse,Entire home/apt,7/27/16,2016-07-27,8-8-16,2016-08-08,50.12588503,-122.956577,14219531,43554256
ab-20778965,Luxury Blackcomb 2 Bedroom Ski/in Condo,Condominium,Entire home/apt,9/1/17,2017-09-01,10-9-17,2017-10-09,50.1215647,-122.9372493,20778965,65790915
ab-20780356,Centrally Located Whistler Studio + Loft Condo,Condominium,Entire home/apt,9/1/17,2017-09-01,9-25-17,2017-09-25,50.11617079,-122.954981,20780356,65790915
ab-15646845,"1 bdrm condo, great location, free parking & wifi.",Apartment,Entire home/apt,10/22/16,2016-10-22,5-23-19,2019-05-23,50.12023,-122.95635,15646845,93382046
ab-12971767,Beautiful Log Home in a Quiet Neighbourhood,Chalet,Private room,5/24/17,2017-05-24,5-22-19,2019-05-22,50.12251,-122.96378,12971767,9122884
ab-5893213,1B/1B Whistler Village apartment - amazing view!,Apartment,Entire home/apt,4/3/15,2015-04-03,5-23-19,2019-05-23,50.11881,-122.95563,5893213,30605893
ab-16514561,The Seasons at Whistler 3 bedroom,Condominium,Entire home/apt,12/25/16,2016-12-25,5-21-19,2019-05-21,50.09374,-122.98737,16514561,14143158
ab-842466,Mountain Modern Style - Ski-in/Ski-,Apartment,Entire home/apt,12/16/12,2012-12-16,5-23-19,2019-05-23,50.09308,-122.98965,842466,4397876
ab-20013052,2-Storey Condo Minutes From The Gondola w/Parking,Townhouse,Entire home/apt,12/6/17,2017-12-06,5-22-19,2019-05-22,50.09839,-122.98983,20013052,142074964
ab-20787620,Luxury 1 BR condo in Whistler,Condominium,Private room,9/2/17,2017-09-02,9-4-17,2017-09-04,50.14653184,-122.9664111,20787620,26804229
ab-14975937,No vacancy sorry!,Chalet,Private room,9/8/16,2016-09-08,8-17-17,2017-08-17,50.12593734,-122.9488426,14975937,94344875
ab-12972494,"Next to Fairmont Whistler, new Blackcomb gondola",Apartment,Entire home/apt,5/11/16,2016-05-11,5-25-19,2019-05-25,50.1169,-122.94929,12972494,69139395
ab-16517088,Tyndall Stone Lodge - Whistler Village,Condominium,Entire home/apt,12/25/16,2016-12-25,5-22-19,2019-05-22,50.11792,-122.95503,16517088,46785486
ab-16518039,Condo in Nordic,Townhouse,Private room,12/25/16,2016-12-25,1-5-17,2017-01-05,50.09804539,-122.9840167,16518039,108595320
ab-5899406,Full season lodge style accommodation,Chalet,Private room,8/29/18,2018-08-29,5-21-19,2019-05-21,50.1041,-122.98663,5899406,8107418
ab-4341035,"LUXURY 3BR HOME, PRIVATE HOT TUB, WALK to VILLAGE",Townhouse,Entire home/apt,9/25/14,2014-09-25,5-25-19,2019-05-25,50.1228,-122.95527,4341035,21105939
ab-4341783,Elegant Apt Beside Whistler Village on Creek,Apartment,Entire home/apt,4/25/18,2018-04-25,5-23-19,2019-05-23,50.09578,-122.99286,4341783,503312
ab-16519437,Upper village boutique hotel-like resort,Timeshare,Entire home/apt,12/25/16,2016-12-25,2-9-17,2017-02-09,50.11894616,-122.9450247,16519437,51146049
ab-19409519,4 bedroom Mountains Edge,Entire condominium,Entire home/apt,6/18/17,2017-06-18,2-5-18,2018-02-05,50.11255314,-122.9580955,19409519,18700501
ab-2881231,Town house in whistler creekside,House,Entire home/apt,4/24/14,2014-04-24,12-26-16,2016-12-26,50.09766955,-122.9872792,2881231,13584206
ab-4342688,Whistler Lakefront World Class View,Apartment,Entire home/apt,9/25/14,2014-09-25,5-21-19,2019-05-21,50.11066,-122.97639,4342688,854621
ab-20805209,"Beautiful Modern Suite, Private Bedroom/Bathroom",Condominium,Private room,9/3/17,2017-09-03,10-6-17,2017-10-06,50.14724624,-122.9674557,20805209,149005869
ab-20808028,Deer Lodge Getaway,Apartment,Entire home/apt,9/3/17,2017-09-03,7-3-18,2018-07-03,50.11787041,-122.9542376,20808028,33020583
ab-20814574,"Prime Ski-in Ski-out Location! Pool, Hot tubs, BBQ, Ski Hill View (109)",Condominium,Entire home/apt,9/4/17,2017-09-04,5-22-19,2019-05-22,50.11528,-122.94469,20814574,148269423
ab-6882517,"Affordable 2 Beds, Walk to Village, Shared Hot Tub",Townhouse,Entire home/apt,6/16/15,2015-06-16,5-24-19,2019-05-24,50.12087,-122.95887,6882517,8520466
ab-4343948,"Spacious, peaceful 2 br, minutes from the village",Apartment,Entire home/apt,9/25/14,2014-09-25,5-22-19,2019-05-22,50.11339,-122.96881,4343948,3295554
ab-18195579,"1 BR - True Ski-in/Ski-out, 3 HotTubs, Ski Valet",Condominium,Entire home/apt,4/11/17,2017-04-11,5-22-19,2019-05-22,50.11703,-122.9448,18195579,21664441
ab-11911000,Whistler Ski-in/Ski-out Top Floor,Condominium,Entire home/apt,3/17/16,2016-03-17,5-22-19,2019-05-22,50.11534,-122.94448,11911000,16936653
ab-13616551,Lovely place on Blueberry 20 min. walk to Village,Condominium,Private room,6/20/16,2016-06-20,9-28-17,2017-09-28,50.11106923,-122.9691483,13616551,78840967
ab-20015399,Perfect Home Base For Whistler Adventures,Condominium,Private room,7/20/17,2017-07-20,8-2-18,2018-08-02,50.09437927,-122.9924391,20015399,61976105
ab-20015616,Mountain View Penthouse 1 BR - Private Balcony,Condominium,Entire home/apt,7/20/17,2017-07-20,5-23-19,2019-05-23,50.11784,-122.95796,20015616,64188893
ab-860256,Ski In/Out 3 BR w/Private Hot Tub,House,Entire home/apt,12/27/12,2012-12-27,5-22-19,2019-05-22,50.11578,-122.94298,860256,4505483
ab-20830239,Whistler Village WM Resort 1BR/2BDs for 4 #2,Resort,Entire home/apt,9/5/17,2017-09-05,5-21-19,2019-05-21,50.11628,-122.95886,20830239,3334196
ab-20830240,Whistler Village Modern One BDR Condo for 4 #1,Resort,Entire home/apt,9/5/17,2017-09-05,5-21-19,2019-05-21,50.11602,-122.95699,20830240,3334196
ab-14980099,Next to bus stop Bedroom,Apartment,Private room,9/8/16,2016-09-08,5-24-19,2019-05-24,50.14277,-122.96683,14980099,67674748
ab-14980127,"Quiet  Village Suite - Walk to Lifts, Free Wifi",Apartment,Entire home/apt,9/8/16,2016-09-08,5-23-19,2019-05-23,50.11693,-122.95508,14980127,68581273
ab-5913505,Beautiful 3 Bedroom Mountain Home,House,Entire home/apt,4/5/15,2015-04-05,11-15-16,2016-11-15,50.1426602,-122.9695402,5913505,14341368
ab-9120189,Single private room-Queen mattress,House,Private room,10/25/15,2015-10-25,5-22-19,2019-05-22,50.09611,-122.99439,9120189,47520978
ab-871083,Beautiful Whistler Village Condo,Apartment,Entire home/apt,1/3/13,2013-01-03,5-22-19,2019-05-22,50.11758,-122.95723,871083,4592183
ab-18213427,2BR Condo at the Tyndall Stone Lodge,Condominium,Entire home/apt,10/28/17,2017-10-28,5-4-19,2019-05-04,50.1189,-122.95587,18213427,26650418
ab-877568,"Free Edge card early season skiing, don't miss it!",Entire apartment,Entire home/apt,1/7/13,2013-01-07,1-1-18,2018-01-01,50.11619456,-122.9587632,877568,4637221
ab-882543,Whistler's best value 4 a single/kitchenette,Guest suite,Entire home/apt,1/10/13,2013-01-10,5-21-19,2019-05-21,50.12435,-122.94925,882543,3004958
ab-20846144,"Prime Ski-in Ski-out Location! Pool, Hot tubs, BBQ, sleeps 4 (110)",Condominium,Entire home/apt,9/6/17,2017-09-06,5-23-19,2019-05-23,50.1147,-122.94579,20846144,148269423
ab-20846628,Quiet Boutique 3 Bedroom Condo in Whistler,Condominium,Entire home/apt,9/6/17,2017-09-06,9-8-17,2017-09-08,50.12018967,-122.9377853,20846628,65790915
ab-20847131,Luxury TownhomeÂ in a Prime Location by Harmony Whistler,Townhouse,Entire home/apt,12/8/17,2017-12-08,5-23-19,2019-05-23,50.11374,-122.9512,20847131,35393628
ab-20849888,Private room in Ski-Out Whistler Townhome!,Townhouse,Private room,9/6/17,2017-09-06,9-27-17,2017-09-27,50.09823835,-122.9885077,20849888,63985828
ab-16533835,Whistler - Cascade Lodge 1 Bdrm SN Condo Resort,Serviced apartment,Entire home/apt,12/26/16,2016-12-26,5-21-19,2019-05-21,50.11742,-122.95834,16533835,9296727
ab-16534187,Whistler -Sundance 1 Bdrm Condo Resort,Serviced apartment,Entire home/apt,12/26/16,2016-12-26,5-21-19,2019-05-21,50.09194,-122.99453,16534187,9296727
ab-16534360,Whistler -Sundance 2 Bdrm Condo Resort,Serviced apartment,Entire home/apt,12/26/16,2016-12-26,5-21-19,2019-05-21,50.09295,-122.99341,16534360,9296727
ab-16534539,Whistler -Sundance 2 Bdrm Plus Condo Resort,Serviced apartment,Entire home/apt,12/26/16,2016-12-26,5-21-19,2019-05-21,50.09143,-122.99471,16534539,9296727
ab-2919176,Central Studio with Pool/Hot Tub,Apartment,Entire home/apt,4/29/14,2014-04-29,5-22-19,2019-05-22,50.11771,-122.95604,2919176,14907600
ab-2920396,"Luxury Studio, Centrally Located, Free Parking",Condominium,Entire home/apt,8/16/17,2017-08-16,5-21-19,2019-05-21,50.11809,-122.95864,2920396,14914427
ab-4357612,Upgraded Wildwood Lodge 1+den,Condominium,Entire home/apt,9/26/14,2014-09-26,11-4-18,2018-11-04,50.11740717,-122.9425624,4357612,22619214
ab-18808066,Cozy Creekside Studio - 5min to lifts-free parking,Apartment,Entire home/apt,5/17/17,2017-05-17,5-24-19,2019-05-24,50.09882,-122.98888,18808066,18158280
ab-2924173,Valhalla Cozy & Enchanting Townhome,Apartment,Entire home/apt,4/29/14,2014-04-29,5-24-19,2019-05-24,50.12123,-122.9589,2924173,14931192
ab-4358540,Cozy Whistler Townhome ,Chalet,Entire home/apt,9/26/14,2014-09-26,5-22-19,2019-05-22,50.12253,-122.9731,4358540,22624463
ab-4369905,Luxury ski-in-ski-out with hot tub and pool,Apartment,Entire home/apt,9/27/14,2014-09-27,5-24-19,2019-05-24,50.1161,-122.94418,4369905,4500777
ab-11939424,"3 Bed, Private Hot Tub, In Village",Townhouse,Entire home/apt,3/18/16,2016-03-18,5-23-19,2019-05-23,50.11893,-122.96008,11939424,20577471
ab-6898933,'The Woods' - 2 bedroom w/ hot tub access - steps from Lost Lake!,Townhouse,Entire home/apt,6/17/15,2015-06-17,6-12-18,2018-06-12,50.12262753,-122.9375853,6898933,35393628
ab-20871561,Whistler 4 Bedroom Hot Tub and Views,Townhouse,Entire home/apt,9/8/17,2017-09-08,4-11-19,2019-04-11,50.11271,-122.97045,20871561,25777071
ab-14239454,Whistler&#x27;s Montebello Luxury lodge 2,Apartment,Entire home/apt,7/28/16,2016-07-28,8-8-16,2016-08-08,50.12308545,-122.9571044,14239454,43554256
ab-11943926,Modern + Nature = Amazing,House,Entire home/apt,3/18/16,2016-03-18,3-7-17,2017-03-07,50.08001359,-123.0389814,11943926,63770926
ab-14239508,Whistler&#x27;s Montebello Luxury lodge 3,Apartment,Entire home/apt,7/28/16,2016-07-28,8-8-16,2016-08-08,50.12423972,-122.9559828,14239508,43554256
ab-6899408,Carlton LodgeÂ by Harmony Whistler Vacations,Condominium,Entire home/apt,6/17/15,2015-06-17,4-26-19,2019-04-26,50.11263,-122.95499,6899408,35393628
ab-6899739,Upper Village Location w/ Pool & Hot Tub by Harmony Whistler,Condominium,Entire home/apt,6/17/15,2015-06-17,5-23-19,2019-05-23,50.11685,-122.94522,6899739,35393628
ab-902544,Two Bedroom Condo in the Heart of Whistler Village,Condominium,Entire home/apt,1/22/13,2013-01-22,5-22-19,2019-05-22,50.1186,-122.95448,902544,3644269
ab-905329,Ravencrest ~ Spacious Blueberry Hill 4BD+Loft,Apartment,Entire home/apt,1/24/13,2013-01-24,5-24-19,2019-05-24,50.11178,-122.97139,905329,683972
ab-905484,Valhalla ~ 3BD Updated Condo w/Hot Tub,Apartment,Entire home/apt,1/24/13,2013-01-24,5-24-19,2019-05-24,50.12012,-122.96075,905484,683972
ab-5932489,Snowbird Whiski Jack Condo,Place,Entire home/apt,4/6/15,2015-04-06,5-22-19,2019-05-22,50.10219,-122.94163,5932489,30008014
ab-9135237,Carleton Lodge 305 Bronze - Mountain View,Condominium,Entire home/apt,10/26/15,2015-10-26,5-20-19,2019-05-20,50.11461,-122.95376,9135237,26808890
ab-9135884,2 bedroom townhome-Whistler Village,Townhouse,Entire home/apt,10/26/15,2015-10-26,9-18-16,2016-09-18,50.117843,-122.958522,9135884,35393628
ab-15663224,Perfect Quiet Location!  Walk everywhere!,Townhouse,Private room,10/23/16,2016-10-23,11-10-16,2016-11-10,50.12080498,-122.9554061,15663224,1356293
ab-18228134,Fantastic Ski-in/Ski-out 2B Blackcomb,Condominium,Entire home/apt,4/13/17,2017-04-13,5-28-18,2018-05-28,50.11695413,-122.9459242,18228134,6733621
ab-12988542,Slope Side Apartment w/ Pool & Hot Tub by Harmony Whistler,Condominium,Entire home/apt,5/12/16,2016-05-12,5-23-19,2019-05-23,50.11563,-122.94534,12988542,35393628
ab-12989051,Aspens Ski in Ski out Apartment,Apartment,Entire home/apt,5/12/16,2016-05-12,5-21-19,2019-05-21,50.10669,-122.93818,12989051,71333969
ab-7873909,Ski in Ski out-Glacier 343,Condominium,Entire home/apt,8/12/15,2015-08-12,12-27-16,2016-12-27,50.1181724,-122.9483776,7873909,9450001
ab-7874013,Ski In Ski Out-Aspens 257,Condominium,Entire home/apt,8/12/15,2015-08-12,12-27-16,2016-12-27,50.11727585,-122.9433934,7874013,9450001
ab-11951720,Whistler's favorite B&B for 2 or 3 - free parking!,Bed and breakfast,Private room,3/19/16,2016-03-19,5-24-19,2019-05-24,50.12443,-122.94914,11951720,3004958
ab-915379,Whistler lakefront,House,Entire home/apt,1/30/13,2013-01-30,1-31-19,2019-01-31,50.16099898,-122.9258979,915379,3200798
ab-18239505,Chateau Relaxeau at Whistler Creekside Gondola,Apartment,Entire home/apt,4/13/17,2017-04-13,5-24-19,2019-05-24,50.09411,-122.99261,18239505,126010878
ab-925603,Lake Placid Lodge Creekside 2 bedroom apartment,Apartment,Private room,2/4/13,2013-02-04,11-8-18,2018-11-08,50.09505898,-122.9910714,925603,3749031
ab-15666285,Walk to everything!!!!,Condominium,Private room,10/23/16,2016-10-23,11-9-16,2016-11-09,50.12254685,-122.9540439,15666285,1356293
ab-9137792,3 Bdrm Creekside Townhouse,Condominium,Entire home/apt,10/26/15,2015-10-26,5-25-19,2019-05-25,50.09239,-122.99391,9137792,47589727
ab-9144110,2 bedroom-village at your doorstep,Condominium,Entire home/apt,10/27/15,2015-10-27,5-21-19,2019-05-21,50.11781,-122.95919,9144110,21103066
ab-18241924,Modern village studio - 5min walk to lifts!,Serviced apartment,Entire home/apt,4/13/17,2017-04-13,5-24-19,2019-05-24,50.11652,-122.95559,18241924,42856656
ab-937980,Awesome Whistler Condo in Village,Apartment,Entire home/apt,2/11/13,2013-02-11,4-1-18,2018-04-01,50.1173973,-122.9541045,937980,750539
ab-4384559,Whistler Village Convenience,Apartment,Entire home/apt,9/28/14,2014-09-28,3-12-19,2019-03-12,50.11743,-122.95608,4384559,6733621
ab-4387145,The Active Group's Paradise,Chalet,Entire home/apt,9/29/14,2014-09-29,4-13-19,2019-04-13,50.13981,-122.96741,4387145,22776031
ab-4387886,Village Studio - Great Location!!,Apartment,Entire home/apt,9/29/14,2014-09-29,5-22-19,2019-05-22,50.11802,-122.95729,4387886,22780368
ab-16542844,Renovated condo with amazing views,Apartment,Entire home/apt,12/27/16,2016-12-27,5-24-19,2019-05-24,50.112,-122.96903,16542844,50605234
ab-11984802,The Aspens 1 Br Ski in Ski Out,Condominium,Entire home/apt,3/21/16,2016-03-21,4-18-17,2017-04-18,50.11651557,-122.9456236,11984802,41850542
ab-964727,"whistler apt. . Pool,BBQ, hot tub,near everthing",Apartment,Entire home/apt,2/27/13,2013-02-27,5-22-19,2019-05-22,50.09499,-122.99151,964727,4910411
ab-9149765,Snowgoose 2 bd 2 bath with private hot tub,Entire townhouse,Entire home/apt,10/27/15,2015-10-27,3-12-18,2018-03-12,50.12064031,-122.9368035,9149765,22619214
ab-12004154,Tyndall Stone ~ Spacious 2BD + Loft Condo,Apartment,Entire home/apt,3/22/16,2016-03-22,5-23-19,2019-05-23,50.11894,-122.9556,12004154,683972
ab-20032739,Whistler Village 2 Bed/2 Bath Sleeps 8,Entire condominium,Entire home/apt,7/21/17,2017-07-21,1-5-18,2018-01-05,50.11780147,-122.9586859,20032739,123938806
ab-12007550,Northstar 5 ~ Family-Friendly Village North 2Bdrm,Apartment,Entire home/apt,3/22/16,2016-03-22,6-10-17,2017-06-10,50.12071398,-122.960177,12007550,683972
ab-974676,Condo with Beautiful Blackcomb Views,Condominium,Entire home/apt,3/3/13,2013-03-03,3-29-18,2018-03-29,50.11084809,-122.9667838,974676,5246077
ab-17317845,Northwood Chalet Whistler: Private Luxury Home,House,Entire home/apt,2/16/17,2017-02-16,5-23-19,2019-05-23,50.14135,-122.95181,17317845,3541755
ab-20897874,Great location & classy place in Whistler,Apartment,Private room,9/10/17,2017-09-10,9-13-17,2017-09-13,50.11776138,-122.9433231,20897874,95095200
ab-16545290,*Whistler Retreat* - 3bdm(1 loft)&private hot tub.,Townhouse,Entire home/apt,12/27/16,2016-12-27,5-25-19,2019-05-25,50.12047,-122.95537,16545290,16596626
ab-16545386,North Star #64,Townhouse,Entire home/apt,4/6/17,2017-04-06,5-20-19,2019-05-20,50.11901,-122.96064,16545386,108885029
ab-20900889,Whistler Creekside townhome with private Hot Tub,Townhouse,Entire home/apt,9/10/17,2017-09-10,4-6-18,2018-04-06,50.08955085,-123.0011131,20900889,41764638
ab-20901251,Our Nest is Best,Apartment,Entire home/apt,9/10/17,2017-09-10,5-24-19,2019-05-24,50.08301,-122.99535,20901251,16622689
ab-17319925,Timeshare for Crankworx in Whistler,Condominium,Entire home/apt,7/22/18,2018-07-22,8-10-18,2018-08-10,50.12114557,-122.9606573,17319925,7682449
ab-17320102,Spring Break Family Retreat,Townhouse,Entire home/apt,2/16/17,2017-02-16,3-16-17,2017-03-16,50.11698794,-122.9616857,17320102,55403282
ab-20902395,Stunning 1 BR + Loft in Whistler Village,Entire condominium,Entire home/apt,9/10/17,2017-09-10,1-15-18,2018-01-15,50.11686905,-122.9548547,20902395,65790915
ab-4393178,Creekside Social 4B Cabin,Chalet,Entire home/apt,9/29/14,2014-09-29,2-24-19,2019-02-24,50.09652951,-122.9844344,4393178,6733621
ab-20903477,Paula's Whistler home;A/C for summer,Townhouse,Entire home/apt,9/10/17,2017-09-10,5-20-19,2019-05-20,50.11778,-122.95834,20903477,119509728
ab-20905094,Comfortable double room,Apartment,Private room,9/10/17,2017-09-10,9-22-17,2017-09-22,50.08909875,-122.9965787,20905094,8732506
ab-20911890,SLOPE-SIDE OASIS: NEWLY RENOVATED (Upper Village),Condominium,Entire home/apt,9/11/17,2017-09-11,5-21-19,2019-05-21,50.11611,-122.94266,20911890,5466877
ab-4401178,LOCATION LOCATION LOCATION,Townhouse,Entire home/apt,10/1/14,2014-10-01,5-24-19,2019-05-24,50.11365,-122.95101,4401178,18817518
ab-4401227,Colorful Comfy  2B Whistler Village,Apartment,Entire home/apt,10/1/14,2014-10-01,3-25-19,2019-03-25,50.11732,-122.95436,4401227,6733621
ab-16546049,Mountainside Lodge - Loft Suite 1,Entire timeshare,Entire home/apt,12/27/16,2016-12-27,1-9-18,2018-01-09,50.11407119,-122.9541067,16546049,81367606
ab-20914726,Cozy 1 Bedroom Whistler Retreat by Lost Lake Park,Condominium,Entire home/apt,9/11/17,2017-09-11,10-13-17,2017-10-13,50.12164633,-122.9344098,20914726,65790915
ab-12010549,Studio Condo Whistler Village 209,Apartment,Entire home/apt,3/22/16,2016-03-22,5-23-19,2019-05-23,50.11723,-122.95714,12010549,17197633
ab-20918973,Whistler Village Central Location Cozy Condo,Place,Entire home/apt,9/11/17,2017-09-11,5-22-19,2019-05-22,50.11804,-122.9559,20918973,147426257
ab-18269976,Centrally Located Whistler Chalet,Chalet,Entire home/apt,9/9/17,2017-09-09,5-24-19,2019-05-24,50.1272,-122.948,18269976,29941588
ab-4410658,Whistler Chalet,Chalet,Entire home/apt,10/1/14,2014-10-01,5-24-19,2019-05-24,50.11564,-122.94295,4410658,12988765
ab-990781,Whistler Creekside Town home,Apartment,Entire home/apt,3/10/13,2013-03-10,5-22-19,2019-05-22,50.0994,-122.99051,990781,3251660
ab-15677660,"Bugle Elk Condo (2 Bed, 2 bath w/loft) sleeps 8",Condominium,Entire home/apt,10/24/16,2016-10-24,5-21-19,2019-05-21,50.11493,-122.95692,15677660,81748680
ab-15677985,HEART OF WHISTLER ~ 270 DEGREE MOUTAIN VIEW,Apartment,Entire home/apt,10/24/16,2016-10-24,2-18-17,2017-02-18,50.11909942,-122.9547276,15677985,101263836
ab-7898933,Ski Whistler Blackcomb 5 bedroom,House,Entire home/apt,8/13/15,2015-08-13,6-2-16,2016-06-02,50.12076068,-122.9695479,7898933,13232844
ab-7899165,2 Bedroom Private/Renovated Condo,House,Entire home/apt,8/13/15,2015-08-13,2-8-17,2017-02-08,50.09048021,-122.9991934,7899165,41649301
ab-992641,Modest affordable basic bedroom,Condominium,Private room,3/11/13,2013-03-11,6-14-17,2017-06-14,50.09252868,-123.0011608,992641,5451027
ab-13634468,Woodrun Lodge Whistler Canada 2BR Condo,Condominium,Entire home/apt,6/21/16,2016-06-21,5-21-19,2019-05-21,50.11471,-122.94286,13634468,52651623
ab-16547762,1 bedroom apartment 1.5km from town.,Apartment,Entire home/apt,12/28/16,2016-12-28,7-12-17,2017-07-12,50.10853774,-122.9675217,16547762,14451525
ab-13005264,3 Bedroom + Den Whistler Townhome with Hot Tub,Townhouse,Entire home/apt,5/13/16,2016-05-13,11-1-17,2017-11-01,50.12422329,-122.9566784,13005264,65790915
ab-17331295,Queensize Bedroom,House,Private room,2/16/17,2017-02-16,5-22-19,2019-05-22,50.11834,-122.97091,17331295,9015160
ab-7903127,"Two Bedroom Condo, Whistler Village",Serviced apartment,Entire home/apt,8/14/15,2015-08-14,5-14-19,2019-05-14,50.12091,-122.95879,7903127,4719178
ab-7903529,Whistler Creekside - 3 bdrm home steps from lift,Townhouse,Entire home/apt,12/31/18,2018-12-31,5-24-19,2019-05-24,50.0964,-122.9887,7903529,3600817
ab-998642,Ski-in/Out or Summer Fun @ Blackcomb/Whistler,Apartment,Entire home/apt,5/9/18,2018-05-09,5-22-19,2019-05-22,50.11583,-122.94342,998642,5488038
ab-15692002,Mountain Views-Village North 1 Bdrm-Free Parking,Townhouse,Entire home/apt,10/25/16,2016-10-25,5-22-19,2019-05-22,50.12004,-122.95604,15692002,97676704
ab-12020466,Lagoons ~ 3BD Updated Village Condo w/Hot Tub,Apartment,Entire home/apt,3/23/16,2016-03-23,5-24-19,2019-05-24,50.11952,-122.96042,12020466,683972
ab-17331754,,,,2/17/17,2017-02-17,3-15-17,2017-03-15,50.11708698,-122.9460134,17331754,
ab-17332076,Entire 2BR Home in Whistler Village,Apartment,Entire home/apt,2/17/17,2017-02-17,5-22-19,2019-05-22,50.11665,-122.95496,17332076,15447975
ab-6925332,STAIRWAY TO SNOW HEAVEN,Condominium,Entire home/apt,6/18/15,2015-06-18,5-21-19,2019-05-21,50.09408,-122.99237,6925332,21233369
ab-20038671,Whistler Alpine Chalet,Entire vacation home,Entire home/apt,8/14/17,2017-08-14,12-25-17,2017-12-25,50.15324329,-122.9655169,20038671,52192450
ab-16555414,3 Bedrm +Den in Benchlands - Ski In/Ski Out Access,House,Entire home/apt,12/28/16,2016-12-28,4-11-19,2019-04-11,50.11666,-122.94082,16555414,25777071
ab-20949902,Perfectly Located 3 beds Loft inWhistler Village,Loft,Entire home/apt,9/13/17,2017-09-13,5-22-19,2019-05-22,50.11885,-122.95478,20949902,147426257
ab-20951382,The Best Top Floor Ski-in/Ski-out condo at Aspens,Serviced apartment,Entire home/apt,9/13/17,2017-09-13,5-21-19,2019-05-21,50.11471,-122.94492,20951382,93101126
ab-6926264,Cozy Comfort,House,Private room,6/18/15,2015-06-18,5-24-19,2019-05-24,50.14289,-122.9722,6926264,30482946
ab-5946821,Chalet Edelweiss - space & comfort!,Chalet,Entire home/apt,4/7/15,2015-04-07,5-21-19,2019-05-21,50.1262,-122.95076,5946821,23354084
ab-18824828,New Ski-In/Ski Out Studio Suite in Creekside,House,Entire home/apt,5/17/17,2017-05-17,5-21-19,2019-05-21,50.09362,-122.98531,18824828,1616015
ab-20957858,Lovely town home 5 min walk to Creekside Gondola,Townhouse,Entire home/apt,9/14/17,2017-09-14,5-24-19,2019-05-24,50.09373,-122.99221,20957858,20293755
ab-13007898,"Village Location, Alpenglow, pool, hot tub",Apartment,Entire home/apt,5/13/16,2016-05-13,3-17-17,2017-03-17,50.1189793,-122.9582461,13007898,1747164
ab-14995300,Cozy double bunk bed in cabin house,House,Shared room,9/9/16,2016-09-09,9-24-16,2016-09-24,50.09855679,-122.9832079,14995300,94554273
ab-18826464,Village Stroll 1 Bedroom,Condominium,Entire home/apt,5/18/17,2017-05-18,8-23-17,2017-08-23,50.11626456,-122.9563633,18826464,17197633
ab-20961057,Executive Whistler Village North TownHome,Townhouse,Entire home/apt,9/14/17,2017-09-14,9-21-17,2017-09-21,50.12013417,-122.959994,20961057,147426257
ab-20965636,"Slopeside at ""The Aspens"" Modern 1 Bedroom",Entire condominium,Entire home/apt,9/14/17,2017-09-14,1-6-18,2018-01-06,50.11651483,-122.9455262,20965636,123938806
ab-15000893,Nicklaus North,House,Entire home/apt,9/10/16,2016-09-10,5-24-19,2019-05-24,50.14009,-122.95722,15000893,58906987
ab-20967132,Aspens 1 Bed Penthouse,Entire condominium,Entire home/apt,9/15/17,2017-09-15,1-5-18,2018-01-05,50.11611851,-122.9445259,20967132,123938806
ab-17335717,Deluxe Resort Studio Suite,Chalet,Entire home/apt,2/17/17,2017-02-17,10-3-17,2017-10-03,50.11685389,-122.9446876,17335717,58675232
ab-19431572,Spacious 2 Bdrm Townhome in prime location,Townhouse,Entire home/apt,6/19/17,2017-06-19,4-17-18,2018-04-17,50.12021931,-122.9385872,19431572,3415624
ab-16557076,Penthouse condo on village stroll,Apartment,Entire home/apt,12/28/16,2016-12-28,3-5-19,2019-03-05,50.11662,-122.95613,16557076,60909178
ab-16557450,TOUGH MUDDER WKND -Intrawest Whistler (aka Embarc),Apartment,Entire home/apt,12/28/16,2016-12-28,5-22-19,2019-05-22,50.1189,-122.94663,16557450,108306775
ab-1009361,Best Whistler Village Rental 3Bdrm 2Bath Kitchen,Townhouse,Entire home/apt,3/18/13,2013-03-18,5-21-19,2019-05-21,50.11362,-122.94898,1009361,5552737
ab-13015761,1 bdrm - Lake Placid Lodge,Apartment,Entire home/apt,5/14/16,2016-05-14,6-3-17,2017-06-03,50.09518429,-122.9896234,13015761,51738647
ab-20970704,"Lagoons, central in Whistler Village sleeps 6",House,Entire home/apt,10/11/17,2017-10-11,5-24-19,2019-05-24,50.11759,-122.95857,20970704,569867
ab-20977150,100m to Lifts - Large 700 sq/ft 1 Bedroom,Entire condominium,Entire home/apt,9/15/17,2017-09-15,1-5-18,2018-01-05,50.11355431,-122.9509247,20977150,123938806
ab-4424307,2019/2020 New Years Week in Whistler Village,Serviced apartment,Entire home/apt,10/3/14,2014-10-03,5-21-19,2019-05-21,50.12215,-122.95598,4424307,8856980
ab-5957995,Aurora Lodge - huge sunny deck!,House,Entire home/apt,4/8/15,2015-04-08,4-30-19,2019-04-30,50.10623,-122.96797,5957995,23354084
ab-20981135,Spacious 3 Bedroom Townhouse In Whistler North,Townhouse,Entire home/apt,9/16/17,2017-09-16,10-15-17,2017-10-15,50.12238736,-122.9581282,20981135,65790915
ab-20981379,"Townhome in Village, Private Hot Tub, Pool & Sauna",Townhouse,Entire home/apt,10/14/17,2017-10-14,5-24-19,2019-05-24,50.1214,-122.95603,20981379,10823552
ab-20982057,1 bed room unit (max 4 people),Place,Entire home/apt,11/22/17,2017-11-22,7-22-18,2018-07-22,50.1145416,-122.9537683,20982057,38799302
ab-18273952,"Beautiful Woodrun 2 bedroom 2 bath, free parking",Condominium,Entire home/apt,4/15/17,2017-04-15,2-13-19,2019-02-13,50.11553,-122.94316,18273952,17197633
ab-18274483,2 Bdrm Village Townhome /w Private Hot Tub,Townhouse,Entire home/apt,4/15/17,2017-04-15,5-21-19,2019-05-21,50.12196,-122.95707,18274483,8926556
ab-18834463,Montebello Luxury with Stunning Mountain Views,Townhouse,Entire home/apt,5/18/17,2017-05-18,5-21-19,2019-05-21,50.12561,-122.95579,18834463,103149397
ab-15702538,Ski Whistler!!,Apartment,Private room,10/26/16,2016-10-26,11-3-16,2016-11-03,50.09462191,-122.9913986,15702538,40293346
ab-9186611,Carleton 306 Silver - One Bedroom - Slopeside,Condominium,Entire home/apt,10/29/15,2015-10-29,5-23-19,2019-05-23,50.11298,-122.95551,9186611,26808890
ab-15007751,Eagle Lodge Studio with Mountain Views & Free wifi,Apartment,Entire home/apt,9/10/16,2016-09-10,5-22-19,2019-05-22,50.1177,-122.95602,15007751,68581273
ab-17344841,Whistler 2 Bdrm Condo - trail to Creekside Gondola,Condominium,Entire home/apt,2/17/17,2017-02-17,3-14-18,2018-03-14,50.09850567,-122.9879921,17344841,117167804
ab-18274543,"Heart of Whistler 1,300 sq ft 307",Condominium,Entire home/apt,4/15/17,2017-04-15,8-30-17,2017-08-30,50.11631992,-122.954643,18274543,17197633
ab-18275625,The Family ModLodge,Vacation home,Entire home/apt,4/15/17,2017-04-15,7-29-17,2017-07-29,50.10940376,-122.9730732,18275625,126347927
ab-7919996,1 BR+ Condo- Great value!,Condominium,Entire home/apt,8/15/15,2015-08-15,5-22-19,2019-05-22,50.09161,-122.99452,7919996,9356362
ab-5962945,Newly Renovated Ski-in/ski-out,Condominium,Entire home/apt,4/9/15,2015-04-09,10-30-18,2018-10-30,50.11742088,-122.9433749,5962945,15007481
ab-12027485,"MAY 1st-NOV 30th   $14,000 -7months",Condominium,Entire home/apt,3/23/16,2016-03-23,8-2-16,2016-08-02,50.12002139,-122.9406621,12027485,24037962
ab-4431649,"Whistler Condo: 2-Level, 2 Bedroom",Apartment,Entire home/apt,10/4/14,2014-10-04,5-23-19,2019-05-23,50.11948,-122.95825,4431649,3532520
ab-18838206,Embarc Whistler,Apartment,Entire home/apt,5/18/17,2017-05-18,6-10-17,2017-06-10,50.11744026,-122.9461727,18838206,53212163
ab-18838366,Whistler Studio at Mountainside Lodge #01,Condominium,Entire home/apt,5/18/17,2017-05-18,5-22-19,2019-05-22,50.11544,-122.95437,18838366,118085755
ab-7922767,1 Bedroom Suite in Whistler,House,Private room,6/10/17,2017-06-10,5-23-19,2019-05-23,50.0891,-123.00022,7922767,41779907
ab-6940530,Carv'em or Park'em at Our Ski-in/Ski-Out Condo,Apartment,Entire home/apt,6/19/15,2015-06-19,8-25-17,2017-08-25,50.11478361,-122.9430254,6940530,6468743
ab-5968957,1 Bed Apartment - Whistler Village,Apartment,Entire home/apt,4/9/15,2015-04-09,3-13-17,2017-03-13,50.11832002,-122.95623,5968957,19857935
ab-21011436,Whistler Creekside Gondola Condo,Apartment,Entire home/apt,9/18/17,2017-09-18,10-4-17,2017-10-04,50.09420929,-122.9925414,21011436,1747962
ab-21012996,Blackcomb ski in ski out.,Apartment,Entire home/apt,9/18/17,2017-09-18,5-21-19,2019-05-21,50.11693,-122.94369,21012996,6307461
ab-21013078,Cozy Creekside Condo-5 Minute walk to Gondola,Apartment,Entire home/apt,9/18/17,2017-09-18,5-21-19,2019-05-21,50.09235,-122.99381,21013078,36117396
ab-4439301,"Montebello Townhome, near village with Hot Tub!",Townhouse,Entire home/apt,10/5/14,2014-10-05,5-23-19,2019-05-23,50.12314,-122.95569,4439301,23042397
ab-9197477,"Private hot tub, mountain views!",Townhouse,Entire home/apt,10/30/15,2015-10-30,5-21-19,2019-05-21,50.09246,-122.99169,9197477,14946721
ab-15011018,Homelike 1 bedroom + den Whistler condo,Apartment,Entire home/apt,12/4/16,2016-12-04,5-22-19,2019-05-22,50.11904,-122.95633,15011018,71985447
ab-6948842,1 BR apartment in heart of Whistler,Apartment,Entire home/apt,6/20/15,2015-06-20,5-23-19,2019-05-23,50.11814,-122.95441,6948842,312204
ab-6949326,Comfortable 5 Bedroom House with Hot Tub,House,Entire home/apt,5/24/17,2017-05-24,5-21-19,2019-05-21,50.15155,-122.96646,6949326,36434969
ab-18288201,Whistler Village 1bdrm Loft Suite  $159 June17-23,Vacation home,Entire home/apt,4/16/17,2017-04-16,6-25-17,2017-06-25,50.11389443,-122.9547733,18288201,31839700
ab-21024722,"1,750 sq ft 4 Bedroom Townhome steps to Green Lake",Townhouse,Entire home/apt,9/19/17,2017-09-19,3-1-19,2019-03-01,50.14117,-122.95342,21024722,10419364
ab-21026148,Cozy Creekside Condo Nestled In The Trees!,Apartment,Entire home/apt,9/19/17,2017-09-19,5-21-19,2019-05-21,50.0935,-122.99361,21026148,1751555
ab-21028401,"Ski-in, ski-out 1BR condo with pool and hot tub!",Apartment,Entire home/apt,9/19/17,2017-09-19,5-21-19,2019-05-21,50.1161,-122.94814,21028401,6447056
ab-19440295,Whistler Creekside Gondola Just a 5 min walk (c),Condominium,Entire home/apt,6/20/17,2017-06-20,5-23-19,2019-05-23,50.09397,-122.99409,19440295,58766804
ab-21040984,"7 min Walk to the ski lifts, golf course views.",Condominium,Entire home/apt,9/20/17,2017-09-20,1-16-19,2019-01-16,50.12006639,-122.9399338,21040984,129659623
ab-3044095,Paradise in Whistler- Location!!!,Townhouse,Entire home/apt,5/13/14,2014-05-13,5-24-19,2019-05-24,50.11915,-122.94086,3044095,14000096
ab-3045467,Chalet Haus Heidi Huge & Affordable,Chalet,Entire home/apt,5/13/14,2014-05-13,5-23-19,2019-05-23,50.12527,-122.95892,3045467,15500139
ab-16572031,Last Minute Whistler Condo N. Village 1/4 - 1/5,Condominium,Entire home/apt,7/3/17,2017-07-03,12-5-18,2018-12-05,50.11880292,-122.9562988,16572031,25599182
ab-15709179,Newly renovated 3rd story suite w/ great views (A),Condominium,Entire home/apt,10/26/16,2016-10-26,5-23-19,2019-05-23,50.09673,-122.9942,15709179,37364898
ab-21044147,Granite Court Townhouse - Whistler Village,Condominium,Entire home/apt,11/4/17,2017-11-04,2-26-18,2018-02-26,50.12204407,-122.954547,21044147,36976097
ab-4447346,Amazing Ski-in/Ski-out 2B Blackcomb,Apartment,Entire home/apt,10/6/14,2014-10-06,5-22-19,2019-05-22,50.11555,-122.94429,4447346,6733621
ab-21047396,"Prime Ski-in Ski-out Location! Pool, Hot tubs, BBQ, sleeps 4 (115)",Condominium,Entire home/apt,10/11/17,2017-10-11,5-23-19,2019-05-23,50.11547,-122.94405,21047396,148269423
ab-21047397,"Prime Ski-in Ski-out Location! Pool, Hot tubs, BBQ, sleeps 4 (116)",Condominium,Entire home/apt,10/11/17,2017-10-11,5-23-19,2019-05-23,50.11618,-122.94539,21047397,148269423
ab-21047398,"Prime Ski-in Ski-out Location! Pool, Hot tubs, BBQ, sleeps 6 (125)",Condominium,Entire home/apt,10/11/17,2017-10-11,5-23-19,2019-05-23,50.11555,-122.94571,21047398,148269423
ab-21047399,"Prime Ski-in Ski-out Location! Pool, Hot tubs, BBQ, sleeps 7 (127)",Condominium,Entire home/apt,10/11/17,2017-10-11,5-23-19,2019-05-23,50.11668,-122.94398,21047399,148269423
ab-18295258,Heart of Whistler Private Hot Tub 306,Condominium,Entire home/apt,4/17/17,2017-04-17,8-31-17,2017-08-31,50.11689147,-122.9548459,18295258,17197633
ab-18295573,Heart of Whistler Private Hot Tub 308,Condominium,Entire home/apt,4/17/17,2017-04-17,8-25-17,2017-08-25,50.1162235,-122.9543572,18295573,17197633
ab-12049761,"Sundance, Whistler, Canada, 2-Bedroom #2",Condominium,Entire home/apt,3/24/16,2016-03-24,5-21-19,2019-05-21,50.09273,-122.99446,12049761,10981379
ab-21047400,"Prime Ski-in Ski-out Location! Pool, Hot tubs, BBQ, sleeps 6 (132)",Condominium,Entire home/apt,10/11/17,2017-10-11,11-4-18,2018-11-04,50.11500687,-122.9444112,21047400,148269423
ab-21047401,"Prime Ski-in Ski-out Location! Pool, Hot tubs, BBQ, sleeps 4 (206)",Condominium,Entire home/apt,10/11/17,2017-10-11,5-23-19,2019-05-23,50.11477,-122.94529,21047401,148269423
ab-21047402,"Ski-in / Ski-out! Bright cozy with king bed, fireplace and heated floors (204)",Condominium,Entire home/apt,10/11/17,2017-10-11,5-23-19,2019-05-23,50.11567,-122.94415,21047402,148269423
ab-21047403,"Prime Ski-in Ski-out Location! Pool, Hot tubs, BBQ, sleeps 4 (205)",Condominium,Entire home/apt,10/11/17,2017-10-11,10-24-18,2018-10-24,50.11706172,-122.9446872,21047403,148269423
ab-21047405,"Prime Ski-in Ski-out Location! Pool, Hot tubs, BBQ, sleeps 4 (113)",Condominium,Entire home/apt,10/11/17,2017-10-11,5-23-19,2019-05-23,50.1169,-122.94603,21047405,148269423
ab-4449338,BluberyHill 2br Whistler Suite Pool and HOT TUB,Apartment,Entire home/apt,3/6/17,2017-03-06,5-23-19,2019-05-23,50.11391,-122.97028,4449338,317618
ab-18296155,Heart of Whistler Studio Loft-Free Parking,Condominium,Entire home/apt,4/17/17,2017-04-17,2-13-19,2019-02-13,50.11548865,-122.956376,18296155,17197633
ab-18296254,Heart of Whistler Private Hot Tub 311,Condominium,Entire home/apt,4/17/17,2017-04-17,7-26-17,2017-07-26,50.11468936,-122.9550717,18296254,17197633
ab-18296521,Heart of Whistler Private Hot Tub 304,Condominium,Entire home/apt,4/17/17,2017-04-17,8-31-17,2017-08-31,50.11696094,-122.9551368,18296521,17197633
ab-21057820,"Bright 2 bed, 2 bath plus loft in Creekside",Apartment,Entire home/apt,9/21/17,2017-09-21,5-24-19,2019-05-24,50.09265,-122.99456,21057820,2309690
ab-21059416,Central Located 2 Bedrooms Cozy Town Home,Townhouse,Entire home/apt,9/21/17,2017-09-21,5-21-19,2019-05-21,50.11919,-122.96025,21059416,151727551
ab-1076367,Lovely Condo Right in the Village!!,Apartment,Entire home/apt,4/13/13,2013-04-13,5-21-19,2019-05-21,50.11822,-122.95496,1076367,9354023
ab-21066255,Whistler Feb 9 -16  up to 6 people Price Reduced!!,Condominium,Entire home/apt,9/22/17,2017-09-22,5-24-19,2019-05-24,50.11914,-122.96062,21066255,151313301
ab-21066939,Whistler Village condo for spring week June 8-15,Loft,Entire home/apt,9/22/17,2017-09-22,5-17-18,2018-05-17,50.11640211,-122.9557412,21066939,15225955
ab-21067641,Peaceful Luxury ski in ski out,Townhouse,Entire home/apt,9/22/17,2017-09-22,5-22-19,2019-05-22,50.09342,-122.98193,21067641,6733621
ab-17366229,Private Studio in center of Whistler Village,Apartment,Entire home/apt,9/4/17,2017-09-04,5-21-19,2019-05-21,50.11964,-122.9587,17366229,117343072
ab-12056053,Studio Condo Whistler Village 224,Apartment,Entire home/apt,3/25/16,2016-03-25,5-21-19,2019-05-21,50.11704,-122.95832,12056053,17197633
ab-21068708,Cozy Mountain Retreat,Townhouse,Entire home/apt,9/22/17,2017-09-22,5-24-19,2019-05-24,50.09719,-122.97934,21068708,151824320
ab-15024449,1 bed Penthouse in Heart of Whistler!,Condominium,Entire home/apt,12/19/16,2016-12-19,5-23-19,2019-05-23,50.11759,-122.95532,15024449,1751555
ab-15718108,Cozy 3 Bedroom Whistler Townhome,Townhouse,Entire home/apt,10/27/16,2016-10-27,11-15-16,2016-11-15,50.11453155,-122.9390268,15718108,65790915
ab-9214922,Whistler Condo with loft - sleeps 7,Condominium,Entire home/apt,11/1/15,2015-11-01,5-22-19,2019-05-22,50.11826,-122.95614,9214922,36347211
ab-9216926,Whistler Cay 5 bedroom home!,House,Entire home/apt,11/1/15,2015-11-01,10-8-17,2017-10-08,50.12642426,-122.9647275,9216926,47929188
ab-17369225,Spacious Townhome Close To Ski Lifts And Trails,Townhouse,Entire home/apt,2/19/17,2017-02-19,5-21-19,2019-05-21,50.11917,-122.94103,17369225,114226955
ab-17369263,The Clock Tower 1 bedrm Condo in Whistler Village,Resort,Entire home/apt,2/19/17,2017-02-19,5-24-19,2019-05-24,50.1113,-122.95068,17369263,117379298
ab-16579419,Upstairs loft creekside,Condominium,Private room,12/30/16,2016-12-30,7-27-17,2017-07-27,50.09077332,-122.992588,16579419,64861710
ab-16580460,Whistler Village Center by Whiski Jack,Apartment,Entire home/apt,12/30/16,2016-12-30,5-23-19,2019-05-23,50.11605,-122.95457,16580460,109288862
ab-19451316,"Village Townhouse, Quaint and Private",Townhouse,Entire home/apt,6/20/17,2017-06-20,5-22-19,2019-05-22,50.11894,-122.9602,19451316,17206189
ab-3093983,Closest Luxury Chalet to Village-Hot tub-Ping pong,House,Entire home/apt,5/19/14,2014-05-19,5-23-19,2019-05-23,50.12035,-122.96253,3093983,1199781
ab-7938843,Master bedroom in Whistler Cay,Condominium,Private room,5/24/17,2017-05-24,5-23-19,2019-05-23,50.12568,-122.96324,7938843,41866216
ab-18311516,Rainbow Suites ~ Rustic 1BD+Loft in Main Village,Apartment,Entire home/apt,4/18/17,2017-04-18,5-21-19,2019-05-21,50.11458,-122.95689,18311516,683972
ab-12069101,2 BR/2 BA Townhouse with Own  Hot Tub,Townhouse,Entire home/apt,3/26/16,2016-03-26,5-22-19,2019-05-22,50.12069,-122.9552,12069101,64666004
ab-9219143,Whistler Village Group/Family Suite w kitchen,Serviced apartment,Entire home/apt,11/1/15,2015-11-01,5-22-19,2019-05-22,50.11431,-122.95397,9219143,1570646
ab-6970727,The Treehouse,Townhouse,Entire home/apt,6/21/15,2015-06-21,11-21-16,2016-11-21,50.09352295,-122.9926371,6970727,36549778
ab-13661909,Glacier Lodge at Blackcomb Base with Pool Access,Condominium,Entire home/apt,6/22/16,2016-06-22,5-23-19,2019-05-23,50.11631,-122.94666,13661909,79412891
ab-6972358,"True Ski-in, ski-out Whistler Townhouse",Townhouse,Entire home/apt,6/21/15,2015-06-21,5-23-19,2019-05-23,50.09361,-122.98086,6972358,36559061
ab-4470454,Whistler Luxury Townhouse 3Bd/3Bth,Chalet,Entire home/apt,10/9/14,2014-10-09,5-24-19,2019-05-24,50.12261,-122.95737,4470454,23193069
ab-3094482,Village Marketplace FREE Park FREE Wifi QUIET view,Apartment,Entire home/apt,5/19/14,2014-05-19,5-21-19,2019-05-21,50.11862,-122.95475,3094482,15697159
ab-15721167,Amazing Corner Unit w/Wrap around Deck & Views,Condominium,Entire home/apt,10/27/16,2016-10-27,4-28-18,2018-04-28,50.09475652,-122.9913825,15721167,37430451
ab-12071124,Studio Condo Whistler Village 223,Apartment,Entire home/apt,3/26/16,2016-03-26,5-23-19,2019-05-23,50.1185,-122.95793,12071124,17197633
ab-18314684,Whistler Golf Log Chalet,House,Entire home/apt,4/18/17,2017-04-18,5-21-19,2019-05-21,50.14126,-122.95273,18314684,83196803
ab-15038932,Beautiful Whistler estate,Villa,Entire home/apt,12/12/16,2016-12-12,12-18-16,2016-12-18,50.10614772,-122.9695088,15038932,37798322
ab-18315182,"ã…¤Village Stroll 2 Bedroom 2 Bathroom, free parking",Condominium,Entire home/apt,4/18/17,2017-04-18,5-22-19,2019-05-22,50.11666,-122.95455,18315182,17197633
ab-9220104,"Northstar 2 bdrm 2 bthm Whistler,Pool, hot tub,BBQ",Townhouse,Entire home/apt,11/1/15,2015-11-01,5-21-19,2019-05-21,50.11918,-122.9603,9220104,46329054
ab-15040284,Whistler Village Townhouse with Private Concierge,Townhouse,Entire home/apt,8/10/17,2017-08-10,5-23-19,2019-05-23,50.11806,-122.9598,15040284,52320868
ab-16587425,Spring Specials! Quiet townhome Granite Court 402,Townhouse,Entire home/apt,1/1/17,2017-01-01,5-25-19,2019-05-25,50.12103,-122.95414,16587425,13503025
ab-3113612,Treetop Retreat- Private Deck w/ Incredible Views,Condominium,Entire home/apt,5/21/14,2014-05-21,5-23-19,2019-05-23,50.09278,-122.99287,3113612,1526612
ab-18855666,Whistler One BR Deluxe at Mountainside Lodge #01,Condominium,Entire home/apt,5/19/17,2017-05-19,5-21-19,2019-05-21,50.11336,-122.95418,18855666,118085755
ab-19454313,Ski-in /out: Upper village Pinnacle Ridge 5 bdrm,Entire townhouse,Entire home/apt,6/20/17,2017-06-20,2-5-18,2018-02-05,50.11219854,-122.9454367,19454313,18700501
ab-13672686,Marketplace 1 bedroom with beautiful views,Condominium,Entire home/apt,6/23/16,2016-06-23,3-4-18,2018-03-04,50.12002523,-122.9549029,13672686,79525407
ab-17396595,Whistler Cascade Lodge One-Bedroom Condo,Serviced apartment,Entire home/apt,2/20/17,2017-02-20,5-21-19,2019-05-21,50.11737,-122.95768,17396595,10595328
ab-17396773,One-Bedroom Condo at Beautiful Cascade Lodge,Serviced apartment,Entire home/apt,2/20/17,2017-02-20,5-21-19,2019-05-21,50.11773,-122.95768,17396773,10595328
ab-18324020,"Penthouse 1-bedroom ski in ski out. Pool, hot tubs",Condominium,Entire home/apt,4/18/17,2017-04-18,5-22-19,2019-05-22,50.11514,-122.94555,18324020,48682285
ab-18325363,Whistler Golf Log Suite,Apartment,Entire home/apt,4/18/17,2017-04-18,10-22-17,2017-10-22,50.14178757,-122.9523507,18325363,83196803
ab-7955152,Comfortable and Private 2,Hostel,Private room,8/17/15,2015-08-17,5-22-19,2019-05-22,50.15018,-122.96563,7955152,36434969
ab-13673409,Magnificent Newly Renovated 4 bed Whistler Home,Townhouse,Entire home/apt,6/23/16,2016-06-23,1-23-19,2019-01-23,50.14094915,-122.9536492,13673409,7597745
ab-16588970,Think Whistler- Village Penthouse- 1 free parking!,Serviced apartment,Entire home/apt,1/1/17,2017-01-01,5-22-19,2019-05-22,50.11681,-122.95675,16588970,42856656
ab-13047492,Excellent location 3 bed Townhouse,Townhouse,Entire home/apt,5/16/16,2016-05-16,5-21-19,2019-05-21,50.11895,-122.9386,13047492,72206221
ab-12082716,"Quiet, Centrally located Condo in Whistler Village",Condominium,Entire home/apt,5/24/17,2017-05-24,5-24-19,2019-05-24,50.1213,-122.9576,12082716,41779907
ab-3125044,2 BDR @ BOUNCE TRAMPOLINE PARK,Apartment,Entire home/apt,5/23/14,2014-05-23,3-11-17,2017-03-11,50.0902013,-123.0401057,3125044,15873210
ab-16589947,Spacious 3-bed in prime location - Sleeps 9,Townhouse,Entire home/apt,1/1/17,2017-01-01,5-22-19,2019-05-22,50.11831,-122.95972,16589947,109407473
ab-17405506,Central Village Location! Perfect for Large Groups,Townhouse,Entire home/apt,2/21/17,2017-02-21,5-24-19,2019-05-24,50.12028,-122.95659,17405506,7359961
ab-16590318,Mountainside Lodge - Loft Suite 2,Entire timeshare,Entire home/apt,1/1/17,2017-01-01,1-9-18,2018-01-09,50.11562241,-122.9534269,16590318,81367606
ab-6992852,Cozy Townhouse on Alpha Lake,Townhouse,Entire home/apt,4/29/19,2019-04-29,5-22-19,2019-05-22,50.09265,-123.00809,6992852,713242
ab-14297231,Max's Creekside Studio,Apartment,Entire home/apt,10/2/17,2017-10-02,5-21-19,2019-05-21,50.09654,-122.99396,14297231,87318507
ab-4502056,Whistler Village Center - 1BR Condo for 4,Apartment,Entire home/apt,10/14/14,2014-10-14,5-22-19,2019-05-22,50.11414,-122.95561,4502056,317618
ab-13058359,Whistler Creekside Queen bedroom,House,Private room,5/16/16,2016-05-16,7-19-17,2017-07-19,50.09865517,-122.9872534,13058359,72310846
ab-9236386,"Carleton 307 Gold Slopeside, Center of the Village",Condominium,Entire home/apt,11/1/15,2015-11-01,5-22-19,2019-05-22,50.11441,-122.95513,9236386,26808890
ab-4503270,Cozy & light private apartment.,Apartment,Entire home/apt,10/14/14,2014-10-14,9-15-16,2016-09-15,50.10816057,-122.9685085,4503270,23354084
ab-17406050,Whistler Village @ Whistler Vacation Club,Timeshare,Entire home/apt,2/21/17,2017-02-21,9-5-17,2017-09-05,50.09494195,-122.9913253,17406050,98872916
ab-12092288,Creekside Comforts,Condominium,Entire home/apt,3/27/16,2016-03-27,8-30-18,2018-08-30,50.09488947,-122.9919577,12092288,44962141
ab-7956525,The Gables 1 Br Premium Location,Townhouse,Entire home/apt,8/17/15,2015-08-17,5-20-19,2019-05-20,50.11434,-122.95067,7956525,41850542
ab-7957907,Private and Comfortable,Hostel,Private room,8/17/15,2015-08-17,5-21-19,2019-05-21,50.1502,-122.96737,7957907,36434969
ab-20071904,STUDIO steps away from Blackcomb Base!,Resort,Private room,7/23/17,2017-07-23,5-21-19,2019-05-21,50.11763,-122.94603,20071904,9156539
ab-20072389,"Creekside Condo, steps from the Gondola!",Condominium,Entire home/apt,7/23/17,2017-07-23,5-7-18,2018-05-07,50.09383223,-122.9936494,20072389,26415530
ab-19460497,Shared Cosy Creekside Apartment,Apartment,Private room,6/21/17,2017-06-21,5-21-19,2019-05-21,50.09399,-122.99476,19460497,52634234
ab-14300391,"Cozy Rustic Chalet, 10 min to village",House,Entire home/apt,8/1/16,2016-08-01,11-9-16,2016-11-09,50.15721036,-122.9303004,14300391,87353684
ab-1120843,"Gourmet retreat, organic dinner and breakfast.",Chalet,Private room,4/28/13,2013-04-28,11-15-18,2018-11-15,50.14655361,-122.9697255,1120843,6149231
ab-14301491,Private room w/ balcony + bathroom w/ soaker tub,House,Private room,8/1/16,2016-08-01,12-25-16,2016-12-25,50.15767675,-122.9313719,14301491,87353684
ab-19461737,Ski in/Ski out - sleeps 8 - 3 bedrooms - renovated,Apartment,Entire home/apt,6/21/17,2017-06-21,5-24-19,2019-05-24,50.12046,-122.94004,19461737,1747164
ab-7005969,Village -  2 Bdr Townhome,Townhouse,Entire home/apt,6/24/15,2015-06-24,6-3-18,2018-06-03,50.11884559,-122.9587695,7005969,8851183
ab-16602101,Whistler's Best Condo location in the Village!,Condominium,Entire home/apt,1/1/17,2017-01-01,5-21-19,2019-05-21,50.11241,-122.95361,16602101,108597432
ab-13059867,"Stunning Luxury Chalet-View, Huge Deck, 2  HotTubs",Entire chalet,Entire home/apt,7/10/17,2017-07-10,2-4-18,2018-02-04,50.14181712,-122.9686211,13059867,67570958
ab-12111071,Steps to the Ski Hill w/ Hot Tub by Harmony Whistler,Condominium,Entire home/apt,3/28/16,2016-03-28,5-23-19,2019-05-23,50.11863,-122.9422,12111071,35393628
ab-4517274,Comfy ski in/ski out 1bdr condo Whistler-Blackcomb,Condominium,Entire home/apt,10/16/14,2014-10-16,5-21-19,2019-05-21,50.11691,-122.94259,4517274,23419428
ab-15735443,Brilliant ski in ski out 1BD condo,Condominium,Entire home/apt,10/28/16,2016-10-28,5-23-19,2019-05-23,50.11548,-122.9436,15735443,84797776
ab-15738210,Blackcomb Condo Just Steps From The Slopes.,Condominium,Entire home/apt,7/4/17,2017-07-04,5-24-19,2019-05-24,50.1181,-122.94317,15738210,101696593
ab-20074364,Beautiful Whistler Townhouse,Townhouse,Entire home/apt,7/23/17,2017-07-23,5-24-19,2019-05-24,50.10112,-122.98599,20074364,46371782
ab-13061107,Unique Home in the Forest,Townhouse,Entire home/apt,1/2/17,2017-01-02,2-7-17,2017-02-07,50.14459559,-122.9602954,13061107,7061896
ab-4521251,Cozy Creekside Studio,Condominium,Entire home/apt,10/16/14,2014-10-16,12-9-18,2018-12-09,50.09828328,-122.9904734,4521251,7668811
ab-12112510,Sunpath 3 br Central Village,Townhouse,Entire home/apt,3/28/16,2016-03-28,5-24-19,2019-05-24,50.11695,-122.95768,12112510,41850542
ab-12113021,Lake Placid Lodge 4 Br,Townhouse,Entire home/apt,3/28/16,2016-03-28,8-27-17,2017-08-27,50.09495148,-122.9918796,12113021,41850542
ab-3157333,Central 2 BD with Private Hot Tub,Townhouse,Entire home/apt,5/26/14,2014-05-26,5-24-19,2019-05-24,50.11809,-122.95841,3157333,14907600
ab-17417190,"2 bed, 2 bath-Whistler Village Mountain View Condo",Apartment,Entire home/apt,2/22/17,2017-02-22,5-20-19,2019-05-20,50.11847,-122.95503,17417190,53455698
ab-15742336,Sunny Bbq Pool Steps to Gondola &Village Blackcomb,Apartment,Entire home/apt,10/28/16,2016-10-28,5-25-19,2019-05-25,50.11758,-122.94329,15742336,101732952
ab-7022810,Whistler Swiss Haus - 3 Bedrooms,House,Entire home/apt,6/25/15,2015-06-25,6-21-18,2018-06-21,50.11583435,-122.9647897,7022810,36811353
ab-12126293,'Glacier Lodge' Ski In Luxury 3BR w/ Pool/Hot Tub!,Apartment,Entire home/apt,3/29/16,2016-03-29,8-7-17,2017-08-07,50.11685827,-122.946691,12126293,35393628
ab-15744426,Peaceful Location w/ Pool & Hot Tub by Harmony Whistler,Condominium,Entire home/apt,10/28/16,2016-10-28,5-23-19,2019-05-23,50.11268,-122.97044,15744426,35393628
ab-9251320,Walk to Whistler Village,Townhouse,Entire home/apt,11/2/15,2015-11-02,9-12-18,2018-09-12,50.11683981,-122.9617726,9251320,8107418
ab-12129374,WHISTLER VILLAGE_Studio_DEER LODGE,Apartment,Entire home/apt,3/29/16,2016-03-29,4-11-17,2017-04-11,50.11637782,-122.9556837,12129374,23975517
ab-13700002,'Lagoons' 2 bedroom townhome - Village Location,Townhouse,Entire home/apt,6/25/16,2016-06-25,9-16-18,2018-09-16,50.11826178,-122.9580692,13700002,35393628
ab-9259302,Mountainside Lodge,Place,Entire home/apt,11/2/15,2015-11-02,5-23-19,2019-05-23,50.11438,-122.95725,9259302,22650245
ab-9260905,3 bed 3 bath with mountain views!,House,Entire home/apt,11/2/15,2015-11-02,11-1-16,2016-11-01,50.15179236,-122.9658573,9260905,47921469
ab-18892749,Whistler Village Alpenglow pool hot tub sauna gym,Condominium,Private room,5/21/17,2017-05-21,10-13-17,2017-10-13,50.11933107,-122.9566876,18892749,13232844
ab-18348876,Village Stroll One Bedroom 446,Condominium,Entire home/apt,4/20/17,2017-04-20,8-23-17,2017-08-23,50.11631971,-122.9560676,18348876,17197633
ab-18349024,ã…¤North Village Townhouse,Condominium,Entire home/apt,4/20/17,2017-04-20,5-21-19,2019-05-21,50.11941,-122.96194,18349024,17197633
ab-18349177,North Village Townhouse 95,Condominium,Entire home/apt,4/20/17,2017-04-20,8-16-17,2017-08-16,50.11894054,-122.9607972,18349177,17197633
ab-18349247,North Village Townhouse 52,Townhouse,Entire home/apt,4/20/17,2017-04-20,7-27-17,2017-07-27,50.11883218,-122.96212,18349247,17197633
ab-18349373,North Village Townhouse 129,Condominium,Entire home/apt,4/20/17,2017-04-20,8-16-17,2017-08-16,50.11739691,-122.9607867,18349373,17197633
ab-4549561,Updated Cozy 2 Bedroom Townhouse w/Private Hot Tub,Townhouse,Entire home/apt,10/20/14,2014-10-20,5-22-19,2019-05-22,50.11997,-122.95731,4549561,14196727
ab-4550191,Whistler  Village North Townhome ,Apartment,Entire home/apt,10/20/14,2014-10-20,8-4-17,2017-08-04,50.12141455,-122.9575046,4550191,23591798
ab-15059391,"Theme rooms, Whistler Village Cabin, walk to lifts",Townhouse,Entire home/apt,9/13/16,2016-09-13,12-17-18,2018-12-17,50.11582847,-122.9591102,15059391,17478503
ab-13712573,Spacious 2 bed and loft with mountain views,House,Entire home/apt,6/26/16,2016-06-26,5-21-19,2019-05-21,50.09643,-122.99556,13712573,54643820
ab-9261503,Blueberry Hill 2bed/2bath,Apartment,Entire home/apt,12/6/16,2016-12-06,5-21-19,2019-05-21,50.11314,-122.96866,9261503,22907000
ab-4567607,3 bedroom townhouse Mountain Views,Apartment,Entire home/apt,10/23/14,2014-10-23,5-8-17,2017-05-08,50.09817639,-122.9790435,4567607,23676895
ab-15070833,Ski-in/Ski-out Whistler Creekside,House,Entire home/apt,9/14/16,2016-09-14,5-24-19,2019-05-24,50.09891,-122.98241,15070833,89209597
ab-3177692,Family Friendly w/ Pool & Hot Tub Walk to Village,Apartment,Entire home/apt,5/29/14,2014-05-29,5-24-19,2019-05-24,50.12206,-122.95557,3177692,6641619
ab-19490883,Modern 1 bedroom Ski in Ski Out Apartment,Apartment,Entire home/apt,6/22/17,2017-06-22,7-29-17,2017-07-29,50.1168498,-122.9461317,19490883,74143556
ab-9272622,Carleton 407 Gold - Spacious Slopeside Suite,Condominium,Entire home/apt,11/3/15,2015-11-03,5-22-19,2019-05-22,50.11464,-122.95418,9272622,26808890
ab-9274003,Whistler Half Duplex,House,Entire home/apt,11/3/15,2015-11-03,6-27-17,2017-06-27,50.08828346,-123.0000073,9274003,20430803
ab-16605113,"Heart of village, full condo, modern,  hot tub",Condominium,Entire home/apt,1/1/17,2017-01-01,5-23-19,2019-05-23,50.12066,-122.95551,16605113,21545008
ab-19492359,ã…¤2 Bedroom Loft Central Location-Free Parking,Condominium,Entire home/apt,6/22/17,2017-06-22,5-24-19,2019-05-24,50.11725,-122.95651,19492359,17197633
ab-19492394,ã…¤2 Bedroom Central Location-Free Parking,Condominium,Entire home/apt,6/22/17,2017-06-22,5-21-19,2019-05-21,50.11746,-122.95658,19492394,17197633
ab-19493664,Base of Whistler Private Hot Tub 903,Condominium,Entire home/apt,6/23/17,2017-06-23,8-16-17,2017-08-16,50.1139378,-122.9559145,19493664,17197633
ab-16607217,Ski in/Ski out 4 star Crystal Lodge Hotel Whistler,Other,Entire home/apt,1/1/17,2017-01-01,1-7-17,2017-01-07,50.11517357,-122.9562911,16607217,8296243
ab-3194110,"3BR Ski In Ski Out Loft, Whistler!",Apartment,Entire home/apt,6/1/14,2014-06-01,4-19-17,2017-04-19,50.11662852,-122.9440815,3194110,12221510
ab-14303030,Brand new condo,Apartment,Private room,8/1/16,2016-08-01,5-19-17,2017-05-19,50.08122519,-123.0405184,14303030,87383391
ab-3201339,"Ski/in-out, Fireplace, Affordable!",Apartment,Entire home/apt,6/1/14,2014-06-01,5-24-19,2019-05-24,50.11824,-122.94267,3201339,12503189
ab-3205313,Whistler Town Plaza Penthouse,Apartment,Private room,6/1/14,2014-06-01,11-1-16,2016-11-01,50.11730167,-122.9545965,3205313,145159
ab-14303350,"Whistler Village - 2BR, 2 bath, & private hot tub!",Entire townhouse,Entire home/apt,8/1/16,2016-08-01,2-26-18,2018-02-26,50.1203434,-122.9573243,14303350,87387733
ab-9276677,Walk to Lift Whistler 1 Bedroom Full Suite,Chalet,Private room,11/3/15,2015-11-03,5-24-19,2019-05-24,50.09726,-122.98571,9276677,48176827
ab-15757700,Contemporary Family Friendly Whistler Home,Chalet,Entire home/apt,7/1/17,2017-07-01,5-23-19,2019-05-23,50.10737,-122.97794,15757700,4049337
ab-12147260,2 BEDROOM COZY GRND FLR TOWNHOME,Apartment,Entire home/apt,3/30/16,2016-03-30,8-27-18,2018-08-27,50.11994743,-122.956127,12147260,65217579
ab-13725486,Centre of Whistler Village with Free Parking!,Apartment,Entire home/apt,6/26/16,2016-06-26,5-22-19,2019-05-22,50.11558,-122.95519,13725486,53147745
ab-3226098,The Nest-Great Studio WhistlerVillage-free parking,Apartment,Entire home/apt,6/3/14,2014-06-03,5-21-19,2019-05-21,50.11907,-122.95765,3226098,16330328
ab-3226375,Private and Sunny ,Apartment,Entire home/apt,6/3/14,2014-06-03,9-30-17,2017-09-30,50.09299157,-122.9918643,3226375,16331238
ab-19503915,"Village Center Studio, Free Parking 4404",Condominium,Entire home/apt,6/23/17,2017-06-23,7-19-17,2017-07-19,50.11510884,-122.9527725,19503915,17197633
ab-19503979,"Village Center Studio, Free Parking 4406",Condominium,Entire home/apt,6/23/17,2017-06-23,7-19-17,2017-07-19,50.11668718,-122.9535539,19503979,17197633
ab-13728045,Studio Suite in White Gold,Guest suite,Entire home/apt,6/27/16,2016-06-27,5-24-19,2019-05-24,50.1272,-122.94777,13728045,80282357
ab-15098219,â›· Amazing location 1 Bedroom plus den sleeps 6 â„ï¸,Apartment,Entire home/apt,9/16/16,2016-09-16,4-17-19,2019-04-17,50.12095,-122.95748,15098219,84821274
ab-16613967,NEW - A beautiful Studio Apartment perfect for 2!,Condominium,Entire home/apt,1/2/17,2017-01-02,1-12-17,2017-01-12,50.12093492,-122.9545827,16613967,8520466
ab-15769975,Exquisite luxury Ski-In/Out 2bedroom Woodrun Lodge,Condominium,Entire home/apt,10/30/16,2016-10-30,5-23-19,2019-05-23,50.11569,-122.94288,15769975,14329829
ab-13730398,1 Bedroom Whistler Condo in Prime Location,Condominium,Entire home/apt,3/6/17,2017-03-06,10-12-17,2017-10-12,50.11851667,-122.9579795,13730398,65790915
ab-14317435,Whistler Home with a mountain view,House,Entire home/apt,1/19/17,2017-01-19,5-22-19,2019-05-22,50.12131,-122.96405,14317435,44134683
ab-12159402,Cascade Lodge # i 1BR condo (sleeps 4),Entire condominium,Entire home/apt,4/1/16,2016-04-01,2-12-18,2018-02-12,50.11786826,-122.9588979,12159402,58385754
ab-3256618,Whistler Coach House,Condominium,Entire home/apt,6/7/14,2014-06-07,5-24-19,2019-05-24,50.09355,-122.99005,3256618,16429081
ab-9278150,Overlooking Olympic Plaza with View,Condominium,Entire home/apt,11/3/15,2015-11-03,8-28-18,2018-08-28,50.12010701,-122.9519385,9278150,18294872
ab-14319514,Cosy double room very close to the village,Apartment,Private room,8/2/16,2016-08-02,10-4-16,2016-10-04,50.12303955,-122.9506696,14319514,24935679
ab-15103018,CHRISTMAS  IN WHISTLER: 2BD/2BA BENCHLANDS,Townhouse,Entire home/apt,11/21/16,2016-11-21,1-2-17,2017-01-02,50.12267372,-122.9368933,15103018,56673392
ab-12171992,Whistler ski in ski out Aspens pool hot tubs Wi-Fi,Apartment,Entire home/apt,4/1/16,2016-04-01,1-2-17,2017-01-02,50.11529244,-122.9459531,12171992,13232844
ab-15776276,"Spacious , deluxe, 4 bedroom Townhome with Hot tub",Townhouse,Entire home/apt,11/1/16,2016-11-01,5-21-19,2019-05-21,50.14269,-122.9548,15776276,19142957
ab-4606719,NOTHING COMPARES! CLICK TO SEE WHY!,Condominium,Entire home/apt,10/28/14,2014-10-28,5-23-19,2019-05-23,50.11185,-122.97133,4606719,3543753
ab-6031686,Lakeside Living in Whistler,House,Entire home/apt,4/14/15,2015-04-14,4-15-19,2019-04-15,50.09092,-123.00587,6031686,31305944
ab-16618767,1 Bedroom slope side at Blackcomb,Apartment,Entire home/apt,1/2/17,2017-01-02,9-28-18,2018-09-28,50.1167131,-122.9466434,16618767,26741011
ab-15784160,Spectacular Blackcomb Mountainside Ski In-Ski Out!,Apartment,Entire home/apt,11/1/16,2016-11-01,5-24-19,2019-05-24,50.11531,-122.94413,15784160,102096040
ab-16619476,"Village Center, 1 BR Marketplace Lodge Condo",Condominium,Entire home/apt,10/11/17,2017-10-11,4-2-18,2018-04-02,50.11905275,-122.9548807,16619476,6791845
ab-7996243,STUNNING VIEWS! Best pool/hot tub deck!,Apartment,Entire home/apt,8/20/15,2015-08-20,5-23-19,2019-05-23,50.11355,-122.97021,7996243,7784624
ab-15113050,Tranquil Chateau Golf Course Setting by Harmony Whistler,Townhouse,Entire home/apt,9/17/16,2016-09-17,5-23-19,2019-05-23,50.12035,-122.93857,15113050,35393628
ab-15785301,1 BR/Bonus Loft/Wood fireplace/NETFLIX/washerdryer,Condominium,Entire home/apt,11/1/16,2016-11-01,5-23-19,2019-05-23,50.09257,-122.99167,15785301,77336927
ab-15114285,Private Room,Condominium,Private room,9/17/16,2016-09-17,9-28-16,2016-09-28,50.08025619,-123.0409368,15114285,95762735
ab-20112552,Aspens-Ski In/Ski Out-REFURBISHED-3 Hot Tubs+Pool,Condominium,Entire home/apt,7/25/17,2017-07-25,5-24-19,2019-05-24,50.11694,-122.94483,20112552,142968918
ab-12188532,Creekside minutes walk to godola,Apartment,Private room,4/1/16,2016-04-01,5-21-19,2019-05-21,50.09972,-122.98994,12188532,20612979
ab-9279632,Beauty Home in Crabapple with Sauna,House,Entire home/apt,11/3/15,2015-11-03,2-6-16,2016-02-06,50.12398498,-122.9726404,9279632,19254342
ab-16620469,Central Whistler Village Condo,Apartment,Entire home/apt,1/2/17,2017-01-02,7-27-18,2018-07-27,50.11940319,-122.9553312,16620469,33791412
ab-4629225,Hot Tub within 200 meters of lifts!,House,Entire home/apt,11/1/14,2014-11-01,3-22-18,2018-03-22,50.11079792,-122.9586807,4629225,23973685
ab-12193598,"ã…¤Benchlands 1,500 sq ft Townhouse 2 free parking",Townhouse,Entire home/apt,4/1/16,2016-04-01,5-23-19,2019-05-23,50.1189,-122.93986,12193598,17197633
ab-15115919,"Deluxe 4 bedroom, private hot tub and garage (45)",Townhouse,Entire home/apt,2/5/18,2018-02-05,1-8-19,2019-01-08,50.12580738,-122.9552361,15115919,95781035
ab-15116035,2 bedroom 2 bathroom Whistler Condo Stunning Views,Apartment,Entire home/apt,9/17/16,2016-09-17,5-21-19,2019-05-21,50.09157,-122.99359,15116035,95784663
ab-18896534,Whistler Studio at Mountainside Lodge #02,Condominium,Entire home/apt,5/22/17,2017-05-22,5-24-19,2019-05-24,50.11547,-122.95348,18896534,118085755
ab-15789402,Entire 1BR@Main St Village Whistler,Apartment,Entire home/apt,11/1/16,2016-11-01,5-21-19,2019-05-21,50.11771,-122.95834,15789402,15447975
ab-6046309,NorthStar #10 Luxury Townhome,Apartment,Entire home/apt,4/15/15,2015-04-15,2-12-19,2019-02-12,50.11880718,-122.9594233,6046309,12263398
ab-17444174,Chateau Brandywine Whistler,House,Entire home/apt,2/23/17,2017-02-23,4-6-17,2017-04-06,50.08936106,-122.9965766,17444174,118060096
ab-4638294,"Walk to lifts, etc. peaceful 3 bed home, Creekside",House,Entire home/apt,11/1/14,2014-11-01,5-24-19,2019-05-24,50.09526,-122.99178,4638294,24015242
ab-17444838,"Seasons at Whistler: 3-BR, Sleeps 8, Full Kitchen",Condominium,Entire home/apt,2/23/17,2017-02-23,5-24-19,2019-05-24,50.08876,-122.99756,17444838,27042710
ab-13734508,Private Room in Whistler,Apartment,Private room,6/27/16,2016-06-27,2-24-17,2017-02-24,50.07834945,-123.0415209,13734508,80372436
ab-18897474,Whistler Loft Suite at Mountainside Lodge #01,Loft,Entire home/apt,5/22/17,2017-05-22,5-20-19,2019-05-20,50.11495,-122.95494,18897474,118085755
ab-9300482,Studio in Whistler Village North,Apartment,Entire home/apt,11/4/15,2015-11-04,5-22-19,2019-05-22,50.11991,-122.95406,9300482,12838651
ab-4644847,"Luxury Ski-in, Ski-out Condo",Apartment,Entire home/apt,11/2/14,2014-11-02,5-22-19,2019-05-22,50.11526,-122.94346,4644847,24047289
ab-8018028,"Large family home, very close to Creekside Gondola",House,Entire home/apt,8/21/15,2015-08-21,2-26-17,2017-02-26,50.09119382,-122.9919556,8018028,42329437
ab-15792625,Embarc Whistler 2 bed Lodge,Apartment,Entire home/apt,11/1/16,2016-11-01,2-7-17,2017-02-07,50.11853471,-122.9458595,15792625,43373705
ab-1152058,Northstar at Stoney Creek Condo,Apartment,Entire home/apt,1/22/18,2018-01-22,12-20-18,2018-12-20,50.11866599,-122.9595825,1152058,1772531
ab-3302876,Whistler's Local Favorite Host,Apartment,Private room,6/12/14,2014-06-12,8-2-17,2017-08-02,50.12626846,-122.956803,3302876,16676651
ab-6055182,Small double room in great location,Apartment,Private room,4/16/15,2015-04-16,10-25-17,2017-10-25,50.11978123,-122.9555635,6055182,5621734
ab-1157230,Private Kitchen Suites,Guest suite,Private room,5/10/13,2013-05-10,5-23-19,2019-05-23,50.14725,-122.96995,1157230,6341320
ab-18361439,"Ski in Ski out 1 bedoom+sofa bed, pool & hot tub",Condominium,Entire home/apt,4/21/17,2017-04-21,5-23-19,2019-05-23,50.11975,-122.9416,18361439,1024137
ab-15127672,"Lofted condo , close to Gondola",Loft,Entire home/apt,9/18/16,2016-09-18,5-22-19,2019-05-22,50.09642,-122.99147,15127672,38749684
ab-15128596,"Bright, Spacious Top Floor with View at Creekside",Condominium,Entire home/apt,9/18/16,2016-09-18,5-24-19,2019-05-24,50.09109,-122.99378,15128596,9672426
ab-17458582, Beautiful apartment in Whistler! ,Timeshare,Entire home/apt,2/24/17,2017-02-24,4-1-17,2017-04-01,50.11697977,-122.9444481,17458582,100423148
ab-12224516,Contemporary Mountainview Chalet,House,Entire home/apt,4/3/16,2016-04-03,3-25-17,2017-03-25,50.12608839,-122.9566826,12224516,65760610
ab-17462136,,,,2/24/17,2017-02-24,3-10-17,2017-03-10,50.11908665,-122.9518571,17462136,
ab-17462606,Luxury 3bdr 3bath Whistler Chalet,Chalet,Entire home/apt,2/24/17,2017-02-24,11-11-17,2017-11-11,50.12317111,-122.9567983,17462606,98387636
ab-3317787,GoldenDreams B&B for over 25 years!,Bed and breakfast,Private room,6/14/14,2014-06-14,5-23-19,2019-05-23,50.127,-122.96753,3317787,17046824
ab-4671070,"Modern Mountain Getaway, Whistler- PRIME LOCATION",Townhouse,Entire home/apt,11/6/14,2014-11-06,5-20-19,2019-05-20,50.12145,-122.9567,4671070,15524568
ab-1198853,Walk to Gondola -Top Floor Penthouse,Apartment,Entire home/apt,5/23/13,2013-05-23,5-23-19,2019-05-23,50.09608,-122.99241,1198853,6549724
ab-16635010,Whistler Village Clock Tower - in the Village,Timeshare,Entire home/apt,1/3/17,2017-01-03,1-16-17,2017-01-16,50.11306348,-122.9554467,16635010,109894166
ab-16635520,Mountainside Lodge: 1-Bedroom with  Full Kitchen,Serviced apartment,Entire home/apt,1/3/17,2017-01-03,3-20-19,2019-03-20,50.11528,-122.95404,16635520,27042710
ab-1217395,Ski-in/Ski-out Cabin Steps Away from the Village,Townhouse,Entire home/apt,5/29/13,2013-05-29,5-24-19,2019-05-24,50.1136,-122.95819,1217395,6641619
ab-14336355,cozy room 10 min from village,House,Private room,8/2/16,2016-08-02,12-28-16,2016-12-28,50.15800276,-122.9301444,14336355,87353684
ab-16642544,Whistler Village Cascade Lodge Condo,Serviced apartment,Entire home/apt,1/3/17,2017-01-03,3-12-19,2019-03-12,50.11616,-122.95927,16642544,30307256
ab-1225920,Whistler Ski Condo,Condominium,Private room,6/1/13,2013-06-01,5-20-19,2019-05-20,50.09555,-122.9979,1225920,5213702
ab-14336788,Whistler - 5Mins from Fun!,House,Private room,8/2/16,2016-08-02,11-3-16,2016-11-03,50.09351179,-122.9945454,14336788,87785583
ab-13748478,Whistler Vacation Club at Lake Placid Lodge,Condominium,Entire home/apt,5/8/17,2017-05-08,12-20-18,2018-12-20,50.09258833,-122.9918876,13748478,52651623
ab-15801924,1 Bedroom Condo at base of Whistler/Blackcomb,Condominium,Entire home/apt,11/1/16,2016-11-01,4-14-17,2017-04-14,50.11544547,-122.9491273,15801924,15686293
ab-13750492,"Spacious, Well Appointed SKI IN-OUT near Village",Condominium,Entire home/apt,6/28/16,2016-06-28,5-24-19,2019-05-24,50.11492,-122.94283,13750492,6019038
ab-1240804,Beautiful suite in Whistler,House,Entire home/apt,6/4/13,2013-06-04,5-23-19,2019-05-23,50.12294,-122.95143,1240804,6764073
ab-17495532,Spacious 3-bedroom at Whiski Jack Snowbird,Condominium,Entire home/apt,2/26/17,2017-02-26,5-24-19,2019-05-24,50.11952,-122.9417,17495532,16186633
ab-18372517,"â„ï¸Family Paradise! - Free Parking, Hot Tub & View",Condominium,Entire home/apt,4/21/17,2017-04-21,5-24-19,2019-05-24,50.12012,-122.9558,18372517,74354856
ab-15804027,Ski Whistler in Decemb(PHONE NUMBER HIDDEN),Apartment,Private room,11/2/16,2016-11-02,12-13-16,2016-12-13,50.09412059,-122.9920082,15804027,40293346
ab-4716735,Stunning 5 Bdrm on Golf Course  Private Hot Tub,House,Entire home/apt,11/12/14,2014-11-12,5-24-19,2019-05-24,50.14078,-122.95532,4716735,7761771
ab-17499796,2 bedrm  Embarc Whistler/previously Club Intrawest,Timeshare,Private room,2/27/17,2017-02-27,3-26-17,2017-03-26,50.11726237,-122.9458119,17499796,118601163
ab-17500471,"Whistler 1 BR CONDOS, Slps 4, 2 beds. Cascade Ldg",Resort,Entire home/apt,2/27/17,2017-02-27,1-13-19,2019-01-13,50.11650014,-122.9588686,17500471,4385059
ab-17500474,"Whistler 1 BR CONDOS, Slps 4, 2 beds. Cascade Ldg",Timeshare,Entire home/apt,2/27/17,2017-02-27,7-3-17,2017-07-03,50.11788158,-122.9576506,17500474,4385059
ab-17500476,"Whistler 1 BR CONDOS, Slps 4, 2 beds. Cascade Ldg",Resort,Entire home/apt,2/27/17,2017-02-27,1-12-19,2019-01-12,50.11638532,-122.9578047,17500476,4385059
ab-12232136,Whistler Creek Hostel-style space for 1,Townhouse,Shared room,1/25/18,2018-01-25,4-5-18,2018-04-05,50.09792369,-122.9884732,12232136,65817055
ab-3372779,Blackcomb Beauty !  ,Apartment,Entire home/apt,6/20/14,2014-06-20,5-21-19,2019-05-21,50.11827,-122.94187,3372779,17017930
ab-17510814,Whistler Retreat,Townhouse,Entire home/apt,9/18/17,2017-09-18,5-24-19,2019-05-24,50.09253,-122.99273,17510814,13238122
ab-4730219,Village Center! #Walk #lifts #food,Apartment,Entire home/apt,11/25/16,2016-11-25,12-1-16,2016-12-01,50.11599943,-122.9547631,4730219,398564
ab-4730547,Cozy two bedroom suite,Entire apartment,Entire home/apt,11/14/14,2014-11-14,2-26-18,2018-02-26,50.12360189,-122.9509431,4730547,12240997
ab-16652614,Creekside condo,Condominium,Private room,1/4/17,2017-01-04,1-12-17,2017-01-12,50.09602535,-122.9903037,16652614,47998744
ab-16652888,"Heart of Whistler Village, 1 PARKING INCLUDED!",Condominium,Entire home/apt,1/4/17,2017-01-04,10-22-17,2017-10-22,50.11819688,-122.9532618,16652888,42856656
ab-17513709,"Luxury, quiet, large 2 Bdrm, 2 Bath in Whistler",Condominium,Entire home/apt,2/27/17,2017-02-27,5-21-19,2019-05-21,50.11152,-122.96907,17513709,27744938
ab-9348124,SPACIOUS Creekside Home: Walk to Gondola & Lakes!,Townhouse,Entire home/apt,11/7/15,2015-11-07,5-21-19,2019-05-21,50.09293,-122.99328,9348124,39477066
ab-20133935,Private Ensuite Bedroom in Whistler!,Townhouse,Private room,7/26/17,2017-07-26,8-12-17,2017-08-12,50.09127797,-123.0074876,20133935,139138557
ab-19529041,Sundance Creekside 3 BR Condo,Condominium,Entire home/apt,6/24/17,2017-06-24,5-23-19,2019-05-23,50.0915,-122.99302,19529041,137137111
ab-16661375,'Glaciers Reach'   1BR w/ private HT - Village!,Townhouse,Entire home/apt,1/5/17,2017-01-05,7-5-17,2017-07-05,50.12185104,-122.9560186,16661375,35393628
ab-8047622,Whistler Village Beer Festival Stay,Apartment,Entire home/apt,8/23/15,2015-08-23,9-18-16,2016-09-18,50.12159389,-122.958736,8047622,38499440
ab-18377431,"Ski in Ski Out Totally Renovated , 2 BR, 2BA, 8ppl",Apartment,Entire home/apt,4/22/17,2017-04-22,5-23-19,2019-05-23,50.11647,-122.94456,18377431,26650864
ab-18377725,Whistler Home with Electric Car Supercharger,House,Entire home/apt,4/22/17,2017-04-22,11-9-18,2018-11-09,50.14024746,-122.9520321,18377725,7597745
ab-1292771,"2 bedroom, quiet, well located, well furnished",Condominium,Entire home/apt,6/19/13,2013-06-19,5-21-19,2019-05-21,50.12016,-122.95811,1292771,7008499
ab-18378589,North Village Townhouse 41,Condominium,Entire home/apt,4/22/17,2017-04-22,8-16-17,2017-08-16,50.11773868,-122.9612109,18378589,17197633
ab-18378669,North Village Townhouse 58,Townhouse,Entire home/apt,4/22/17,2017-04-22,9-2-17,2017-09-02,50.11759585,-122.9621202,18378669,17197633
ab-18378737,North Village Townhouse 46,Condominium,Entire home/apt,4/22/17,2017-04-22,9-2-17,2017-09-02,50.11773679,-122.9625306,18378737,17197633
ab-1295382,Whistler Creekside Villa - single nights now open!,Apartment,Entire home/apt,6/20/13,2013-06-20,5-24-19,2019-05-24,50.093,-122.99202,1295382,6246029
ab-1296809,Fantastic Townhouse - Romantic!,Apartment,Entire home/apt,6/21/13,2013-06-21,10-17-16,2016-10-17,50.1135451,-122.9595719,1296809,3725474
ab-16661738,"Walk to Village, Lake & Market 2 beds private room",House,Private room,1/5/17,2017-01-05,8-27-17,2017-08-27,50.12563407,-122.9573832,16661738,81268390
ab-8049659,Spacious 2nd floor studio suite with fireplace (A),Condominium,Entire home/apt,8/24/15,2015-08-24,5-23-19,2019-05-23,50.0962,-122.99628,8049659,37364898
ab-1302135,3 bedrm/2 bath near-village chalet; great hot-tub!,House,Entire home/apt,6/22/13,2013-06-22,8-9-18,2018-08-09,50.12346851,-122.9490041,1302135,3004958
ab-9351853,Whistler Village - Play More!,Townhouse,Entire home/apt,11/7/15,2015-11-07,5-23-19,2019-05-23,50.12,-122.95787,9351853,4944151
ab-15142544,Litwin Lodge - stunning chalet w private hot tub,Chalet,Entire home/apt,10/2/17,2017-10-02,1-10-19,2019-01-10,50.0876682,-123.0016885,15142544,12768734
ab-8051402,Central 2BD with Private Hot Tub/Pool,Apartment,Entire home/apt,8/24/15,2015-08-24,3-7-19,2019-03-07,50.12187,-122.95584,8051402,42520140
ab-9351889,Lovely Chalet with Great View,Chalet,Entire home/apt,11/7/15,2015-11-07,1-5-19,2019-01-05,50.11008029,-122.9627871,9351889,44526702
ab-16666513,Village Center 2 bedroom with loft,Apartment,Entire home/apt,1/5/17,2017-01-05,3-30-19,2019-03-30,50.11968,-122.95509,16666513,7784624
ab-14351985,"Whistler,  3 bedroom SKI IN/OUT at Glacier Lodge",Apartment,Entire home/apt,8/3/16,2016-08-03,5-22-19,2019-05-22,50.11756,-122.94649,14351985,19142957
ab-4751154,Ë‘Free Parking Loft Studio Whistler Village,Apartment,Entire home/apt,11/16/14,2014-11-16,5-21-19,2019-05-21,50.11781,-122.9579,4751154,17197633
ab-4751196,1BR Suite Whistler Village sleeps 4 - Pool Hottub!,Serviced apartment,Entire home/apt,1/9/17,2017-01-09,5-24-19,2019-05-24,50.11623,-122.95679,4751196,317618
ab-4752998,Cozy Bedroom in Super Chill Home,Apartment,Private room,11/17/14,2014-11-17,5-4-16,2016-05-04,50.09997322,-122.9914682,4752998,1746330
ab-12255253,Ë°Benchlands 3 Bedroom Townhouse 2 free parking,Apartment,Entire home/apt,4/4/16,2016-04-04,5-22-19,2019-05-22,50.11811,-122.93939,12255253,17197633
ab-15830558,2 bedroom suite at the bottom of Whistler Mountain,Condominium,Entire home/apt,11/3/16,2016-11-03,5-21-19,2019-05-21,50.11278,-122.95509,15830558,52706624
ab-18911380,1BR Whistler creek condo,Condominium,Private room,5/22/17,2017-05-22,7-26-17,2017-07-26,50.09665867,-122.9864957,18911380,131799117
ab-14354166,"1 bedroom Condo, ski & soak!",Apartment,Entire home/apt,8/3/16,2016-08-03,4-11-18,2018-04-11,50.11806625,-122.9423931,14354166,884300
ab-20148669,Beautiful Mountain Side 1 Bedroom + Den Townhouse,Condominium,Entire home/apt,7/27/17,2017-07-27,9-5-17,2017-09-05,50.11592001,-122.9417953,20148669,65790915
ab-21092607,Nester's Condo,Entire condominium,Entire home/apt,9/24/17,2017-09-24,2-10-18,2018-02-10,50.12738504,-122.9553754,21092607,82350987
ab-17526605,Beautiful Whistler Luxury Chalet,House,Entire home/apt,3/1/17,2017-03-01,3-6-19,2019-03-06,50.10911,-122.97716,17526605,19713983
ab-15149675,Well appointed private chalet north of the village,Chalet,Entire home/apt,12/5/16,2016-12-05,9-28-18,2018-09-28,50.14614382,-122.9675495,15149675,88028683
ab-7050334,Beautiful home in Alta Vista close to the lake,House,Entire home/apt,6/27/15,2015-06-27,10-31-17,2017-10-31,50.10820602,-122.9741513,7050334,36970163
ab-21096853,Whistler Chalet,House,Entire home/apt,9/24/17,2017-09-24,6-11-18,2018-06-11,50.16312022,-122.9256694,21096853,152105426
ab-15831757,2 Bedroom/2 Bath Kitchen Suite in Whistler Village,Apartment,Entire home/apt,11/3/16,2016-11-03,5-22-19,2019-05-22,50.1189,-122.95899,15831757,21730154
ab-15832201,Whistler Creek Lodge Studio,Apartment,Entire home/apt,12/23/17,2017-12-23,2-24-19,2019-02-24,50.0955,-122.99208,15832201,102513172
ab-21097644,"Whistler, Alpine Meadows 2 Bedrooms loft Sleeps 6",House,Entire home/apt,9/24/17,2017-09-24,5-10-19,2019-05-10,50.14735,-122.96869,21097644,6641619
ab-21097947,"Prime Ski-in Ski-out Location! Pool, Hot tubs, Ski Hill View (209)",Condominium,Entire home/apt,10/11/17,2017-10-11,5-23-19,2019-05-23,50.11685,-122.94607,21097947,148269423
ab-21097948,"Prime Ski-in Ski-out Location! Pool, Hot tubs, BBQ, sleeps 4 (215)",Condominium,Entire home/apt,10/11/17,2017-10-11,5-23-19,2019-05-23,50.11616,-122.94455,21097948,148269423
ab-21097949,"Prime Ski-in Ski-out Location! Pool, Hot tubs, BBQ, sleeps 4 (216)",Condominium,Entire home/apt,10/11/17,2017-10-11,5-23-19,2019-05-23,50.11685,-122.94572,21097949,148269423
ab-21097950,"Prime Ski-in Ski-out Location! Pool, Hot tubs, BBQ, sleeps 8 (207)",Condominium,Entire home/apt,10/11/17,2017-10-11,5-23-19,2019-05-23,50.11527,-122.94437,21097950,148269423
ab-21097951,"Prime Ski-in Ski-out Location! Pool, Hot tubs, BBQ, sleeps 4 (217)",Condominium,Entire home/apt,10/11/17,2017-10-11,5-23-19,2019-05-23,50.11528,-122.9461,21097951,148269423
ab-18395194,Revamped One Bedroom Unit With Mountain Views!,Apartment,Entire home/apt,4/23/17,2017-04-23,5-22-19,2019-05-22,50.11801,-122.95572,18395194,68581273
ab-21106141,Max's Creekside Room,Apartment,Entire home/apt,9/24/17,2017-09-24,5-22-19,2019-05-22,50.09541,-122.99467,21106141,87318507
ab-21106455,Max's Creekside Condo,Apartment,Entire home/apt,9/25/17,2017-09-25,5-22-19,2019-05-22,50.09503,-122.99453,21106455,87318507
ab-15151499,Whistler-Blackcomb Townhouse,Townhouse,Entire home/apt,11/22/16,2016-11-22,5-24-19,2019-05-24,50.12211,-122.95564,15151499,94652786
ab-18913831,Luxury 3 Bed/ 3 Bath Montebello II townhouse,Townhouse,Entire home/apt,5/23/17,2017-05-23,5-24-19,2019-05-24,50.12462,-122.95537,18913831,105624693
ab-17529485,Whistler Escape,Apartment,Entire home/apt,3/1/17,2017-03-01,5-24-19,2019-05-24,50.12067,-122.95429,17529485,1991680
ab-8072483,Upper Village Tranquility Eight People,Condominium,Entire home/apt,8/25/15,2015-08-25,4-18-18,2018-04-18,50.11815024,-122.9471206,8072483,17197633
ab-16677139,Great location in whistler village,Condominium,Entire home/apt,1/6/17,2017-01-06,4-14-17,2017-04-14,50.11959583,-122.9569995,16677139,54345030
ab-15833314,Whistler Chalet,House,Entire home/apt,11/4/16,2016-11-04,12-9-16,2016-12-09,50.11561449,-122.9644952,15833314,25777071
ab-6129572,Valhalla Whistler B.C. Canada,Apartment,Entire home/apt,4/22/15,2015-04-22,5-24-19,2019-05-24,50.12054,-122.95986,6129572,20586132
ab-17530893,Blueberry Hill 4br/3.5bath,Townhouse,Entire home/apt,3/1/17,2017-03-01,10-12-17,2017-10-12,50.11267149,-122.9735014,17530893,34210197
ab-21134341,Studio in Whistler Village,Apartment,Entire home/apt,9/27/17,2017-09-27,5-23-19,2019-05-23,50.1152,-122.95328,21134341,41190661
ab-12269494,Ski In / Ski Out Modern Lodge Room Sleeps 4,Condominium,Entire home/apt,4/5/16,2016-04-05,9-12-17,2017-09-12,50.11874003,-122.9460418,12269494,66084697
ab-21136060,Luxury ski in/out large townhouse w/private hottub,Townhouse,Entire home/apt,11/4/17,2017-11-04,5-21-19,2019-05-21,50.11504,-122.94002,21136060,23587309
ab-21138682,LUXURY Family Home: Private Patio w Hot Tub & BBQ,Townhouse,Entire home/apt,9/27/17,2017-09-27,5-24-19,2019-05-24,50.14142,-122.95352,21138682,11568255
ab-12273219,Ski In / Ski Out Modern Lodge Studio w Kitchen,Condominium,Entire home/apt,4/5/16,2016-04-05,9-12-17,2017-09-12,50.11682405,-122.9462743,12273219,66084697
ab-16680008,2 bedroom Loft Whistler Village Center w/ Hot tub!,Apartment,Entire home/apt,1/6/17,2017-01-06,5-24-19,2019-05-24,50.11346,-122.95417,16680008,317618
ab-21140602,Stunning Golf Course ViewsÂ by Harmony Whistler,Townhouse,Entire home/apt,9/27/17,2017-09-27,5-23-19,2019-05-23,50.1221,-122.93756,21140602,35393628
ab-21147781,Spectacular Ski-In + Ski-Out Beautiful Chalet,House,Private room,9/27/17,2017-09-27,10-19-17,2017-10-19,50.09525821,-122.9895179,21147781,152576567
ab-21149475,"Bright & Spacious 4 bed, sleeps 8, Hot Tub, Garage",Townhouse,Entire home/apt,9/28/17,2017-09-28,5-24-19,2019-05-24,50.11659,-122.93979,21149475,8520466
ab-21151908,"Studio w/ Hot Tub, Park FREE, Walk to Village",Guest suite,Private room,12/29/18,2018-12-29,5-23-19,2019-05-23,50.12036,-122.95506,21151908,82347277
ab-9383990,Ski in Ski out 1-bedroom,Condominium,Entire home/apt,11/9/15,2015-11-09,8-21-17,2017-08-21,50.11617686,-122.9440623,9383990,48682285
ab-21153414,Whistler 1 room cheap,Private room in serviced apartment,Private room,9/28/17,2017-09-28,1-13-18,2018-01-13,50.1617511,-122.9291701,21153414,92457885
ab-21156250,Family holiday home in the mountains,House,Entire home/apt,11/22/17,2017-11-22,12-5-17,2017-12-05,50.12191446,-122.9713329,21156250,152291285
ab-16686702,Modern Cozy Whistler Creekside 3 Bedroom Townhome!,Townhouse,Entire home/apt,1/6/17,2017-01-06,5-20-19,2019-05-20,50.09537,-122.99483,16686702,74729587
ab-15163138,New Lux 6Bdr House,House,Entire home/apt,9/20/16,2016-09-20,10-5-16,2016-10-05,50.1126291,-122.9536373,15163138,96210432
ab-9388952,Alta Lake Cabin for your Family,House,Entire home/apt,11/9/15,2015-11-09,3-22-19,2019-03-22,50.10909,-122.97771,9388952,15433153
ab-13786690,"Base of Whistler, private hot tub, free parking",Condominium,Entire home/apt,4/6/17,2017-04-06,9-5-18,2018-09-05,50.11176323,-122.9556896,13786690,17197633
ab-21163964,"Creekside 3BR, Sleeps 8, Luxury Stay",Townhouse,Entire home/apt,12/6/17,2017-12-06,5-22-19,2019-05-22,50.09334,-122.99327,21163964,2776871
ab-21164117,"The Mini Chalet - Steps to Gondola, Lakes & Trails",Townhouse,Entire home/apt,12/9/17,2017-12-09,5-24-19,2019-05-24,50.09289,-122.991,21164117,6015416
ab-21164941,"Bright 3 bed, Sleeps 7, Ski in/out Great Views!",Townhouse,Entire home/apt,9/29/17,2017-09-29,5-24-19,2019-05-24,50.0923,-122.99229,21164941,8520466
ab-17542046,"Alpenglow-1BR, 1Bath, 10Ft ceiling Central Village",Condominium,Entire home/apt,3/1/17,2017-03-01,5-23-19,2019-05-23,50.11841,-122.95707,17542046,96573513
ab-21174246,Bright 1 Bedroom Whistler Village,Entire condominium,Entire home/apt,9/29/17,2017-09-29,1-5-18,2018-01-05,50.12090496,-122.9568925,21174246,123938806
ab-15166205,Modern Whistler 2 bd/2 ba Town Home near Ski lifts,Townhouse,Entire home/apt,9/20/16,2016-09-20,1-16-17,2017-01-16,50.11782565,-122.9576698,15166205,96236003
ab-15843360,Whistler Creekside Condo,Apartment,Entire home/apt,11/4/16,2016-11-04,2-25-17,2017-02-25,50.09737016,-122.9886208,15843360,46346765
ab-9393723,Powderhorn- Luxury 4 bedroom close to ski runs,Condominium,Entire home/apt,11/10/15,2015-11-10,5-23-19,2019-05-23,50.11825,-122.94109,9393723,22619214
ab-4785744,New Year in Whistler&#8208;&#8208;Luxury & amazing views for 4,Chalet,Entire home/apt,11/21/14,2014-11-21,5-23-19,2019-05-23,50.11986,-122.95675,4785744,22415051
ab-1363934,"Huge Private Hot Tub, Pool, Village",Entire apartment,Entire home/apt,7/8/13,2013-07-08,12-9-17,2017-12-09,50.12030348,-122.958293,1363934,1747164
ab-9394606,4bed/5bath Open Concept Chalet,Chalet,Entire home/apt,11/10/15,2015-11-10,5-23-19,2019-05-23,50.13183,-122.94969,9394606,32169044
ab-13102163,Snowberry Villas,Townhouse,Entire home/apt,5/19/16,2016-05-19,5-23-19,2019-05-23,50.11932,-122.94171,13102163,72806257
ab-14368794,"Quiet, comfortable, spacious Whistler retreat",Townhouse,Entire home/apt,8/4/16,2016-08-04,5-23-19,2019-05-23,50.11156,-122.97326,14368794,88148307
ab-18409526,Central 1BD with Hot Tub/Sauna/Pool,Apartment,Entire home/apt,4/23/17,2017-04-23,5-21-19,2019-05-21,50.11795,-122.95854,18409526,127555075
ab-21189490,whistler downtown,Serviced apartment,Entire home/apt,10/4/17,2017-10-04,5-21-19,2019-05-21,50.09317,-122.99483,21189490,49170887
ab-21189494,whistler sleeps 6-8,Condominium,Entire home/apt,10/4/17,2017-10-04,5-24-19,2019-05-24,50.09171,-122.99361,21189494,49170887
ab-21189542,whistler cascade sleeps 4-5,Condominium,Entire home/apt,10/4/17,2017-10-04,5-24-19,2019-05-24,50.11662,-122.95856,21189542,49170887
ab-17543829,Whistler Creekside Three Story Original Cabin,House,Private room,3/1/17,2017-03-01,7-14-17,2017-07-14,50.0991612,-122.9854518,17543829,42059183
ab-15844169,Whistler Luxury 4 bedroom home close to ski lifts,House,Entire home/apt,11/4/16,2016-11-04,5-22-19,2019-05-22,50.08747,-123.01163,15844169,102629996
ab-17544650,Cedar Ridge 8 - Ski-in/Ski-out,Townhouse,Entire home/apt,3/1/17,2017-03-01,5-24-19,2019-05-24,50.11242,-122.94959,17544650,119021784
ab-9408297,"WHISTLER Sundance, Studio up to 2 Bdrm, 1-4 BEDS",Condominium,Entire home/apt,12/22/16,2016-12-22,1-12-19,2019-01-12,50.09270738,-122.9923065,9408297,4385059
ab-1386660,Aspens luxury condo ski in ski out,Apartment,Entire home/apt,7/13/13,2013-07-13,1-17-17,2017-01-17,50.11695847,-122.9440717,1386660,7501822
ab-18928291,"Olympic village condo 1 bed, 1 bath (pool/hot tub)",Condominium,Entire home/apt,5/23/17,2017-05-23,5-2-18,2018-05-02,50.11744045,-122.9558918,18928291,81748680
ab-7072875,MODERN+COZY+SKI-IN/SKI-OUT+HOTTUB!!,Apartment,Entire home/apt,6/28/15,2015-06-28,8-13-17,2017-08-13,50.11659814,-122.9426213,7072875,36665911
ab-21207363,Mountain view Snow Ridge Estate with Ski-inSki-out,Villa,Private room,10/4/17,2017-10-04,10-16-17,2017-10-16,50.11176403,-122.9860613,21207363,153201410
ab-21212388,Embarc Whistler(formerly Club Intrawest),Condominium,Entire home/apt,10/7/17,2017-10-07,5-23-19,2019-05-23,50.11684,-122.94664,21212388,118529926
ab-7074233,"Bright and quiet rental, large deck",Townhouse,Entire home/apt,6/28/15,2015-06-28,5-23-19,2019-05-23,50.08836,-122.99992,7074233,37090914
ab-7076680,5 Bdrm Home + Toboggan Run,House,Entire home/apt,6/28/15,2015-06-28,3-1-17,2017-03-01,50.14294299,-122.9701519,7076680,30482946
ab-21218742,Cozy Creekside Retreat (close to gondola; 1 bdrm),Apartment,Entire home/apt,11/13/17,2017-11-13,5-22-19,2019-05-22,50.09263,-122.99363,21218742,13140779
ab-19554068,Ski IN at Treeline on Blackcomb!  4 Bedrooms,Townhouse,Entire home/apt,6/26/17,2017-06-26,5-22-19,2019-05-22,50.12232,-122.93502,19554068,7761771
ab-9412207,WHISTLER PH 309~Ski-In/Ski-Out~Aspens on Blackcomb,Condominium,Entire home/apt,11/11/15,2015-11-11,5-20-19,2019-05-20,50.11474,-122.94436,9412207,23468733
ab-14381399,Tyndall Stone Lodge Whistler BC 2BR Condo,Place,Entire home/apt,8/5/16,2016-08-05,5-24-19,2019-05-24,50.09386,-122.99428,14381399,52651623
ab-12295071,Cozy Room in Log Cabin on Edge of the Forest,Chalet,Private room,4/6/16,2016-04-06,9-24-16,2016-09-24,50.1567798,-122.9348596,12295071,20283555
ab-19555279,Entire 1BR Home in Whistler Village,Apartment,Entire home/apt,6/26/17,2017-06-26,5-23-19,2019-05-23,50.11823,-122.9549,19555279,15447975
ab-16691540,Studio at Westin Resort & Spa Whistler Village,Timeshare,Private room,1/7/17,2017-01-07,1-9-17,2017-01-09,50.11130051,-122.9564879,16691540,3390947
ab-13798140,Cozy room close to lake and village,Condominium,Private room,7/1/16,2016-07-01,5-19-17,2017-05-19,50.10175644,-122.9799945,13798140,915981
ab-21231592,"Ski-in Ski-out, 2 BR, 2 BA Greystone Lodge",Condominium,Entire home/apt,1/6/18,2018-01-06,7-9-18,2018-07-09,50.11554091,-122.9442836,21231592,6791845
ab-21233731,"True Ski-in Ski-out, 1 BR Greystone Lodge Condo",Condominium,Entire home/apt,10/9/17,2017-10-09,5-24-19,2019-05-24,50.11713,-122.94433,21233731,6791845
ab-15175226,Stunning villa for rent in Whistler,House,Entire home/apt,11/25/16,2016-11-25,11-25-16,2016-11-25,50.10850585,-122.9610954,15175226,27623345
ab-21240540,"SKI-IN/OUT 3 Bdrm Upper Village, Private Hot Tub",Townhouse,Entire home/apt,10/23/17,2017-10-23,5-24-19,2019-05-24,50.11707,-122.94081,21240540,11944114
ab-16692548,Whistler Village Cascade Lodge Condo SN,Serviced apartment,Entire home/apt,1/7/17,2017-01-07,3-12-19,2019-03-12,50.11751973,-122.9586779,16692548,30307256
ab-20171495,Cute one bedroom near the village,Guest suite,Entire home/apt,8/15/17,2017-08-15,8-28-17,2017-08-28,50.12763114,-122.9690926,20171495,48764503
ab-20171792,2 bed Rustic Luxury Retreat  near Blackcomb Mtn,Condominium,Entire home/apt,7/28/17,2017-07-28,5-23-19,2019-05-23,50.12164,-122.93789,20171792,6090636
ab-21249269,Town Plaza Eagle Lodge,Condominium,Entire home/apt,10/9/17,2017-10-09,5-22-19,2019-05-22,50.1166,-122.95467,21249269,153388448
ab-13800725,Whistler Village 1BDR Q bed + Q sleeper sofa for 4,Condominium,Entire home/apt,7/1/16,2016-07-01,8-30-17,2017-08-30,50.11623891,-122.9573696,13800725,21659291
ab-18415014,Private 2 Bedroom Suite by Alta Lake,Apartment,Entire home/apt,4/24/17,2017-04-24,9-4-17,2017-09-04,50.11199927,-122.9766043,18415014,2596312
ab-14387606,CRANKWORX Large Mstr BDRM & Ensuite,House,Private room,8/5/16,2016-08-05,10-5-16,2016-10-05,50.09239216,-122.9916575,14387606,35926036
ab-18416130,"1BR Condo at Glacier Lodge,Ski in/out,Pool/Hot tub",Condominium,Entire home/apt,4/24/17,2017-04-24,5-23-19,2019-05-23,50.11815,-122.94791,18416130,2530538
ab-18418040,Hare's Lair - 3 minute walk to Gondola,Apartment,Entire home/apt,12/6/17,2017-12-06,5-24-19,2019-05-24,50.09456,-122.99061,18418040,40340388
ab-21255689,"True Ski-in Ski-out, Studio, Greystone Lodge",Condominium,Entire home/apt,10/9/17,2017-10-09,5-24-19,2019-05-24,50.11685,-122.94469,21255689,6791845
ab-21262021,"Lofted 1 bedroom, 5 minutes from lifts.",Loft,Entire home/apt,10/9/17,2017-10-09,5-24-19,2019-05-24,50.09515,-122.99063,21262021,128805625
ab-21262219,"New Year Chalet 12 guests, near Ski lift",Chalet,Entire home/apt,10/11/17,2017-10-11,10-23-17,2017-10-23,50.11714883,-122.9633474,21262219,152175504
ab-13809516,"Serenity, in a Ski in-Ski out location",Condominium,Private room,12/8/16,2016-12-08,5-24-19,2019-05-24,50.11814,-122.94121,13809516,81268390
ab-12310742,Â·Studio Condo Whistler Village 422,Apartment,Entire home/apt,4/7/16,2016-04-07,5-22-19,2019-05-22,50.11795,-122.95815,12310742,17197633
ab-6182275,Whistler Cascade Beautiful 1 bdrm,Apartment,Entire home/apt,4/26/15,2015-04-26,4-8-19,2019-04-08,50.1163,-122.95978,6182275,1381289
ab-6183007,Whistler Sundance 1 bdrm sleeps 4,Apartment,Entire home/apt,4/26/15,2015-04-26,4-11-19,2019-04-11,50.09095,-122.99085,6183007,1381289
ab-6183090,Whistler Sundance 2 bdrm sleeps 6,Apartment,Entire home/apt,4/26/15,2015-04-26,4-9-19,2019-04-09,50.09113,-122.99138,6183090,1381289
ab-14389053,"Cozy, private 2nd story suite w/ kitchenette (B)",Condominium,Entire home/apt,8/5/16,2016-08-05,5-24-19,2019-05-24,50.0962,-122.99399,14389053,37364898
ab-21264439,Studio at the village gondola base,Condominium,Entire home/apt,10/9/17,2017-10-09,4-15-19,2019-04-15,50.1135,-122.9555,21264439,22619214
ab-21267960,Modern Quiet Family Friendly Bike/Walk everywhere,Townhouse,Entire home/apt,11/8/17,2017-11-08,5-22-19,2019-05-22,50.11363,-122.96812,21267960,9483651
ab-13810741,Creekside Condo 2 Bedroom,Condominium,Entire home/apt,7/2/16,2016-07-02,12-9-18,2018-12-09,50.09864466,-122.9885127,13810741,45084483
ab-21276922,"Sunpath 2 bdm, 2 bath townhouse  pool, hot tub",Condominium,Entire home/apt,10/11/17,2017-10-11,5-23-19,2019-05-23,50.11771,-122.95978,21276922,22619214
ab-21278006,Tyndall Stone 2 + loft condo in the village,Condominium,Entire home/apt,10/11/17,2017-10-11,5-24-19,2019-05-24,50.11959,-122.9556,21278006,22619214
ab-4802721,Whistler Castle,Chalet,Entire home/apt,11/23/14,2014-11-23,5-22-19,2019-05-22,50.10232,-122.98435,4802721,24742916
ab-4803333,Cozy studio in Creekside,Apartment,Entire home/apt,11/23/14,2014-11-23,8-14-18,2018-08-14,50.09681478,-122.99043,4803333,23901261
ab-4803836,2 brTownhome Gleneagles golf or ski!,Townhouse,Entire home/apt,11/23/14,2014-11-23,5-21-19,2019-05-21,50.12068,-122.93901,4803836,23973685
ab-4803889,Whistler Studio -Center of Village!,Entire apartment,Entire home/apt,11/23/14,2014-11-23,3-17-18,2018-03-17,50.1148882,-122.95558,4803889,317618
ab-4803953,Gables 35 - 4510 Blackcomb Way,Villa,Entire home/apt,11/23/14,2014-11-23,5-21-19,2019-05-21,50.1146,-122.94916,4803953,23973685
ab-14396062,Whiski Jack Condos @ Whistler 2BR Condo,Condominium,Entire home/apt,7/4/17,2017-07-04,5-22-19,2019-05-22,50.09638,-122.99534,14396062,52651623
ab-6190962,PRIME Whistler Village 1 Bedroom,Apartment,Entire home/apt,4/27/15,2015-04-27,5-24-19,2019-05-24,50.11801,-122.9581,6190962,15743897
ab-1394590,Luxury 2 bed/2 bath condo,Apartment,Entire home/apt,7/14/13,2013-07-14,5-21-19,2019-05-21,50.11851,-122.9552,1394590,7537954
ab-21282954,OLYMPIC PLAZA! MARKETPLACE LODGE! 2 BDRM SLEEPS 6!,Condominium,Entire home/apt,10/18/17,2017-10-18,5-22-19,2019-05-22,50.11797,-122.95669,21282954,153984244
ab-4804071,2 bedroom two level ski in-out ,Townhouse,Entire home/apt,11/23/14,2014-11-23,5-23-19,2019-05-23,50.11491,-122.95096,4804071,23973685
ab-6192547,Condo surrounded by nature,Condominium,Entire home/apt,1/9/17,2017-01-09,9-4-18,2018-09-04,50.0930305,-122.9903124,6192547,21299472
ab-4809477,"Spacious, Lake side, 2 Bed Condo",Apartment,Entire home/apt,11/24/14,2014-11-24,6-12-18,2018-06-12,50.09134041,-123.0074381,4809477,3469975
ab-21291734,Whistler Townhome in beautiful Alpine Meadows,Private room in townhouse,Private room,12/10/17,2017-12-10,12-10-17,2017-12-10,50.14640481,-122.9616489,21291734,54693375
ab-21293886,Aspens 2 bed/2 ba ski-in/ski-out,Condominium,Entire home/apt,12/3/18,2018-12-03,5-24-19,2019-05-24,50.11765,-122.94443,21293886,35145092
ab-9427240,NorthStar Townhouse - Whistler Village,Townhouse,Entire home/apt,11/11/15,2015-11-11,11-17-18,2018-11-17,50.11888201,-122.957708,9427240,3269011
ab-21295490,Spacious + Prime Location | Two Bedroom Townhouse,Condominium,Entire home/apt,10/14/17,2017-10-14,5-22-19,2019-05-22,50.11832,-122.94045,21295490,21569406
ab-15852814,"Club at Twin Peaks: 2-BR, Sleeps 6, Full Kitchen",Entire condominium,Entire home/apt,11/5/16,2016-11-05,11-29-17,2017-11-29,50.12093782,-122.959093,15852814,27042710
ab-21299499,Modern Mountain Luxury - 5 minutes to village,Apartment,Entire home/apt,10/14/17,2017-10-14,10-14-17,2017-10-14,50.15923236,-122.9305833,21299499,154119345
ab-16706338,Slopeside at Powders Edge!,Apartment,Entire home/apt,1/8/17,2017-01-08,9-21-17,2017-09-21,50.11277089,-122.9549098,16706338,7784624
ab-16706460,CENTRAL WHISTLER VILLAGE Condo,Condominium,Entire home/apt,1/8/17,2017-01-08,5-3-17,2017-05-03,50.11414391,-122.955234,16706460,26387255
ab-4823626,Large ensuite room in shared house ,House,Private room,11/26/14,2014-11-26,7-19-16,2016-07-19,50.16027461,-122.9311719,4823626,24838203
ab-1408769,Whistler New Modern Luxury Home,House,Entire home/apt,7/18/13,2013-07-18,5-24-19,2019-05-24,50.14173,-122.95853,1408769,7597745
ab-21308203,Locals house - steps to gondola,Entire house,Entire home/apt,12/23/17,2017-12-23,3-2-18,2018-03-02,50.09419896,-122.9955721,21308203,90515111
ab-18932120,Family chalet with easy access to activities,House,Entire home/apt,5/24/17,2017-05-24,6-1-17,2017-06-01,50.08627829,-123.0004763,18932120,63823974
ab-21309994,Tyndall Stone - Whistler Village - sleeps 4 to 6,Apartment,Entire home/apt,10/14/17,2017-10-14,5-22-19,2019-05-22,50.11811,-122.95514,21309994,1747164
ab-17556606,Whistler Wanderlust Vacation. True Ski in Ski out!,Condominium,Entire home/apt,3/2/17,2017-03-02,5-24-19,2019-05-24,50.11763,-122.94638,17556606,119152527
ab-21310378,Aspens 2 bdrm condo SKI-IN/SKI-OUT on Blackcomb,Resort,Entire home/apt,10/21/17,2017-10-21,5-23-19,2019-05-23,50.11638,-122.9461,21310378,154232262
ab-21311171,#226 Cascade Lodge By Elevate Real Estate (1-bed),Resort,Entire home/apt,10/14/17,2017-10-14,11-6-18,2018-11-06,50.11624081,-122.9576871,21311171,3749031
ab-13814124,"Whistler, the week before CrankWorx",Condominium,Entire home/apt,7/2/16,2016-07-02,8-14-16,2016-08-14,50.1178983,-122.9542183,13814124,38499440
ab-21313101,Cozy Apartment in Creekside - walk to the lifts,Loft,Entire home/apt,11/4/17,2017-11-04,5-23-19,2019-05-23,50.09551,-122.99075,21313101,25099921
ab-7114381,Marketplace Lodge #223,Condominium,Entire home/apt,7/1/15,2015-07-01,5-24-19,2019-05-24,50.11958,-122.95761,7114381,37268186
ab-14402891,"Whistler Creekside Ski-in/Ski-Out, Jan 22-26 2017",Condominium,Entire home/apt,8/6/16,2016-08-06,11-2-16,2016-11-02,50.09330231,-122.991982,14402891,88545460
ab-14403264,"Gorgeous 1 Bed, sleeps 4 Village Location, Lagoons",Townhouse,Entire home/apt,8/6/16,2016-08-06,5-24-19,2019-05-24,50.11955,-122.95806,14403264,8520466
ab-4824472,Whistler Family Ski Resort Retreat,Apartment,Entire home/apt,11/26/14,2014-11-26,5-22-19,2019-05-22,50.11968,-122.94064,4824472,24841371
ab-21314432,2 BR condo in Whistler Village with hot tub access,Townhouse,Entire home/apt,10/14/17,2017-10-14,5-25-19,2019-05-25,50.12049,-122.96031,21314432,10197787
ab-21320332,POWDERS EDGE - Stay in the heart of Whistler,Condominium,Entire home/apt,10/14/17,2017-10-14,5-22-19,2019-05-22,50.11206,-122.9541,21320332,4287776
ab-4828768,1 BR Townhouse with Private Hot Tub - FREE PARKING,Townhouse,Entire home/apt,11/27/14,2014-11-27,5-24-19,2019-05-24,50.1213,-122.9556,4828768,3916735
ab-21322301,Whistler Sundance Sleeps 4-5,Condominium,Entire home/apt,10/14/17,2017-10-14,5-22-19,2019-05-22,50.09141,-122.9952,21322301,49170887
ab-14403606,"Renovated ski-in, ski out condo",Apartment,Entire home/apt,8/6/16,2016-08-06,5-24-19,2019-05-24,50.11746,-122.94429,14403606,50605234
ab-14403886,Sundance Place,Condominium,Entire home/apt,8/6/16,2016-08-06,9-21-16,2016-09-21,50.09279021,-122.9943183,14403886,85964791
ab-21323125,#406 Cascade Lodge By Elevate Real Estate (1-bed),Resort,Entire home/apt,10/14/17,2017-10-14,11-6-18,2018-11-06,50.1179687,-122.9589702,21323125,3749031
ab-16709187,Cozy Cascade Lodge,Condominium,Entire home/apt,1/8/17,2017-01-08,5-24-19,2019-05-24,50.11728,-122.95906,16709187,91214395
ab-14404430,SKI-IN 2 Bedroom Upper Village w/Private Hot Tub,Townhouse,Entire home/apt,8/6/16,2016-08-06,5-21-19,2019-05-21,50.11647,-122.94142,14404430,8821150
ab-21327828,3 Bdrm Blackcomb Slopeside Forest Retreat,Condominium,Entire home/apt,11/4/17,2017-11-04,5-23-19,2019-05-23,50.11646,-122.94073,21327828,8904738
ab-21329003,Embarc (formally known as Club intrawest),Chalet,Private room,10/16/17,2017-10-16,5-25-19,2019-05-25,50.11762,-122.94466,21329003,154410588
ab-15858237,"1.5 Bedroom House, 2 minute walk to the Gondola!",Townhouse,Entire home/apt,11/5/16,2016-11-05,5-6-19,2019-05-06,50.09814,-122.98859,15858237,65975869
ab-17558557,Two rooms with queen size beds,House,Private room,3/2/17,2017-03-02,5-22-19,2019-05-22,50.16337,-122.93138,17558557,119176987
ab-16709760,Whistler Village Cascade Lodge Condo Near Gondola,Serviced apartment,Entire home/apt,1/8/17,2017-01-08,3-12-19,2019-03-12,50.11794,-122.95859,16709760,30307256
ab-21342714,Cascade 604 by Elevate Vacations,Apartment,Entire home/apt,10/14/17,2017-10-14,5-23-19,2019-05-23,50.11656,-122.9595,21342714,134284463
ab-13815771,"3 bed Beautifully Renovated, Fantastic Views!",Townhouse,Entire home/apt,7/2/16,2016-07-02,5-24-19,2019-05-24,50.11505,-122.93917,13815771,8520466
ab-15193522,Brio House,House,Entire home/apt,9/22/16,2016-09-22,5-22-19,2019-05-22,50.10704,-122.96845,15193522,48987533
ab-1427955,Adorable Condo w Pool and Hot Tub,Apartment,Entire home/apt,7/22/13,2013-07-22,5-24-19,2019-05-24,50.09695,-122.9887,1427955,503312
ab-21355271,4 bedroom Whistler house,House,Entire home/apt,10/18/17,2017-10-18,5-23-19,2019-05-23,50.1269,-122.96714,21355271,154578002
ab-17560831,"Amazing Village Location! 2 bedroom, 2 bathroom!",Serviced apartment,Entire home/apt,3/2/17,2017-03-02,5-21-19,2019-05-21,50.11967,-122.95706,17560831,46625431
ab-9436660,Gorgeous 1 Bedroom Village Location,Apartment,Entire home/apt,11/12/15,2015-11-12,5-24-19,2019-05-24,50.11951,-122.95501,9436660,8520466
ab-21358834,Debs Spacious Village Condo w/POOL&HT,Apartment,Entire home/apt,11/8/17,2017-11-08,8-5-18,2018-08-05,50.12184852,-122.9556864,21358834,154627753
ab-15193862,"Large 2 Bedroom, 2.5 Bathroom Village Townhome",Townhouse,Entire home/apt,9/22/16,2016-09-22,11-10-16,2016-11-10,50.12143326,-122.9587526,15193862,68404496
ab-8129766,Ski Golf Whistler Fairway Chalet 5 bedroom hottub,Chalet,Entire home/apt,8/29/15,2015-08-29,5-22-19,2019-05-22,50.14263,-122.95361,8129766,13232844
ab-21366358,Fantastic Lakeside Apartment,Apartment,Entire home/apt,10/16/17,2017-10-16,5-21-19,2019-05-21,50.10559,-122.98297,21366358,76995094
ab-18936191,"Village Center Studio, Free Parking 3308",Timeshare,Private room,5/24/17,2017-05-24,7-17-17,2017-07-17,50.11448358,-122.9536684,18936191,17197633
ab-21370702,Fantastic deal! Luxury suite sleeps 6,Condominium,Entire home/apt,10/21/17,2017-10-21,2-11-19,2019-02-11,50.11746255,-122.9449747,21370702,44629026
ab-8131804,Whistler Retreat w/ Private Hot Tub,Townhouse,Entire home/apt,8/29/15,2015-08-29,5-22-19,2019-05-22,50.1235,-122.95641,8131804,32449284
ab-21376723,Cozy winter getaway: Creekside studio near lifts,Apartment,Entire home/apt,10/18/17,2017-10-18,5-24-19,2019-05-24,50.09713,-122.99613,21376723,56673392
ab-21379611,Blackcomb Village Abode (Ski in/Ski out),Apartment,Entire home/apt,11/11/17,2017-11-11,5-22-19,2019-05-22,50.11766,-122.94112,21379611,32081807
ab-21380072,Ideally Located 1 Bedroom 750 SF Creekside Condo,Condominium,Entire home/apt,10/18/17,2017-10-18,4-7-18,2018-04-07,50.09739986,-122.991977,21380072,28885096
ab-21381783,"Marmot's Den-3 mins' walk to Gondola, good reviews",Apartment,Entire home/apt,11/6/17,2017-11-06,5-23-19,2019-05-23,50.09403,-122.99366,21381783,40340388
ab-21382190,Whistler Village 2 Bedroom Unit at Twin Peaks,Resort,Entire home/apt,10/18/17,2017-10-18,5-22-19,2019-05-22,50.1205,-122.95899,21382190,49292551
ab-21382672,Steps From Whistler Village w/ Pool & Hot Tub by Harmony Whistler,Townhouse,Entire home/apt,10/21/17,2017-10-21,5-23-19,2019-05-23,50.12062,-122.95918,21382672,35393628
ab-21384144,Private Club Saturday Before Christmas - 1 night,Villa,Entire home/apt,10/18/17,2017-10-18,4-28-18,2018-04-28,50.11841795,-122.9463103,21384144,95938625
ab-15860993,"Cosy, modern bedroom with parking",Private room in house,Private room,11/5/16,2016-11-05,1-31-18,2018-01-31,50.14755414,-122.9616804,15860993,68565255
ab-18944098,â›·1Bd Condo *Amazing Location*+FREE Parking+Hot tub,Condominium,Entire home/apt,5/24/17,2017-05-24,5-21-19,2019-05-21,50.12169,-122.95888,18944098,98262102
ab-20183196,Five Bed Chalet Free Parking + pool !,Chalet,Entire home/apt,8/15/17,2017-08-15,9-20-17,2017-09-20,50.10730525,-122.963588,20183196,127665506
ab-20183585,"Creekside ski in/ski out, private hot tub.",Townhouse,Entire home/apt,8/10/17,2017-08-10,5-22-19,2019-05-22,50.09188,-122.99061,20183585,97910682
ab-13124005,SPECTACULAR SLOPESIDE  2BD/2BA true ski in/out,Townhouse,Entire home/apt,5/20/16,2016-05-20,5-22-19,2019-05-22,50.11454,-122.94182,13124005,56673392
ab-20185008,THE HIDEOUT | Luxury in Heart of Whistler village,Apartment,Entire home/apt,8/10/17,2017-08-10,5-23-19,2019-05-23,50.11703,-122.95999,20185008,38493337
ab-3490553,"Whistler Condo, Walk to lift, Hot Tub, Pool, Fr Pa",Apartment,Entire home/apt,7/3/14,2014-07-03,5-21-19,2019-05-21,50.11984,-122.9571,3490553,17578565
ab-21397954,"Westin Hotels and Resorts, Whistler",Private room in serviced apartment,Private room,10/21/17,2017-10-21,3-6-18,2018-03-06,50.11282634,-122.955019,21397954,7784624
ab-8134001,"Whistler Interval, Dec 18 -25!",Condominium,Entire home/apt,8/29/15,2015-08-29,5-21-19,2019-05-21,50.09254,-122.99465,8134001,39987677
ab-15199573,Vacation Rentals Mountainside Lodge - Studio Suite,House,Entire home/apt,9/22/16,2016-09-22,10-21-16,2016-10-21,50.11516593,-122.9533305,15199573,96521726
ab-15199593,Vacation Rentals Whiski Jack at Creekside,House,Entire home/apt,9/22/16,2016-09-22,10-18-16,2016-10-18,50.11139092,-122.957175,15199593,96521726
ab-21398738,Nighthawk,House,Entire home/apt,10/21/17,2017-10-21,4-3-19,2019-04-03,50.1119,-122.96788,21398738,155028292
ab-1445943,Modern Luxury+Steam Shower&amp;Jacuzzi,Apartment,Entire home/apt,7/26/13,2013-07-26,5-4-16,2016-05-04,50.11594267,-122.9429557,1445943,7762647
ab-1446416,Whistler Blackcomb suite @ base of Blackcomb,Condominium,Entire home/apt,7/26/13,2013-07-26,5-22-19,2019-05-22,50.11827,-122.94697,1446416,7765239
ab-21399372,Beautiful Mountain getaway steps from ski lifts,Apartment,Entire home/apt,11/6/17,2017-11-06,5-23-19,2019-05-23,50.11551,-122.9504,21399372,155034864
ab-15867569,"Mini Chalet Christine, Walk to Creekside Gondola",Townhouse,Entire home/apt,11/6/16,2016-11-06,5-21-19,2019-05-21,50.09414,-122.99117,15867569,102857551
ab-9461089,8 minutes walking to the Gondola,House,Private room,11/13/15,2015-11-13,2-6-17,2017-02-06,50.11047044,-122.963836,9461089,26650864
ab-13126268,Newly updated condo at Blackcomb base,Condominium,Entire home/apt,5/21/16,2016-05-21,5-23-19,2019-05-23,50.11812,-122.94835,13126268,61330547
ab-18947697,Ski-in Ski-Out Mountain Home with Views & Hot Tub.,Townhouse,Entire home/apt,5/25/17,2017-05-25,6-13-17,2017-06-13,50.09230815,-122.9781987,18947697,778269
ab-18947800,"3 bed, 3 bath, 3 liv, White Gold Whistler Home",House,Entire home/apt,5/25/17,2017-05-25,10-1-17,2017-10-01,50.12656935,-122.9498079,18947800,35939024
ab-13127599,Beautifully renovated townhouse,Townhouse,Entire home/apt,5/21/16,2016-05-21,5-9-17,2017-05-09,50.09396004,-122.9966256,13127599,20940859
ab-16723067,"Pool/Hot Tub, Mountain View/Whistler Creekside",Condominium,Entire home/apt,1/9/17,2017-01-09,5-23-19,2019-05-23,50.09478,-122.99174,16723067,110478473
ab-6228870,Cozy Whistler Village Studio Condo,Condominium,Entire home/apt,5/1/15,2015-05-01,5-22-19,2019-05-22,50.11617,-122.95647,6228870,32313569
ab-21413043,Fabulous 2 bedroom overlooking the village!,Condominium,Entire home/apt,10/23/17,2017-10-23,5-23-19,2019-05-23,50.11628,-122.95606,21413043,65305043
ab-21413049,3BR home - close to ski mountains,Chalet,Entire home/apt,11/6/17,2017-11-06,5-23-19,2019-05-23,50.11977,-122.94277,21413049,8095837
ab-16723335,Queen bedroom in Whistler,Private room in townhouse,Private room,3/4/18,2018-03-04,3-10-18,2018-03-10,50.08821598,-123.0062732,16723335,49621708
ab-14418564,"Cascade Lodge, Whistler, CAN, 1-bedroom #1",Condominium,Entire home/apt,8/7/16,2016-08-07,5-24-19,2019-05-24,50.1165,-122.95868,14418564,10981379
ab-18950579,Spacious Ski In/Ski Out 1Bdrm Condo w/ Lrg Pool/HT,Condominium,Entire home/apt,5/25/17,2017-05-25,5-21-19,2019-05-21,50.09365,-122.98951,18950579,132129180
ab-21423144,Spacious SKI INÂ / SKI OUTÂ Home by Harmony Whistler,Apartment,Entire home/apt,10/23/17,2017-10-23,5-23-19,2019-05-23,50.11408,-122.9437,21423144,35393628
ab-21425862,Village location-2 bed-Pool-Hot tub-renovated,Townhouse,Entire home/apt,10/21/17,2017-10-21,9-19-18,2018-09-19,50.1165571,-122.9583745,21425862,1747164
ab-21425933,,,,11/13/17,2017-11-13,11-13-17,2017-11-13,50.11745317,-122.9543133,21425933,
ab-21427370,Whistler Village Town Plaza One Bedroom Condo,Condominium,Entire home/apt,10/21/17,2017-10-21,5-23-19,2019-05-23,50.11458,-122.95594,21427370,63415341
ab-15205024,Alpenglow - 1BR 1B Top Floor Penthouse,Entire condominium,Entire home/apt,9/23/16,2016-09-23,1-25-18,2018-01-25,50.11854024,-122.9573653,15205024,96573513
ab-21438154,Spacious & Bright 3 BR Condo + Hot Tub in Whistler,Condominium,Entire home/apt,10/21/17,2017-10-21,11-17-17,2017-11-17,50.11827187,-122.9582284,21438154,65790915
ab-21438264,Cozy Whistler Retreat by Gondola with Free Parking,Entire condominium,Entire home/apt,10/23/17,2017-10-23,1-21-18,2018-01-21,50.09726899,-122.9900076,21438264,122773552
ab-9465343,Ideally located Whistler getaway,Townhouse,Entire home/apt,11/14/15,2015-11-14,4-30-16,2016-04-30,50.12126355,-122.9560893,9465343,10573153
ab-1450581,TRUE Ski in/out w POOL & HOT TUB !,Apartment,Entire home/apt,7/27/13,2013-07-27,3-28-19,2019-03-28,50.11546,-122.94404,1450581,7784624
ab-14419662,"Cascade Lodge, Whistler, CAN, 1-bedroom #2",Condominium,Entire home/apt,8/7/16,2016-08-07,5-22-19,2019-05-22,50.11692,-122.95657,14419662,10981379
ab-14420921,"Large, cozy family cabin",Apartment,Entire home/apt,8/7/16,2016-08-07,3-22-17,2017-03-22,50.14382244,-122.9655938,14420921,88731227
ab-15206034,Walking distance to everything!,Condominium,Entire home/apt,9/23/16,2016-09-23,5-24-19,2019-05-24,50.12044,-122.95602,15206034,96583292
ab-17575769,Recently updated! Cozy 1 BR condo in the Village,Condominium,Entire home/apt,3/3/17,2017-03-03,5-22-19,2019-05-22,50.11892,-122.95543,17575769,9339885
ab-21448014,Luxurious ski in/out house with private hot tub,House,Entire home/apt,10/25/17,2017-10-25,5-21-19,2019-05-21,50.08991,-122.99363,21448014,68564158
ab-21448123,Beautiful 2 Bedroom in Eagle Lodge,Apartment,Entire home/apt,10/23/17,2017-10-23,5-23-19,2019-05-23,50.11623,-122.95409,21448123,68581273
ab-21449959,Luxury Whistler ski-in home,Entire house,Entire home/apt,10/23/17,2017-10-23,2-19-18,2018-02-19,50.10954149,-122.9610675,21449959,83196803
ab-16727896,PRIVATE 1 Bedroom/1 Bath with Kitchen in Village,Chalet,Entire home/apt,1/9/17,2017-01-09,5-23-19,2019-05-23,50.11929,-122.95869,16727896,21730154
ab-15207408,Whistler Creek Condo,Condominium,Entire home/apt,9/23/16,2016-09-23,5-1-18,2018-05-01,50.09548273,-122.9917471,15207408,96595294
ab-20189934,Convenient Village Location by Harmony Whistler,Townhouse,Entire home/apt,8/15/17,2017-08-15,5-23-19,2019-05-23,50.11953,-122.95886,20189934,35393628
ab-20190206,Whistler cabin - Snowgoose 8 at Blackcomb Mountain,Chalet,Entire home/apt,7/29/17,2017-07-29,5-23-19,2019-05-23,50.11996,-122.93698,20190206,143760071
ab-21462235,Mountain Chalet,Chalet,Entire home/apt,10/23/17,2017-10-23,1-27-19,2019-01-27,50.09985887,-122.9818483,21462235,7217730
ab-9473781,Ski in - ski out one bedroom condo.,Condominium,Entire home/apt,11/14/15,2015-11-14,7-4-17,2017-07-04,50.11773609,-122.9439537,9473781,49100758
ab-21467123,Whistler Cascade lodge  Condo walk/shuttle lifts!,Condominium,Entire home/apt,10/25/17,2017-10-25,5-22-19,2019-05-22,50.11727,-122.95872,21467123,8440595
ab-21467141,"Whistler Creekside resort condo , 2BR plus den!",Condominium,Entire home/apt,10/25/17,2017-10-25,5-24-19,2019-05-24,50.09109,-122.99493,21467141,8440595
ab-3522316,4 Bed True Ski in/Out Painted Cliff,Townhouse,Entire home/apt,7/6/14,2014-07-06,5-24-19,2019-05-24,50.11456,-122.94105,3522316,8520466
ab-4862610,5 Star Reviews -2 bedroom 2 Bathroom FREE PARKING,Apartment,Entire home/apt,12/2/14,2014-12-02,5-20-19,2019-05-20,50.11241,-122.96981,4862610,8107418
ab-16734729,Whistler Village Condo Steps From The Lifts,Condominium,Entire home/apt,1/10/17,2017-01-10,2-3-17,2017-02-03,50.1123484,-122.9553737,16734729,7326841
ab-21473573,MODERN WHISTLER LUXURY SKI ON SKI OFF TOWNHOUSE,Chalet,Entire home/apt,10/25/17,2017-10-25,4-10-19,2019-04-10,50.11015,-122.96015,21473573,12983268
ab-21474563,Creekside Get Away,Condominium,Entire home/apt,10/25/17,2017-10-25,9-26-18,2018-09-26,50.09267817,-122.9918867,21474563,112875624
ab-9476428,Cozy Mountain Studio in Whistler,Apartment,Entire home/apt,11/14/15,2015-11-14,2-18-19,2019-02-18,50.12196974,-122.9764703,9476428,49115251
ab-17586162,MOUNTAIN RETREAT (High Season),Guest suite,Entire home/apt,3/4/17,2017-03-04,10-20-18,2018-10-20,50.12211289,-122.9661651,17586162,59908012
ab-9476884,WHISTLER PH 465~Ski-In/Ski-Out~Aspens on Blackcomb,Condominium,Entire home/apt,11/14/15,2015-11-14,5-22-19,2019-05-22,50.11491,-122.94384,9476884,23468733
ab-21479319,Luxury and Charming 4 BR Home with fireplace,House,Entire home/apt,10/25/17,2017-10-25,11-6-17,2017-11-06,50.10755186,-122.9689224,21479319,155718317
ab-21479544,Embarc Whistler (formally Club Intrawest),Apartment,Entire home/apt,10/25/17,2017-10-25,11-18-17,2017-11-18,50.11855045,-122.9459463,21479544,32643335
ab-9478256,Artist Retreat,House,Private room,11/14/15,2015-11-14,9-18-16,2016-09-18,50.10916405,-122.9740253,9478256,49126823
ab-16737768,Whistler Village Cascade Lodge Condo,Serviced apartment,Entire home/apt,1/10/17,2017-01-10,3-12-19,2019-03-12,50.11721,-122.95849,16737768,30307256
ab-21484985,Christmas in Whistler!,Villa,Entire home/apt,10/25/17,2017-10-25,5-21-19,2019-05-21,50.11839,-122.94611,21484985,138939430
ab-21484996,Gorgeous 1 Bdrm on Alta Lake,Guest suite,Entire home/apt,10/25/17,2017-10-25,3-28-19,2019-03-28,50.11877,-122.9836,21484996,1615939
ab-15219660,GREAT LOCATION: 2BR Next to Golf Course BBQ sleep6,Townhouse,Entire home/apt,9/24/16,2016-09-24,5-23-19,2019-05-23,50.12023,-122.93852,15219660,33950170
ab-15220429,Perfect Place To Sort out your New Life inWhistler,Condominium,Entire home/apt,9/24/16,2016-09-24,11-20-16,2016-11-20,50.1192335,-122.95971,15220429,95325428
ab-15220895,Glaciers Reach 2BR w/ rooftop private hot tub steps from Whistler Village!,Townhouse,Entire home/apt,9/24/16,2016-09-24,9-16-18,2018-09-16,50.12217348,-122.9573252,15220895,35393628
ab-21488447,Charming Snowberry Villas in Benchlands,Townhouse,Entire home/apt,10/25/17,2017-10-25,5-21-19,2019-05-21,50.11938,-122.93946,21488447,72806257
ab-15874298,Upper Village Snug-Ski in/out-Whistler Blackcomb,Apartment,Entire home/apt,11/6/16,2016-11-06,5-5-18,2018-05-05,50.11655366,-122.944303,15874298,102920496
ab-19592380,Chalet style Whistler Condo,Apartment,Entire home/apt,6/28/17,2017-06-28,8-22-17,2017-08-22,50.11912886,-122.9580899,19592380,1194652
ab-21490529,Cascade Lodge 1BR #1 (FREE WiFi/NO CLEAN FEE),Condominium,Entire home/apt,10/25/17,2017-10-25,5-24-19,2019-05-24,50.11705,-122.95884,21490529,12613718
ab-21490993,Cascade Lodge 1BR #2 (FREE WiFi/NO CLEAN FEE),Condominium,Entire home/apt,10/25/17,2017-10-25,5-23-19,2019-05-23,50.11628,-122.95819,21490993,12613718
ab-21491165,Cascade Lodge 1BR #3 (FREE WiFi/NO CLEAN FEE),Condominium,Entire home/apt,10/25/17,2017-10-25,5-21-19,2019-05-21,50.11631,-122.95821,21491165,12613718
ab-21501462,Mountainside Lodge- Studio,Serviced apartment,Entire home/apt,10/28/17,2017-10-28,5-22-19,2019-05-22,50.11363,-122.95436,21501462,31214940
ab-15875606,Embarc Whistler Studio,Apartment,Entire home/apt,11/6/16,2016-11-06,2-8-17,2017-02-08,50.11900229,-122.9445113,15875606,43373705
ab-21502963,Newly renovated town home with new private hot tub,Townhouse,Entire home/apt,10/28/17,2017-10-28,5-21-19,2019-05-21,50.12194,-122.95713,21502963,156227518
ab-16740721,"Woodrun Lodge by Whiski Jack - Feb 19 - 26, 2017",Condominium,Entire home/apt,1/10/17,2017-01-10,1-22-17,2017-01-22,50.11531909,-122.9424215,16740721,111040818
ab-20193930,1 Bedroom Townhome - Whistler Village,Condominium,Entire home/apt,8/15/17,2017-08-15,5-21-19,2019-05-21,50.12061,-122.95883,20193930,143797891
ab-16741601,"1 Bedroom + Den Apt, Ski in-out Blackcomb. Price!!",Apartment,Entire home/apt,1/10/17,2017-01-10,2-3-17,2017-02-03,50.11635376,-122.9438694,16741601,55059455
ab-21505934,"Heart of Whistler village, 5min walk to lift!",Serviced apartment,Entire home/apt,10/28/17,2017-10-28,5-21-19,2019-05-21,50.1185,-122.95639,21505934,42856656
ab-21511398,Perfect place in the mountains,Entire house,Entire home/apt,10/28/17,2017-10-28,11-28-17,2017-11-28,50.12456101,-122.9698036,21511398,156299828
ab-21512090,Whistler Cascade lodge  Last minute 2 nights free!,Resort,Entire home/apt,10/28/17,2017-10-28,9-16-18,2018-09-16,50.11675756,-122.9566916,21512090,8440595
ab-21512104,Whistler Cascade lodge  Weekend Holiday Stays,Condominium,Entire home/apt,10/28/17,2017-10-28,12-22-18,2018-12-22,50.11712167,-122.9592338,21512104,8440595
ab-21512129,"Whistler Creekside resort condo , 2BR plus den (2)",Condominium,Entire home/apt,10/28/17,2017-10-28,1-4-19,2019-01-04,50.09333103,-122.9937397,21512129,8440595
ab-21512132,Whistler Creekside 2BR/Den sleep8 2 Free Nights!!,Resort,Private room,10/28/17,2017-10-28,5-24-19,2019-05-24,50.09315,-122.99375,21512132,8440595
ab-21513951,Bright & Cozy 1BR Winter Forest Retreat,Townhouse,Entire home/apt,11/4/17,2017-11-04,5-24-19,2019-05-24,50.12277,-122.93832,21513951,8520466
ab-21514392,Small den room in Whistler village,Condominium,Private room,10/28/17,2017-10-28,5-23-19,2019-05-23,50.12021,-122.9556,21514392,38431029
ab-21514741,True ski-in/out: close to village with Private HT,Townhouse,Entire home/apt,10/28/17,2017-10-28,5-21-19,2019-05-21,50.11077,-122.94929,21514741,152355344
ab-16742691,HEART of Whistler Village suite,Serviced apartment,Entire home/apt,1/10/17,2017-01-10,5-22-19,2019-05-22,50.11524,-122.95717,16742691,94435392
ab-21516682,Central Whistler Village Condo Sleeps 4,Entire condominium,Entire home/apt,10/28/17,2017-10-28,1-6-18,2018-01-06,50.11733307,-122.9544512,21516682,123938806
ab-15223110,"MODERN LOG HOME W/ LAKE VIEWS, HOTUB, SLEEPS 9",Chalet,Entire home/apt,5/24/17,2017-05-24,5-24-19,2019-05-24,50.11396,-122.97544,15223110,71696903
ab-14427715,Large & Beautiful Family Home - Christmas only,House,Entire home/apt,8/8/16,2016-08-08,9-24-16,2016-09-24,50.15945985,-122.9305819,14427715,8520466
ab-14428421,Heart of the village... Steps from the gondolas,Condominium,Entire home/apt,8/8/16,2016-08-08,5-22-19,2019-05-22,50.11528,-122.95583,14428421,59650550
ab-13142572,"Fantastic 1 BR Ski In/Out  at  Aspens, Sleeps 2-4",Apartment,Entire home/apt,5/22/16,2016-05-22,5-1-17,2017-05-01,50.11518807,-122.9442596,13142572,19142957
ab-20195864,Enchanted Emerald Chalet,Chalet,Entire home/apt,8/1/17,2017-08-01,10-27-18,2018-10-27,50.15982533,-122.9281207,20195864,79379
ab-21527159,1 bedroom 2 bath steps to it all!,Condominium,Entire home/apt,10/28/17,2017-10-28,5-21-19,2019-05-21,50.11941,-122.95646,21527159,23973685
ab-9489035,Akasha: 107490,Entire villa,Entire home/apt,5/24/17,2017-05-24,3-11-18,2018-03-11,50.1093515,-122.9604856,9489035,45536328
ab-3552327,Twin Peaks Resort - 2 Bed 2 Bath - 102,Apartment,Entire home/apt,7/9/14,2014-07-09,10-31-18,2018-10-31,50.11864504,-122.9592202,3552327,3749031
ab-9489524,Snow Ridge Estate: 107816,Villa,Entire home/apt,11/15/15,2015-11-15,12-18-16,2016-12-18,50.0945127,-122.9861628,9489524,45536328
ab-13839410,Perfect 3 Bedroom Whistler Condo,Condominium,Entire home/apt,7/3/16,2016-07-03,10-12-17,2017-10-12,50.12157446,-122.9377048,13839410,65790915
ab-9490706,The Gables 1 Br Central Location,Townhouse,Entire home/apt,11/15/15,2015-11-15,5-21-19,2019-05-21,50.11334,-122.95085,9490706,41850542
ab-4886383,Amazing Modern Chalet With Views,Entire chalet,Entire home/apt,5/24/17,2017-05-24,3-17-18,2018-03-17,50.15465882,-122.9629303,4886383,25139122
ab-15885044,Whistler Village - Bear Lodge 1 bedroom sleeps 4,Apartment,Entire home/apt,11/7/16,2016-11-07,5-22-19,2019-05-22,50.11589,-122.95527,15885044,1747164
ab-4888344,Cozy Modern 2bed  1.5bath,Condominium,Entire home/apt,12/7/14,2014-12-07,5-23-19,2019-05-23,50.10603,-122.98309,4888344,243076
ab-9492002,WHISTLER PH 441~Ski-In/Ski-Out~Aspens on Blackcomb,Condominium,Entire home/apt,11/15/15,2015-11-15,5-22-19,2019-05-22,50.11528,-122.94577,9492002,23468733
ab-21530898,Whistler Luxury Motorhome with Garage & Work Shop,Camper/RV,Entire home/apt,11/6/17,2017-11-06,3-2-18,2018-03-02,50.13685135,-122.9518154,21530898,1201565
ab-9494370,$85/nightly or $550/weekly May to Nov 2019,Condominium,Entire home/apt,11/15/15,2015-11-15,5-21-19,2019-05-21,50.11807,-122.94261,9494370,25316494
ab-13840202,Whistler Beautiful 1 Bedroom Condo,Condominium,Entire home/apt,7/3/16,2016-07-03,10-13-17,2017-10-13,50.12325328,-122.9341761,13840202,65790915
ab-21539964,1BR Condo at the Ironwood Resort,Condominium,Entire home/apt,11/6/17,2017-11-06,5-16-19,2019-05-16,50.11324,-122.96956,21539964,26650418
ab-4891635,Whistler Village Studio - Specials,Apartment,Entire home/apt,12/7/14,2014-12-07,5-22-19,2019-05-22,50.11489,-122.95582,4891635,317618
ab-15885928,"Summer paradise in the village, near Lost Lake",Condominium,Entire home/apt,5/20/19,2019-05-20,5-24-19,2019-05-24,50.12065,-122.9566,15885928,17138766
ab-13841083,Whistler Beautiful 2 Bedroom Condo,Condominium,Entire home/apt,7/3/16,2016-07-03,10-12-17,2017-10-12,50.12227812,-122.9357417,13841083,65790915
ab-15887065,The Treehouse,Apartment,Entire home/apt,11/7/16,2016-11-07,5-24-19,2019-05-24,50.09429,-122.99396,15887065,49037760
ab-8173539,Lakefront Condo in Whistler,Condominium,Entire home/apt,9/1/15,2015-09-01,5-22-19,2019-05-22,50.1122,-122.97673,8173539,43137194
ab-21553366,"Whistler Village Townhome - Hot Tub, 2 BR Sleeps 7",Townhouse,Entire home/apt,11/4/17,2017-11-04,5-22-19,2019-05-22,50.12055,-122.95802,21553366,23168417
ab-21553610,â˜…Stylish Townhouse in Village w/ PRIVATE HOT TUB!â˜…,Townhouse,Entire home/apt,11/4/17,2017-11-04,5-23-19,2019-05-23,50.11838,-122.95819,21553610,43556347
ab-15236687,Whistler 2 bdrm Condo-View from Pool and Hot Tub,Apartment,Entire home/apt,9/25/16,2016-09-25,5-24-19,2019-05-24,50.11394,-122.96866,15236687,35914859
ab-13154745,Modern serene reno'd ski in/out under gondola,Townhouse,Entire home/apt,5/22/16,2016-05-22,5-22-19,2019-05-22,50.11203,-122.9483,13154745,73418832
ab-12388010,Best Whistler Village Slope Side Condo 2 bedroom,Condominium,Entire home/apt,4/10/16,2016-04-10,4-8-17,2017-04-08,50.11509334,-122.9449366,12388010,5552737
ab-14438965,Modern Mountain Studio in the Village,Serviced apartment,Entire home/apt,8/8/16,2016-08-08,5-22-19,2019-05-22,50.11758,-122.95412,14438965,71408986
ab-16755480,Two Bedroom Suite at Glacier Lodge,Apartment,Entire home/apt,1/11/17,2017-01-11,5-23-19,2019-05-23,50.11768,-122.94627,16755480,99546601
ab-16757103,Village Townhome: Outdoor Hot Tub & Pool,Townhouse,Entire home/apt,1/11/17,2017-01-11,5-21-19,2019-05-21,50.1214,-122.95597,16757103,11773667
ab-13843459,Perfect 2 Bedroom Whistler Condo,Condominium,Entire home/apt,7/4/16,2016-07-04,10-12-17,2017-10-12,50.12044423,-122.9373228,13843459,65790915
ab-3580548,PremiumCondo BlueberryHill 2BR 2bath w SkiParking,Condominium,Entire home/apt,7/12/14,2014-07-12,5-2-19,2019-05-02,50.11273,-122.97121,3580548,18035578
ab-21565642,Cozy 2 Bedroom Townhouse in Whistler Village,Townhouse,Entire home/apt,11/4/17,2017-11-04,5-23-19,2019-05-23,50.11768,-122.95801,21565642,156816293
ab-9505644,Whistler Four Bedroom Townhome with Enclosed Yard,Townhouse,Entire home/apt,11/16/15,2015-11-16,5-24-19,2019-05-24,50.14635,-122.96104,9505644,49260979
ab-9505710,"In the village, penthouse suite",Apartment,Entire home/apt,1/7/17,2017-01-07,5-24-19,2019-05-24,50.11693,-122.9572,9505710,48404028
ab-3586082,Glacier Lodge: Whistler's Biggest 1 BR Apartment.,Condominium,Entire home/apt,5/10/17,2017-05-10,5-24-19,2019-05-24,50.11662,-122.94759,3586082,16193619
ab-21569213,Large luxury 3 bedroom house with hot tub & deck,Entire house,Entire home/apt,11/13/17,2017-11-13,1-18-18,2018-01-18,50.10920463,-122.9768101,21569213,80079878
ab-9511286,One bedroom condo..close to lifts.,Apartment,Entire home/apt,11/16/15,2015-11-16,5-7-16,2016-05-07,50.0973401,-122.9901288,9511286,25316494
ab-4916210,Whistler 1BR Village Center for 2 - Walk to lifts!,Condominium,Entire home/apt,12/12/14,2014-12-12,5-24-19,2019-05-24,50.11275,-122.95588,4916210,317618
ab-21576104,Whistler - Studio,Condominium,Entire home/apt,11/4/17,2017-11-04,7-11-18,2018-07-11,50.11822099,-122.9443812,21576104,96299084
ab-21578711,Beautiful Ski-In/Ski-Out 1-Bdrm Right on the Hill,Condominium,Entire home/apt,11/4/17,2017-11-04,4-11-19,2019-04-11,50.11537,-122.94476,21578711,21175657
ab-7180446,1 bdm townhome with private hot tub,Townhouse,Entire home/apt,7/4/15,2015-07-04,10-29-16,2016-10-29,50.12170827,-122.956142,7180446,37441134
ab-14446430,Cozy Creekside Apartment,Apartment,Entire home/apt,8/9/16,2016-08-09,9-27-16,2016-09-27,50.0946429,-122.9912943,14446430,88939497
ab-9514055,Bright  loft with views of the Peak,Condominium,Entire home/apt,11/16/15,2015-11-16,5-4-16,2016-05-04,50.09686031,-122.990075,9514055,49100758
ab-9514706,Creekside Townhome,Townhouse,Entire home/apt,11/16/15,2015-11-16,5-22-19,2019-05-22,50.09161,-122.99199,9514706,49037760
ab-21582337,Studio Within Walking Distance of Whistler Village! | Pool + Hot Tub,Condominium,Entire home/apt,11/6/17,2017-11-06,5-23-19,2019-05-23,50.11745,-122.95976,21582337,151701730
ab-21582343,Bright and Comfortable Studio Suite with GREAT Amenities!,Condominium,Entire home/apt,11/11/17,2017-11-11,5-14-18,2018-05-14,50.11790749,-122.9603085,21582343,151701730
ab-21582349,Suite for 6 with Fireplace | 2 Hot Tubs + Heated Outdoor Pool,Condominium,Entire home/apt,11/6/17,2017-11-06,5-23-19,2019-05-23,50.11779,-122.95979,21582349,151701730
ab-21582350,BRIGHT 2 Bedroom Suite with Fireplace and Awesome Amenities,Condominium,Entire home/apt,11/11/17,2017-11-11,5-15-18,2018-05-15,50.11578967,-122.9606229,21582350,151701730
ab-21582352,"Suite for 4 with a Full Kitchen, Fireplace | Pool + Hot Tub Access",Condominium,Entire home/apt,11/6/17,2017-11-06,5-22-19,2019-05-22,50.11639,-122.96195,21582352,151701730
ab-21582356,Bright and Comfortable 1 Bedroom Suite with UNREAL Amenities!,Condominium,Entire home/apt,11/11/17,2017-11-11,5-2-18,2018-05-02,50.11651349,-122.9605071,21582356,151701730
ab-21582361,Bright Studio Condo with Cozy Fireplace and Private Balcony,Condominium,Entire home/apt,11/11/17,2017-11-11,6-3-18,2018-06-03,50.11744389,-122.9578942,21582361,151701730
ab-21582364,Bright Studio Condo with Cozy Fireplace and Private Balcony,Condominium,Entire home/apt,11/11/17,2017-11-11,5-12-18,2018-05-12,50.11746171,-122.9565382,21582364,151701730
ab-21582367,Bright Condo with Fireplace + Private Balcony | Hot Tub + Pool!,Condominium,Entire home/apt,11/11/17,2017-11-11,5-26-18,2018-05-26,50.11876341,-122.9583444,21582367,151701730
ab-21582370,Bright 2 Bedroom Condo with Private Balcony | AMAZING Amenities!,Condominium,Entire home/apt,11/11/17,2017-11-11,5-14-18,2018-05-14,50.11772903,-122.9566961,21582370,151701730
ab-21582419,Ski-In Residence in AMAZING Location Across from Creekside Gondola,Condominium,Entire home/apt,11/11/17,2017-11-11,5-23-19,2019-05-23,50.09444,-122.99192,21582419,151701730
ab-21582420,Ski-In Residence in AMAZING Location Across from Creekside Gondola,Condominium,Entire home/apt,11/11/17,2017-11-11,5-13-18,2018-05-13,50.09423108,-122.9920036,21582420,151701730
ab-21582425,Ski-In/Ski-Out Residence 300m from Alpha Lake Park! Sleeps 6!,Condominium,Entire home/apt,9/10/18,2018-09-10,3-9-19,2019-03-09,50.09476,-122.99153,21582425,151701730
ab-21582431,Ski-In Apartment Near Whistler with Free Wi-Fi and Pool Access!!!,Condominium,Entire home/apt,11/11/17,2017-11-11,5-24-19,2019-05-24,50.11636,-122.94231,21582431,151701730
ab-21582433,Holiday Apartment Near Whistler with Free Wi-Fi and Pool Access!!!,Condominium,Entire home/apt,11/11/17,2017-11-11,5-13-18,2018-05-13,50.11639394,-122.9443922,21582433,151701730
ab-8189575,Charming+Spacious 3full bdrm/2ba ski in w Mtn view,Townhouse,Entire home/apt,9/2/15,2015-09-02,5-24-19,2019-05-24,50.12008,-122.94203,8189575,10129766
ab-21582436,Charming 1 Bedroom Suite with Access to Amazing Amenities,Condominium,Entire home/apt,11/11/17,2017-11-11,5-21-19,2019-05-21,50.1202,-122.95806,21582436,151701730
ab-21582440,Charming 1 Bedroom Suite with Access to Amazing Amenities,Condominium,Entire home/apt,11/11/17,2017-11-11,5-13-18,2018-05-13,50.12049806,-122.9565211,21582440,151701730
ab-21582441,1 Bedroom Suite with a Patio and Private Hot Tub | Shared Pool Access,Condominium,Entire home/apt,11/11/17,2017-11-11,9-3-18,2018-09-03,50.11982104,-122.9576192,21582441,151701730
ab-21582443,Lovely and Spacious 1 Bedroom with Gorgeous Deck and Private Hot Tub,Condominium,Entire home/apt,11/11/17,2017-11-11,5-13-18,2018-05-13,50.12146658,-122.9562238,21582443,151701730
ab-21582445,Beautiful Mountain Inspired 2 Bedroom with Deck and Private Hot Tub,Condominium,Entire home/apt,11/6/17,2017-11-06,9-4-18,2018-09-04,50.12057152,-122.9575822,21582445,151701730
ab-21582447,Beautiful Mountain Inspired 2 Bedroom with Deck and Private Hot Tub,Condominium,Entire home/apt,11/11/17,2017-11-11,5-3-18,2018-05-03,50.12048149,-122.9569394,21582447,151701730
ab-21582452,Bright Ski-In Deluxe Room | Pool + 2 Hot Tubs!,Room in boutique hotel,Private room,9/10/18,2018-09-10,5-24-19,2019-05-24,50.118,-122.94789,21582452,151701730
ab-21582460,"Mountainside Studio with Fireplace | Pool, Bike Storage + 2 Hot Tubs",Serviced apartment,Entire home/apt,11/8/17,2017-11-08,5-21-19,2019-05-21,50.11758,-122.94698,21582460,151701730
ab-21582464,Sweet Escape Studio with Fireplace and AMAZING Amenities!,Condominium,Entire home/apt,11/11/17,2017-11-11,5-13-18,2018-05-13,50.11651933,-122.94674,21582464,151701730
ab-21582467,SUPER Inviting Studio Suite with Unreal Amenities and Fireplace!,Condominium,Entire home/apt,11/11/17,2017-11-11,9-2-18,2018-09-02,50.11640316,-122.9478617,21582467,151701730
ab-21582470,SUPER Inviting Studio Suite with Unreal Amenities and Fireplace!,Condominium,Entire home/apt,11/11/17,2017-11-11,5-13-18,2018-05-13,50.11700396,-122.9469132,21582470,151701730
ab-21582475,Ski-In 1 Bedroom Condo with Private Balcony + Fireplace | Pool Access,Condominium,Entire home/apt,11/11/17,2017-11-11,5-24-19,2019-05-24,50.11663,-122.94808,21582475,151701730
ab-21582479,Lovely 1 Bedroom Condo with Private Balcony and AWESOME Amenities,Condominium,Entire home/apt,11/11/17,2017-11-11,5-13-18,2018-05-13,50.11772159,-122.9465566,21582479,151701730
ab-21582483,Deluxe Condo with Cozy Fireplace and Private Balcony | FUN AMENITIES!,Condominium,Entire home/apt,11/11/17,2017-11-11,5-24-19,2019-05-24,50.11682,-122.9487,21582483,151701730
ab-21582488,Deluxe Condo with Cozy Fireplace and Private Balcony | FUN AMENITIES!,Condominium,Entire home/apt,11/11/17,2017-11-11,5-13-18,2018-05-13,50.1163456,-122.9484948,21582488,151701730
ab-21582494,"Ski-In Suite | Heated Pool, 2 Hot Tubs, Ski Valet, Bike Storage + More",Condominium,Entire home/apt,11/6/17,2017-11-06,5-22-19,2019-05-22,50.1167,-122.94648,21582494,151701730
ab-21582497,Loft Suite in Heart of Whistler - Heated Pool + 2 Hot Tubs on site!!,Condominium,Entire home/apt,11/11/17,2017-11-11,5-13-18,2018-05-13,50.11667172,-122.9466585,21582497,151701730
ab-21582502,"Deluxe Ski-In Suite | Pool, 2 Hot Tubs, Ski Valet + Bike Storage",Condominium,Entire home/apt,11/6/17,2017-11-06,5-22-19,2019-05-22,50.11695,-122.94699,21582502,151701730
ab-21582507,Deluxe Lofted Suite with AMAZING AMENITIES and Private Balcony,Condominium,Entire home/apt,11/11/17,2017-11-11,5-13-18,2018-05-13,50.11831151,-122.9484619,21582507,151701730
ab-21582512,Elegant Studio Suite with Fireplace and Private Balcony,Serviced apartment,Entire home/apt,11/8/17,2017-11-08,5-23-19,2019-05-23,50.11479,-122.94017,21582512,151701730
ab-21582515,Elegant Studio Suite with Fireplace and Private Balcony,Condominium,Entire home/apt,11/11/17,2017-11-11,5-14-18,2018-05-14,50.11299161,-122.9413174,21582515,151701730
ab-21582522,True Ski-In Suite with Fireplace | Pool + Hot Tub Access,Condominium,Entire home/apt,11/6/17,2017-11-06,5-21-19,2019-05-21,50.11406,-122.94144,21582522,151701730
ab-21582526,Stunning Open-Concept 2 Bedroom Suite with Amazing Amenities!,Condominium,Entire home/apt,11/11/17,2017-11-11,5-14-18,2018-05-14,50.11343045,-122.9416922,21582526,151701730
ab-21582527,True Ski In Rental! Suite with Private Balcony + Fireplace,Condominium,Entire home/apt,11/11/17,2017-11-11,5-23-19,2019-05-23,50.11443,-122.94191,21582527,151701730
ab-21582530,Beautiful Open-concept 1 Bedroom Suite with Private Balcony,Condominium,Entire home/apt,11/11/17,2017-11-11,5-14-18,2018-05-14,50.11283484,-122.9404873,21582530,151701730
ab-21582535,True Ski-in/out Access! Bright 1 Bedroom Suite with Fireplace + Patio,Condominium,Entire home/apt,11/11/17,2017-11-11,5-20-19,2019-05-20,50.11339,-122.93988,21582535,151701730
ab-21582537,Elegant and Bright 1 Bedroom Suite with True Ski-in/out Access,Condominium,Entire home/apt,11/11/17,2017-11-11,5-14-18,2018-05-14,50.11270846,-122.9419978,21582537,151701730
ab-21582545,Modern 2 Bedroom Suite with Private Balcony and Wonderful Amenities!,Condominium,Entire home/apt,11/11/17,2017-11-11,5-24-19,2019-05-24,50.11335,-122.94186,21582545,151701730
ab-21582547,Modern 2 Bedroom Suite with Private Balcony and Wonderful Amenities!,Condominium,Entire home/apt,11/11/17,2017-11-11,5-14-18,2018-05-14,50.11291247,-122.9403054,21582547,151701730
ab-21582646,Studio Condo in the Heart of Whistler with a Fireplace + Balcony,Serviced apartment,Entire home/apt,11/6/17,2017-11-06,5-24-19,2019-05-24,50.12082,-122.9563,21582646,151701730
ab-21582652,Amazing Solo or Couples Retreat RIGHT IN THE HEART OF WHISTLER VILLAGE,Condominium,Entire home/apt,11/11/17,2017-11-11,5-13-18,2018-05-13,50.12059017,-122.9563277,21582652,151701730
ab-21582657,Condo for 4 with Air-Conditioning In the Heart of Whistler Village!,Condominium,Entire home/apt,11/6/17,2017-11-06,5-22-19,2019-05-22,50.11851,-122.95666,21582657,151701730
ab-21582661,AMAZING Location!! Condo for Couples In Heart of Whistler Village!,Condominium,Entire home/apt,11/11/17,2017-11-11,5-14-18,2018-05-14,50.11944909,-122.954957,21582661,151701730
ab-21582664,Condo with Fireplace + Air-Conditioning In Whistler Village!,Condominium,Entire home/apt,11/21/17,2017-11-21,5-24-19,2019-05-24,50.12005,-122.95673,21582664,151701730
ab-21582666,AMAZING Air-Conditioned Group Condo In Heart of Whistler Village!,Condominium,Entire home/apt,11/21/17,2017-11-21,5-13-18,2018-05-13,50.11927455,-122.956379,21582666,151701730
ab-21582669,TRUE Ski-In Townhome with a Fireplace and Private Balcony,Townhouse,Entire home/apt,11/11/17,2017-11-11,3-10-19,2019-03-10,50.11521,-122.9401,21582669,151701730
ab-21582672,TRUE Ski-In Townhome for a Family or Group with PRIVATE HOT TUB,Townhouse,Entire home/apt,11/11/17,2017-11-11,5-14-18,2018-05-14,50.11605739,-122.9403602,21582672,151701730
ab-21582676,Only 1km from Whistler Village | Stone Fireplace + Outdoor Hot Tub,House,Entire home/apt,11/11/17,2017-11-11,5-21-19,2019-05-21,50.11661,-122.94216,21582676,151701730
ab-21582680,Luxurious Private Holiday Home for Groups on Blackcomb Mountain,House,Entire home/apt,11/11/17,2017-11-11,5-14-18,2018-05-14,50.11734023,-122.9428904,21582680,151701730
ab-21582685,Spacious Suite 5 Minutes from Whistler Village,Condominium,Entire home/apt,11/11/17,2017-11-11,5-23-19,2019-05-23,50.11963,-122.95851,21582685,151701730
ab-21582686,Peaceful and Cozy 1 Bedroom Suite Just a Short Drive to the Lifts!,Condominium,Entire home/apt,11/11/17,2017-11-11,5-15-18,2018-05-15,50.11919164,-122.9601241,21582686,151701730
ab-21582688,Modern 1 Bedroom Suite with Full Kitchen + Private Balcony,Condominium,Entire home/apt,6/8/18,2018-06-08,5-23-19,2019-05-23,50.1203,-122.96273,21582688,151701730
ab-21582693,Charming 2 Bedroom with Magnificent Gas Fireplace,Nature lodge,Private room,11/11/17,2017-11-11,5-21-19,2019-05-21,50.12052,-122.96097,21582693,151701730
ab-21582696,Charming 2 Bedroom with Magnificent Gas Fireplace,Private room,Private room,11/11/17,2017-11-11,5-15-18,2018-05-15,50.11891421,-122.9604949,21582696,151701730
ab-21582701,Amazing location! Lovely Suite for 2 with a Fireplace and Balcony,Townhouse,Entire home/apt,11/11/17,2017-11-11,5-24-19,2019-05-24,50.12184,-122.95883,21582701,151701730
ab-21582703,Quiet Holiday in Mountains for Solo or Couple Travellers Near Lifts!,Townhouse,Entire home/apt,11/11/17,2017-11-11,5-15-18,2018-05-15,50.12218553,-122.9581607,21582703,151701730
ab-21582747,Suite only 200m From Ski-Lifts with a Private Balcony + BBQ!,Condominium,Entire home/apt,11/11/17,2017-11-11,5-24-19,2019-05-24,50.11534,-122.94968,21582747,151701730
ab-21582752,Secluded Romantic Getaway for Couples only 200m From Ski-Lifts!!,Condominium,Entire home/apt,11/11/17,2017-11-11,5-15-18,2018-05-15,50.1147598,-122.9504298,21582752,151701730
ab-21582761,DELUXE SKI-IN Residence with Fireplace + Pool & Hot Tub Access!!,Townhouse,Entire home/apt,11/8/17,2017-11-08,5-23-19,2019-05-23,50.09212,-122.97964,21582761,151701730
ab-21582765,DELUXE SKI-IN Residence with Fireplace + Pool & Hot Tub Access!!,Townhouse,Entire home/apt,11/11/17,2017-11-11,5-15-18,2018-05-15,50.09388061,-122.9809003,21582765,151701730
ab-21582768,"Deluxe SKI-IN Residence with a Pool, 3 HOT TUBS, Gym + Business Centre",Condominium,Entire home/apt,11/6/17,2017-11-06,9-3-18,2018-09-03,50.11667585,-122.9458463,21582768,151701730
ab-21582769,DELUXE SKI-IN Residence for Families or Groups. 3 HOT TUBS on-site!!,Condominium,Entire home/apt,11/11/17,2017-11-11,5-13-18,2018-05-13,50.1149571,-122.9460264,21582769,151701730
ab-21582770,"Ski-In Suite with a Fireplace + Balcony | 3 Hot Tubs, Pool, + Gym",Condominium,Entire home/apt,11/11/17,2017-11-11,5-22-19,2019-05-22,50.11501,-122.9459,21582770,151701730
ab-21582772,Gorgeous Apartment for Couples or Families in TRUE SKI-IN LOCATION,Condominium,Entire home/apt,11/11/17,2017-11-11,5-13-18,2018-05-13,50.11497693,-122.9457565,21582772,151701730
ab-21582778,"Deluxe Retreat with SKI-IN ACCESS, 3 Hot Tubs, and Pool Access",Condominium,Entire home/apt,11/8/17,2017-11-08,5-22-19,2019-05-22,50.11608,-122.94386,21582778,151701730
ab-21582779,Deluxe Romantic Couples Retreat with TRUE SKI-IN ACCESS and 3 HOT TUBS,Condominium,Entire home/apt,11/11/17,2017-11-11,5-13-18,2018-05-13,50.116905,-122.9439651,21582779,151701730
ab-21582785,"Ski-In Getaway with Access to 3 HOT TUBS, Pool, Gym, + Fitness Centre!",Condominium,Entire home/apt,11/11/17,2017-11-11,5-21-19,2019-05-21,50.11506,-122.94455,21582785,151701730
ab-21582790,Luxurious Ski-In Group Getaway with Access to 3 HOT TUBS and a Pool!!,Condominium,Entire home/apt,11/13/17,2017-11-13,5-13-18,2018-05-13,50.11675449,-122.9453202,21582790,151701730
ab-21582793,"Deluxe Ski-In Apartment | Pool, 3 Hot Tubs, Business Centre, Gym",Condominium,Entire home/apt,11/18/17,2017-11-18,5-21-19,2019-05-21,50.11543,-122.94559,21582793,151701730
ab-21582795,Exquisite Deluxe Apartment for Pairs or Families at TRUE SKI-IN Resort,Condominium,Entire home/apt,11/18/17,2017-11-18,5-13-18,2018-05-13,50.11557092,-122.9448049,21582795,151701730
ab-21582798,Spacious 1 Bedroom Suite with Private Balcony and Fireplace,Condominium,Entire home/apt,11/11/17,2017-11-11,5-22-19,2019-05-22,50.11589,-122.94324,21582798,151701730
ab-21582801,Spacious 1 Bedroom Suite with Private Balcony and Amazing Amenities!,Condominium,Entire home/apt,11/11/17,2017-11-11,5-13-18,2018-05-13,50.11528464,-122.9437455,21582801,151701730
ab-21582804,Luxurious Condo with Loft and Private Balcony - Quick walk to lifts!,Condominium,Entire home/apt,11/6/17,2017-11-06,5-20-19,2019-05-20,50.11738,-122.94209,21582804,151701730
ab-16758363,3 Bedroom  Sleeps VIEW Penthouse on Blueberry Hill,Apartment,Entire home/apt,1/11/17,2017-01-11,9-21-17,2017-09-21,50.11658488,-122.9687225,16758363,7784624
ab-21582809,Luxurious Condo with Loft and Private Balcony - Quick walk to lifts!,Condominium,Entire home/apt,11/11/17,2017-11-11,5-13-18,2018-05-13,50.11729164,-122.9434575,21582809,151701730
ab-21582826,"Studio Suite with Fireplace, Full Kitchen, and Hot Tub Access!",Serviced apartment,Entire home/apt,11/11/17,2017-11-11,5-22-19,2019-05-22,50.11443,-122.95467,21582826,151701730
ab-21582828,Cozy and Comfortable Studio Suite with Amazing Amenities,Condominium,Entire home/apt,11/11/17,2017-11-11,5-13-18,2018-05-13,50.11598087,-122.9554551,21582828,151701730
ab-21582834,"Superior Studio with Fireplace, Full Kitchen Plus Gym + Hot Tub Access",Serviced apartment,Entire home/apt,11/8/17,2017-11-08,5-22-19,2019-05-22,50.11485,-122.95469,21582834,151701730
ab-21582837,"Superior Studio with Fireplace, Comfortable Beds and Awesome Amenities",Condominium,Entire home/apt,11/11/17,2017-11-11,5-15-18,2018-05-15,50.11479812,-122.9546789,21582837,151701730
ab-21582843,Deluxe Studio Suite with Fireplace + Air Conditioning | Gym + Hot Tub,Serviced apartment,Entire home/apt,11/11/17,2017-11-11,5-24-19,2019-05-24,50.11445,-122.95513,21582843,151701730
ab-21582846,Wonderful Deluxe Studio Suite with Fireplace and Amazing Amenities!,Condominium,Entire home/apt,11/18/17,2017-11-18,5-14-18,2018-05-14,50.11593337,-122.9548061,21582846,151701730
ab-21582851,"Spacious Studio Suite with Loft + Fireplace | Gym, Wi-Fi, + Hot Tub!",Serviced apartment,Entire home/apt,3/10/18,2018-03-10,5-22-19,2019-05-22,50.11494,-122.95328,21582851,151701730
ab-21582852,"Spacious Studio Suite with Loft, Fireplace and Wonderful Amenities!",Condominium,Entire home/apt,3/13/18,2018-03-13,5-13-18,2018-05-13,50.11506971,-122.9554256,21582852,151701730
ab-21582858,Deluxe Studio with Cozy Fireplace and Den | On-Site Gym + Hot Tub,Serviced apartment,Entire home/apt,11/11/17,2017-11-11,5-22-19,2019-05-22,50.11452,-122.95394,21582858,151701730
ab-21582861,Deluxe Studio with Cozy Fireplace and Den | Great Amenities!,Condominium,Entire home/apt,11/11/17,2017-11-11,5-15-18,2018-05-15,50.11495786,-122.9549393,21582861,151701730
ab-21582866,Deluxe 1 Bedroom Suite with Loft and Fireplace | Gym + Fireplace,Condominium,Entire home/apt,3/10/18,2018-03-10,5-22-19,2019-05-22,50.11639,-122.95522,21582866,151701730
ab-21582870,GREAT FOR GROUPS! Deluxe 1 Bedroom Suite with Loft and Fireplace,Condominium,Entire home/apt,3/13/18,2018-03-13,5-14-18,2018-05-14,50.11589336,-122.953864,21582870,151701730
ab-21582876,Bright Deluxe 2 Bedroom Suite with Fireplace | Gym + Ski/Bike Storage,Condominium,Entire home/apt,11/11/17,2017-11-11,5-22-19,2019-05-22,50.11514,-122.95528,21582876,151701730
ab-21582884,Bright and Comfortable Deluxe 2 Bedroom Suite with Fireplace!,Condominium,Entire home/apt,11/11/17,2017-11-11,5-14-18,2018-05-14,50.11454576,-122.9533488,21582884,151701730
ab-21582886,Deluxe ACCESSIBLE 2 Bedroom Suite with Fireplace and Hot Tub Access!,Condominium,Entire home/apt,3/10/18,2018-03-10,5-22-19,2019-05-22,50.11539,-122.95402,21582886,151701730
ab-21582892,Deluxe ACCESSIBLE 2 Bedroom Suite with Fireplace and Amenities!,Condominium,Entire home/apt,3/13/18,2018-03-13,5-14-18,2018-05-14,50.11603431,-122.9537192,21582892,151701730
ab-21582896,Bright Spacious 2 Bedroom Townhome with Private Patio + Full Kitchen,Townhouse,Entire home/apt,11/11/17,2017-11-11,5-22-19,2019-05-22,50.11944,-122.93898,21582896,151701730
ab-21582899,Naturally Bright and Spacious 2 Bedroom Suite with Private Patio,Townhouse,Entire home/apt,11/11/17,2017-11-11,5-14-18,2018-05-14,50.11916943,-122.9404075,21582899,151701730
ab-21582904,"Spacious 1 Bedroom Suite with a Full Kitchen, a Balcony, + a Fireplace",Condominium,Entire home/apt,11/11/17,2017-11-11,5-22-19,2019-05-22,50.11712,-122.95362,21582904,151701730
ab-21582906,Spacious 1 Bedroom Suite with Great Access to Mountains and Amenities,Condominium,Entire home/apt,11/11/17,2017-11-11,5-15-18,2018-05-15,50.11762555,-122.9538383,21582906,151701730
ab-21582908,Modern 2 Bedroom Suite in Whistler with Full Kitchen + Fireplace,Condominium,Entire home/apt,11/11/17,2017-11-11,5-22-19,2019-05-22,50.11572,-122.95578,21582908,151701730
ab-21582909,Elegant and Modern 2 Bedroom Mountain Suite with Lovely Fireplace,Condominium,Entire home/apt,11/11/17,2017-11-11,5-12-18,2018-05-12,50.11785325,-122.9554839,21582909,151701730
ab-21582912,"Holiday Home with PRIVATE HOT TUB, Balcony, and Fireplace!",Condominium,Entire home/apt,11/8/17,2017-11-08,5-23-19,2019-05-23,50.12356,-122.95518,21582912,151701730
ab-21582915,Group Holiday Rental With PRIVATE HOT TUB Overlooking Whistler Village,Condominium,Entire home/apt,11/11/17,2017-11-11,5-13-18,2018-05-13,50.12444152,-122.9551809,21582915,151701730
ab-1518967,Luxury 2 Bedroom in Whistler - FREE PARKING,Apartment,Entire home/apt,8/11/13,2013-08-11,5-22-19,2019-05-22,50.11366,-122.97078,1518967,8107418
ab-21587181,Whistler Cascade lodge Weekend and Holiday Stays,Room in aparthotel,Private room,11/4/17,2017-11-04,5-22-19,2019-05-22,50.11772,-122.9571,21587181,8440595
ab-21587186,Whistler Cascade lodge  3Night Prime Stays!,Resort,Entire home/apt,11/4/17,2017-11-04,5-22-19,2019-05-22,50.11654,-122.95834,21587186,8440595
ab-21587464,Whistler Creekside 2BR+Den 3 night Weekend Stays,Condominium,Entire home/apt,11/4/17,2017-11-04,5-21-19,2019-05-21,50.09272,-122.99541,21587464,8440595
ab-21587471,Whistler Creekside 1BR+Den New Years!!,Entire timeshare,Entire home/apt,11/4/17,2017-11-04,1-21-18,2018-01-21,50.09287356,-122.9933621,21587471,8440595
ab-7182166,Classic 3br Chalet Modern Comforts w/ hot tub,House,Entire home/apt,7/4/15,2015-07-04,5-22-19,2019-05-22,50.10822,-122.97586,7182166,104963
ab-16763277,Whistler Village Cascade Lodge Condo walk to lifts,Serviced apartment,Entire home/apt,1/12/17,2017-01-12,3-19-19,2019-03-19,50.11705,-122.95993,16763277,30307256
ab-20210715,Available for Crankworx!,Condominium,Private room,8/1/17,2017-08-01,9-3-17,2017-09-03,50.1188348,-122.9564596,20210715,105378722
ab-1524962,"Stunning Ski-in Ski-Out Condo w Pool, Hot Tub, Bbq",Apartment,Entire home/apt,8/12/13,2013-08-12,5-23-19,2019-05-23,50.09979,-122.99256,1524962,503312
ab-14451396,Luxury 5bdr Chalet with Mtn Views,Chalet,Entire home/apt,8/9/16,2016-08-09,5-22-19,2019-05-22,50.14967,-122.9666,14451396,57574738
ab-7195866,Ski in/ski out 1 bed unit with AC!,Apartment,Entire home/apt,7/5/15,2015-07-05,5-24-19,2019-05-24,50.11552,-122.94401,7195866,25751978
ab-13844366,2 Bedroom Whistler Townhome with Hot Tub,Townhouse,Entire home/apt,7/4/16,2016-07-04,9-6-17,2017-09-06,50.11931332,-122.9604207,13844366,65790915
ab-14452657,1 BR Condo in The Aspens w/ Heated Pool & Hot Tubs,Apartment,Entire home/apt,8/9/16,2016-08-09,5-24-19,2019-05-24,50.11635,-122.94615,14452657,17939866
ab-4931256,"Jan.5-11, 2020, Slopeside, lg.corner unit",Condominium,Entire home/apt,12/15/14,2014-12-15,5-3-19,2019-05-03,50.11569,-122.94427,4931256,22958856
ab-21595652,5 Stars Resort/hotel,Timeshare,Entire home/apt,11/4/17,2017-11-04,3-13-18,2018-03-13,50.11672283,-122.945025,21595652,463918
ab-21595757,1 bed + den room in central location,Apartment,Entire home/apt,11/4/17,2017-11-04,12-9-18,2018-12-09,50.12042201,-122.9569376,21595757,38431029
ab-21596548,Mountainside Lodge - 1 Bedroom Suite,Nature lodge,Entire home/apt,11/4/17,2017-11-04,11-28-17,2017-11-28,50.1148253,-122.9531936,21596548,29562085
ab-8194407,Carleton Lodge #402,Condominium,Entire home/apt,9/2/15,2015-09-02,5-24-19,2019-05-24,50.11234,-122.95457,8194407,10531914
ab-8194809,Carleton Lodge #408,Condominium,Entire home/apt,9/2/15,2015-09-02,5-23-19,2019-05-23,50.1142,-122.95436,8194809,10531914
ab-8195338,The Aspens on Blackcomb #212,Condominium,Entire home/apt,9/2/15,2015-09-02,9-13-18,2018-09-13,50.11773873,-122.9427083,8195338,10531914
ab-21603630,Beautiful studio in Whistler for two people,Apartment,Entire home/apt,11/4/17,2017-11-04,11-16-17,2017-11-16,50.12100484,-122.9613379,21603630,155226688
ab-18488133,Cozy Creekside Studio,Apartment,Entire home/apt,4/28/17,2017-04-28,7-4-17,2017-07-04,50.09903534,-122.9888507,18488133,128272277
ab-21606607,Luxury Whistler Vacation Rental,Entire place,Entire home/apt,11/4/17,2017-11-04,12-14-17,2017-12-14,50.11882822,-122.9443547,21606607,157161480
ab-21607454,WorldMark Whistler - Cascade Lodge,Condominium,Entire home/apt,11/4/17,2017-11-04,5-23-19,2019-05-23,50.11701,-122.95918,21607454,15580547
ab-21607520,Ski In Ski Out w/ Pool & Hot Tub by Harmony Whistler,Apartment,Entire home/apt,11/6/17,2017-11-06,5-23-19,2019-05-23,50.11654,-122.94269,21607520,35393628
ab-9528978,Whistler Village Sleeps 4,Apartment,Entire home/apt,11/17/15,2015-11-17,6-4-16,2016-06-04,50.11577613,-122.9591163,9528978,17876150
ab-17607419,BEST location BIG condo sleeps 8 w/private HOT TUB,Loft,Entire home/apt,3/5/17,2017-03-05,10-9-18,2018-10-09,50.1123379,-122.954405,17607419,7452618
ab-17608044,Beautiful Creekside chalet,House,Entire home/apt,3/5/17,2017-03-05,7-31-18,2018-07-31,50.0923392,-122.9967664,17608044,115865509
ab-21608806,CONTEMPORARY 3BR CONDO WITH SPECTACULAR VIEW !,Apartment,Entire home/apt,12/6/17,2017-12-06,5-22-19,2019-05-22,50.11157,-122.96768,21608806,157180544
ab-18488637,Northstar Whistler Village,Townhouse,Entire home/apt,4/28/17,2017-04-28,10-4-17,2017-10-04,50.11930372,-122.9587494,18488637,42644437
ab-4940245,Luxury 1 bdrm ski in ski out condo,Apartment,Entire home/apt,12/16/14,2014-12-16,5-21-19,2019-05-21,50.11599,-122.94852,4940245,25459228
ab-6310954,Whistler - Cascade Lodge 1 Bdrm Condo Resort,Serviced apartment,Entire home/apt,5/6/15,2015-05-06,5-21-19,2019-05-21,50.11679,-122.95788,6310954,9296727
ab-15889841,Modern Whistler Chalet,House,Entire home/apt,11/7/16,2016-11-07,5-21-19,2019-05-21,50.14584,-122.96926,15889841,1886689
ab-8203446,Modern luxury meets cozy Whistler,Townhouse,Entire home/apt,9/26/18,2018-09-26,4-10-19,2019-04-10,50.12241,-122.9389,8203446,43261202
ab-21611150,Whiski Jack - Whistler Town Plaza - 2 Bedrooms!,Timeshare,Entire home/apt,11/4/17,2017-11-04,11-13-17,2017-11-13,50.11789132,-122.9550555,21611150,29562085
ab-8205000,Adara Hotel - Two Floor Penthouse Suite,Room in boutique hotel,Private room,9/3/15,2015-09-03,5-24-19,2019-05-24,50.11362,-122.95551,8205000,10531914
ab-13845163,Whistler Gem! Lovely 1 Bedroom Condo,Condominium,Entire home/apt,7/4/16,2016-07-04,10-10-17,2017-10-10,50.11675533,-122.9426522,13845163,65790915
ab-21621201,Gondola Village Gem,Apartment,Entire home/apt,11/4/17,2017-11-04,5-24-19,2019-05-24,50.09402,-122.99205,21621201,59049017
ab-17609026,Marketplace Lodge - Village - Budget,Apartment,Entire home/apt,3/5/17,2017-03-05,1-12-19,2019-01-12,50.11919233,-122.9550261,17609026,1747164
ab-21622140,"IMPROVED 2Br/2Ba (Ski-to-Door, HT & Free Parking)",Townhouse,Entire home/apt,11/23/17,2017-11-23,5-24-19,2019-05-24,50.12092,-122.93411,21622140,135542419
ab-1544821,"3BR Condo, Sleeps 8, Walk to Lift!",Entire apartment,Entire home/apt,8/17/13,2013-08-17,1-11-18,2018-01-11,50.09097883,-122.9942067,1544821,2608825
ab-20216521,Single den in newly renovated Creekside Condo!,Condominium,Private room,10/2/17,2017-10-02,5-7-19,2019-05-07,50.09732,-122.98838,20216521,65975869
ab-4948554,PINETREE CHALET Whistler,Chalet,Entire home/apt,12/18/14,2014-12-18,5-21-19,2019-05-21,50.15843,-122.93034,4948554,23920762
ab-4948853,Whistler Chalet Ski in Ski Out,Chalet,Entire home/apt,12/18/14,2014-12-18,5-23-19,2019-05-23,50.11553,-122.94436,4948853,4010718
ab-21623570,"1BR Penthouse in Village w/ Pool, Hot Tub & Sauna",Condominium,Entire home/apt,11/11/17,2017-11-11,5-23-19,2019-05-23,50.11683,-122.95482,21623570,5132321
ab-21624714,120 steps to the new gondola on Blackcomb,Condominium,Entire home/apt,11/4/17,2017-11-04,5-21-19,2019-05-21,50.1164,-122.94777,21624714,66231751
ab-13845591,Whistler Gem! Lovely 2 Bedroom + Loft Condo,Condominium,Entire home/apt,7/4/16,2016-07-04,10-12-17,2017-10-12,50.11594631,-122.941912,13845591,65790915
ab-6319386,Whistler -Sundance 1 Bdrm Plus Condo Resort,Serviced apartment,Entire home/apt,5/7/15,2015-05-07,5-21-19,2019-05-21,50.09238,-122.99092,6319386,9296727
ab-12408205,Cute & Cozy Whistler Village Condo,Condominium,Entire home/apt,4/11/16,2016-04-11,2-1-17,2017-02-01,50.11805834,-122.9591495,12408205,27112623
ab-12408558,Family friendly mountain home,House,Entire home/apt,4/11/16,2016-04-11,3-14-19,2019-03-14,50.14932,-122.96744,12408558,11281558
ab-3630097,2 Bedroom in Glacier's Reach at Whistler,Condominium,Entire home/apt,7/17/14,2014-07-17,1-2-19,2019-01-02,50.12038946,-122.9572764,3630097,18294872
ab-3636682,"Central, Charming, Spacious, Family Townhome",Townhouse,Entire home/apt,7/17/14,2014-07-17,9-24-18,2018-09-24,50.12221636,-122.953897,3636682,18340396
ab-21633927,Private 2 Bedroom Accommodation in Whistler,Guest suite,Entire home/apt,11/6/17,2017-11-06,5-15-18,2018-05-15,50.15219209,-122.9636371,21633927,60778234
ab-6319574,Whistler -Sundance 2 Bdrm Loft Condo Resort,Serviced apartment,Entire home/apt,5/7/15,2015-05-07,5-21-19,2019-05-21,50.09132,-122.98987,6319574,9296727
ab-9543465,Wildwood Lodge 108 near lifts,Condominium,Entire home/apt,11/18/15,2015-11-18,5-24-19,2019-05-24,50.11698,-122.94377,9543465,22619214
ab-9544626,Superb on Slope Ski-in/Ski-Out Home,Cabin,Entire home/apt,11/18/15,2015-11-18,8-26-17,2017-08-26,50.11206821,-122.9504566,9544626,39840297
ab-21637111,3 bedroom Whistler Chalet,Chalet,Entire home/apt,11/11/17,2017-11-11,5-22-19,2019-05-22,50.14203,-122.97037,21637111,157449790
ab-7206537,Closest B&B to Whistler Village,Bed and breakfast,Private room,7/5/15,2015-07-05,5-21-19,2019-05-21,50.12292,-122.94787,7206537,37735687
ab-14466766,Excellent 3 Bedroom Whistler Townhome,Entire townhouse,Entire home/apt,8/10/16,2016-08-10,3-1-18,2018-03-01,50.11903405,-122.9589753,14466766,65790915
ab-21641395,Whistler Cascade lodge 7th night free ICE,Resort,Entire home/apt,11/6/17,2017-11-06,5-22-19,2019-05-22,50.11595,-122.95648,21641395,8440595
ab-21641397,Whistler Cascade lodge Presidents week Holiday!!,Condominium,Entire home/apt,11/6/17,2017-11-06,5-22-19,2019-05-22,50.11627,-122.95739,21641397,8440595
ab-21644343,Gorgeous Family Chalet,Chalet,Entire home/apt,11/6/17,2017-11-06,5-23-19,2019-05-23,50.12976,-122.94924,21644343,47037987
ab-21646403,Whistler Village 2 Bed 2 Bath Townhouse,Entire townhouse,Entire home/apt,11/6/17,2017-11-06,1-6-18,2018-01-06,50.12015919,-122.9582572,21646403,123938806
ab-14467308,Excellent Whistler Studio + Loft  Condo,Condominium,Entire home/apt,8/10/16,2016-08-10,10-12-17,2017-10-12,50.11434916,-122.9551572,14467308,65790915
ab-21649590,"Brim Haus | Whistler Views, Walk to Gondola",Townhouse,Entire home/apt,12/8/17,2017-12-08,5-22-19,2019-05-22,50.09333,-122.99202,21649590,11378974
ab-14467694,"Unique, iconic airstream w/ nature",Camper/RV,Entire home/apt,8/10/16,2016-08-10,5-21-19,2019-05-21,50.13582,-122.9523,14467694,333213
ab-14467742,Beautiful 1 Bedroom Whistler Condo,Condominium,Entire home/apt,8/10/16,2016-08-10,10-11-17,2017-10-11,50.11538806,-122.9488668,14467742,65790915
ab-12422585,Luxurious Whistler Ski-in/Ski-out 1 Bedroom Condo,Apartment,Entire home/apt,4/12/16,2016-04-12,6-18-18,2018-06-18,50.1184708,-122.9419708,12422585,27184506
ab-9547159,Luxury Montebello Townhouse with Hot Tub,Townhouse,Entire home/apt,11/18/15,2015-11-18,5-24-19,2019-05-24,50.12293,-122.95572,9547159,49440996
ab-9547930,Charming Chalet w/ Fairway Views by Harmony Whistler,Townhouse,Entire home/apt,11/18/15,2015-11-18,5-23-19,2019-05-23,50.12157,-122.94121,9547930,35393628
ab-8211415,HEART OF WHISTLER  270 DEG VIEW,Apartment,Entire home/apt,9/3/15,2015-09-03,11-14-16,2016-11-14,50.11905284,-122.9562094,8211415,43299287
ab-21656132,Whistler Cascade lodge Prime  Weeks 7th night free,Resort,Entire home/apt,11/8/17,2017-11-08,5-24-19,2019-05-24,50.11588,-122.95711,21656132,8440595
ab-21656137,Whistler Cascade lodge Prime week 7th night free,Condominium,Entire home/apt,11/8/17,2017-11-08,5-23-19,2019-05-23,50.11751,-122.95872,21656137,8440595
ab-21659387,Christmas in Whistler,Entire timeshare,Entire home/apt,11/8/17,2017-11-08,12-24-17,2017-12-24,50.09256563,-122.9933536,21659387,1544811
ab-21660812,Cozy Creekside Gem!,Condominium,Entire home/apt,11/8/17,2017-11-08,5-21-19,2019-05-21,50.10135,-122.99137,21660812,157656975
ab-9549840,Inn at Clifftop Lane - T.A. 5* B&B,Bed & Breakfast,Private room,11/24/16,2016-11-24,4-29-17,2017-04-29,50.08941779,-123.0113494,9549840,11487888
ab-13847432,Family friendly 2 bed 2 bath,Apartment,Entire home/apt,7/4/16,2016-07-04,9-28-16,2016-09-28,50.07688984,-123.0401999,13847432,52651402
ab-21664008,"Beautiful 1Br-Steps to SkiLift, Shops, Restaurants",Apartment,Entire home/apt,11/21/17,2017-11-21,5-24-19,2019-05-24,50.09312,-122.99174,21664008,157679614
ab-21664311,Ski-in/Ski-out Chalet Nice&Luxury Property!,Chalet,Entire home/apt,11/8/17,2017-11-08,11-21-17,2017-11-21,50.11557768,-122.9389936,21664311,156821146
ab-21665328,"Cozy Studio w/ fabulous view, walking distance to Creekside Gondola & shops",Apartment,Entire home/apt,11/8/17,2017-11-08,5-24-19,2019-05-24,50.09812,-122.99018,21665328,56846406
ab-21666348,Whistler Village Ski-in/Ski-out Condo,Resort,Entire home/apt,11/8/17,2017-11-08,9-12-18,2018-09-12,50.11368058,-122.954549,21666348,12925982
ab-21666629,Whistler Village Holiday Vacation Getaway,Timeshare,Entire home/apt,11/8/17,2017-11-08,4-21-18,2018-04-21,50.11485946,-122.9543014,21666629,157704202
ab-21667756,Lake Placid Lodge Creekside luxury pool/hot tub,Condominium,Entire home/apt,11/21/17,2017-11-21,5-24-19,2019-05-24,50.09415,-122.9908,21667756,23086110
ab-1573612,Whistler Alpine Chalet - Chateau,House,Entire home/apt,8/23/13,2013-08-23,5-24-19,2019-05-24,50.10679,-122.97585,1573612,8363114
ab-21679137,"Spacious 1 Bedroom Suite with Loft, Balcony, Full Kitchen, + Fireplace",Condominium,Entire home/apt,11/11/17,2017-11-11,9-3-18,2018-09-03,50.11794347,-122.9547137,21679137,151701730
ab-21679143,VERY Spacious 1 Bedroom Suite with Loft and Awesome Private Patio,Condominium,Entire home/apt,11/11/17,2017-11-11,5-13-18,2018-05-13,50.11928257,-122.9564333,21679143,151701730
ab-21679724,Cascade 613 by Elevate Real Estate Management,Apartment,Entire home/apt,11/8/17,2017-11-08,10-21-18,2018-10-21,50.11745999,-122.9571228,21679724,134284463
ab-15257646,Luxurious 1 bdrm w/Heated Pool & HotTub,Apartment,Entire home/apt,9/26/16,2016-09-26,5-24-19,2019-05-24,50.09326,-122.99134,15257646,81563638
ab-21680045,Modern Marketplace Lodge,Apartment,Entire home/apt,11/21/17,2017-11-21,5-20-19,2019-05-20,50.11952,-122.95463,21680045,74532005
ab-21682056,The Alpine Suite,Guest suite,Entire home/apt,11/8/17,2017-11-08,11-11-17,2017-11-11,50.15605401,-122.9618007,21682056,69373917
ab-1598193,3 bed Beautiful Ski in/Out Mountain Star,Townhouse,Entire home/apt,8/29/13,2013-08-29,5-24-19,2019-05-24,50.11417,-122.93887,1598193,8520466
ab-9564241,"Cozy & modern condo in Whistler, BC",Condominium,Entire home/apt,11/19/15,2015-11-19,5-22-19,2019-05-22,50.10161,-122.98558,9564241,33454171
ab-21683571,Whistler Creekside Condo with private hot tub,Entire condominium,Entire home/apt,11/13/17,2017-11-13,1-2-18,2018-01-02,50.09879446,-122.9872015,21683571,7810393
ab-21683592,2 BR Whistler Lakefront Condo,Condominium,Entire home/apt,11/21/17,2017-11-21,5-22-19,2019-05-22,50.11243,-122.97814,21683592,44187547
ab-21685319,Whistler Cornacopia 2Bdrm  @ Twin Peaks $249/nght,Condominium,Entire home/apt,11/8/17,2017-11-08,11-11-17,2017-11-11,50.11952584,-122.9596068,21685319,31839700
ab-21685453,Whistler Sleeps 4-5,Condominium,Entire home/apt,11/11/17,2017-11-11,5-23-19,2019-05-23,50.11725,-122.95932,21685453,49170887
ab-21691977,Alpine Greens,Townhouse,Entire home/apt,11/11/17,2017-11-11,5-24-19,2019-05-24,50.12021,-122.94133,21691977,153388448
ab-21693027,Charming Creekside townhouse,Condominium,Entire home/apt,11/11/17,2017-11-11,5-23-19,2019-05-23,50.09188,-122.99293,21693027,2445432
ab-9566204,Whistler's Olympic Luxury Mtn Condo,Condominium,Entire home/apt,11/19/15,2015-11-19,5-21-19,2019-05-21,50.1103,-122.97003,9566204,49526623
ab-7220338,Beautiful Chalet / Mountain Views / Hot Tub,Chalet,Entire home/apt,11/22/16,2016-11-22,4-21-18,2018-04-21,50.14069533,-122.9695691,7220338,37522263
ab-7222857,2 bd2bth prvte hot tub KING bed No bunks Free prkg,Apartment,Entire home/apt,7/6/15,2015-07-06,5-22-19,2019-05-22,50.1203,-122.95624,7222857,37441134
ab-14474170,4 Bedroom Whistler Townhome,Apartment,Entire home/apt,8/10/16,2016-08-10,11-9-16,2016-11-09,50.11095492,-122.9575307,14474170,25777071
ab-17624297,Modern Whistler Luxury Cabin on quiet street,House,Entire home/apt,3/6/17,2017-03-06,10-10-18,2018-10-10,50.12428332,-122.9683505,17624297,119837775
ab-18997978,Best Ski-in/out Studio in the Upper Village,Apartment,Entire home/apt,5/27/17,2017-05-27,5-24-19,2019-05-24,50.11572,-122.94712,18997978,127555075
ab-18506319,Whistler Village North Studio - Dream location!,Apartment,Entire home/apt,9/4/17,2017-09-04,5-20-19,2019-05-20,50.11818,-122.95491,18506319,616508
ab-21716964,Cat's Ski Paradise,Townhouse,Entire home/apt,11/11/17,2017-11-11,5-23-19,2019-05-23,50.09264,-122.99191,21716964,158125726
ab-16783781,Cozy Creekside Loft - Gondola 7 min walk,Loft,Entire home/apt,1/13/17,2017-01-13,5-21-19,2019-05-21,50.09791,-122.99006,16783781,4567321
ab-16784303,Embarc Whistler 2 bdrm condo,Condominium,Entire home/apt,1/13/17,2017-01-13,5-25-19,2019-05-25,50.11882,-122.94512,16784303,14143158
ab-21717252,"3 bedroom, 2 bath Whistler Upper Village townhouse",Townhouse,Entire home/apt,11/11/17,2017-11-11,5-20-19,2019-05-20,50.11878,-122.9423,21717252,96453221
ab-15912096,"1BR Luxuryâ€“True SI/SO,Pool,3 HTubs,Bike Storage",Condominium,Entire home/apt,11/9/16,2016-11-09,1-6-19,2019-01-06,50.11621949,-122.9455403,15912096,21664441
ab-21718294,Christmas on the Whistler Benchlands !!,Other,Entire home/apt,11/11/17,2017-11-11,11-24-17,2017-11-24,50.12300131,-122.9360242,21718294,57481105
ab-3679605,Totem Chalet- Blueberry,House,Entire home/apt,8/14/17,2017-08-14,5-21-19,2019-05-21,50.11756,-122.96843,3679605,18700501
ab-21723792,Whistler Creekside 2BR + Den  walk to Gondola 2,Condominium,Entire home/apt,11/13/17,2017-11-13,5-21-19,2019-05-21,50.09313,-122.99448,21723792,8440595
ab-21723794,Whistler Creekside Prime Time  Stays 7thnight FREE,Condominium,Entire home/apt,11/13/17,2017-11-13,5-20-19,2019-05-20,50.09144,-122.99471,21723794,8440595
ab-13185680,Luxury Whistler Location 3 bed w/private hot tub,Townhouse,Entire home/apt,5/24/16,2016-05-24,5-21-19,2019-05-21,50.12421,-122.95584,13185680,73766660
ab-9576504,Spectacular Log Home,House,Entire home/apt,12/5/16,2016-12-05,11-22-17,2017-11-22,50.12508326,-122.9648961,9576504,10736790
ab-15913462,Whistler on the Lake - 1bdrm,Apartment,Entire home/apt,11/9/16,2016-11-09,5-22-19,2019-05-22,50.11229,-122.97622,15913462,7366543
ab-6347134,"Ski-in/ski-out, deck w/ best views!",Apartment,Entire home/apt,5/9/15,2015-05-09,10-7-17,2017-10-07,50.11603109,-122.9434738,6347134,15007481
ab-16791490,Whistler Mountainside Lodge,Resort,Entire home/apt,1/13/17,2017-01-13,5-21-19,2019-05-21,50.11421,-122.95437,16791490,430113
ab-9577731,Ski In/Out Whistler Suite+Kitchen,Condominium,Entire home/apt,11/20/15,2015-11-20,1-21-17,2017-01-21,50.09416728,-122.9901341,9577731,21730154
ab-13187792,Whistler Village Luxury Ski Access Home Sleeps 13,Townhouse,Entire home/apt,5/24/16,2016-05-24,5-22-19,2019-05-22,50.10912,-122.95881,13187792,73789949
ab-1620315,Ski in/Ski out 2br Suite - Whistler,Resort,Entire home/apt,9/3/13,2013-09-03,5-22-19,2019-05-22,50.11588,-122.94297,1620315,7054805
ab-8226810,"1 Bedroom, 1 Bath Condo",Apartment,Entire home/apt,9/4/15,2015-09-04,5-22-19,2019-05-22,50.0913,-122.99247,8226810,43381703
ab-8227014,Whistler 2br - Tyndall Stone Lodge,Resort,Entire home/apt,9/4/15,2015-09-04,5-22-19,2019-05-22,50.11766,-122.95646,8227014,7054805
ab-16793278,Executive condo in the Village with unreal view!,Apartment,Entire home/apt,1/14/17,2017-01-14,5-22-19,2019-05-22,50.12033,-122.95679,16793278,105378722
ab-16793791,"Town Plaza: 1-Bedroom, Sleeps 4, Full Kitchen",Serviced apartment,Entire home/apt,1/14/17,2017-01-14,5-23-19,2019-05-23,50.11867,-122.95463,16793791,27042710
ab-20231517,"Greyguard, a Contemporary Hideaway above Creekside",Apartment,Entire home/apt,8/2/17,2017-08-02,5-22-19,2019-05-22,50.09393,-122.99263,20231517,45175253
ab-15273680,White Gold home,House,Entire home/apt,9/27/16,2016-09-27,1-11-17,2017-01-11,50.12372192,-122.9486875,15273680,1740764
ab-18508671,"3 bedroom, 3 full bath townhouse",Condominium,Entire home/apt,4/29/17,2017-04-29,5-13-17,2017-05-13,50.08015025,-123.0434647,18508671,11915026
ab-18509778,town plaza bear lodge one bedroom condo,Apartment,Entire home/apt,5/1/17,2017-05-01,5-22-19,2019-05-22,50.11769,-122.95432,18509778,127728047
ab-17637069,ã…¤True Ski-in & out Aspens on Blackcomb,Condominium,Entire home/apt,3/7/17,2017-03-07,5-21-19,2019-05-21,50.11612,-122.94407,17637069,17197633
ab-9588125,"Spacious Valhalla  2 bdm, 2.5 bath",Townhouse,Entire home/apt,11/20/15,2015-11-20,5-24-19,2019-05-24,50.12062,-122.95962,9588125,22619214
ab-19000276,Walk to Lifts & Lakes from this Creekside Gem,Apartment,Entire home/apt,5/28/17,2017-05-28,5-20-19,2019-05-20,50.09605,-122.9919,19000276,84821274
ab-6358649,Large 3 bedroom at Blackcomb base,Condominium,Entire home/apt,7/11/18,2018-07-11,7-11-18,2018-07-11,50.11611267,-122.9482592,6358649,33070892
ab-14488287,5 Bedroom Village Townhome,Apartment,Entire home/apt,8/11/16,2016-08-11,10-30-16,2016-10-30,50.11488284,-122.9502681,14488287,68404496
ab-13191526,well appointed motor coach,Camper/RV,Entire home/apt,5/25/16,2016-05-25,1-30-17,2017-01-30,50.11616485,-122.9469401,13191526,6307461
ab-16797366,"Modern 3br Home, Private Hot Tub, Walk to Village",Townhouse,Entire home/apt,1/14/17,2017-01-14,5-23-19,2019-05-23,50.12061,-122.95425,16797366,72781239
ab-16797881,"Private Hot Tub, Whistler Village, Queen Ensuite",Condominium,Entire home/apt,1/14/17,2017-01-14,5-24-19,2019-05-24,50.12189,-122.95724,16797881,44436278
ab-16797924,Bright Open Studio in the Heart of Whistler,Apartment,Entire home/apt,1/14/17,2017-01-14,5-23-19,2019-05-23,50.11785,-122.95812,16797924,22162240
ab-15275563,Beautiful Whistler villa for rent,Villa,Entire home/apt,9/27/16,2016-09-27,11-10-16,2016-11-10,50.10785941,-122.9676968,15275563,14339598
ab-15276437,Spacious 3 Bedroom by Whistler Village,Townhouse,Entire home/apt,9/27/16,2016-09-27,10-3-16,2016-10-03,50.1197403,-122.9367884,15276437,44808435
ab-15929476,Beautifully Renovated 2bed/2bath Ski In-Ski Out,Condominium,Entire home/apt,11/10/16,2016-11-10,2-20-17,2017-02-20,50.11639514,-122.9468734,15929476,103367528
ab-1640504,Luxery Townhome 1 kilometre  from Whistler Village,Townhouse,Entire home/apt,9/7/13,2013-09-07,5-23-19,2019-05-23,50.11264,-122.97397,1640504,8710291
ab-7242448,Elegant Ski/In/Out  2Bdrm at the Woodrun,Condominium,Entire home/apt,7/7/15,2015-07-07,5-22-19,2019-05-22,50.11601,-122.94551,7242448,30931672
ab-9592411,"Woodrun ski in, ski out, hot tub",Condominium,Entire home/apt,11/21/15,2015-11-21,5-24-19,2019-05-24,50.11689,-122.94341,9592411,22619214
ab-15932603,PEO Whistler: 1 Bedroom in village w/ mtn view,Apartment,Entire home/apt,11/10/16,2016-11-10,5-22-19,2019-05-22,50.11811,-122.9561,15932603,102941925
ab-6363338,Whistler Village vaulted with views,Condominium,Entire home/apt,5/10/15,2015-05-10,9-25-17,2017-09-25,50.11964536,-122.9548844,6363338,3200798
ab-15284828,Luxury Ski In/Off Whistler,Townhouse,Entire home/apt,9/28/16,2016-09-28,8-13-17,2017-08-13,50.11122949,-122.9597679,15284828,12983268
ab-14489731,Contemporary brand new renovation !,Apartment,Entire home/apt,8/11/16,2016-08-11,5-24-19,2019-05-24,50.1162,-122.95437,14489731,27383344
ab-20238134,Siri Lagoon Townhouse in Whistler,Apartment,Entire home/apt,8/2/17,2017-08-02,5-22-19,2019-05-22,50.11881,-122.95998,20238134,144202142
ab-15935566,Fabulous ski-in/ski-out at Whistler!,Resort,Entire home/apt,11/11/16,2016-11-11,5-25-19,2019-05-25,50.11489,-122.94423,15935566,31180611
ab-16807682,Blackcomb Cabin - Ski-in / Ski-out -Cozy 2 bedroom,Apartment,Entire home/apt,1/15/17,2017-01-15,5-22-19,2019-05-22,50.11641,-122.94133,16807682,3017832
ab-16807820,King Studio in Whistler Village,Condominium,Entire home/apt,1/15/17,2017-01-15,2-9-17,2017-02-09,50.11359445,-122.9547107,16807820,7326841
ab-18521782,Cascade Lodge - Whistler - 1 BR apartment for 4,Condominium,Private room,5/1/17,2017-05-01,9-27-17,2017-09-27,50.11614597,-122.9580161,18521782,81977915
ab-16808078,Queen Loft in Whistler Village,Condominium,Entire home/apt,1/15/17,2017-01-15,2-8-17,2017-02-08,50.11426754,-122.9533998,16808078,7326841
ab-1661235,Canada-Whistler-Cascade Lodge Resort 1 Bdrm Condo,Condominium,Entire home/apt,9/12/13,2013-09-12,5-22-19,2019-05-22,50.11668,-122.95695,1661235,602654
ab-4998604,Fantastic Ski in/ski out 2B Blackcomb,Other,Entire home/apt,12/27/14,2014-12-27,4-15-17,2017-04-15,50.11684421,-122.94472,4998604,25751978
ab-12491115,400 sq ft ski in/out Townhouse at Creekside,Apartment,Entire home/apt,4/15/16,2016-04-15,5-21-19,2019-05-21,50.09351,-122.99344,12491115,5813139
ab-1669273,Enjoy the best home in Whistler!,Guest suite,Entire home/apt,9/14/13,2013-09-14,5-24-19,2019-05-24,50.11301,-122.94866,1669273,3004958
ab-12493044,Bear Lodge- Whistler Village- 2 BD,Condominium,Entire home/apt,4/15/16,2016-04-15,5-21-19,2019-05-21,50.1183,-122.95425,12493044,11416827
ab-1671591,WhistlerBlackcomb Vacation Paradise,Chalet,Entire home/apt,9/14/13,2013-09-14,10-18-17,2017-10-18,50.11831177,-122.9399145,1671591,4674221
ab-1672067,Canada-Whistler-Sundance Resort 1 Bedroom Condo,Condominium,Entire home/apt,9/15/13,2013-09-15,5-21-19,2019-05-21,50.09186,-122.99428,1672067,602654
ab-1673009,Whistler Village Getaway,House,Entire home/apt,9/18/17,2017-09-18,5-22-19,2019-05-22,50.12146,-122.95732,1673009,8856335
ab-1677648,Quiet 2BR Townhome in Village North,Townhouse,Entire home/apt,9/16/13,2013-09-16,5-23-19,2019-05-23,50.12046,-122.95734,1677648,8848395
ab-13877713,Lake Placid Lodge Whistler 1BR,Condominium,Entire home/apt,7/6/16,2016-07-06,5-21-19,2019-05-21,50.11638,-122.9576,13877713,52651623
ab-19642641,Five Star Mountain Getaway,House,Entire home/apt,7/1/17,2017-07-01,3-27-18,2018-03-27,50.15129722,-122.9690809,19642641,138247839
ab-1703754,Whistler 2br/2ba Suite at Creekside,Serviced apartment,Entire home/apt,9/22/13,2013-09-22,5-23-19,2019-05-23,50.09946,-122.98578,1703754,7054805
ab-3749947,Whistler Home,House,Entire home/apt,7/28/14,2014-07-28,7-31-17,2017-07-31,50.08956826,-122.9940601,3749947,19185270
ab-9615681,1 BEDROOM CLUB INTRAWEST DEC.19 2018-JAN.2 2019,Serviced apartment,Entire home/apt,11/22/15,2015-11-22,5-22-19,2019-05-22,50.118,-122.94721,9615681,7088980
ab-14519452,Aspens ski in ski out 1 bedroom pool hot tubs gym,Apartment,Entire home/apt,8/13/16,2016-08-13,12-8-16,2016-12-08,50.11502756,-122.944589,14519452,13232844
ab-6394044,Whistler Saddle House Luxury Chalet,House,Entire home/apt,5/12/15,2015-05-12,5-22-19,2019-05-22,50.14258,-122.95006,6394044,33339556
ab-13882474,Whistler Studio -Center of Village Square! Sleeps2,Apartment,Entire home/apt,7/6/16,2016-07-06,5-23-19,2019-05-23,50.11482,-122.95592,13882474,317618
ab-12517488,Perfect 1 Bedroom Whistler Condo,Apartment,Entire home/apt,4/17/16,2016-04-17,10-13-17,2017-10-13,50.12025661,-122.93684,12517488,65790915
ab-8275123,Whistler - Mountain Escape,Chalet,Entire home/apt,9/7/15,2015-09-07,5-23-19,2019-05-23,50.14235,-122.96635,8275123,25912216
ab-19018021,Deluxe Ski In/Ski Out Contemporary 2 Bdrm/2Bath,Condominium,Entire home/apt,5/29/17,2017-05-29,5-24-19,2019-05-24,50.11489,-122.94535,19018021,110224232
ab-12519850,Fantastic Hideaway by the Hill,Loft,Entire home/apt,4/17/16,2016-04-17,5-24-19,2019-05-24,50.09448,-122.99268,12519850,22737121
ab-3772503,3 Bdrm home with mountain views,House,Entire home/apt,1/16/17,2017-01-16,4-30-17,2017-04-30,50.15339208,-122.9634235,3772503,13206457
ab-8277017,Le Chamois- Premium Ski In/Out 1 Bed 1 Bath Condo,Condominium,Entire home/apt,9/7/15,2015-09-07,4-29-19,2019-04-29,50.11663,-122.94786,8277017,24838203
ab-8277037,Mountainside Treehouse,Condominium,Entire home/apt,11/8/17,2017-11-08,5-21-19,2019-05-21,50.09309,-122.99309,8277037,10556310
ab-15302843,Mountainside Lodge 1 bdrm Loft unit sleeps 5,Condominium,Entire home/apt,9/29/16,2016-09-29,10-3-16,2016-10-03,50.11564774,-122.9534508,15302843,248752
ab-12520844,Townhouse in the heart of Whistler,Townhouse,Entire home/apt,5/24/17,2017-05-24,10-21-18,2018-10-21,50.11610021,-122.9608741,12520844,942217
ab-19019207,Luxury Quiet Blackcomb Townhouse w/ Gorgeous Views,Townhouse,Private room,5/29/17,2017-05-29,5-22-19,2019-05-22,50.11487,-122.9388,19019207,132707450
ab-18527816,Private one bedroom suite,In-law,Entire home/apt,5/1/17,2017-05-01,8-27-17,2017-08-27,50.1269703,-122.957921,18527816,81268390
ab-18528220,Private Queen Bedroom in Beautiful Chalet Home,Chalet,Private room,5/1/17,2017-05-01,6-12-17,2017-06-12,50.15179642,-122.9670264,18528220,128629357
ab-9646768,Private Hot Tub In  the Village,Condominium,Entire home/apt,12/5/16,2016-12-05,12-21-18,2018-12-21,50.12061048,-122.9598791,9646768,4010718
ab-15942527,Whiski Jack Condo,Timeshare,Entire home/apt,11/11/16,2016-11-11,11-21-16,2016-11-21,50.09443954,-122.9917913,15942527,82240168
ab-9650934,Whistler Slopeside Condo,Condominium,Entire home/apt,11/24/15,2015-11-24,5-23-19,2019-05-23,50.11807,-122.94395,9650934,49893167
ab-5005984,Wildwood 308 - Beautiful Mt Side,Apartment,Entire home/apt,12/28/14,2014-12-28,5-22-19,2019-05-22,50.11821,-122.94222,5005984,25815370
ab-9652139,Bright Studio Room with Hot Tub,House,Private room,5/24/17,2017-05-24,5-21-19,2019-05-21,50.08485,-123.01817,9652139,48175891
ab-13220579,"Economical, Family-Friendly, Prime Location!",Condominium,Entire home/apt,5/26/16,2016-05-26,5-4-19,2019-05-04,50.11638,-122.9463,13220579,4397876
ab-18542154,1 Bedroom Mountain Nest steps to Creekside gondola,Condominium,Entire home/apt,9/18/17,2017-09-18,5-24-19,2019-05-24,50.09113,-122.99278,18542154,12412745
ab-15952335,Cozy Original A Frame in Blueberry,House,Entire home/apt,11/12/16,2016-11-12,9-24-18,2018-09-24,50.10965236,-122.9749362,15952335,56769012
ab-20254591,Whistler Village CozyTownhome - Walk to Lifts!,Townhouse,Entire home/apt,8/3/17,2017-08-03,5-22-19,2019-05-22,50.11868,-122.95969,20254591,20815398
ab-12536158,Enjoy Winter in Whistler,Entire apartment,Entire home/apt,4/18/16,2016-04-18,1-10-18,2018-01-10,50.12181852,-122.9337734,12536158,49294009
ab-9661523,"In the Village, Private Hot Tub, 2 mnts to lifts",Townhouse,Entire home/apt,12/8/16,2016-12-08,12-19-18,2018-12-19,50.12171107,-122.9603767,9661523,12988765
ab-9661748,Englewood Greens Spacious Townhouse,Townhouse,Entire home/apt,11/24/15,2015-11-24,5-22-19,2019-05-22,50.14086,-122.95458,9661748,15084819
ab-9662157,Ski in/Ski out  Mountain Hideaway,House,Entire home/apt,11/24/15,2015-11-24,5-24-19,2019-05-24,50.09628,-122.98188,9662157,6726305
ab-15954040,Beautiful 2 bedroom newly renovated apartment,Apartment,Entire home/apt,11/12/16,2016-11-12,5-22-19,2019-05-22,50.10403,-122.98288,15954040,103585011
ab-19035923,1 BR Modern Townhome with Outdoor Hot Tub and Pool,Townhouse,Entire home/apt,5/30/17,2017-05-30,5-24-19,2019-05-24,50.12076,-122.95696,19035923,3916735
ab-15954914,*Cozy Modern Condo right in Whistler Village*,Apartment,Entire home/apt,11/12/16,2016-11-12,5-23-19,2019-05-23,50.11525,-122.95499,15954914,103594601
ab-17651752,Beautiful Family Home at Prestigious Location,House,Entire home/apt,3/8/17,2017-03-08,8-22-18,2018-08-22,50.12193608,-122.970024,17651752,83196803
ab-15955626,Newly Renovated Whistler Studio Min to Lifts,Apartment,Entire home/apt,11/12/16,2016-11-12,5-21-19,2019-05-21,50.09675,-122.99405,15955626,66676446
ab-15957319,Emerald Cozy Crib,Other,Entire home/apt,11/12/16,2016-11-12,3-28-17,2017-03-28,50.15993847,-122.9316143,15957319,2502760
ab-15958371,Private Room in Whistler Home (B),House,Private room,11/12/16,2016-11-12,6-17-17,2017-06-17,50.08855428,-122.9990295,15958371,49621708
ab-14530384,Cozy Creekside Ski in/Ski out with lots of beds,Apartment,Entire home/apt,8/13/16,2016-08-13,9-27-16,2016-09-27,50.09892783,-122.9865943,14530384,89842175
ab-19663576,Whistler Vacation Home,Resort,Private room,7/1/17,2017-07-01,5-22-19,2019-05-22,50.15239,-122.9671,19663576,79379
ab-7278222,Whistler Village North Condo,Condominium,Entire home/apt,7/9/15,2015-07-09,5-14-19,2019-05-14,50.11932,-122.95736,7278222,1035037
ab-14533461,Studio Living in the Heart of Whistler Village,Apartment,Private room,8/13/16,2016-08-13,5-24-19,2019-05-24,50.11544,-122.95355,14533461,38847503
ab-15968952,Whistler Sundance Sleeps 6-7,Condominium,Entire home/apt,11/13/16,2016-11-13,11-24-18,2018-11-24,50.0915372,-122.993354,15968952,39631194
ab-15969252,"Bright, Renovated 1 Bedroom Apartment in Whistler",Apartment,Entire home/apt,11/13/16,2016-11-13,4-12-19,2019-04-12,50.11712,-122.95573,15969252,68581273
ab-19674993,"Embarc Resort Whistler, Sleeps 4",Vacation home,Entire home/apt,7/2/17,2017-07-02,7-4-17,2017-07-04,50.11905824,-122.9450001,19674993,84746633
ab-15969320,At the base of Whistler Mountain (a),Condominium,Entire home/apt,11/13/16,2016-11-13,5-24-19,2019-05-24,50.09403,-122.99463,15969320,58766804
ab-15971669,Beautiful 3 bdrm Whistler loft sleeps 8,Timeshare,Entire home/apt,11/13/16,2016-11-13,12-19-16,2016-12-19,50.09245289,-122.9937139,15971669,17876150
ab-14538565,Whistler Creek Studio. Close to lifts + parking.,Apartment,Entire home/apt,8/14/16,2016-08-14,5-20-19,2019-05-20,50.09853,-122.99028,14538565,89945583
ab-13223187,Townhouse tucked away in a quiet wooded setting,Townhouse,Entire home/apt,5/27/16,2016-05-27,5-21-19,2019-05-21,50.08806,-122.99955,13223187,74198187
ab-13223270,Premier Ski-in/Out Condo with Pool & Hot Tub,Condominium,Entire home/apt,5/27/16,2016-05-27,5-24-19,2019-05-24,50.1168,-122.94186,13223270,30024526
ab-15973304,"Beautifully updated 3 bedroom, across from village",Townhouse,Entire home/apt,11/13/16,2016-11-13,5-22-19,2019-05-22,50.11784,-122.95911,15973304,103759261
ab-15975343,Private Room in Whistler Home (W),House,Private room,11/13/16,2016-11-13,12-9-16,2016-12-09,50.0872197,-123.0012798,15975343,49621708
ab-6416084,Quiet Whistler Village Townhouse -FREE PARKING,Townhouse,Entire home/apt,5/14/15,2015-05-14,5-22-19,2019-05-22,50.11844,-122.95962,6416084,32313569
ab-9666597,Gorgeous Home w/ Prime Location by Harmony Whistler,Apartment,Entire home/apt,11/25/15,2015-11-25,5-23-19,2019-05-23,50.11396,-122.95095,9666597,35393628
ab-19679562,Luxury 'Taluswood' 3BR family home w/ pool & hot tub access,Townhouse,Entire home/apt,7/2/17,2017-07-02,9-16-18,2018-09-16,50.0953672,-122.9801734,19679562,35393628
ab-16828904,1BR Condo Whistler Village Centre walk to Gondola,Condominium,Entire home/apt,1/16/17,2017-01-16,9-12-18,2018-09-12,50.11059993,-122.9589127,16828904,26650418
ab-3802963,"Ski-in, Ski-Out Condo, The Aspens",Serviced apartment,Entire home/apt,8/4/14,2014-08-04,5-24-19,2019-05-24,50.11696,-122.94313,3802963,2742136
ab-15982532,Twin Peaks Resort - 2 Bed 2 Bath - 101,Condominium,Entire home/apt,11/14/16,2016-11-14,6-10-18,2018-06-10,50.11974694,-122.9593168,15982532,3749031
ab-15983893,Convenient and Cozy Whistler Getaway,Apartment,Entire home/apt,11/14/16,2016-11-14,5-24-19,2019-05-24,50.11291,-122.96766,15983893,84821274
ab-6425508,1BR Lake Placid Lodge Ski-In/Ski-Out,Condominium,Entire home/apt,5/15/15,2015-05-15,4-1-19,2019-04-01,50.09294,-122.99014,6425508,26650418
ab-6425545,Room and en-suite Creekside &gt; 3 months only,Apartment,Private room,8/1/17,2017-08-01,8-8-18,2018-08-08,50.09813064,-122.9905924,6425545,4933482
ab-9670429,â›°ï¸ 1 Bdrm Modern Village Penthouse - view!,Serviced apartment,Entire home/apt,11/25/15,2015-11-25,5-24-19,2019-05-24,50.12003,-122.95704,9670429,23756437
ab-9674533,#219 -  Dusty's  at Alpenglow,Apartment,Entire home/apt,11/25/15,2015-11-25,11-12-18,2018-11-12,50.11938148,-122.9592181,9674533,35146399
ab-12568271,Stylish 1BR - Olympic Plaza,Condominium,Entire home/apt,4/19/16,2016-04-19,11-20-16,2016-11-20,50.11784984,-122.9576363,12568271,35393628
ab-7309151,Whistler Panoramic View Home,House,Entire home/apt,7/11/15,2015-07-11,9-6-18,2018-09-06,50.11566446,-122.9679473,7309151,7597745
ab-16844114,Village Location & PRIVATE Hot Tub by Harmony Whistler,Townhouse,Entire home/apt,1/17/17,2017-01-17,5-23-19,2019-05-23,50.12091,-122.95721,16844114,35393628
ab-7309668,Ë‘Studio Condo Upper Village Tranquility,Apartment,Entire home/apt,7/11/15,2015-07-11,5-21-19,2019-05-21,50.11842,-122.94734,7309668,17197633
ab-7310283,Ë™Hotel Room Upper Village Tranquility,Place,Entire home/apt,7/11/15,2015-07-11,5-23-19,2019-05-23,50.11763,-122.94706,7310283,17197633
ab-12572662,The Ski Shack at Creekside,Condominium,Entire home/apt,4/19/16,2016-04-19,5-24-19,2019-05-24,50.09428,-122.99146,12572662,9128545
ab-15988657,Village Location w/ PRIVATE Hot TubÂ by Harmony Whistler,Townhouse,Entire home/apt,11/14/16,2016-11-14,5-23-19,2019-05-23,50.11761,-122.9585,15988657,35393628
ab-12583932,2BR suite in quiet area with view,Apartment,Entire home/apt,4/20/16,2016-04-20,10-4-16,2016-10-04,50.1527539,-122.963394,12583932,68250504
ab-1745675,"Delux Ski-in-Out, 2 Bdrm, at Aspens",Serviced apartment,Entire home/apt,10/1/13,2013-10-01,5-24-19,2019-05-24,50.11565,-122.94403,1745675,9188291
ab-15990523,Alpine Meadows,House,Entire home/apt,11/14/16,2016-11-14,12-12-16,2016-12-12,50.14164757,-122.9731894,15990523,83053708
ab-1755873,"Whistler Studio in Village, Slps 2",Serviced apartment,Entire home/apt,10/4/13,2013-10-04,5-22-19,2019-05-22,50.11542,-122.95514,1755873,7054805
ab-1759361,Sunny 1bd walk to Creekside Gondola,Apartment,Entire home/apt,10/5/13,2013-10-05,5-22-19,2019-05-22,50.10077,-122.99111,1759361,5013704
ab-17653724,,,,3/8/17,2017-03-08,3-13-17,2017-03-13,50.1147654,-122.9440688,17653724,
ab-18546231,Lagoons -Updated Family-Friendly 2BD Village Condo,Apartment,Entire home/apt,5/2/17,2017-05-02,5-20-19,2019-05-20,50.11878,-122.95864,18546231,683972
ab-1767070,Alpine Greens,Apartment,Entire home/apt,10/6/13,2013-10-06,5-20-17,2017-05-20,50.11976904,-122.9425898,1767070,9232484
ab-17654995,Big studio in whistler village 1bed,Apartment,Entire home/apt,3/8/17,2017-03-08,5-10-17,2017-05-10,50.11592504,-122.9566075,17654995,117488011
ab-18547320,Powderhorn ~ Slopeside Family-Friendly 1BD+Den,Apartment,Entire home/apt,5/2/17,2017-05-02,5-24-19,2019-05-24,50.11756,-122.94219,18547320,683972
ab-12593762,Golf and Ski - 3 Bedroom Condo,Condominium,Entire home/apt,4/20/16,2016-04-20,3-30-19,2019-03-30,50.12197,-122.94042,12593762,12163601
ab-18548649,Peaceful Whistler Village 2 bedroom!,Condominium,Entire home/apt,5/2/17,2017-05-02,5-24-19,2019-05-24,50.11987,-122.9531,18548649,68581273
ab-1773216,Cozy & Comfortable 2 Br. Apt,Apartment,Entire home/apt,10/8/13,2013-10-08,5-5-18,2018-05-05,50.12785329,-122.954099,1773216,994065
ab-1773349,Bright Corner Townhome - Whistler,Townhouse,Entire home/apt,10/8/13,2013-10-08,5-24-19,2019-05-24,50.11954,-122.95792,1773349,8520466
ab-18549684,"Bear Lodge Beauty. Walk to the Lifts, Free Wifi!",Apartment,Entire home/apt,5/2/17,2017-05-02,10-2-18,2018-10-02,50.11656209,-122.9546469,18549684,68581273
ab-13248736,Spectacular views. Ski in Ski out - Taluswood,Townhouse,Entire home/apt,5/28/16,2016-05-28,5-24-19,2019-05-24,50.09387,-122.97978,13248736,74491524
ab-13249613,"Updated 1BR Townhouse with big, open deck",Townhouse,Entire home/apt,5/28/16,2016-05-28,5-24-19,2019-05-24,50.12053,-122.95752,13249613,13678071
ab-1785744,Whistler Village Location -  Deer Lodge 341,Apartment,Entire home/apt,10/11/13,2013-10-11,5-22-19,2019-05-22,50.11812,-122.95627,1785744,1747164
ab-1790202,Easy Walk to Creekside Gondola,Apartment,Entire home/apt,10/12/13,2013-10-12,7-12-17,2017-07-12,50.0917814,-122.9951524,1790202,4205365
ab-15312948,Whistler Village Studio,Apartment,Entire home/apt,10/1/16,2016-10-01,11-2-16,2016-11-02,50.12039813,-122.9588022,15312948,1351825
ab-16853059,Ski in/ Out The Aspens Whistler Blackcomb.,Condominium,Entire home/apt,1/18/17,2017-01-18,5-24-19,2019-05-24,50.11563,-122.94452,16853059,71116759
ab-16854391,Whistler is Waiting!,Timeshare,Private room,1/18/17,2017-01-18,1-28-17,2017-01-28,50.11640351,-122.954633,16854391,40293346
ab-20265221,Cascade Lodge Whistler 1BR,Other,Entire home/apt,8/3/17,2017-08-03,8-10-17,2017-08-10,50.11630698,-122.959554,20265221,52651623
ab-1847871,New Year ski in and out.,Apartment,Private room,10/25/13,2013-10-25,11-13-16,2016-11-13,50.11770823,-122.9588438,1847871,9652501
ab-16855662,Golf Course & Mountain Views by Harmony Whistler,Townhouse,Entire home/apt,1/18/17,2017-01-18,5-23-19,2019-05-23,50.12075,-122.93923,16855662,35393628
ab-18570205,Creekside,House,Private room,5/3/17,2017-05-03,5-24-19,2019-05-24,50.09215,-122.99649,18570205,123128367
ab-18571227,Quiet Condo with a View.  Outdoor Pool & Hot Tub!,Condominium,Entire home/apt,5/3/17,2017-05-03,5-24-19,2019-05-24,50.11306,-122.96979,18571227,68581273
ab-19698605,"Very quite yet close to everything, bonus parking",House,Entire home/apt,7/3/17,2017-07-03,8-26-17,2017-08-26,50.12557441,-122.9579451,19698605,81268390
ab-16001108,Cozy 2 Bedroom  Townhome,Townhouse,Entire home/apt,11/15/16,2016-11-15,5-23-19,2019-05-23,50.11994,-122.94129,16001108,12222801
ab-16001287,Whistler Creek Condo in  Creekside,Loft,Entire home/apt,11/15/16,2016-11-15,5-23-19,2019-05-23,50.09517,-122.99041,16001287,4488793
ab-19699026,Peaceful retreat,Condominium,Entire home/apt,7/3/17,2017-07-03,7-13-17,2017-07-13,50.11870762,-122.9432622,19699026,138782181
ab-18580868,2 Bedroom Whistler Village Penthouse,Condominium,Entire home/apt,5/4/17,2017-05-04,5-21-19,2019-05-21,50.11587,-122.95591,18580868,40938379
ab-18582676,Perfect location,Condominium,Entire home/apt,5/4/17,2017-05-04,7-18-18,2018-07-18,50.11405188,-122.9497107,18582676,23982760
ab-13263589,"Luxury Retreat - Snowridge Estate, Ski-in/out",House,Entire home/apt,5/29/16,2016-05-29,2-23-17,2017-02-23,50.09346919,-122.9870557,13263589,10699383
ab-15314435,"3 BDRM/Den, 3.5 Bath,Private Hot Tub,Steps To MTN",Townhouse,Entire home/apt,10/1/16,2016-10-01,6-25-17,2017-06-25,50.12561913,-122.9576255,15314435,14336814
ab-18584158,Whistler Creekside 4 Bedroom,Townhouse,Entire home/apt,5/4/17,2017-05-04,4-11-19,2019-04-11,50.09756,-122.98667,18584158,25777071
ab-19700576,"3Br Lux Townhome - True Ski in/out, Private HotTub",Townhouse,Entire home/apt,7/3/17,2017-07-03,5-24-19,2019-05-24,50.11375,-122.93958,19700576,135240653
ab-7331000,Taluswood Creekside Retreat,Condominium,Entire home/apt,7/12/15,2015-07-12,5-21-19,2019-05-21,50.09717,-122.97918,7331000,38407119
ab-3860531,Whistler first class ski in ski out,Apartment,Entire home/apt,8/11/14,2014-08-11,5-22-19,2019-05-22,50.11679,-122.94485,3860531,19919954
ab-20267620,Quiet Private Room,Townhouse,Private room,8/3/17,2017-08-03,9-15-17,2017-09-15,50.14749584,-122.9605176,20267620,38296333
ab-16004590,Montebello Place,House,Entire home/apt,11/15/16,2016-11-15,5-21-19,2019-05-21,50.12427,-122.95609,16004590,103277556
ab-16004813,"Valley Trail townhouse, 2min walk to the Village",Townhouse,Entire home/apt,11/15/16,2016-11-15,5-24-19,2019-05-24,50.1142,-122.96132,16004813,2285902
ab-16005743,Creekside studio FreeParking-5WalkMin to Gondola!!,Apartment,Entire home/apt,11/16/16,2016-11-16,5-24-19,2019-05-24,50.09642,-122.9952,16005743,103605631
ab-3866432,Beautiful townhouse in creekside,House,Entire home/apt,8/12/14,2014-08-12,5-23-19,2019-05-23,50.09878,-122.98607,3866432,2429264
ab-20269243,Mountain Top Oasis in Creekside,Condominium,Entire home/apt,8/4/17,2017-08-04,5-22-19,2019-05-22,50.09325,-122.99249,20269243,8831932
ab-16869006,Bayshores 1-bedroom Suite 15min walk to Creekside,Apartment,Entire home/apt,1/19/17,2017-01-19,2-20-17,2017-02-20,50.08817906,-122.9998163,16869006,11710118
ab-17667722,,,,3/9/17,2017-03-09,3-13-17,2017-03-13,50.08032897,-123.0409921,17667722,
ab-17667969,Heart of W / behind the curtain.,Apartment,Shared room,3/9/17,2017-03-09,7-17-18,2018-07-17,50.11821551,-122.956155,17667969,100458057
ab-17668009,2 Bed Ski-in-Ski-Out Comfort on Blackcomb Mtn,Townhouse,Entire home/apt,3/9/17,2017-03-09,5-22-19,2019-05-22,50.11423,-122.94162,17668009,778269
ab-8295201,"Enjoy the views, come relax north of the village",House,Private room,9/8/15,2015-09-08,9-24-16,2016-09-24,50.16159012,-122.9270719,8295201,20126998
ab-19703136,"Cascade Lodge Whistler Village 1 bedroom, sleeps 4",Serviced apartment,Entire home/apt,7/4/17,2017-07-04,3-30-19,2019-03-30,50.11586,-122.95701,19703136,122138209
ab-17668387,Modern 4 Bed Private Hot Tub Mountain Views,Townhouse,Entire home/apt,3/9/17,2017-03-09,5-22-19,2019-05-22,50.12629,-122.95327,17668387,96453221
ab-14576442,"Studio in Highlands, Whistler BC",Other,Entire home/apt,8/16/16,2016-08-16,6-22-17,2017-06-22,50.10082726,-122.9899669,14576442,1747962
ab-17670327,Modern lofted studio in Creekside,Loft,Entire home/apt,3/9/17,2017-03-09,9-2-17,2017-09-02,50.0974837,-122.992115,17670327,115952992
ab-13911940,Whistler,,,,#VALUE!,,#VALUE!,,,,
Cozy renovated  house ,,,,,#VALUE!,,#VALUE!,,,,
"comfy bedroom""",House,Private room,7/19/17,9-21-17,#VALUE!,Canada,#VALUE!,-122.9656948,,12258932,
ab-17671622,2BR Condo Heart of Whistler Village Facing Slopes,Apartment,Entire home/apt,3/9/17,2017-03-09,5-22-19,2019-05-22,50.11883,-122.95689,17671622,13669631
ab-5038687,Cozy Studio 100m from gondola!,Apartment,Entire home/apt,1/2/15,2015-01-02,5-24-19,2019-05-24,50.11354,-122.95466,5038687,3038949
ab-19050021,Whistler Creekside Condo,Townhouse,Entire home/apt,5/30/17,2017-05-30,6-8-17,2017-06-08,50.09416663,-122.9904162,19050021,132967125
ab-13913012,"Beautiful Mountain Views, 1 Blk to Village, Pool",Apartment,Entire home/apt,7/5/17,2017-07-05,5-24-19,2019-05-24,50.11737,-122.95748,13913012,20782482
ab-8305093,Whistler private,House,Private room,9/9/15,2015-09-09,10-10-16,2016-10-10,50.08205902,-123.0226034,8305093,37660244
ab-8309859,Canada-Whistler-Sundance Resort 2 Bd Condo,Condominium,Entire home/apt,9/9/15,2015-09-09,5-24-19,2019-05-24,50.0914,-122.99361,8309859,602654
ab-8310307,Canada-Whistler-Sundance Resort 2 Bdrm Loft,Condominium,Entire home/apt,9/9/15,2015-09-09,5-20-19,2019-05-20,50.09289,-122.99542,8310307,602654
ab-8310545,Canada-Whistler-Sundance Resort 2 Bdrm Plus Condo,Condominium,Entire home/apt,9/9/15,2015-09-09,5-20-19,2019-05-20,50.09328,-122.99359,8310545,602654
ab-15330329,Â·One Bedroom Condo Whistler Village 409,Condominium,Entire home/apt,10/1/16,2016-10-01,5-21-19,2019-05-21,50.11809,-122.95832,15330329,17197633
ab-5042096,"2BD 2BA @ Twin Peaks, in Heart of Whistler Village",Apartment,Entire home/apt,1/3/15,2015-01-03,5-24-19,2019-05-24,50.11956,-122.95753,5042096,12743554
ab-19052621,LAKE FRONT shared home. private room,House,Private room,4/2/18,2018-04-02,5-24-19,2019-05-24,50.15333,-122.93234,19052621,132955646
ab-16881326,Heart of Whistler Studio Loft 309,Apartment,Entire home/apt,1/19/17,2017-01-19,7-27-17,2017-07-27,50.11530684,-122.9562857,16881326,17197633
ab-16881706,LUXURY NEW LOFT AT CREEKSIDE,Townhouse,Entire home/apt,1/20/17,2017-01-20,6-11-17,2017-06-11,50.09455238,-122.9929516,16881706,7653251
ab-20279268,Le Chamois- Premium 1 Bedroom 1 Bathroom Condo,Condominium,Entire home/apt,8/4/17,2017-08-04,11-18-17,2017-11-18,50.11704916,-122.9493268,20279268,24838203
ab-6481342,"Lakeside Condo in Whistler, BC",Condominium,Entire home/apt,5/19/15,2015-05-19,5-22-19,2019-05-22,50.11127,-122.97689,6481342,23100826
ab-6482566,The Treetop Cabin,Townhouse,Entire home/apt,5/19/15,2015-05-19,5-25-19,2019-05-25,50.09442,-122.994,6482566,23675911
ab-6482575,Celebrate The New Year @ Whistler,Apartment,Entire home/apt,5/19/15,2015-05-19,5-22-19,2019-05-22,50.11512,-122.95333,6482575,7441198
ab-13280816,Beautiful 3 Bedroom Townhome,Townhouse,Entire home/apt,5/30/16,2016-05-30,11-11-16,2016-11-11,50.09259041,-122.9832395,13280816,68404496
ab-13281209,NEW RENOVATION 880 sqft /Walk to Hill/Free Parking,Apartment,Entire home/apt,5/30/16,2016-05-30,5-23-19,2019-05-23,50.09553,-122.99401,13281209,44202049
ab-16018099,The Aspens Whistler - ski in/ski out condo,Condominium,Entire home/apt,11/16/16,2016-11-16,5-20-19,2019-05-20,50.11584,-122.94348,16018099,7385012
ab-16018699,Great location in Whistler Creekside,Entire townhouse,Entire home/apt,11/16/16,2016-11-16,3-8-18,2018-03-08,50.10016826,-122.9850645,16018699,62487110
ab-16886218,"Walk to Village, Lake & Market-2 beds semi-private",House,Private room,1/20/17,2017-01-20,8-27-17,2017-08-27,50.12753631,-122.9566752,16886218,81268390
ab-16020347,Family friendly town-home - Hot tub/Parking/Ski-in,Townhouse,Entire home/apt,11/17/16,2016-11-17,5-21-19,2019-05-21,50.12018,-122.93926,16020347,2025594
ab-16026160,Cozy 2BD on Alta Lake in Whistler,Apartment,Entire home/apt,11/17/16,2016-11-17,7-18-17,2017-07-18,50.12207547,-122.9762873,16026160,44682377
ab-13283018,Brand New Mountain View Village 1 Bedroom,Serviced apartment,Entire home/apt,5/30/16,2016-05-30,5-24-19,2019-05-24,50.11864,-122.95675,13283018,23756437
ab-7365616,"Village Gatehouse, Whistler, BC",Condominium,Entire home/apt,7/13/15,2015-07-13,5-22-19,2019-05-22,50.11674,-122.95618,7365616,37275892
ab-16890600,Cozy Studio in Whistler,Apartment,Entire home/apt,1/20/17,2017-01-20,10-30-17,2017-10-30,50.10056324,-122.9912462,16890600,112675158
ab-16031899,A Mountain Home Away From Home,House,Entire home/apt,11/17/16,2016-11-17,10-20-17,2017-10-20,50.10578429,-122.9690022,16031899,104298055
ab-7368247,Central Whistler Getaway,Entire house,Entire home/apt,3/10/18,2018-03-10,3-10-18,2018-03-10,50.12614237,-122.9638907,7368247,1024137
ab-9738552,Whistler 2 Bdrm Condo @ Marketplace,Condominium,Entire home/apt,11/29/15,2015-11-29,5-23-19,2019-05-23,50.12058,-122.9592,9738552,15899957
ab-9739474,Walk to Lifts/ Ski Passes included!,Apartment,Private room,11/29/15,2015-11-29,4-4-17,2017-04-04,50.11524024,-122.9546481,9739474,1520446
ab-16039095,Amazing Views,Apartment,Entire home/apt,11/18/16,2016-11-18,5-23-19,2019-05-23,50.11298,-122.97156,16039095,104378666
ab-15337515,Whistler Sundance 2 Bedroom Condo,Condominium,Entire home/apt,10/1/16,2016-10-01,5-24-19,2019-05-24,50.09261,-122.99379,15337515,16913110
ab-19054186,"Large, bright main street studio with pool/hot tub",Condominium,Entire home/apt,6/1/17,2017-06-01,5-23-19,2019-05-23,50.11835,-122.95793,19054186,11166244
ab-16040255,Slopeside nest Blackcomb: Great View; Great Value!,Apartment,Entire home/apt,11/18/16,2016-11-18,5-23-19,2019-05-23,50.11773,-122.9438,16040255,48092719
ab-16041781,Studio Condo Whistler Village 207,Apartment,Entire home/apt,11/18/16,2016-11-18,5-24-19,2019-05-24,50.11901,-122.9595,16041781,17197633
ab-16896008,Worldmark Sundance,Resort,Entire home/apt,1/20/17,2017-01-20,5-22-19,2019-05-22,50.09283,-122.99484,16896008,111935967
ab-16897024,Treehouse Suite | 2 Bedroom | Secluded in Nature,House,Entire home/apt,1/21/17,2017-01-21,5-23-19,2019-05-23,50.15748,-122.93252,16897024,112751244
ab-8324768,Creekside Townhome,Townhouse,Entire home/apt,9/10/15,2015-09-10,3-15-17,2017-03-15,50.09268745,-122.998006,8324768,43885420
ab-21726808,Ski In/Ski Out 6 BR for Families or Large Groups,House,Entire home/apt,11/13/17,2017-11-13,5-23-19,2019-05-23,50.09381,-122.98503,21726808,1616015
ab-21726839,BlackTusk Suite 403 Style in the Heart of Whistler,Apartment,Entire home/apt,12/6/17,2017-12-06,5-24-19,2019-05-24,50.11473,-122.95705,21726839,139146809
ab-19713489,Apartment On Treetop Lane,Chalet,Entire home/apt,7/4/17,2017-07-04,7-17-17,2017-07-17,50.12485883,-122.960504,19713489,138923990
ab-16043079,Embarc Resort Whistler (formerly Club Intrawest),Timeshare,Entire home/apt,11/18/16,2016-11-18,12-17-16,2016-12-17,50.1167324,-122.9461643,16043079,104421980
ab-16043122,Bright Whistler Creekside Gondola Townhome,Townhouse,Shared room,11/18/16,2016-11-18,5-16-18,2018-05-16,50.0940395,-122.9930295,16043122,6563940
ab-16043197,Blackcomb Slope Side 2 bedroom,Condominium,Entire home/apt,11/18/16,2016-11-18,5-22-19,2019-05-22,50.11716,-122.94305,16043197,102647433
ab-16897451,Studio Creekside,Apartment,Shared room,1/21/17,2017-01-21,2-4-17,2017-02-04,50.09934708,-122.9914501,16897451,40804603
ab-15338695,Whistler Sundance 2 Bedroom Plus Condo,Condominium,Entire home/apt,10/1/16,2016-10-01,5-24-19,2019-05-24,50.0914,-122.9937,15338695,16913110
ab-21735745,Whistler Creekside,Condominium,Entire home/apt,11/20/17,2017-11-20,5-22-19,2019-05-22,50.09689,-122.98871,21735745,46346765
ab-21736070,Skier's delight! 2 min walk to Creekside Gondola,Townhouse,Entire home/apt,11/13/17,2017-11-13,5-22-19,2019-05-22,50.09392,-122.99153,21736070,16714692
ab-19056526,Creekside Studio,Apartment,Entire home/apt,6/1/17,2017-06-01,6-5-17,2017-06-05,50.09946317,-122.9897938,19056526,133025248
ab-19056916,Whistler Creekside Condo/Crankworx,Condominium,Entire home/apt,6/1/17,2017-06-01,10-2-17,2017-10-02,50.09272288,-122.991671,19056916,133029859
ab-8327513,1Bd Beautifully Just Renovated,Condominium,Entire home/apt,9/10/15,2015-09-10,5-24-19,2019-05-24,50.1169,-122.95459,8327513,27383344
ab-9752591,1 Bdrm- HEART of Whistler Village!,Condominium,Entire home/apt,11/29/15,2015-11-29,1-2-17,2017-01-02,50.11303135,-122.9560242,9752591,3502574
ab-21738642,2 Bedroom Townhouse in Whistler's Best Location,Townhouse,Entire home/apt,11/13/17,2017-11-13,5-24-19,2019-05-24,50.11389,-122.94995,21738642,96453221
ab-13916239,Whistler 5 bedroom - Peak Living,Townhouse,Entire home/apt,7/8/16,2016-07-08,5-23-19,2019-05-23,50.10116,-122.98953,13916239,33242466
ab-21740668,"Creekside Condo Sleeps 8, Hot Tub, Walk to Lift",Apartment,Entire home/apt,11/21/17,2017-11-21,5-23-19,2019-05-23,50.09669,-122.99611,21740668,46346765
ab-21746934,Ski-in&Ski-out near Ski area 2-3 Guests!,Apartment,Entire home/apt,11/13/17,2017-11-13,11-27-17,2017-11-27,50.11642709,-122.963368,21746934,157149849
ab-16050587,Romantic Cabin in the Forest with mountain views,Chalet,Entire home/apt,3/17/19,2019-03-17,5-24-19,2019-05-24,50.14659,-122.97039,16050587,24919834
ab-16900790,Whistler/Creekside 3 bedroom Timeshare,Timeshare,Entire home/apt,1/21/17,2017-01-21,2-12-17,2017-02-12,50.09623895,-122.9880493,16900790,112802709
ab-17699521,1BR Ste in Whistler Village for 4 -Pool & Hot Tub!,Apartment,Entire home/apt,3/11/17,2017-03-11,5-22-19,2019-05-22,50.11562,-122.95952,17699521,317618
ab-19057908,Town plaza Deer Lodge one bedroom condo,Apartment,Entire home/apt,6/1/17,2017-06-01,5-22-19,2019-05-22,50.11601,-122.95587,19057908,127728047
ab-19058757,North Village Townhouse 39,Townhouse,Entire home/apt,6/1/17,2017-06-01,8-17-17,2017-08-17,50.11925456,-122.9585923,19058757,17197633
ab-15342380,"Luxury 3 BR home, Walk to Village, Private Hot Tub",Townhouse,Entire home/apt,10/1/16,2016-10-01,5-23-19,2019-05-23,50.12351,-122.95501,15342380,97819804
ab-5060707,LC304 - LeChamois 304 - Brand New!,Apartment,Entire home/apt,1/5/15,2015-01-05,11-26-18,2018-11-26,50.11564642,-122.9473709,5060707,26133463
ab-21756091,Rustic Whistler Cabin,Cabin,Entire home/apt,11/18/17,2017-11-18,4-2-19,2019-04-02,50.16313,-122.92742,21756091,505152
ab-19719059,Charming one bedroom suite,Apartment,Entire home/apt,7/4/17,2017-07-04,9-6-17,2017-09-06,50.09288885,-122.9931946,19719059,128272277
ab-21764039,"Greystone Lodge ski in, ski out  2 bdm, 2 bath",Condominium,Private room,11/18/17,2017-11-18,11-4-18,2018-11-04,50.1163697,-122.9428433,21764039,22619214
ab-21764770,"Stylish 4-bedroom Townhouse, Private Hot Tub",Townhouse,Entire home/apt,11/18/17,2017-11-18,5-23-19,2019-05-23,50.14448,-122.94439,21764770,96453221
ab-16054333,Whistler Sleeps 4,Condominium,Entire home/apt,11/19/16,2016-11-19,5-23-19,2019-05-23,50.09325,-122.99352,16054333,39631194
ab-16054634,"Creekside 2 Bedroom, Free Parking",Apartment,Entire home/apt,11/19/16,2016-11-19,3-23-18,2018-03-23,50.09787163,-122.9864991,16054634,17197633
ab-17699859,1BD Whistler Village Suite for 4 -Pool HotTub Park,Serviced apartment,Entire home/apt,3/11/17,2017-03-11,5-24-19,2019-05-24,50.11607,-122.95827,17699859,317618
ab-9756495,Creekside Suite 5 Min walk to lift,Apartment,Entire home/apt,12/1/15,2015-12-01,5-24-19,2019-05-24,50.09678,-122.98917,9756495,40640991
ab-21766785,1BR Whistler condo in premium Embarc Resort,Resort,Entire home/apt,11/18/17,2017-11-18,5-24-19,2019-05-24,50.11669,-122.94498,21766785,1874666
ab-21770041,Beautiful Studio Suite,Serviced apartment,Private room,11/18/17,2017-11-18,5-20-19,2019-05-20,50.11903,-122.94601,21770041,102171624
ab-21770377,"1 BR Creekside Condo, a few steps to the Gondola.",Condominium,Entire home/apt,12/8/17,2017-12-08,5-19-19,2019-05-19,50.09443,-122.99067,21770377,158621986
ab-21771928,Last min deal!   1 BR/Loft. Private Hot tub,Serviced apartment,Entire home/apt,11/18/17,2017-11-18,5-22-19,2019-05-22,50.11704,-122.95438,21771928,158634219
ab-7418745,Cozy Condo in Whistler Creekside,Condominium,Entire home/apt,7/16/15,2015-07-16,4-19-18,2018-04-19,50.09330306,-122.9926316,7418745,698253
ab-15345307,Great Whistler Townhouse! Village Access!,Apartment,Entire home/apt,10/2/16,2016-10-02,1-13-19,2019-01-13,50.12181358,-122.9553604,15345307,62132916
ab-16055929,2 Bedroom Condo in the heart of Whistler Village,Resort,Entire home/apt,11/19/16,2016-11-19,5-22-19,2019-05-22,50.11744,-122.95622,16055929,104563550
ab-15346576,Gorgeous suite in British Columbia,Apartment,Entire home/apt,10/2/16,2016-10-02,11-15-16,2016-11-15,50.11383872,-122.9543443,15346576,75827202
ab-8352191,"Beautiful 1 BD, on golf course walking to village",House,Entire home/apt,12/5/16,2016-12-05,5-24-19,2019-05-24,50.12066,-122.96682,8352191,42675485
ab-16056261,Super Spacious Whistler Private Hot Tub Sleeps 13+,Chalet,Entire home/apt,11/19/16,2016-11-19,12-24-16,2016-12-24,50.09098742,-122.9987035,16056261,72182
ab-21782852,"Inviting 3 Bedroom, 2.5 Bathroom, Private Hot Tub",Townhouse,Entire home/apt,11/18/17,2017-11-18,1-18-19,2019-01-18,50.12281962,-122.9382918,21782852,96453221
ab-13927319,New Centralized Condo!,Condominium,Entire home/apt,7/9/16,2016-07-09,10-4-16,2016-10-04,50.11775355,-122.9441899,13927319,82729960
ab-21786136,Comfy Creekside studio near lifts (sleeps 4),Condominium,Entire home/apt,11/21/17,2017-11-21,5-24-19,2019-05-24,50.09643,-122.99404,21786136,56673392
ab-15353329,Aspens On Blackcomb 2BR Condo,Condominium,Entire home/apt,10/2/16,2016-10-02,3-19-19,2019-03-19,50.11671,-122.94531,15353329,52651623
ab-16056943,ã…¤Creekside 2 Bedroom Steps to Gondola-Free Parking,Apartment,Entire home/apt,11/19/16,2016-11-19,5-24-19,2019-05-24,50.09539,-122.99035,16056943,17197633
ab-21787451,Whistler Penthouse! Ski in/out! Pool & Hot Tub!,Condominium,Entire home/apt,11/18/17,2017-11-18,5-22-19,2019-05-22,50.11752,-122.94431,21787451,82530974
ab-21788116,Walk to whistler Gondi free parking/hottub/wifi,Condominium,Private room,12/20/17,2017-12-20,5-23-19,2019-05-23,50.11841,-122.95789,21788116,158770758
ab-21788221,Steps to whistler gondola free parking,Condominium,Private room,12/20/17,2017-12-20,5-19-19,2019-05-19,50.11964,-122.95834,21788221,158771873
ab-21788584,Village 1BR - Best Location & Newly Renovated!,Condominium,Entire home/apt,11/18/17,2017-11-18,5-23-19,2019-05-23,50.11722,-122.95582,21788584,158650669
ab-19068811,"Spacious, fully renovated apt with mountain views!",Guest suite,Entire home/apt,6/1/17,2017-06-01,10-2-17,2017-10-02,50.12968941,-122.9506324,19068811,503312
ab-21788877,Whistler Townhouse,Townhouse,Entire home/apt,11/20/17,2017-11-20,5-21-19,2019-05-21,50.09799,-122.98172,21788877,154980834
ab-15353840,WorldMark Whistler - Cascade Lodge 1BR,Condominium,Entire home/apt,10/2/16,2016-10-02,5-22-19,2019-05-22,50.118,-122.95649,15353840,52651623
ab-21789518,Steller's Nest - 3-4 mins' walk to Gondola,Condominium,Entire home/apt,11/21/17,2017-11-21,5-21-19,2019-05-21,50.09403,-122.99223,21789518,40340388
ab-9760270,Great Whistler Creekside town-home,Entire house,Entire home/apt,12/1/15,2015-12-01,2-28-18,2018-02-28,50.09734412,-122.9875033,9760270,50335036
ab-13929161,Whistler's best choice rooms for 2 or 3!,Bed and breakfast,Private room,7/9/16,2016-07-09,5-23-19,2019-05-23,50.12372,-122.94953,13929161,3004958
ab-21798191,"Newly Listed 3BR Townhouse, Private Hot Tub",Townhouse,Entire home/apt,11/18/17,2017-11-18,5-23-19,2019-05-23,50.11939,-122.94085,21798191,96453221
ab-8362787,#225 - Top of the World Alpenglow,Apartment,Entire home/apt,9/12/15,2015-09-12,11-12-18,2018-11-12,50.11917035,-122.9572891,8362787,35146399
ab-21799039,A Prime location to Whistler's Creekside Gondola.,Condominium,Entire home/apt,11/21/17,2017-11-21,5-21-19,2019-05-21,50.09418,-122.99361,21799039,158860522
ab-16066652,Beautiful Whistler Holiday,Villa,Entire home/apt,11/20/16,2016-11-20,4-20-17,2017-04-20,50.10806791,-122.9679307,16066652,104661275
ab-13311637,Whistler Village Condo,Apartment,Entire home/apt,6/1/16,2016-06-01,5-22-19,2019-05-22,50.1187,-122.95603,13311637,24592205
ab-16067863,3 Bdrm home in Alpine,House,Entire home/apt,11/20/16,2016-11-20,4-6-17,2017-04-06,50.1511879,-122.9644837,16067863,100232425
ab-16068259,Updated 2 bedroom Getaway w hot tub- near village!,Apartment,Entire home/apt,11/20/16,2016-11-20,5-23-19,2019-05-23,50.12177,-122.95539,16068259,65305043
ab-17714813,"VILLAGE LOFT - 2 bdrm, 5 min from Gondola",Townhouse,Entire home/apt,3/12/17,2017-03-12,5-24-19,2019-05-24,50.09211,-122.99393,17714813,21898365
ab-15360302,"Luxury, mountain-side, Ski-in/Out! Sleeps 12!",Townhouse,Entire home/apt,10/3/16,2016-10-03,5-20-19,2019-05-20,50.09296,-122.97805,15360302,4175684
ab-21803315,"Cozy A Frame in Alta Vista, Whistler",Entire vacation home,Entire home/apt,11/20/17,2017-11-20,1-5-18,2018-01-05,50.10882938,-122.9755801,21803315,158901478
ab-21803597,Embarc/Club intrawest. 1 bd1bth. 14 or 13 night,Resort,Entire home/apt,11/18/17,2017-11-18,5-22-19,2019-05-22,50.11822,-122.94614,21803597,37441134
ab-21804214,2 Bed Suite - Walk to Village - Mountain Views,Guest suite,Entire home/apt,11/21/17,2017-11-21,2-11-19,2019-02-11,50.11016548,-122.9732934,21804214,687269
ab-19071703,Whistler Wonderland:  2 Bedroom/1 Sofa Bed  Condo,Condominium,Entire home/apt,6/1/17,2017-06-01,5-21-19,2019-05-21,50.11815,-122.9445,19071703,9156539
ab-19071980,Steps away from Blackcomb Base! 1 bedrm+1 sofa bed,Resort,Entire home/apt,6/1/17,2017-06-01,5-23-19,2019-05-23,50.11694,-122.94492,19071980,9156539
ab-19072585,1 bdrm apt in whistler village Olympic plaza,Apartment,Entire home/apt,6/1/17,2017-06-01,5-23-19,2019-05-23,50.12056,-122.95653,19072585,51738647
ab-21815456,Cozy family friendly condo,Condominium,Entire home/apt,11/20/17,2017-11-20,5-24-19,2019-05-24,50.11817,-122.95774,21815456,156227518
ab-21815770,'Marketplace' Spacious 1 Bedroom - Whistler Village,Condominium,Entire home/apt,11/21/17,2017-11-21,7-9-18,2018-07-09,50.12037668,-122.9545827,21815770,35393628
ab-19730144,5 Bedroom + Den - Whistler Luxury Townhome,Townhouse,Entire home/apt,7/5/17,2017-07-05,8-19-18,2018-08-19,50.10997341,-122.9582373,19730144,27111892
ab-13937387,Whistler Condo For 8 Q/T/B/SS,Condominium,Entire home/apt,7/9/16,2016-07-09,5-31-17,2017-05-31,50.09151122,-122.9953688,13937387,21659291
ab-21818471,Two Bedroom and Two Bath Ski-In/Ski-Out,Guest suite,Entire home/apt,11/20/17,2017-11-20,5-23-19,2019-05-23,50.09438,-122.9863,21818471,1616015
ab-21818742,Marketplace Lodge ~ Updated 1BD in Ideal Location!,Apartment,Entire home/apt,11/21/17,2017-11-21,5-24-19,2019-05-24,50.12104,-122.95796,21818742,683972
ab-21820446,Executive Luxury location with Mountain Views,Entire house,Entire home/apt,11/18/17,2017-11-18,1-19-18,2018-01-19,50.16038109,-122.9288301,21820446,159061555
ab-8369161,Gorgeous Renovated Ski in/Out Home,Townhouse,Entire home/apt,9/13/15,2015-09-13,7-27-18,2018-07-27,50.11526721,-122.9403646,8369161,44110261
ab-21824980,Whistler Condo,Condominium,Entire home/apt,11/18/17,2017-11-18,5-22-19,2019-05-22,50.11598,-122.93909,21824980,29421013
ab-9779267,Mountainside coziness with luxury on Benchlands 8,Townhouse,Entire home/apt,12/1/15,2015-12-01,5-21-19,2019-05-21,50.11962,-122.93871,9779267,22078860
ab-5081042,Whister-Spacious 2bdrm close to all,Apartment,Entire home/apt,3/7/17,2017-03-07,5-6-17,2017-05-06,50.10135351,-122.9833207,5081042,26241084
ab-21826872,"Glaciers Reach ~ Luxurious 2BD, Private Hot Tub",Apartment,Entire home/apt,11/21/17,2017-11-21,5-24-19,2019-05-24,50.11982,-122.95551,21826872,683972
ab-21826897,Westin Resort - Whistler Village,Place,Entire home/apt,11/21/17,2017-11-21,12-24-18,2018-12-24,50.11295863,-122.9555621,21826897,159116436
ab-21827601,Maison magnifique sur Blueberry Hill,House,Entire home/apt,11/25/17,2017-11-25,12-7-17,2017-12-07,50.11651125,-122.9696729,21827601,159123759
ab-14626427,Village Gate House 1BR~6~Full Kitchen,Condominium,Entire home/apt,8/19/16,2016-08-19,5-22-19,2019-05-22,50.09397,-122.99351,14626427,52651623
ab-21828069,Spacious Studio - Walk to Creekside - FREE PARKING,Apartment,Entire home/apt,11/21/17,2017-11-21,9-25-18,2018-09-25,50.1004725,-122.98988,21828069,157933490
ab-21828092,"Treeline, Quiet wooded location, close to village and slope, 3 bdrm, sleeps 8",Townhouse,Entire home/apt,11/23/17,2017-11-23,5-23-19,2019-05-23,50.12272,-122.93369,21828092,148269423
ab-21828093,"Valhalla 2.5 bedroom, sleeps 8, Quiet setting just steps from the action!",Townhouse,Entire home/apt,11/21/17,2017-11-21,9-5-18,2018-09-05,50.12138254,-122.9601402,21828093,148269423
ab-21828094,"Prime Ski-in Ski-out Location! Top Floor Unit, Pool, Hot tubs, BBQ (545)",Condominium,Entire home/apt,2/5/18,2018-02-05,5-23-19,2019-05-23,50.11645,-122.94445,21828094,148269423
ab-5083500,3 bedroom 200m from ski in-out!,Townhouse,Entire home/apt,1/9/15,2015-01-09,5-21-19,2019-05-21,50.11327,-122.94916,5083500,23973685
ab-21828748,"Prime Ski-in Ski-out Location! Pool, Hot tubs, BBQ, sleeps 4 (221)",Condominium,Entire home/apt,11/18/17,2017-11-18,5-23-19,2019-05-23,50.11695,-122.94473,21828748,148269423
ab-21829151,"Prime Ski-in Ski-out Location! Pool, Hot tubs, BBQ, sleeps 4 (228)",Condominium,Entire home/apt,11/23/17,2017-11-23,2-27-19,2019-02-27,50.11529,-122.94543,21829151,148269423
ab-21829155,"Prime Ski-in Ski-out Location! Pool, Hot tubs, BBQ, sleeps 8 (227)",Condominium,Entire home/apt,11/23/17,2017-11-23,5-23-19,2019-05-23,50.11551,-122.946,21829155,148269423
ab-21829166,"Prime Ski-in Ski-out Location! Pool, Hot tubs, BBQ, sleeps 4 (229)",Condominium,Entire home/apt,11/23/17,2017-11-23,5-23-19,2019-05-23,50.11663,-122.94422,21829166,148269423
ab-21829175,"Prime Ski-in Ski-out Location! Pool, Hot tubs, BBQ, sleeps 4 (235)",Condominium,Entire home/apt,11/23/17,2017-11-23,3-3-19,2019-03-03,50.11683,-122.94556,21829175,148269423
ab-14627816,Whistler&#x27;s Creekside ski in ski out family home,House,Entire home/apt,8/19/16,2016-08-19,10-24-16,2016-10-24,50.09329387,-122.9843546,14627816,5745083
ab-21829186,"Prime Ski-in Ski-out Location! Pool, Hot tubs, BBQ, sleeps 8 (220)",Condominium,Entire home/apt,11/20/17,2017-11-20,9-6-18,2018-09-06,50.11473453,-122.9456571,21829186,148269423
ab-21829187,"Prime Ski-in Ski-out Location! Pool, Hot tubs, BBQ, sleeps 6 (234)",Condominium,Entire home/apt,11/23/17,2017-11-23,5-22-19,2019-05-22,50.11538,-122.94458,21829187,148269423
ab-21829202,"Prime Ski-in Ski-out Location! Pool, Hot tubs, BBQ, sleeps 4 (222)",Condominium,Entire home/apt,11/23/17,2017-11-23,5-23-19,2019-05-23,50.11539,-122.94399,21829202,148269423
ab-21829244,"Prime Ski-in Ski-out Location! Pool, Hot tubs, BBQ, sleeps 8 (219)",Condominium,Entire home/apt,11/20/17,2017-11-20,5-23-19,2019-05-23,50.1155,-122.94475,21829244,148269423
ab-21829799,CONDO IN WHISTLER VILLAGE - PERFECT LOCATION,Condominium,Entire home/apt,12/16/17,2017-12-16,5-22-19,2019-05-22,50.11912,-122.95635,21829799,159148998
ab-21830499,3 bed room loft rooms can be shared by 8 people,Resort,Shared room,11/21/17,2017-11-21,7-23-18,2018-07-23,50.0933091,-122.9936006,21830499,38799302
ab-7448917,Classic Whistler Cabin,Chalet,Entire home/apt,6/25/18,2018-06-25,9-14-18,2018-09-14,50.14746938,-122.9718236,7448917,1837321
ab-20307056,Ski-in/Ski-out Condo for Whistler/Blackcomb,Condominium,Entire home/apt,8/6/17,2017-08-06,5-24-19,2019-05-24,50.11738,-122.94335,20307056,19758256
ab-21833225,Whistler House with Hot Tub,Entire house,Entire home/apt,11/21/17,2017-11-21,12-14-17,2017-12-14,50.10783891,-122.9683589,21833225,159183371
ab-19731791,Whistler Creekside Condo,Condominium,Entire home/apt,7/5/17,2017-07-05,8-4-18,2018-08-04,50.09255276,-122.9904133,19731791,139110850
ab-14630693,Stunning Whistler Chalet overlooking Alpha Lake,House,Entire home/apt,8/19/16,2016-08-19,5-21-19,2019-05-21,50.09652,-123.00256,14630693,10276553
ab-15371219,Beautiful Whistler estate,Villa,Entire home/apt,10/3/16,2016-10-03,1-16-17,2017-01-16,50.11236144,-122.9572053,15371219,33103821
ab-9792594,Whistler Condo in Main Village! 1/26 - 2/2/2019,Condominium,Entire home/apt,11/6/17,2017-11-06,11-25-18,2018-11-25,50.11731917,-122.9574271,9792594,21223810
ab-5083735,The President Suite w Private Hot Tub,Apartment,Entire home/apt,1/9/15,2015-01-09,3-7-19,2019-03-07,50.11323,-122.95566,5083735,7784624
ab-8385746,Mountain Chalet- Perfect for Family,House,Entire home/apt,9/14/15,2015-09-14,6-6-17,2017-06-06,50.08650117,-122.9966597,8385746,30803060
ab-21848437,Presidential Turret Suite in HEART of Village!,Condominium,Entire home/apt,11/20/17,2017-11-20,5-26-18,2018-05-26,50.11556674,-122.9562517,21848437,7784624
ab-21848965,"1 cozy hotel room at Glacier Lodge,ski in/out",Apartment,Private room,11/25/17,2017-11-25,5-22-19,2019-05-22,50.11625,-122.94334,21848965,144202142
ab-21850120,"Whistler Magnificent 5BR Home, Private Hot Tub",Chalet,Entire home/apt,11/21/17,2017-11-21,11-15-18,2018-11-15,50.12739706,-122.9607471,21850120,106255316
ab-21850810,New modern house at the Nicklaus North Golf Course,House,Entire home/apt,11/22/17,2017-11-22,5-21-19,2019-05-21,50.14191,-122.95872,21850810,69730702
ab-21851760,"1 deluxe studio at Glacier Lodge,ski in/out",Serviced apartment,Private room,11/25/17,2017-11-25,5-22-19,2019-05-22,50.11605,-122.9468,21851760,144202142
ab-21854013,3 Bedroom Creekside Condo!,Condominium,Entire home/apt,11/21/17,2017-11-21,11-21-17,2017-11-21,50.09585218,-122.9882657,21854013,17887528
ab-20310872,Whistler gorgeous1 BDR Q +Q sleeper sofa for 4,Timeshare,Entire home/apt,8/6/17,2017-08-06,8-30-17,2017-08-30,50.11713265,-122.959145,20310872,21659291
ab-14633700,Whistler Sundance 1 bedroom Condo,Condominium,Entire home/apt,8/19/16,2016-08-19,5-21-19,2019-05-21,50.09335,-122.99339,14633700,16913110
ab-8390228,Cozy+Spacious+Private Village Gem!,Apartment,Entire home/apt,9/14/15,2015-09-14,1-10-17,2017-01-10,50.11847893,-122.9595592,8390228,19254342
ab-21864992,Upper Village Ski-in Ski-out Mountainview Studio,Serviced apartment,Entire home/apt,11/23/17,2017-11-23,5-23-19,2019-05-23,50.11553,-122.94708,21864992,11208344
ab-15374588,RV Parking Spot In Alpine includes Power & WiFi,Other,Entire home/apt,10/4/16,2016-10-04,3-26-17,2017-03-26,50.14839067,-122.9693759,15374588,58430343
ab-17732520,Log Cabin Whistler Dream Chalet with Big Views,Chalet,Entire home/apt,3/13/17,2017-03-13,5-23-19,2019-05-23,50.09458,-122.99135,17732520,503312
ab-16084618,"Classic Log Home, Whistler Village - 4 Bed",House,Entire home/apt,11/21/16,2016-11-21,2-14-17,2017-02-14,50.12084988,-122.9626704,16084618,32761304
ab-21868533,Great 2 Bedroom w Pool & Hot Tub  in the Village,Apartment,Entire home/apt,11/22/17,2017-11-22,5-20-19,2019-05-20,50.12037,-122.95874,21868533,84821274
ab-21869046,Contemporary Whistler Clubhouse 10+ppl,House,Entire home/apt,11/21/17,2017-11-21,5-24-19,2019-05-24,50.08599,-123.01971,21869046,3246877
ab-21877194,Creeksides Cozy Studio ~ Walk to Gondola,Apartment,Entire home/apt,11/22/17,2017-11-22,4-7-18,2018-04-07,50.09968014,-122.9913555,21877194,157933490
ab-15375215,"RV Parking Spot In Alpine, with Power and Wifi",Other,Entire home/apt,10/4/16,2016-10-04,10-31-16,2016-10-31,50.14928875,-122.9674195,15375215,58430343
ab-15375266,RV Parking in Alpine with Power & Wifi,Other,Entire home/apt,10/4/16,2016-10-04,3-27-17,2017-03-27,50.14837184,-122.9691537,15375266,58430343
ab-16085026,'Sunpath' Stylish 2BR w/ pool & hot tub - Village!,Townhouse,Entire home/apt,11/21/16,2016-11-21,11-8-17,2017-11-08,50.11830049,-122.9584909,16085026,35393628
ab-21880451,Whistler Village 2 Bed/2 Bath **BOOK NOW**,Serviced apartment,Entire home/apt,11/22/17,2017-11-22,5-23-19,2019-05-23,50.11823,-122.95559,21880451,10202294
ab-21882206,Aspens Ski-in-Ski-out WALK to Everything!,Condominium,Entire home/apt,11/23/17,2017-11-23,3-5-19,2019-03-05,50.11448,-122.94416,21882206,7784624
ab-21882865,Whistler Creekside 2BR + Loft walk to Gondola (2),Entire timeshare,Entire home/apt,11/22/17,2017-11-22,12-18-17,2017-12-18,50.09259456,-122.9953491,21882865,8440595
ab-21882869,Whistler Creekside 2BR + Den walk to Gondola,Condominium,Entire home/apt,11/22/17,2017-11-22,5-24-19,2019-05-24,50.09192,-122.99463,21882869,8440595
ab-21885332,Whistler Village - 2 bed/2 bath - 1 free parking!,Serviced apartment,Entire home/apt,12/7/17,2017-12-07,5-22-19,2019-05-22,50.11792,-122.95641,21885332,42856656
ab-21885630,"Brand New 2Br Townhouse,  Steps to Hill & Village",Townhouse,Entire home/apt,11/23/17,2017-11-23,5-24-19,2019-05-24,50.11887,-122.94091,21885630,6334570
ab-21885922,Fantastic Family Ski Chalet (Ski in / Ski out),House,Entire home/apt,11/26/17,2017-11-26,5-24-19,2019-05-24,50.0924,-122.97961,21885922,7291517
ab-8392261,Ski in/out quiet townhouse,Townhouse,Entire home/apt,9/14/15,2015-09-14,5-23-19,2019-05-23,50.11511,-122.94248,8392261,42068301
ab-8392820,"# 1 Whistler Condo, Village Square",Condominium,Entire home/apt,9/14/15,2015-09-14,5-25-19,2019-05-25,50.11553,-122.95726,8392820,16007472
ab-21893503,Whistler Mountain View Chalet,House,Entire home/apt,11/26/17,2017-11-26,5-9-19,2019-05-09,50.15358,-122.96176,21893503,6791845
ab-21894058,"Taluswood 4 Bedroom, Sleeps 10, Private Hot Tub, BBQ, Free Wifi (36)",Townhouse,Entire home/apt,12/23/17,2017-12-23,4-2-18,2018-04-02,50.09620011,-122.9788509,21894058,148269423
ab-20322633,"Ski-in-Ski-out 4BR on Slopes, Free Village Shuttle",Townhouse,Entire home/apt,8/7/17,2017-08-07,5-24-19,2019-05-24,50.11535,-122.93973,20322633,96453221
ab-21894899,"Sunpath 1 bedroom, sleeps 4, Quiet setting just steps from the action!",Entire apartment,Entire home/apt,1/22/18,2018-01-22,2-6-18,2018-02-06,50.11880005,-122.9592611,21894899,148269423
ab-21894967,"Valhalla 1 bedroom, sleeps 4, Quiet setting just steps from the action!",Townhouse,Entire home/apt,11/26/17,2017-11-26,5-23-19,2019-05-23,50.11972,-122.95894,21894967,148269423
ab-16085102,Montebello Townhome 3bed 3bath and hot tub,Townhouse,Entire home/apt,11/21/16,2016-11-21,5-21-19,2019-05-21,50.12393,-122.9567,16085102,104639833
ab-21895235,"Powderhorn Newly Renovated, 3 Bedroom Condo, Minutes from Slope",Condominium,Entire home/apt,12/7/17,2017-12-07,5-24-19,2019-05-24,50.11745,-122.94247,21895235,148269423
ab-21895362,"Lakefront, 1 Bedroom, Newly Reno'd, Free Wifi",Entire townhouse,Entire home/apt,12/9/17,2017-12-09,2-26-18,2018-02-26,50.11210562,-122.9768567,21895362,148269423
ab-21895571,"Greystone, Renovated Ski in Ski out, sleeps 5, Free Wifi (217)",Condominium,Entire home/apt,11/25/17,2017-11-25,5-23-19,2019-05-23,50.11682,-122.94256,21895571,148269423
ab-21895875,"Valhalla, 2 bedroom, sleeps 6, Amazing mountain views just steps from the action",Townhouse,Entire home/apt,11/26/17,2017-11-26,5-23-19,2019-05-23,50.12196,-122.95903,21895875,148269423
ab-21895876,"Painted Cliff  Ski-in, Ski-out Luxury with serene mountain view, sleeps 7 (18)",Townhouse,Entire home/apt,11/25/17,2017-11-25,5-23-19,2019-05-23,50.11514,-122.94132,21895876,148269423
ab-21896067,"Taluswood 3 Bedroom, Sleeps 8, Private Hot Tub, BBQ, Free Wifi (23)",Townhouse,Entire home/apt,12/9/17,2017-12-09,1-14-19,2019-01-14,50.09590188,-122.9811443,21896067,148269423
ab-21896201,"Painted Cliff Ski-in, Ski-out Luxury with serene mountain views, sleeps 8 (16)",Townhouse,Entire home/apt,11/25/17,2017-11-25,5-23-19,2019-05-23,50.11468,-122.94129,21896201,148269423
ab-21896276,"Painted Cliff Ski-in, Ski-out Luxury with serene mountain views, sleeps 6 (43)",Townhouse,Entire home/apt,11/25/17,2017-11-25,5-23-19,2019-05-23,50.1141,-122.94167,21896276,148269423
ab-21896822,"The Westin Resort and Spa, Whistler",Bed & Breakfast,Entire home/apt,11/23/17,2017-11-23,11-23-17,2017-11-23,50.113247,-122.9568002,21896822,130918434
ab-9808906,One Dlb Bed Private Bathroom Shower,Apartment,Private room,12/3/15,2015-12-03,5-7-16,2016-05-07,50.12034941,-122.9395322,9808906,24037962
ab-21897162,"Glacier's Reach, 1 bedroom, sleeps 4, quiet setting,  just steps from the action",Townhouse,Entire home/apt,11/26/17,2017-11-26,5-23-19,2019-05-23,50.11999,-122.95608,21897162,148269423
ab-21897277,Club Intrawest:Check in today! /night,Entire villa,Entire home/apt,11/23/17,2017-11-23,12-28-17,2017-12-28,50.11639228,-122.9454808,21897277,93260505
ab-21898862,2 Bedroom Condo with Private Balcony + Fireplace | Gym,Condominium,Entire home/apt,12/7/17,2017-12-07,5-22-19,2019-05-22,50.11562,-122.94343,21898862,151701730
ab-21898875,Spacious 2 Bedroom Condo with Private Balcony | AWESOME AMENITIES!,Condominium,Entire home/apt,1/6/18,2018-01-06,5-14-18,2018-05-14,50.11439911,-122.9426887,21898875,151701730
ab-21899051,"Cedar Hollow Luxury 4 Bdrm, Ski-in Ski-out , Private Hot Tub, Steam Shower (8)",Townhouse,Entire home/apt,12/7/17,2017-12-07,5-23-19,2019-05-23,50.11218,-122.94898,21899051,148269423
ab-21899250,"Fitzsimmons Luxury 4 Bdrm, Private Hot Tub, BBQ (33)",Townhouse,Entire home/apt,12/6/17,2017-12-06,5-23-19,2019-05-23,50.12663,-122.95509,21899250,148269423
ab-21899291,"Forest Trails, 2.5 bedroom family home, walk to lift, free wifi",Townhouse,Entire home/apt,11/23/17,2017-11-23,5-23-19,2019-05-23,50.11883,-122.94107,21899291,148269423
ab-21899336,"Prime Ski-in Ski-out Location! Top Floor Unit, Pool, Hot tubs, BBQ (552)",Condominium,Entire home/apt,11/26/17,2017-11-26,5-23-19,2019-05-23,50.11554,-122.94561,21899336,148269423
ab-21899380,"Prime Ski-in Ski-out Location! Top Floor Unit, Pool, Hot tubs, BBQ (563)",Condominium,Entire home/apt,11/25/17,2017-11-25,5-23-19,2019-05-23,50.11656,-122.94574,21899380,148269423
ab-21899615,"Prime Ski-in Ski-out Location! Top Floor Unit, Pool, Hot tubs, BBQ (549)",Condominium,Entire home/apt,11/25/17,2017-11-25,5-23-19,2019-05-23,50.11665,-122.94598,21899615,148269423
ab-21899757,"Prime Ski-in Ski-out Location! Top Floor Unit, Pool, Hot tubs, BBQ (464)",Condominium,Entire home/apt,11/25/17,2017-11-25,7-4-18,2018-07-04,50.11489427,-122.9456464,21899757,148269423
ab-15377352,Retro-chic Creekside Townhouse,Townhouse,Entire home/apt,10/4/16,2016-10-04,9-22-18,2018-09-22,50.09689756,-122.9933029,15377352,98267555
ab-15377468,Whistler Cascade Lodge 1BR sleeps 4 - Killer View!,Condominium,Entire home/apt,10/4/16,2016-10-04,5-24-19,2019-05-24,50.11611,-122.95823,15377468,7916657
ab-21899896,"Prime Ski-in Ski-out Location! Top Floor Unit, Pool, Hot tubs, BBQ (548)",Condominium,Entire home/apt,11/25/17,2017-11-25,5-23-19,2019-05-23,50.11475,-122.94417,21899896,148269423
ab-21899897,"Prime Ski-in Ski-out Location! Top Floor Unit, Pool, Hot tubs, BBQ (547)",Condominium,Entire home/apt,11/25/17,2017-11-25,5-23-19,2019-05-23,50.11693,-122.94384,21899897,148269423
ab-21899915,Clocktower Studio,Timeshare,Entire home/apt,11/23/17,2017-11-23,11-26-17,2017-11-26,50.1138263,-122.9558057,21899915,56422694
ab-21900285,"Prime Ski-in Ski-out Location! Pool, Hot tubs, BBQ, sleeps 6 (460)",Condominium,Entire home/apt,11/25/17,2017-11-25,5-23-19,2019-05-23,50.11506,-122.94589,21900285,148269423
ab-21900396,"Prime Ski-in Ski-out Location! Top Floor Unit, Pool, Hot tubs, BBQ (543)",Condominium,Entire home/apt,11/25/17,2017-11-25,5-23-19,2019-05-23,50.11486,-122.94523,21900396,148269423
ab-21900415,"Prime Ski-in Ski-out Location! Pool, Hot tubs, BBQ, sleeps 8 (458)",Condominium,Entire home/apt,11/25/17,2017-11-25,5-23-19,2019-05-23,50.11532,-122.94469,21900415,148269423
ab-21900502,"Prime Ski-in Ski-out Location! Pool, Hot tubs, BBQ (463)",Condominium,Entire home/apt,11/25/17,2017-11-25,5-23-19,2019-05-23,50.11707,-122.94541,21900502,148269423
ab-21900601,"Prime Ski-in Ski-out Location! Pool, Hot tubs, BBQ, sleeps 4 (461)",Condominium,Entire home/apt,11/25/17,2017-11-25,5-23-19,2019-05-23,50.11677,-122.94554,21900601,148269423
ab-17737097,"WHISTLER Sundance, Studio up to 2 Bdrm, 1-4 BEDS",Resort,Entire home/apt,3/13/17,2017-03-13,1-13-19,2019-01-13,50.09243727,-122.9949036,17737097,4385059
ab-17737109,WHISTLER Studio up to 2 Bdrm (priced 4 studio) SD,Resort,Entire home/apt,3/13/17,2017-03-13,1-13-19,2019-01-13,50.09136446,-122.9950062,17737109,4385059
ab-19735454,Private Bed + Bath w/ free parking,Townhouse,Private room,7/5/17,2017-07-05,8-12-17,2017-08-12,50.09048475,-123.0087424,19735454,139138557
ab-19735501,Ski in/out condo in Whistler with hot tub/pool,Apartment,Entire home/apt,9/11/17,2017-09-11,5-24-19,2019-05-24,50.09423,-122.99199,19735501,70690533
ab-21900609,"Prime Ski-in Ski-out Location! Top Floor Unit, Pool, Hot tubs, BBQ (439)",Condominium,Entire home/apt,11/25/17,2017-11-25,5-23-19,2019-05-23,50.11493,-122.94568,21900609,148269423
ab-21900613,"The Flying Bear-4 Mins walk to Gondola, great view",Townhouse,Entire home/apt,11/25/17,2017-11-25,12-6-17,2017-12-06,50.09308495,-122.9950466,21900613,40340388
ab-21900705,"Prime Ski-in Ski-out Location! Top Floor Unit, Pool, Hot tubs, BBQ (427)",Condominium,Entire home/apt,11/26/17,2017-11-26,5-23-19,2019-05-23,50.11488,-122.94407,21900705,148269423
ab-21900742,"Prime Ski-in Ski-out Location! Pool, Hot tubs, BBQ, sleeps 6 (444)",Condominium,Entire home/apt,11/25/17,2017-11-25,5-23-19,2019-05-23,50.11672,-122.94611,21900742,148269423
ab-21900831,"Prime Ski-in Ski-out Location! Top Floor Unit, Pool, Hot tubs, BBQ (438)",Condominium,Entire home/apt,11/25/17,2017-11-25,5-23-19,2019-05-23,50.11489,-122.94553,21900831,148269423
ab-21900876,"Prime Ski-in Ski-out Location! Pool, Hot tubs, BBQ, sleeps 4 (443)",Condominium,Entire home/apt,11/25/17,2017-11-25,5-23-19,2019-05-23,50.11634,-122.94546,21900876,148269423
ab-21901174,"Prime Ski-in Ski-out Location! Top Floor Unit, Pool, Hot tubs, BBQ (415)",Condominium,Entire home/apt,11/25/17,2017-11-25,5-23-19,2019-05-23,50.11611,-122.94463,21901174,148269423
ab-21901201,"Prime Ski-in Ski-out Location! Top Floor Unit, Pool, Hot tubs, BBQ (414)",Condominium,Entire home/apt,11/25/17,2017-11-25,5-23-19,2019-05-23,50.11693,-122.94547,21901201,148269423
ab-21901217,"Prime Ski-in Ski-out Location! Top Floor Unit, Pool, Hot tubs, BBQ (417)",Condominium,Entire home/apt,11/25/17,2017-11-25,5-23-19,2019-05-23,50.11527,-122.94598,21901217,148269423
ab-21901365,Cozy Creekside Studio - Walk to Lifts!,Apartment,Entire home/apt,12/23/17,2017-12-23,5-24-19,2019-05-24,50.09709,-122.99035,21901365,159753961
ab-21905405,Whistler Cascade lodge 3Night Prime Holiday Stays,Condominium,Entire home/apt,11/26/17,2017-11-26,5-23-19,2019-05-23,50.11796,-122.95729,21905405,8440595
ab-21905409,Whistler Cascade lodge 7night Prime Holiday Stays,Condominium,Entire home/apt,11/26/17,2017-11-26,5-23-19,2019-05-23,50.11659,-122.95719,21905409,8440595
ab-21905422,Whistler Cascade lodge 3Night Prime Stays,Timeshare,Entire home/apt,11/26/17,2017-11-26,11-26-17,2017-11-26,50.11770395,-122.9582127,21905422,8440595
ab-21905653,Cozy Condo in the Heart of Whistler Village!,Entire condominium,Entire home/apt,11/26/17,2017-11-26,2-2-18,2018-02-02,50.11400616,-122.9559757,21905653,138603743
ab-21907684,Clocktower 1bd timeshare,Entire timeshare,Entire home/apt,11/25/17,2017-11-25,12-24-17,2017-12-24,50.11306433,-122.955495,21907684,56422694
ab-21910368,"Prime Ski-in Ski-out Location! Pool, Hot tubs, BBQ, sleeps 6 (239)",Condominium,Entire home/apt,11/25/17,2017-11-25,5-23-19,2019-05-23,50.11621,-122.94471,21910368,148269423
ab-21910713,"Prime Ski-in Ski-out Location! Pool, Hot tubs, BBQ, sleeps 8 (248)",Condominium,Entire home/apt,11/25/17,2017-11-25,5-23-19,2019-05-23,50.11517,-122.94391,21910713,148269423
ab-21911566,"Prime Ski-in Ski-out Location! Pool, Hot tubs, BBQ, sleeps 6 (252)",Condominium,Entire home/apt,11/26/17,2017-11-26,5-23-19,2019-05-23,50.11504,-122.94439,21911566,148269423
ab-21911720,"Prime Ski-in Ski-out Location! Pool, Hot tubs, BBQ, sleeps 4 (238)",Apartment,Entire home/apt,11/25/17,2017-11-25,11-6-18,2018-11-06,50.11640946,-122.9445444,21911720,148269423
ab-21911749,"Prime Ski-in Ski-out Location! Pool, Hot tubs, BBQ, sleeps 8 (242)",Condominium,Entire home/apt,11/25/17,2017-11-25,5-23-19,2019-05-23,50.11615,-122.94385,21911749,148269423
ab-21911762,"Prime Ski-in Ski-out, Luxury Slopeside Unit, Pool, Hot tubs, sleeps 6 (255)",Condominium,Entire home/apt,11/25/17,2017-11-25,5-23-19,2019-05-23,50.11623,-122.94537,21911762,148269423
ab-21911921,"Prime Ski-in Ski-out Location! Pool, Hot tubs, BBQ, sleeps 4 (261)",Condominium,Entire home/apt,11/25/17,2017-11-25,11-6-18,2018-11-06,50.1163528,-122.9460977,21911921,148269423
ab-21911975,"Prime Ski-in Ski-out Location! Pool, Hot tubs, BBQ, sleeps 6 (258)",Condominium,Entire home/apt,11/25/17,2017-11-25,5-23-19,2019-05-23,50.11654,-122.94462,21911975,148269423
ab-21912113,Whistler Sleeps 6-8,Condominium,Entire home/apt,11/25/17,2017-11-25,5-23-19,2019-05-23,50.09289,-122.99348,21912113,49170887
ab-21912859,"Prime Ski-in Ski-out Location! Pool, Hot tubs, BBQ, sleeps 4 (304)",Condominium,Entire home/apt,11/25/17,2017-11-25,5-23-19,2019-05-23,50.11701,-122.94456,21912859,148269423
ab-21912987,"Prime Ski-in Ski-out Location! Pool, Hot tubs, sleeps 4 (302)",Condominium,Entire home/apt,11/25/17,2017-11-25,5-23-19,2019-05-23,50.11615,-122.94545,21912987,148269423
ab-21913231,"Prime Ski-in Ski-out Location! Pool, Hot tubs, BBQ, sleeps 4 (314)",Condominium,Entire home/apt,11/25/17,2017-11-25,5-23-19,2019-05-23,50.1149,-122.94447,21913231,148269423
ab-21913388,"Prime Ski-in Ski-out Location! Pool, Hot tubs, BBQ, sleeps 4 (315)",Condominium,Entire home/apt,11/25/17,2017-11-25,5-23-19,2019-05-23,50.11705,-122.94402,21913388,148269423
ab-21913496,"Prime Ski-in Ski-out Location! Pool, Hot tubs, BBQ, sleeps 8 (319)",Condominium,Entire home/apt,11/25/17,2017-11-25,5-23-19,2019-05-23,50.11679,-122.94579,21913496,148269423
ab-21913558,"Prime Ski-in Ski-out Location! Pool, Hot tubs, BBQ, sleeps 4 (328)",Condominium,Entire home/apt,11/25/17,2017-11-25,5-23-19,2019-05-23,50.11508,-122.94564,21913558,148269423
ab-21913571,"Prime Ski-in Ski-out Location! Pool, Hot tubs, BBQ, sleeps 4 (335)",Condominium,Entire home/apt,11/25/17,2017-11-25,5-23-19,2019-05-23,50.11508,-122.94573,21913571,148269423
ab-21913628,"Prime Ski-in Ski-out Location! Pool, Hot tubs, BBQ, sleeps 4 (321)",Condominium,Entire home/apt,11/25/17,2017-11-25,5-23-19,2019-05-23,50.11468,-122.94525,21913628,148269423
ab-21913638,"Prime Ski-in Ski-out Location! Pool, Hot tubs, BBQ, sleeps 8 (351)",Condominium,Entire home/apt,11/25/17,2017-11-25,5-23-19,2019-05-23,50.11552,-122.94383,21913638,148269423
ab-21913642,Whistler ski studio,Condominium,Entire home/apt,11/25/17,2017-11-25,5-22-19,2019-05-22,50.11636,-122.94267,21913642,129314106
ab-21913664,"Prime Ski-in Ski-out Location! Pool, Hot tubs, sleeps 8 (349)",Condominium,Entire home/apt,11/26/17,2017-11-26,5-23-19,2019-05-23,50.11656,-122.94574,21913664,148269423
ab-21913703,"Prime Ski-in Ski-out Location! Pool, Hot tubs, BBQ, sleeps 6 (347)",Condominium,Entire home/apt,11/25/17,2017-11-25,5-23-19,2019-05-23,50.11513,-122.94428,21913703,148269423
ab-21913720,Cosy studio a few steps from the slopes,Condominium,Entire home/apt,11/25/17,2017-11-25,12-6-17,2017-12-06,50.09548172,-122.9957965,21913720,54643820
ab-21913727,"Prime Ski-in Ski-out Location! Pool, Hot tubs, BBQ, sleeps 6 (352)",Condominium,Entire home/apt,11/25/17,2017-11-25,5-23-19,2019-05-23,50.11675,-122.94565,21913727,148269423
ab-21914065,Cozy Creekside one bedroom with free parking,Condominium,Entire home/apt,12/9/17,2017-12-09,5-21-19,2019-05-21,50.09385,-122.99115,21914065,36434969
ab-7478931,Whistler Townhouse LOFT+POOL+HOTTUB,Townhouse,Entire home/apt,7/19/15,2015-07-19,5-22-19,2019-05-22,50.09358,-122.9903,7478931,19254342
ab-9811302,Steps to the mountain,Condominium,Entire home/apt,12/3/15,2015-12-03,5-24-19,2019-05-24,50.0969,-122.99246,9811302,50543674
ab-21915934,"Prime Ski-in Ski-out Location! Pool, Hot tubs, BBQ, sleeps 4 (353)",Condominium,Entire home/apt,11/26/17,2017-11-26,5-23-19,2019-05-23,50.11519,-122.94436,21915934,148269423
ab-21915998,"Recently Renovated Unit with 270 deg view of Slope. Ski-in/Ski-out, Free Wi-Fi",Condominium,Entire home/apt,11/25/17,2017-11-25,5-23-19,2019-05-23,50.11611,-122.94581,21915998,148269423
ab-21916127,"Prime Ski-in Ski-out Location! Pool, Hot tubs, BBQ, sleeps 6 (358)",Condominium,Entire home/apt,11/25/17,2017-11-25,5-23-19,2019-05-23,50.11563,-122.9461,21916127,148269423
ab-21916243,"Prime Ski-in Ski-out Location! Pool, Hot tubs, BBQ, sleeps 6 (412)",Condominium,Entire home/apt,11/25/17,2017-11-25,5-23-19,2019-05-23,50.11644,-122.94406,21916243,148269423
ab-21916278,"Prime Ski-in Ski-out Location! Pool, Hot tubs, BBQ, AC, sleeps 4 (367)",Condominium,Entire home/apt,11/25/17,2017-11-25,5-23-19,2019-05-23,50.11688,-122.94607,21916278,148269423
ab-17739635,Pool BBQ Airconditioning - 3BR 2BA - Best location,Condominium,Entire home/apt,3/14/17,2017-03-14,5-24-19,2019-05-24,50.09273,-122.99057,17739635,77120590
ab-21923875,2 Bd 1 Bath Amazing Location 10min walk to village,Guest suite,Entire home/apt,12/8/17,2017-12-08,5-21-19,2019-05-21,50.12677,-122.94776,21923875,54549660
ab-9822602,Luxury room with hot tub in Whistler Village,Condominium,Private room,12/4/15,2015-12-04,5-22-19,2019-05-22,50.11507,-122.95511,9822602,24123640
ab-16088422,"Think Whistler, Village Flat, 5 min walk to lifts!",Serviced apartment,Entire home/apt,11/21/16,2016-11-21,5-24-19,2019-05-24,50.11733,-122.95413,16088422,42856656
ab-16089205,Modern Mountain Lounge,Condominium,Entire home/apt,11/21/16,2016-11-21,5-23-19,2019-05-23,50.1195,-122.95835,16089205,104865635
ab-21928897,2 bedroom shared unit,Apartment,Private room,11/25/17,2017-11-25,4-19-18,2018-04-19,50.092385,-122.9939936,21928897,38799302
ab-5123627,Fitzsimmons Whistler 2BD - 6D,Apartment,Entire home/apt,1/14/15,2015-01-14,7-29-17,2017-07-29,50.11489981,-122.9568856,5123627,3749031
ab-9825072,Conveniently Located Studio,Townhouse,Entire home/apt,12/4/15,2015-12-04,5-24-19,2019-05-24,50.12,-122.95961,9825072,31595940
ab-9825385,Whistler condo with amazing view,Condominium,Entire home/apt,12/4/15,2015-12-04,5-14-16,2016-05-14,50.11162009,-122.9674585,9825385,50605234
ab-9826776,"2 bd, 2 bth reno&#x27;d ski in ski out",Townhouse,Entire home/apt,12/4/15,2015-12-04,5-14-16,2016-05-14,50.11302268,-122.9454754,9826776,11803391
ab-8415466,Beautiful villa for rent,Villa,Entire home/apt,7/20/17,2017-07-20,8-1-17,2017-08-01,50.1093743,-122.9729476,8415466,42841379
ab-21937642,Modern Main Street Condo in Whistler Village,Apartment,Entire home/apt,12/8/17,2017-12-08,5-30-18,2018-05-30,50.12018192,-122.9553164,21937642,71818518
ab-7481412,"Ski Home! Beautiful 4 Bed,  Sleeps 8-9, Hot Tub",Townhouse,Entire home/apt,7/19/15,2015-07-19,5-24-19,2019-05-24,50.12177,-122.93361,7481412,8520466
ab-21943422,Whistler/Creekside Condo - 1 bdrm + loft,Condominium,Entire home/apt,12/8/17,2017-12-08,5-24-19,2019-05-24,50.09483,-122.99275,21943422,160167016
ab-15391853,Taluswood - renovated 2 bedroom and private garage,Townhouse,Entire home/apt,10/5/16,2016-10-05,5-22-19,2019-05-22,50.09626,-122.98048,15391853,95781035
ab-13335461,Ë¯Eight People Upper Village Tranquility,Condominium,Entire home/apt,6/2/16,2016-06-02,5-22-19,2019-05-22,50.1162,-122.94677,13335461,17197633
ab-20331035,'Sunpath' Large 2 bedroom w/ pool & hot tub access steps from the Village!,Condominium,Entire home/apt,8/7/17,2017-08-07,5-6-18,2018-05-06,50.11843938,-122.9591339,20331035,35393628
ab-21946626,Montebello Whistler townhome with a view of W & B mtn,Townhouse,Entire home/apt,1/6/18,2018-01-06,5-21-19,2019-05-21,50.12315,-122.95626,21946626,54501946
ab-9827540,Cozy Home for 8 (5Min from Village),House,Entire home/apt,8/15/17,2017-08-15,10-9-17,2017-10-09,50.15020446,-122.9659716,9827540,229141
ab-16098879,"Whistler Upper Vill: 3 BR/2 BA, Sleeps 8, Hot Tub",Condominium,Entire home/apt,11/22/16,2016-11-22,9-20-17,2017-09-20,50.11937503,-122.940852,16098879,74873839
ab-21947921,4 Bdrm Townhouse walk to the Village,Entire townhouse,Entire home/apt,12/8/17,2017-12-08,12-26-17,2017-12-26,50.12593092,-122.9547745,21947921,51270275
ab-21950746,Nick North Whistler Condo Getaway,Condominium,Entire home/apt,7/7/18,2018-07-07,5-24-19,2019-05-24,50.14336,-122.94895,21950746,17972824
ab-21952816,Fabulous Marquise Ski in/Ski out,Apartment,Entire home/apt,12/7/17,2017-12-07,5-21-19,2019-05-21,50.11807,-122.9427,21952816,6733621
ab-21955363,Luxury Ski-in/Ski-out on Whistler Mountain,Townhouse,Entire home/apt,12/8/17,2017-12-08,5-24-19,2019-05-24,50.11136,-122.9494,21955363,7597745
ab-16099947,Best Location! - Modern 2 Bedroom The Gables,Townhouse,Entire home/apt,11/22/16,2016-11-22,5-24-19,2019-05-24,50.11345,-122.95102,16099947,104951428
ab-16100270,Resort Quest at Whistler Peak Lodge,Other,Entire home/apt,11/22/16,2016-11-22,11-25-16,2016-11-25,50.11584731,-122.9534828,16100270,4266752
ab-16100906,Embarc Whistler - 1 bedroom,Timeshare,Entire home/apt,11/22/16,2016-11-22,2-6-17,2017-02-06,50.11737369,-122.9463181,16100906,104960615
ab-13348663,Peak View Penthouse,Loft,Entire home/apt,6/3/16,2016-06-03,5-21-19,2019-05-21,50.09711,-122.99157,13348663,31307802
ab-19748647,Whistler Village Northstar 2 B/R 2 Bath,Condominium,Entire home/apt,7/6/17,2017-07-06,10-27-17,2017-10-27,50.11992893,-122.9589119,19748647,47511634
ab-21965477,500m to Gondola! 3 Bdrm Townhouse; warm and modern,Townhouse,Entire home/apt,12/16/17,2017-12-16,5-23-19,2019-05-23,50.09316,-122.99479,21965477,148262353
ab-9841559,Whistler Creek Townhome,Entire townhouse,Entire home/apt,12/5/15,2015-12-05,2-5-18,2018-02-05,50.09179226,-122.9916744,9841559,50677841
ab-21966497,Amazing - 2Br/2Ba Townhouse - Hot Tub,Townhouse,Entire home/apt,12/8/17,2017-12-08,5-21-19,2019-05-21,50.12168,-122.95885,21966497,160370751
ab-21967152,WorldMark Sundance 2BR+Loft  Sleeps 8,Resort,Entire home/apt,12/8/17,2017-12-08,1-3-19,2019-01-03,50.09322653,-122.9937794,21967152,122138209
ab-20333777,Stay in the heart of Whistler,Townhouse,Entire home/apt,8/7/17,2017-08-07,5-21-19,2019-05-21,50.11778,-122.95817,20333777,46900932
ab-13349648,Quiet and Cozy Creekside Townhouse,Townhouse,Entire home/apt,6/3/16,2016-06-03,5-22-19,2019-05-22,50.0915,-122.99317,13349648,373752
ab-21976974,Beautiful Bench Land Townhome 3bdrm 2bath,Townhouse,Entire home/apt,12/9/17,2017-12-09,7-14-18,2018-07-14,50.11865189,-122.9403842,21976974,17083291
ab-21980880,The Marquise,Condominium,Entire home/apt,12/7/17,2017-12-07,5-22-19,2019-05-22,50.1176,-122.94331,21980880,153388448
ab-9846645,Luxury 3 Bedroom Plus Den Townhome,Townhouse,Entire home/apt,12/5/15,2015-12-05,1-3-17,2017-01-03,50.12445918,-122.9578732,9846645,50700706
ab-19750766,Bear Lodge Fully Equipped One Bedroom Condo.,Condominium,Entire home/apt,7/6/17,2017-07-06,6-14-18,2018-06-14,50.11782288,-122.9558011,19750766,68581273
ab-20353614,Quiet Mountain Studio Suite in Whistler,Condominium,Entire home/apt,8/8/17,2017-08-08,10-12-17,2017-10-12,50.12283878,-122.933957,20353614,65790915
ab-21982835,"Two bedroom with Ski-Home Access, Private hot tub",Townhouse,Entire home/apt,12/7/17,2017-12-07,5-24-19,2019-05-24,50.11656,-122.93861,21982835,96453221
ab-21993625,3 Bedroom + Den Whistler Townhome with Hot Tub,Entire townhouse,Entire home/apt,12/6/17,2017-12-06,1-15-18,2018-01-15,50.12293871,-122.9578577,21993625,65790915
ab-20355078,Cozy Whistler 1 Bedroom Mountain Condo,Condominium,Entire home/apt,8/8/17,2017-08-08,10-13-17,2017-10-13,50.12156606,-122.9553033,20355078,65790915
ab-16110651,Quiet Mountainside Escape:  Ski/Bike In-Out,Condominium,Entire home/apt,11/23/16,2016-11-23,5-24-19,2019-05-24,50.11597,-122.94411,16110651,105038814
ab-9859369,*FREE SIGHTSEE/BIKE PARK PASSES* 2 bdrm w Hot Tub!,Apartment,Entire home/apt,12/6/15,2015-12-06,5-24-19,2019-05-24,50.11894,-122.93924,9859369,7784624
ab-21997567,"Boho Chic Mountain Home, 5 min from Creekside",Entire townhouse,Entire home/apt,12/7/17,2017-12-07,12-7-17,2017-12-07,50.10025862,-122.9854933,21997567,6334570
ab-21998782,#412 Cascade Lodge By Elevate Real Estate (1-bed),Condominium,Entire home/apt,12/10/17,2017-12-10,11-7-18,2018-11-07,50.11629303,-122.9590511,21998782,3749031
ab-21998930,#416 Cascade Lodge By Elevate Real Estate (1-bed),Condominium,Entire home/apt,12/6/17,2017-12-06,11-6-18,2018-11-06,50.11565066,-122.9578693,21998930,3749031
ab-21999139,#506 Cascade Lodge By Elevate Real Estate (1-bed),Condominium,Entire home/apt,12/6/17,2017-12-06,11-8-18,2018-11-08,50.11617168,-122.9596744,21999139,3749031
ab-21999221,#532 Cascade Lodge By Elevate Real Estate (1-bed),Condominium,Entire home/apt,12/10/17,2017-12-10,11-8-18,2018-11-08,50.11708974,-122.9587452,21999221,3749031
ab-21999246,Newly Renovated & Central Location in Whistler,Apartment,Entire home/apt,2/5/18,2018-02-05,5-22-19,2019-05-22,50.11376,-122.95599,21999246,43541894
ab-21999296,#530 Cascade Lodge By Elevate Real Estate (2-bed),Condominium,Entire home/apt,12/6/17,2017-12-06,11-8-18,2018-11-08,50.11757481,-122.9587653,21999296,3749031
ab-21999467,#630 Cascade Lodge By Elevate Real Estate (2-bed),Condominium,Entire home/apt,12/6/17,2017-12-06,11-8-18,2018-11-08,50.11778934,-122.9582774,21999467,3749031
ab-21999600,Whistler Cascade Lodge Presidents week,Condominium,Entire home/apt,12/6/17,2017-12-06,5-22-19,2019-05-22,50.1172,-122.95804,21999600,8440595
ab-21999602,Whistler Cascade Lodge 3night stays,Resort,Entire home/apt,12/7/17,2017-12-07,5-24-19,2019-05-24,50.11638,-122.95656,21999602,8440595
ab-21999608,Whistler Cascade Lodge Short Stays,Condominium,Entire home/apt,12/7/17,2017-12-07,5-22-19,2019-05-22,50.11673,-122.95671,21999608,8440595
ab-21999808,SB0201 (3 Bedroom) SNOWBIRD  BY ERM,Townhouse,Entire home/apt,12/7/17,2017-12-07,5-23-19,2019-05-23,50.11474,-122.94133,21999808,3749031
ab-16112185,Cozy Creekside Cabin,Cabin,Entire home/apt,11/23/16,2016-11-23,3-22-18,2018-03-22,50.09388686,-122.9948566,16112185,15087428
ab-22000003,SB0202 (4 Bedroom) Snowbird By ERM,Condominium,Entire home/apt,12/6/17,2017-12-06,5-21-19,2019-05-21,50.11373,-122.94302,22000003,3749031
ab-13965534,Heart of Whistler Village 1 Bdrm Penthouse Suite,Apartment,Entire home/apt,7/11/16,2016-07-11,5-23-19,2019-05-23,50.11634,-122.95452,13965534,83237927
ab-22002042,Creekside condo,Townhouse,Entire home/apt,12/7/17,2017-12-07,1-12-19,2019-01-12,50.09885885,-122.9888227,22002042,47998744
ab-5160663,Greystone Ski in/out  2BR/2BA  Slp7,Condominium,Entire home/apt,1/19/15,2015-01-19,5-22-19,2019-05-22,50.11491,-122.94452,5160663,14931192
ab-5161842,House on Nicklaus North Golf Course,House,Entire home/apt,1/19/15,2015-01-19,5-23-19,2019-05-23,50.14185,-122.95322,5161842,26696664
ab-20359999,Great Centrally Located 2 Bedroom Whistler Condo,Condominium,Entire home/apt,8/9/17,2017-08-09,10-13-17,2017-10-13,50.11946041,-122.9605853,20359999,65790915
ab-20360733,Modern Whistler 2 Bedroom Condo w/ Hot Tub & Deck,Condominium,Entire home/apt,8/9/17,2017-08-09,10-13-17,2017-10-13,50.11941659,-122.9596023,20360733,65790915
ab-19115890,'Tyndall Stone' Modern 1BR in heart of Village!,Townhouse,Entire home/apt,6/3/17,2017-06-03,11-8-17,2017-11-08,50.11779802,-122.9546875,19115890,35393628
ab-8446094,"Whistler, 3 bdrm loft, sleeps 8",Apartment,Entire home/apt,9/17/15,2015-09-17,12-18-16,2016-12-18,50.0926938,-122.9951333,8446094,17876150
ab-20361448,Amazing Blackcomb Location w/ Pool & Hot Tub by Harmony Whistler,Condominium,Entire home/apt,8/9/17,2017-08-09,5-25-19,2019-05-25,50.11796,-122.94696,20361448,35393628
ab-20361946,2 bedroom Modern Mountain Retreat in Creekside,Townhouse,Entire home/apt,8/9/17,2017-08-09,5-21-19,2019-05-21,50.09655,-122.99008,20361946,23676895
ab-8447461,Fantastic Ski in/Ski out apartment in Creekside,Guest suite,Entire home/apt,9/17/15,2015-09-17,5-21-19,2019-05-21,50.09296,-122.99237,8447461,42329437
ab-14674760,Completely updated 2 bdrm townhome with pool,Condominium,Entire home/apt,8/21/16,2016-08-21,8-28-18,2018-08-28,50.12058655,-122.9556389,14674760,84104905
ab-5173337,Cosy Open 2B Whistler Village,Apartment,Entire home/apt,1/21/15,2015-01-21,3-12-19,2019-03-12,50.11681,-122.95576,5173337,6733621
ab-22016655,SB0203 (3 Bedroom) Snowbird By ERM,Condominium,Entire home/apt,12/7/17,2017-12-07,5-21-19,2019-05-21,50.11486,-122.9427,22016655,3749031
ab-22016856,SB0205 (3 Bedroom) Snowbird  By ERM,Condominium,Entire home/apt,12/7/17,2017-12-07,5-24-19,2019-05-24,50.11451,-122.94316,22016856,3749031
ab-22017022,SB0207 (3 Bedroom) Snowbird By ERM,Condominium,Entire home/apt,12/7/17,2017-12-07,5-24-19,2019-05-24,50.11308,-122.94279,22017022,3749031
ab-22017167,SB0208 (2 Bedroom)  Snowbird By ERM,Condominium,Entire home/apt,12/7/17,2017-12-07,5-24-19,2019-05-24,50.11718,-122.93951,22017167,3749031
ab-22020251,THE LOOKOUT PENTHOUSE // a luxe suite in Whistler,Serviced apartment,Entire home/apt,12/7/17,2017-12-07,5-24-19,2019-05-24,50.11473,-122.94579,22020251,6315403
ab-22021685,Large Studio in Whistler Village,Condominium,Entire home/apt,12/6/17,2017-12-06,5-23-19,2019-05-23,50.11884,-122.95959,22021685,104388294
ab-16113609,Skiers Dream Apartment Dec 18 to 25,Apartment,Entire home/apt,11/23/16,2016-11-23,12-14-16,2016-12-14,50.11329988,-122.9580091,16113609,33118487
ab-16114543,Creekside Studio - Walk to Lifts,Condominium,Entire home/apt,11/23/16,2016-11-23,4-3-19,2019-04-03,50.0971,-122.98865,16114543,46867295
ab-16115801,Lovely Whistler family home! Space for everyone!,House,Entire home/apt,11/23/16,2016-11-23,5-24-19,2019-05-24,50.14719,-122.97146,16115801,18365436
ab-13979632,"Whistler Modern, Ski In/Out, Hot Tub & Heated Pool",Room in aparthotel,Private room,7/12/16,2016-07-12,5-24-19,2019-05-24,50.11785,-122.94631,13979632,1356898
ab-22031108,Spacious Well Appointed Townhouse,Entire townhouse,Entire home/apt,12/6/17,2017-12-06,3-4-18,2018-03-04,50.09233014,-122.9932074,22031108,134284463
ab-22033099,PE901 Powders By Elevate Real Estate,Condominium,Entire home/apt,12/6/17,2017-12-06,5-21-19,2019-05-21,50.11299,-122.95678,22033099,3749031
ab-8459732,Cosy Townhome close to restaurants,Apartment,Entire home/apt,9/18/15,2015-09-18,10-19-16,2016-10-19,50.09276484,-122.9933661,8459732,3053436
ab-22033156,Spacious 3 Bedroom Suite with Private Patio and a Fireplace!,Condominium,Entire home/apt,12/7/17,2017-12-07,5-24-19,2019-05-24,50.12137,-122.95912,22033156,151701730
ab-22033171,PERFECT FOR GROUPS! Spacious 3 Bedroom Suite with Private Patio,Condominium,Entire home/apt,1/6/18,2018-01-06,5-3-18,2018-05-03,50.11979213,-122.96078,22033171,151701730
ab-22033516,Modern in the Heart of Whistler Village!!,Apartment,Entire home/apt,12/7/17,2017-12-07,3-26-18,2018-03-26,50.11446665,-122.9558147,22033516,160907324
ab-22033631,PE902 Powders Edge By Elevate Real Estate,Condominium,Entire home/apt,12/7/17,2017-12-07,5-24-19,2019-05-24,50.11336,-122.95937,22033631,3749031
ab-22033939,PE903 Powders Edge By Elevate Real Estate,Condominium,Entire home/apt,12/7/17,2017-12-07,5-22-19,2019-05-22,50.1118,-122.95692,22033939,3749031
ab-22034111,PE904 Powders Edge By Elevate Real Estate,Condominium,Entire home/apt,12/6/17,2017-12-06,5-22-19,2019-05-22,50.11326,-122.95606,22034111,3749031
ab-22034243,PE905 Powders Edge By Elevate Real Estate,Condominium,Entire home/apt,12/7/17,2017-12-07,5-22-19,2019-05-22,50.11277,-122.95688,22034243,3749031
ab-22034372,PE906 Powders Edge By Elevate Real Estate,Condominium,Entire home/apt,12/7/17,2017-12-07,5-22-19,2019-05-22,50.11376,-122.9577,22034372,3749031
ab-17776910,"Ski-in/Ski-out 2BR, 2Bth Luxury Condo Blckcomb Mt",Condominium,Entire home/apt,3/16/17,2017-03-16,2-20-19,2019-02-20,50.11365,-122.96605,17776910,47728260
ab-16122333,Fantastic 1 bedroom +den condo -walk everywhere !,Condominium,Entire home/apt,11/24/16,2016-11-24,5-1-17,2017-05-01,50.12102223,-122.9564067,16122333,19142957
ab-16122363,"Whistler, Ski in/Out Deluxe  Glacier Lodge Condo",Condominium,Entire home/apt,11/24/16,2016-11-24,5-22-19,2019-05-22,50.11815,-122.94817,16122363,19142957
ab-23288851,Stunning SLOPESIDE 1 Bedroom Suite with Private Balcony and Hot Tub!!!,Condominium,Entire home/apt,2/19/18,2018-02-19,5-24-19,2019-05-24,50.11429,-122.95578,23288851,151701730
ab-23288885,Stunning SLOPESIDE 1 Bedroom Suite with Private Balcony and Hot Tub!!!,Condominium,Entire home/apt,2/19/18,2018-02-19,5-2-18,2018-05-02,50.11270674,-122.955683,23288885,151701730
ab-23288918,RARE TRUE Ski-in/Ski-out Suite with Fireplace and Valley Views!,Condominium,Entire home/apt,2/19/18,2018-02-19,5-21-19,2019-05-21,50.11461,-122.95581,23288918,151701730
ab-23288944,RARE TRUE Ski-in/Ski-out Suite with Modern Style and Valley Views!,Condominium,Entire home/apt,2/19/18,2018-02-19,5-1-18,2018-05-01,50.11349386,-122.9549925,23288944,151701730
ab-23288981,Slopeside 1 Bedroom Mountain View Suite | AMAZING LOCATION!!,Condominium,Entire home/apt,2/19/18,2018-02-19,5-23-19,2019-05-23,50.11454,-122.95361,23288981,151701730
ab-22053061,LAST Minute Special- 2BR in Embrac,Resort,Entire home/apt,12/7/17,2017-12-07,5-23-19,2019-05-23,50.117,-122.94531,22053061,154410588
ab-13981526,Harmony at Eagle Lodge (2 Bed / 2 Full Bathrooms),Apartment,Entire home/apt,7/12/16,2016-07-12,5-22-19,2019-05-22,50.11611,-122.95576,13981526,83099102
ab-22483032,2 BR Spacious Unit Twin Peaks Whistler Sleeps 6,Place,Entire home/apt,1/6/18,2018-01-06,5-24-19,2019-05-24,50.11945,-122.95888,22483032,36978550
ab-14688207,Relax in style steps fr village w/ pool & hot tub!,Townhouse,Entire home/apt,8/22/16,2016-08-22,5-23-19,2019-05-23,50.1169,-122.95793,14688207,91327881
ab-5185072,Perfect for Families | 4bdr/3bth | Private Hot Tub,House,Entire home/apt,1/2/17,2017-01-02,5-23-19,2019-05-23,50.11353505,-122.9694668,5185072,10418326
ab-14688344,Condo,Apartment,Entire home/apt,8/22/16,2016-08-22,12-2-18,2018-12-02,50.11493282,-122.9443839,14688344,51268296
ab-23289001,RARE 1 Bedroom Mountain View Suite | AMAZING LOCATION!!,Condominium,Entire home/apt,2/19/18,2018-02-19,5-1-18,2018-05-01,50.11478397,-122.9554029,23289001,151701730
ab-23289025,PRIVATE Hot Tub! Ski-in/Ski-out Location! Fireplace + Outdoor Pool,Condominium,Entire home/apt,2/19/18,2018-02-19,5-21-19,2019-05-21,50.11263,-122.95348,23289025,151701730
ab-23289049,Modern Suite with TRUE Ski-in/Ski-out and PRIVATE Balcony with Hot Tub,Condominium,Entire home/apt,2/19/18,2018-02-19,5-13-18,2018-05-13,50.11339738,-122.9552487,23289049,151701730
ab-23289092,Stunning SLOPE-SIDE 2 Bedroom Suite with Amazing Mountain View,Condominium,Entire home/apt,2/19/18,2018-02-19,5-23-19,2019-05-23,50.11437,-122.95397,23289092,151701730
ab-23289120,Stunning SLOPE-SIDE 2 Bedroom Suite with Amazing Mountain View,Condominium,Entire home/apt,2/19/18,2018-02-19,5-2-18,2018-05-02,50.11285368,-122.9540739,23289120,151701730
ab-23289138,AMAZING Ski In/Ski Out Location! PRIVATE Hot Tub + Balcony!,Condominium,Entire home/apt,2/19/18,2018-02-19,5-22-19,2019-05-22,50.11494,-122.9538,23289138,151701730
ab-23289162,Stunning Suite with AMAZING LOCATION and Personal Hot Tub + Balcony!,Condominium,Entire home/apt,2/19/18,2018-02-19,5-2-18,2018-05-02,50.11322012,-122.9539388,23289162,151701730
ab-23289481,Spacious 2 Bedroom Suite with UNBEATABLE ski-in/ski-out location!,Condominium,Entire home/apt,2/19/18,2018-02-19,5-22-19,2019-05-22,50.11487,-122.95427,23289481,151701730
ab-23289501,Spacious 2 Bedroom Suite with UNBEATABLE ski-in/ski-out location!,Condominium,Entire home/apt,2/19/18,2018-02-19,5-14-18,2018-05-14,50.11469886,-122.9556324,23289501,151701730
ab-23289529,Stunning Premium 2 Bedroom Suite in UNMATCHED SLOPE-SIDE Location!,Condominium,Entire home/apt,2/19/18,2018-02-19,5-21-19,2019-05-21,50.11338,-122.95347,23289529,151701730
ab-23289547,Stunning Premium 2 Bedroom Suite in UNMATCHED SLOPE-SIDE Location!,Condominium,Entire home/apt,2/19/18,2018-02-19,5-2-18,2018-05-02,50.11339101,-122.9543527,23289547,151701730
ab-8471733,Ski Home in Whistler Village,House,Entire home/apt,9/19/15,2015-09-19,12-3-15,2015-12-03,50.12526886,-122.9610384,8471733,44613766
ab-8473592,Boutique Whistler Village Escape,Apartment,Entire home/apt,9/19/15,2015-09-19,6-10-17,2017-06-10,50.11515014,-122.9565139,8473592,44623718
ab-20382415,Spacious Whistler 2 Bedroom Condo w/ Hot Tub,Condominium,Entire home/apt,8/10/17,2017-08-10,10-12-17,2017-10-12,50.11807769,-122.9587818,20382415,65790915
ab-22060600,"The Flying Bear-3 mins walk to gondola, great view",Apartment,Entire home/apt,12/6/17,2017-12-06,5-21-19,2019-05-21,50.09434,-122.99426,22060600,40340388
ab-17790049,One BDRM Newly  Renovated Condo in The Aspens,Condominium,Entire home/apt,3/17/17,2017-03-17,5-22-19,2019-05-22,50.11678,-122.94546,17790049,118071736
ab-16125136,"3 bedroom, quiet, spacious, tasteful, convenient.",Townhouse,Entire home/apt,11/24/16,2016-11-24,5-22-19,2019-05-22,50.12,-122.93946,16125136,7008499
ab-22486922,BEST OF MARQUISE,Condominium,Entire home/apt,11/20/18,2018-11-20,5-21-19,2019-05-21,50.11602,-122.94409,22486922,164905301
ab-5200301,Whistler Cascade Lodge 1 br condo,Apartment,Entire home/apt,1/25/15,2015-01-25,5-23-19,2019-05-23,50.1173,-122.95689,5200301,103427
ab-20385325,Lovely Whistler 3 Bedroom Mountain Townhome,Townhouse,Entire home/apt,8/10/17,2017-08-10,10-13-17,2017-10-13,50.1189941,-122.9598077,20385325,65790915
ab-14691668,The #1 ski in/out in Whistler Village,Serviced apartment,Entire home/apt,8/22/16,2016-08-22,5-21-19,2019-05-21,50.11282,-122.95556,14691668,76570804
ab-24118135,Sundance Whistler,Condominium,Entire home/apt,8/11/18,2018-08-11,2-8-19,2019-02-08,50.09149386,-122.9938528,24118135,77837540
ab-8484916,Beautiful Whistler Chalet near Village. Private.,Chalet,Entire home/apt,12/5/16,2016-12-05,5-22-19,2019-05-22,50.12327,-122.96628,8484916,44685956
ab-23303945,Whistler Village North 1-Bedroom Condo,Condominium,Entire home/apt,2/19/18,2018-02-19,7-21-18,2018-07-21,50.11882588,-122.9579337,23303945,173513490
ab-8486740,Upper Village Ski In Ski Out Suite,Condominium,Entire home/apt,9/20/15,2015-09-20,5-21-16,2016-05-21,50.11621827,-122.9419819,8486740,22825384
ab-20389499,Stunning Whistler 2 Bedroom Condo w/ Balcony,Condominium,Entire home/apt,8/10/17,2017-08-10,10-12-17,2017-10-12,50.11750159,-122.9586519,20389499,65790915
ab-20389734,Fantastic Family-Friendly Whistler 2 Bedroom Condo,Condominium,Entire home/apt,8/10/17,2017-08-10,10-13-17,2017-10-13,50.12029215,-122.9598817,20389734,65790915
ab-23305134,Suite for 4 with Fireplace | TRUE Ski-in/Ski-out in Whistler Village,Condominium,Entire home/apt,2/19/18,2018-02-19,5-21-19,2019-05-21,50.1126,-122.95632,23305134,151701730
ab-23305160,Chic Suite | Rare Find with TRUE Ski-in/Ski-out in Whistler Village,Condominium,Entire home/apt,2/19/18,2018-02-19,5-13-18,2018-05-13,50.11286746,-122.9546166,23305160,151701730
ab-23305218,Ski-in/out Benchlands 3-bedroom Townhome,Townhouse,Entire home/apt,2/20/18,2018-02-20,5-24-19,2019-05-24,50.11589,-122.94146,23305218,173513490
ab-23305240,Blackcomb Mountain Ski-in/out 1-Bedroom Condo,Condominium,Entire home/apt,2/20/18,2018-02-20,5-24-19,2019-05-24,50.11561,-122.94618,23305240,173513490
ab-23305256,Ski-in/out 1-bedroom Blackcomb Mountain Condo,Condominium,Entire home/apt,2/20/18,2018-02-20,5-24-19,2019-05-24,50.1168,-122.94545,23305256,173513490
ab-23305264,1-Bedroom Ski Access Slope-side Condo,Condominium,Entire home/apt,2/20/18,2018-02-20,1-3-19,2019-01-03,50.11489049,-122.9460386,23305264,173513490
ab-23305278,2-bedroom Ski-in/out Blackcomb Mountain Condo,Condominium,Entire home/apt,2/20/18,2018-02-20,5-22-19,2019-05-22,50.11539,-122.94422,23305278,173513490
ab-23305294,Ski-in/out 1-bedroom at Aspens Condos,Condominium,Entire home/apt,2/20/18,2018-02-20,5-21-19,2019-05-21,50.11502,-122.94471,23305294,173513490
ab-23305306,Slope-side Ski Access 2-Bedroom Condo,Condominium,Entire home/apt,2/20/18,2018-02-20,5-20-19,2019-05-20,50.11609,-122.94577,23305306,173513490
ab-23305315,1-Bedroom Ski-in/out to Blackcomb Mountain,Condominium,Entire home/apt,2/20/18,2018-02-20,5-22-19,2019-05-22,50.1161,-122.94392,23305315,173513490
ab-23305318,Ski-in/out 2-bedroom Blackcomb Mountain Condo,Condominium,Entire home/apt,2/20/18,2018-02-20,5-20-19,2019-05-20,50.11507,-122.94403,23305318,173513490
ab-23305325,1-bedroom Ski-in/out Aspens Condo,Condominium,Entire home/apt,2/20/18,2018-02-20,5-21-19,2019-05-21,50.11695,-122.94443,23305325,173513490
ab-23305331,Ski-in/out 1-bedroom Condo,Condominium,Entire home/apt,2/20/18,2018-02-20,5-24-19,2019-05-24,50.11612,-122.94557,23305331,173513490
ab-23305338,Blackcomb Mountain Ski-in-out 2-Bedroom Retreat,Condominium,Entire home/apt,2/20/18,2018-02-20,1-2-19,2019-01-02,50.11682138,-122.9445435,23305338,173513490
ab-23305348,"Close to Village, Golf Adjacent 2-bedroom Condo",Townhouse,Entire home/apt,2/19/18,2018-02-19,5-20-19,2019-05-20,50.12069,-122.93787,23305348,173513490
ab-23305445,Updated 2-bedroom+loft condo Near Activities,Condominium,Entire home/apt,2/20/18,2018-02-20,5-20-19,2019-05-20,50.11288,-122.9685,23305445,173513490
ab-23305492,Walk to Lifts 2-Bedroom Contemporary Getaway,Condominium,Entire home/apt,2/20/18,2018-02-20,5-24-19,2019-05-24,50.11777,-122.96007,23305492,173513490
ab-23305507,Centrally Located 2-bedroom Town Home,Condominium,Entire home/apt,2/19/18,2018-02-19,5-23-19,2019-05-23,50.1189,-122.96025,23305507,173513490
ab-23305519,Centrally Located Walk to Village 3-bedroom Town Home,Condominium,Entire home/apt,2/20/18,2018-02-20,5-21-19,2019-05-21,50.11789,-122.95864,23305519,173513490
ab-23305528,2-bedroom Town Home Walk to Ski and Village,Condominium,Entire home/apt,2/20/18,2018-02-20,5-21-19,2019-05-21,50.118,-122.95841,23305528,173513490
ab-23305535,Close to it all 3-bedroom Townhome,Condominium,Entire home/apt,2/19/18,2018-02-19,5-21-19,2019-05-21,50.11876,-122.96035,23305535,173513490
ab-23305787,Centrally Located Luxury 3-bedroom Vacation Home,Townhouse,Entire home/apt,2/19/18,2018-02-19,10-23-18,2018-10-23,50.12535135,-122.9566035,23305787,173513490
ab-23305789,3-Bedroom Central Whistler Location Town Home,Townhouse,Entire home/apt,2/19/18,2018-02-19,5-24-19,2019-05-24,50.12283,-122.95462,23305789,173513490
ab-23305798,3-bedroom + Den Whistler North Village Retreat w/Hot Tub,Townhouse,Entire home/apt,2/19/18,2018-02-19,5-23-19,2019-05-23,50.12247,-122.95538,23305798,173513490
ab-23305806,Walk to Ski Comfortable 1-Bedroom Condo,Condominium,Entire home/apt,2/20/18,2018-02-20,5-24-19,2019-05-24,50.11587,-122.94224,23305806,173513490
ab-23305809,"Prime Walk to Ski Blackcomb Mountain Location, Sleeps 4",Condominium,Entire home/apt,2/20/18,2018-02-20,5-23-19,2019-05-23,50.11643,-122.94257,23305809,173513490
ab-23305812,"Contemporary 1-Bedroom Condo, Walk to Ski",Condominium,Entire home/apt,2/20/18,2018-02-20,7-22-18,2018-07-22,50.11600524,-122.9419057,23305812,173513490
ab-23305836,Walk to ski Loaded 1-bedroom codo,Condominium,Entire home/apt,2/20/18,2018-02-20,5-22-19,2019-05-22,50.11763,-122.94397,23305836,173513490
ab-23305844,Deluxe 3-bedroom Mountain Retreat,Townhouse,Entire home/apt,2/19/18,2018-02-19,5-24-19,2019-05-24,50.10972,-122.95843,23305844,173513490
ab-23305851,Centrally Located 3-Bedroom Townhome,Condominium,Entire home/apt,2/19/18,2018-02-19,7-20-18,2018-07-20,50.11918676,-122.9586307,23305851,173513490
ab-23305865,Walk to Lifts 2-bedroom Townhome,Condominium,Entire home/apt,2/19/18,2018-02-19,5-24-19,2019-05-24,50.11943,-122.95977,23305865,173513490
ab-23305868,Ski-in/out on Blackcomb Mountain 2-bedroom Townhouse,Condominium,Entire home/apt,2/20/18,2018-02-20,5-22-19,2019-05-22,50.11527,-122.94141,23305868,173513490
ab-23305875,Walk to Lifts 1-Bedroom Cozy Townhome,Condominium,Entire home/apt,2/20/18,2018-02-20,5-21-19,2019-05-21,50.1172,-122.95794,23305875,173513490
ab-23305883,Ski-in/out 2-Bedroom Retreat w/Private Hot Tub,Townhouse,Entire home/apt,2/20/18,2018-02-20,7-20-18,2018-07-20,50.11515199,-122.9433648,23305883,173513490
ab-23305885,"Walk to Ski, Steps from Racquet Club, 4-Season 3-Bedroom Townhome",Townhouse,Entire home/apt,2/19/18,2018-02-19,5-24-19,2019-05-24,50.1206,-122.95883,23305885,173513490
ab-23305892,2-Bedroom Walk to ski North Village Condo,Condominium,Entire home/apt,2/19/18,2018-02-19,5-22-19,2019-05-22,50.1155,-122.95516,23305892,173513490
ab-23305897,Ski-in Shuttle out 2-Bedroom Blackcomb Mountain Townhome,Townhouse,Entire home/apt,2/19/18,2018-02-19,5-23-19,2019-05-23,50.12207,-122.93368,23305897,173513490
ab-22086011,3 Bedroom 2 bath Home with Mineral Hot Tub,House,Entire home/apt,12/6/17,2017-12-06,4-1-18,2018-04-01,50.11205107,-122.9764237,22086011,161337358
ab-22086662,Cozy condo in Whistler Village,Condominium,Entire home/apt,12/6/17,2017-12-06,5-22-19,2019-05-22,50.11579,-122.958,22086662,27477423
ab-16133244,Cute adventurous living space,Camper/RV,Entire home/apt,11/24/16,2016-11-24,7-2-17,2017-07-02,50.05025626,-123.1002875,16133244,46808367
ab-22087414,"Montebello Luxury 3 Bed, 3 Bath,  private hot tub",Townhouse,Entire home/apt,12/6/17,2017-12-06,5-22-19,2019-05-22,50.12264,-122.95808,22087414,155028292
ab-22088509,Whistler Vacation Club At Twin Peaks #3881,Resort,Entire home/apt,12/6/17,2017-12-06,5-23-19,2019-05-23,50.12055,-122.95878,22088509,117986903
ab-22494948,Whistler (Week Feb 16-23) @ Lake Placid Lodge,Resort,Entire home/apt,1/6/18,2018-01-06,1-20-19,2019-01-20,50.09435782,-122.9899334,22494948,155096742
ab-19133185,Great Value by the Gondola w/ Free Parking,Apartment,Entire home/apt,6/4/17,2017-06-04,5-22-19,2019-05-22,50.09779,-122.98812,19133185,122773552
ab-23307331,Mountain View Luxe 3-bedroom Vacation Home,Townhouse,Entire home/apt,2/19/18,2018-02-19,5-21-19,2019-05-21,50.12343,-122.95494,23307331,173513490
ab-23307346,Walk to Ski Benchlands 1-Bedroom Condo,Condominium,Entire home/apt,2/20/18,2018-02-20,1-2-19,2019-01-02,50.11629251,-122.9422455,23307346,173513490
ab-23307355,Ski-in/out to Blackcomb Mountain 2-bedroom Townhome,Condominium,Entire home/apt,2/20/18,2018-02-20,5-21-19,2019-05-21,50.115,-122.94042,23307355,173513490
ab-23307391,Ski-in/out 2-Bedroom Retreat with Resort-style amenities,Condominium,Entire home/apt,2/20/18,2018-02-20,5-20-19,2019-05-20,50.11448,-122.94414,23307391,173513490
ab-22096755,Nice Whistler Chalet Ski-in/Ski-out,Entire chalet,Entire home/apt,12/6/17,2017-12-06,12-12-17,2017-12-12,50.12038182,-122.9616285,22096755,159712364
ab-22099127,Schitterend Huis met Bergzicht in Whistler,Entire vacation home,Entire home/apt,12/10/17,2017-12-10,12-10-17,2017-12-10,50.1395345,-122.9543645,22099127,161438726
ab-20392724,Beautiful Whistler 1 Bedroom Townhome + Den,Townhouse,Entire home/apt,8/10/17,2017-08-10,10-12-17,2017-10-12,50.11609572,-122.9426151,20392724,65790915
ab-16135591,Blackcomb Base - Ski in/out property sleeps 6,Condominium,Entire home/apt,11/25/16,2016-11-25,5-24-19,2019-05-24,50.11797,-122.94694,16135591,105263949
ab-22103619,Reno-ed Studio in the Heart of Whistler Village,Entire condominium,Entire home/apt,12/6/17,2017-12-06,1-17-18,2018-01-17,50.11732871,-122.9585164,22103619,99922624
ab-22105651,"3 Bedroom Private Home at Brio Estates in Whistler, BC",Entire house,Entire home/apt,12/16/17,2017-12-16,12-19-17,2017-12-19,50.10824845,-122.9761889,22105651,151701730
ab-22108445,Ski-In/Ski-Out -Private Hottub-Townhouse,Townhouse,Entire home/apt,12/7/17,2017-12-07,5-21-19,2019-05-21,50.09439,-122.98293,22108445,135540975
ab-22108771,Newly renovated bright top floor one bedroom condo,Apartment,Entire home/apt,12/6/17,2017-12-06,5-24-19,2019-05-24,50.10048,-122.99003,22108771,161512034
ab-22108916,"Leaping Lynx - 3 mins to gondola, great view",Apartment,Entire home/apt,12/6/17,2017-12-06,5-21-19,2019-05-21,50.09248,-122.99316,22108916,40340388
ab-22108967,New Year's week in Whistler village,Entire timeshare,Entire home/apt,12/6/17,2017-12-06,1-2-18,2018-01-02,50.11648122,-122.9579309,22108967,7810393
ab-17794231,Embarc Studio,Serviced apartment,Private room,3/17/17,2017-03-17,8-3-17,2017-08-03,50.11762396,-122.9452214,17794231,69657375
ab-22109364,1BR + Den in Whistler Village Comfortably Sleeps 6,Condominium,Entire home/apt,12/6/17,2017-12-06,5-31-18,2018-05-31,50.1195025,-122.9547536,22109364,161367128
ab-22111609,Taluswood Ridge Chalet,Entire vacation home,Entire home/apt,12/7/17,2017-12-07,12-16-17,2017-12-16,50.09285354,-122.9805512,22111609,3369205
ab-22113892,cozy four bdr. with lake views,Entire vacation home,Entire home/apt,12/13/17,2017-12-13,12-19-17,2017-12-19,50.09831277,-122.9936133,22113892,161544332
ab-22115164,Quiet and cozy apartment for 2 /close to ski slope,Entire apartment,Entire home/apt,12/7/17,2017-12-07,12-13-17,2017-12-13,50.12391689,-122.9516317,22115164,161149451
ab-24944184,"2Br/2Ba Townhouse - Hot Tub, Free Parking, Pool",Townhouse,Entire home/apt,5/10/18,2018-05-10,5-20-19,2019-05-20,50.119,-122.95867,24944184,188580599
ab-23310738,Pan Pacific Mountainside Studio Whistler/Blackcomb,Boutique hotel,Shared room,2/19/18,2018-02-19,7-8-18,2018-07-08,50.1128719,-122.9543022,23310738,114018091
ab-22117009,Elegant Modern Bedroom Steps Away From Gondola,House,Private room,12/6/17,2017-12-06,8-26-18,2018-08-26,50.09308601,-122.9926413,22117009,1747962
ab-13388845,BEST LOCATION in Whistler -90 meters to both Lifts,Apartment,Entire home/apt,6/6/16,2016-06-06,5-22-19,2019-05-22,50.11368,-122.95325,13388845,4287776
ab-22123161,"Whistler Creekside, Sundance, 2 BR, 2 Bath",Condominium,Entire home/apt,12/11/17,2017-12-11,5-23-19,2019-05-23,50.09274,-122.99382,22123161,161621739
ab-22498361,Whistler Creekside,Resort,Entire home/apt,1/6/18,2018-01-06,5-22-19,2019-05-22,50.09363,-122.99123,22498361,59839478
ab-22125065,"Glacier's Reach Studio, sleeps 2, quiet setting,  just steps from the action!",Apartment,Entire home/apt,12/9/17,2017-12-09,5-20-19,2019-05-20,50.12121,-122.95542,22125065,148269423
ab-16143104,**FREE LIFT TICKETS** SKI-IN-OUT! w POOL & HOT TUB,Apartment,Entire home/apt,11/25/16,2016-11-25,4-11-19,2019-04-11,50.09365,-122.98986,16143104,7784624
ab-22130446,Whistler Village Steps from Gondola,Resort,Entire home/apt,12/9/17,2017-12-09,5-24-19,2019-05-24,50.11391,-122.95348,22130446,22262356
ab-20406154,Spacious 2 Bedroom Townhome in Whistler,Townhouse,Entire home/apt,8/11/17,2017-08-11,10-11-17,2017-10-11,50.11752093,-122.9402693,20406154,65790915
ab-20406167,"Quiet, private room apartment in Whistler",Apartment,Private room,8/11/17,2017-08-11,9-14-17,2017-09-14,50.12221724,-122.959025,20406167,145518722
ab-22504875,Whistler-Sundance Creekside  2-Bedroom Loft Condo,Place,Entire home/apt,2/5/18,2018-02-05,1-28-19,2019-01-28,50.09142238,-122.9948685,22504875,35145827
ab-20407932,Top Floor Whistler Ski-in/Ski-out/Blackcomb Aspens,Condominium,Entire home/apt,8/11/17,2017-08-11,5-24-19,2019-05-24,50.11638,-122.94384,20407932,145535230
ab-5241031,STEPS! to Gondola w PRIVATE HOT TUB,Condominium,Entire home/apt,2/1/15,2015-02-01,3-28-19,2019-03-28,50.11332,-122.95467,5241031,7784624
ab-22145176,Cozy Creekside Studio,Condominium,Entire home/apt,12/13/17,2017-12-13,5-24-19,2019-05-24,50.09712,-122.99004,22145176,49591711
ab-22150736,"Amazing 1 bd Marquise condo, ski in/out steps away",Condominium,Entire home/apt,12/10/17,2017-12-10,5-27-18,2018-05-27,50.11599202,-122.9423948,22150736,161760395
ab-23322559,Whistler Village Sunpath 2bed/2bath FULL RENO!!!,Condominium,Entire home/apt,2/20/18,2018-02-20,5-21-19,2019-05-21,50.11689,-122.95796,23322559,173496272
ab-23323652,Resort Style Walk to ski 1-bedroom condo,Condominium,Entire home/apt,8/11/18,2018-08-11,5-24-19,2019-05-24,50.11734,-122.94244,23323652,173513490
ab-22507810,SUPER WINTER GETAWAY 2BD/2BA  Views + pool + H/T,Condominium,Entire home/apt,1/6/18,2018-01-06,5-21-19,2019-05-21,50.11289,-122.97024,22507810,56673392
ab-22159864,Embarcâ„¢ Whisler (Intrawest) - Mar 17th to 25th,Entire place,Entire home/apt,12/9/17,2017-12-09,2-13-18,2018-02-13,50.11701162,-122.9445186,22159864,84847517
ab-25867811,Crystal Lodge Delux Loft Suite,Room in hotel,Private room,6/9/18,2018-06-09,5-23-19,2019-05-23,50.11502,-122.95502,25867811,193079282
ab-23327496,"BEST option: 2 room SUITE, Private Hot Tub, Pool",Room in aparthotel,Private room,2/19/18,2018-02-19,5-23-19,2019-05-23,50.11395,-122.95266,23327496,63219501
ab-17810299,Heart of Whistler- Spacious 2bed 2bath retreat!,Resort,Entire home/apt,3/18/17,2017-03-18,5-22-19,2019-05-22,50.12077,-122.95779,17810299,1194652
ab-22165851,Modern & Cozy: Whistler Village 2 BR Walk To Lifts,Apartment,Entire home/apt,12/9/17,2017-12-09,5-19-19,2019-05-19,50.11515,-122.94953,22165851,6641619
ab-22166301,Alpine Meadows Townhome,Townhouse,Private room,2/7/18,2018-02-07,5-21-19,2019-05-21,50.14638,-122.96009,22166301,54693375
ab-22166747,Ski-in/Ski-out / Walk to Gondola / Free Parking,House,Entire home/apt,12/9/17,2017-12-09,5-24-19,2019-05-24,50.11502,-122.94981,22166747,6641619
ab-23328959,"Prime location, renoâ€™d, clean, pool, hottub, f/p.",Condominium,Entire home/apt,6/18/18,2018-06-18,5-21-19,2019-05-21,50.12092,-122.95807,23328959,22732499
ab-14014139,Studio Condo Whistler Village 401,Apartment,Entire home/apt,7/14/16,2016-07-14,5-22-19,2019-05-22,50.11898,-122.95538,14014139,17197633
ab-23339193,Beatiful Whistler Mountain House,House,Entire home/apt,3/8/18,2018-03-08,5-20-19,2019-05-20,50.09684,-122.98253,23339193,45330034
ab-5262540,2BR Condo Northstar Village North Close to Gondola,Condominium,Entire home/apt,2/2/15,2015-02-02,1-23-19,2019-01-23,50.12060306,-122.9595351,5262540,26650418
ab-22177153,"Walk to Creekside lifts, apres & more - 1 bedroom!",Townhouse,Entire home/apt,12/11/17,2017-12-11,5-21-19,2019-05-21,50.09248,-122.99238,22177153,119023593
ab-22177621,Huge! Private Hot tub & Steam. 1 bedroom w/loft!,Chalet,Entire home/apt,12/11/17,2017-12-11,5-23-19,2019-05-23,50.11675,-122.95578,22177621,158634219
ab-14016440,4 bedroom Whistler mountain home (sleeps 8),Entire house,Entire home/apt,7/14/16,2016-07-14,5-11-19,2019-05-11,50.08959109,-122.99966,14016440,49621708
ab-22179371,"Room in Ski-in Suite w/ Fireplace, Pool & Hot Tub",Condominium,Private room,12/13/17,2017-12-13,5-3-18,2018-05-03,50.11525084,-122.9431213,22179371,1713192
ab-25870203,Elegant Suite + Slopeside Access | Your Whistler Retreat,Condominium,Entire home/apt,6/10/18,2018-06-10,5-22-19,2019-05-22,50.09437,-122.98992,25870203,194196206
ab-25870219,Spacious Suite in Whistler | Ski-in Ski-out Access!,Condominium,Entire home/apt,6/10/18,2018-06-10,5-24-19,2019-05-24,50.09513,-122.98921,25870219,194196206
ab-25870226,Modern Suite in Whistler | Great Mountain Access,Condominium,Entire home/apt,6/10/18,2018-06-10,5-24-19,2019-05-24,50.09355,-122.99015,25870226,194196206
ab-25870242,Mountain Suite in Whistler | Ski-in + Ski-out Access,Condominium,Entire home/apt,6/10/18,2018-06-10,5-21-19,2019-05-21,50.09573,-122.98856,25870242,194196206
ab-25870251,Spacious + Modern Suite | Minutes from Downtown Whistler,Condominium,Entire home/apt,6/10/18,2018-06-10,5-22-19,2019-05-22,50.09413,-122.99055,25870251,194196206
ab-25870337,Elegant Suite + Heated Outdoor Pool | 5 Minutes from Downtown Whistler,Condominium,Entire home/apt,6/10/18,2018-06-10,5-23-19,2019-05-23,50.09542,-122.9898,25870337,194196206
ab-25870544,Blackcomb Greens-2bd/2bath -Spacious+Cozy+Peaceful,Condominium,Entire home/apt,6/10/18,2018-06-10,5-24-19,2019-05-24,50.12011,-122.93727,25870544,170595390
ab-22186475,Last Minute Value! Christmas in Whistler Village,Entire condominium,Entire home/apt,12/13/17,2017-12-13,1-6-18,2018-01-06,50.12032556,-122.9576066,22186475,123938806
ab-22187349,"Town Plaza Studio, Hot Tub, Wifi, Gym",Entire condominium,Entire home/apt,12/11/17,2017-12-11,1-7-18,2018-01-07,50.11569192,-122.955116,22187349,123938806
ab-22187917,"Best Location, 1 Bed Condo  w/ free Wifi & Parking",Entire condominium,Entire home/apt,12/13/17,2017-12-13,1-6-18,2018-01-06,50.1141891,-122.9514693,22187917,123938806
ab-22188347,"Central Village Studio w/ Hot Tub, Pool, Parking",Entire condominium,Entire home/apt,12/13/17,2017-12-13,1-6-18,2018-01-06,50.11913213,-122.9571,22188347,123938806
ab-22188895,"2 Bed 2 Bath Whistler Village, 8 Guests",Entire condominium,Entire home/apt,12/11/17,2017-12-11,1-7-18,2018-01-07,50.11748739,-122.9589934,22188895,123938806
ab-22189249,"Ski-in/Ski-out, Upgraded 1 Bed w/ Hot Tub",Entire condominium,Entire home/apt,12/11/17,2017-12-11,1-7-18,2018-01-07,50.11661723,-122.9443456,22189249,123938806
ab-23342234,Whistler Village Luxury Log Chateau Hot Tub 5BDR,House,Entire home/apt,2/20/18,2018-02-20,3-7-19,2019-03-07,50.12195,-122.9631,23342234,159493741
ab-22190539,Whistler 3 Bedroom Townhome,Townhouse,Entire home/apt,12/11/17,2017-12-11,5-24-19,2019-05-24,50.14538,-122.96169,22190539,54693375
ab-22192104,Holiday season in Whistler,Entire condominium,Entire home/apt,12/13/17,2017-12-13,1-3-18,2018-01-03,50.11254402,-122.9682487,22192104,7810393
ab-25872882,Prime Location 1 bedroom Condo,Condominium,Entire home/apt,6/9/18,2018-06-09,5-22-19,2019-05-22,50.11757,-122.95583,25872882,194399974
ab-22196091,Studio Condo Whistler Village 201,Condominium,Entire home/apt,12/11/17,2017-12-11,5-21-19,2019-05-21,50.11778,-122.95847,22196091,17197633
ab-22201715,"Beautiful 2 Bed, 2 Bath close to all amenities",Condominium,Entire home/apt,12/13/17,2017-12-13,5-24-19,2019-05-24,50.11997,-122.95432,22201715,102997570
ab-17815277,2B/2B Whistler Village - Mountain Views,Apartment,Entire home/apt,3/18/17,2017-03-18,5-20-19,2019-05-20,50.11873,-122.95471,17815277,53455698
ab-8536195,"Large room with ensuite, Creekside",Townhouse,Private room,9/22/15,2015-09-22,5-21-19,2019-05-21,50.09879,-122.9912,8536195,3042776
ab-22203910,Nice view Ski-in/Ski-out Whistler,Entire chalet,Entire home/apt,12/13/17,2017-12-13,12-19-17,2017-12-19,50.11630649,-122.9625513,22203910,161276732
ab-24966985,Quiet Whistler condo,Condominium,Entire home/apt,5/23/18,2018-05-23,6-4-18,2018-06-04,50.09883535,-122.9875083,24966985,23417311
ab-22206355,Beautiful Ski-In 3 Bedroom Luxury Condo,Condominium,Entire home/apt,12/21/17,2017-12-21,5-24-19,2019-05-24,50.12082,-122.93875,22206355,51703858
ab-22207889,Whistler Cascade Lodge 2BR sleeps 6 - Killer View!,Condominium,Entire home/apt,12/13/17,2017-12-13,5-21-19,2019-05-21,50.11731,-122.95936,22207889,7916657
ab-19143791,Studio in the heart of Whistler Village,Room in aparthotel,Private room,1/23/18,2018-01-23,5-22-19,2019-05-22,50.11658,-122.95589,19143791,133841857
ab-22208817,Whistler Benchland Townhome,Townhouse,Private room,12/13/17,2017-12-13,7-14-18,2018-07-14,50.11878414,-122.9403216,22208817,17083291
ab-22210372,Peak Chalet,Entire house,Entire home/apt,12/13/17,2017-12-13,2-5-18,2018-02-05,50.11687451,-122.9690202,22210372,18700501
ab-22214247,"2 Bd/2 Bth Ski-in,Ski-out: Fireplace,Pool&Hot Tub",Entire condominium,Entire home/apt,12/13/17,2017-12-13,2-8-18,2018-02-08,50.11487423,-122.9445047,22214247,1713192
ab-22215988,Ski-in/Ski-out at Coast Blackcomb Suites,Entire place,Entire home/apt,12/13/17,2017-12-13,12-28-17,2017-12-28,50.11477293,-122.9404867,22215988,19842909
ab-22531069,"Amazing 2Bdr/2Bath - Steps to Lifts, Free Parking",Apartment,Entire home/apt,1/6/18,2018-01-06,5-22-19,2019-05-22,50.11525,-122.95559,22531069,165454163
ab-23356540,Marquise - Ski in Ski out - Pool - Hot tub -,Condominium,Entire home/apt,2/20/18,2018-02-20,5-24-19,2019-05-24,50.11783,-122.94401,23356540,1747164
ab-22232333,"Modern, just renovated Studio with Whistler flair",Condominium,Entire home/apt,12/16/17,2017-12-16,5-24-19,2019-05-24,50.09553,-122.99537,22232333,23469730
ab-22232986,Spectacular townhome in spectacular Neighbourhood!,Entire townhouse,Entire home/apt,12/13/17,2017-12-13,2-26-18,2018-02-26,50.14785926,-122.9618715,22232986,29390657
ab-20425004,"Glacier Lodge ski in, ski out 2 Bedroom/Den + Loft",Condominium,Entire home/apt,8/12/17,2017-08-12,7-29-18,2018-07-29,50.11714456,-122.9475289,20425004,68581273
ab-5297813,2BR Condo at The Ironwood Resort,Condominium,Entire home/apt,2/6/15,2015-02-06,5-16-19,2019-05-16,50.11328,-122.96966,5297813,26650418
ab-25884509,Mountainside Coziness with Luxury on Benchlands 4,Townhouse,Entire home/apt,6/10/18,2018-06-10,5-21-19,2019-05-21,50.1177,-122.94128,25884509,22078860
ab-23357826,4 Bed Family Townhome,Townhouse,Entire home/apt,3/20/18,2018-03-20,9-15-18,2018-09-15,50.07914327,-123.0412161,23357826,113882287
ab-23358346,Chalet Style 1 Bedroom Condo in Creekside,Apartment,Entire home/apt,2/22/18,2018-02-22,4-26-18,2018-04-26,50.09308425,-122.9930727,23358346,59477901
ab-22234042,Village 2 bd for FAMILIES+ freeparking+hottub+pool,Townhouse,Entire home/apt,12/23/17,2017-12-23,5-20-19,2019-05-20,50.1192,-122.95895,22234042,23791775
ab-22235109,Just renovated beautiful Studio Whistler Creekside,Condominium,Entire home/apt,12/16/17,2017-12-16,5-20-19,2019-05-20,50.0954,-122.99399,22235109,23469730
ab-8545625,"Whistler 1 BR CONDOS, Slps 4, 2 beds. Cascade Ldg",Condominium,Entire home/apt,12/19/16,2016-12-19,1-12-19,2019-01-12,50.11752306,-122.9600205,8545625,4385059
ab-23358967,Chalet Style Two Bedroom Loft Condo,Condominium,Entire home/apt,2/22/18,2018-02-22,10-8-18,2018-10-08,50.09297688,-122.9934712,23358967,59477901
ab-22248999,"New Listing - Spacious 4BR Home, Private hot tub",House,Entire home/apt,12/16/17,2017-12-16,5-22-19,2019-05-22,50.14045,-122.95446,22248999,96453221
ab-22249549,The Alpenglow Loft,Condominium,Entire home/apt,12/16/17,2017-12-16,5-24-19,2019-05-24,50.11884,-122.95805,22249549,162578177
ab-22249914,Sundance 102 at Worldmark,Apartment,Entire home/apt,2/22/18,2018-02-22,5-22-19,2019-05-22,50.09251,-122.99533,22249914,86180465
ab-5309527,Beautiful 3 bedroom house for March,House,Entire home/apt,2/7/15,2015-02-07,5-22-19,2019-05-22,50.14978,-122.96778,5309527,21465677
ab-22252189,1å¤§æˆ¿å¯ä½4äººçš„æ»‘é›ªåº¦å‡é…’åº—/ WHISTLER CASCADE LODGE HOTEL,Serviced apartment,Entire home/apt,7/2/18,2018-07-02,5-24-19,2019-05-24,50.11792,-122.95721,22252189,162600289
ab-22252204,Paradise in Whistler - Upper Village,Entire chalet,Entire home/apt,12/16/17,2017-12-16,1-3-18,2018-01-03,50.11774869,-122.9408131,22252204,14000096
ab-22254187,Creekside Mountain Sweet Queen,Townhouse,Private room,12/16/17,2017-12-16,5-21-19,2019-05-21,50.0959,-122.98867,22254187,74729587
ab-22254581,Creekside Mountain Darling Double,Townhouse,Private room,12/16/17,2017-12-16,5-24-19,2019-05-24,50.09625,-122.98902,22254581,74729587
ab-22254889,Creekside Mountain Majestic 3 Bedroom,Townhouse,Entire home/apt,12/16/17,2017-12-16,5-21-19,2019-05-21,50.09741,-122.98835,22254889,74729587
ab-23360514,Bright Suite at Ski In/Out Glacier Lodge!+Hot Tub,Serviced apartment,Entire home/apt,2/20/18,2018-02-20,5-25-19,2019-05-25,50.11809,-122.94664,23360514,2861600
ab-24158216,Bright Two Storey Corner Townhouse at North Star,Condominium,Entire home/apt,4/3/18,2018-04-03,5-24-19,2019-05-24,50.11608,-122.95768,24158216,5644351
ab-22262804,Carleton Lodge Platinum 302 - Ski in Walk out,Condominium,Entire home/apt,12/16/17,2017-12-16,5-23-19,2019-05-23,50.11456,-122.95334,22262804,26808890
ab-25889065,"Ski-in/ski-out 1Br with pool, HT, gym!",Apartment,Entire home/apt,6/10/18,2018-06-10,5-21-19,2019-05-21,50.11601,-122.94268,25889065,194532879
ab-22550233,New Listing 5BR Ski-in Ski-Out + Hot Tub Whistler,Townhouse,Entire home/apt,1/6/18,2018-01-06,5-21-19,2019-05-21,50.11183,-122.94432,22550233,96453221
ab-22550507,Mountainside Lodge,Resort,Entire home/apt,1/6/18,2018-01-06,5-22-19,2019-05-22,50.11538,-122.95302,22550507,165680052
ab-22551889,"Shared/Private Room in Creekside, 5 min to gondola",Private room in house,Private room,1/22/18,2018-01-22,3-9-18,2018-03-09,50.09612766,-122.9960652,22551889,157514806
ab-23372234,Loft Suite in the Heart of the Village! Parking!,Entire loft,Entire home/apt,2/19/18,2018-02-19,3-7-18,2018-03-07,50.1163825,-122.9549339,23372234,13529752
ab-22267880,Small Loft room steps away from gondola,Cabin,Shared room,12/16/17,2017-12-16,8-25-18,2018-08-25,50.09204033,-122.9904718,22267880,1747962
ab-22269618,Great 2 Bedroom at the base of Blackcomb Mountain,Entire condominium,Entire home/apt,12/16/17,2017-12-16,12-22-17,2017-12-22,50.11946855,-122.9408651,22269618,23676895
ab-22278133,Powderhorn 2 bed 2 bath ski in/ski out,Condominium,Entire home/apt,12/16/17,2017-12-16,5-21-19,2019-05-21,50.11738,-122.94143,22278133,155028292
ab-22555061,"Luxury 3 Bedroom, 3 Bathroom Townhouse",Townhouse,Entire home/apt,1/6/18,2018-01-06,4-1-18,2018-04-01,50.11524889,-122.9569578,22555061,163473879
ab-22280121,Gorgeous Ski in/out Townhome on Whistler/Blackcomb,Townhouse,Entire home/apt,12/16/17,2017-12-16,8-21-18,2018-08-21,50.11079371,-122.9489822,22280121,27111892
ab-22561093,"Close to it ALL! Village,Hot Tub,Parking,Laundry!",Private room in townhouse,Private room,1/6/18,2018-01-06,1-18-18,2018-01-18,50.11950399,-122.9573913,22561093,50283286
ab-8568406,'Carleton Lodge' Modern/Spacious- Whistler Village,Apartment,Entire home/apt,9/24/15,2015-09-24,7-12-17,2017-07-12,50.1143546,-122.9531247,8568406,35393628
ab-8569385,New Condo in Whistler Celebration Plaza,Apartment,Entire home/apt,9/24/15,2015-09-24,5-22-19,2019-05-22,50.11963,-122.95654,8569385,10573153
ab-22280616,"New Listing-Spacious, Luxury 5BR, Private Hot Tub",Entire townhouse,Entire home/apt,12/16/17,2017-12-16,1-6-18,2018-01-06,50.12291376,-122.937667,22280616,96453221
ab-23378477,Impeccable Glacier Lodge Hotel Room  Pool+Hot tub,Serviced apartment,Entire home/apt,2/22/18,2018-02-22,5-21-19,2019-05-21,50.11834,-122.94686,23378477,2861600
ab-24987814,Whistler Creekside 1 Bedroom Condo,Condominium,Entire home/apt,5/12/18,2018-05-12,3-6-19,2019-03-06,50.09168,-122.99382,24987814,188726284
ab-22282983,Whistler Coach house,Entire guest suite,Entire home/apt,12/16/17,2017-12-16,1-12-18,2018-01-12,50.15437263,-122.9642375,22282983,141453315
ab-8571655,Whistler Mountain Ski Condo + Loft,Apartment,Entire home/apt,9/25/15,2015-09-25,5-22-19,2019-05-22,50.11564,-122.95455,8571655,31011940
ab-22288178,Luxurious/Large 1bed 2Bath Townhome In Village,Townhouse,Entire home/apt,12/16/17,2017-12-16,5-24-19,2019-05-24,50.11888,-122.95916,22288178,152715452
ab-22289168,Cedar Ridge 4 Bedroom,Townhouse,Entire home/apt,12/18/17,2017-12-18,4-11-19,2019-04-11,50.1113,-122.94944,22289168,25777071
ab-22566825,Emerald Cottage,Entire house,Entire home/apt,1/6/18,2018-01-06,1-6-18,2018-01-06,50.16277448,-122.9274723,22566825,52274568
ab-19161726,Whistler Village 1 Bedroom + Hot Tub Access,Condominium,Entire home/apt,6/5/17,2017-06-05,5-24-19,2019-05-24,50.12032,-122.95527,19161726,17206189
ab-23381920,Stunning Creekside Townhome-atGondola-Pool&Hot tub,Townhouse,Entire home/apt,2/22/18,2018-02-22,5-23-19,2019-05-23,50.09426,-122.99013,23381920,46992420
ab-26692195,"Whistler-Sundance 2BR Plus, sleeps 8",Apartment,Entire home/apt,7/8/18,2018-07-08,5-14-19,2019-05-14,50.09212,-122.99594,26692195,25473090
ab-22292709,Cozy 1 BDRM Whistler Creekside condo,Condominium,Entire home/apt,12/23/17,2017-12-23,5-23-19,2019-05-23,50.09412,-122.99375,22292709,95060190
ab-22569162,"Modern, Quiet, Simple and Clean Bedroom",Private room in apartment,Private room,1/6/18,2018-01-06,2-5-18,2018-02-05,50.07653192,-123.0449617,22569162,141250833
ab-22569555,Whistler Village Cascade Lodge Condo,Serviced apartment,Entire home/apt,1/6/18,2018-01-06,3-10-19,2019-03-10,50.11615,-122.95832,22569555,30307256
ab-24176770,Creekside Gondola - just steps away,Condominium,Entire home/apt,4/6/18,2018-04-06,5-24-19,2019-05-24,50.09432,-122.99056,24176770,182215203
ab-22570042,2BR Lovely Whistler Suite sleeps 6! HotTub/Parking,Serviced apartment,Entire home/apt,1/6/18,2018-01-06,5-24-19,2019-05-24,50.09107,-122.99361,22570042,317618
ab-22570546,"Whistler Village(Parking,WiFi,Outdoor Hot Tub)",Townhouse,Entire home/apt,2/5/18,2018-02-05,5-20-19,2019-05-20,50.1201,-122.95659,22570546,11773667
ab-22318562,"Whistler Townhouse - top end, cosy, quiet - sleep2",Condominium,Entire home/apt,12/20/17,2017-12-20,5-21-19,2019-05-21,50.12033,-122.9542,22318562,66966845
ab-23396039,Whistler Luxury Ski-in Ski-Out Townhouse Taluswood,Townhouse,Entire home/apt,2/23/18,2018-02-23,5-24-19,2019-05-24,50.09248,-122.97781,23396039,174422939
ab-24183068,Modern 3 Bedroom Whistler Home,Townhouse,Entire home/apt,6/17/18,2018-06-17,5-24-19,2019-05-24,50.11249,-122.975,24183068,46967511
ab-22579655,"Whistler 2br in Blueberry Hills area, Ironwood",Serviced apartment,Entire home/apt,1/6/18,2018-01-06,1-21-19,2019-01-21,50.11465106,-122.9681489,22579655,7054805
ab-22580450,Ski In/Out*VILLAGE*Kitchen/Fireplace/Free Parking,Apartment,Entire home/apt,1/8/18,2018-01-08,5-22-19,2019-05-22,50.11523,-122.95566,22580450,21730154
ab-22328924,"Whistler Village, NEWLY RENOVATED - 2 bed 2 bath",Apartment,Entire home/apt,12/20/17,2017-12-20,5-21-19,2019-05-21,50.11943,-122.9572,22328924,14478295
ab-22582679,The Stash - Boutique Mountain Enclave at Creekside,Condominium,Entire home/apt,1/6/18,2018-01-06,5-23-19,2019-05-23,50.09623,-122.99579,22582679,9354023
ab-25013919,Whistler Village Town Home W/ Private Hottub/Deck,Townhouse,Entire home/apt,5/12/18,2018-05-12,9-11-18,2018-09-11,50.12069471,-122.9553967,25013919,156227518
ab-22339734,VC0401 Whistler Village Centre By Elevate (Studio),Condominium,Entire home/apt,12/20/17,2017-12-20,5-23-19,2019-05-23,50.11496,-122.95332,22339734,3749031
ab-22342114,'Hearthstone Lodge' Luxury 2BR w/ mountain views in heart of Village,Condominium,Entire home/apt,12/27/17,2017-12-27,5-6-18,2018-05-06,50.11448251,-122.9567664,22342114,35393628
ab-22584921,Max's Vintage Studio,Apartment,Entire home/apt,1/6/18,2018-01-06,5-21-19,2019-05-21,50.09549,-122.99421,22584921,87318507
ab-22359994,Great Affordable Bedroom in Whistler!,Guest suite,Private room,12/23/17,2017-12-23,7-2-18,2018-07-02,50.13067838,-122.9655762,22359994,6549724
ab-25017227,LOVELY 1BR Condo w/ Mountain Views,Condominium,Entire home/apt,5/14/18,2018-05-14,5-21-19,2019-05-21,50.09947,-122.98951,25017227,27854185
ab-22361121,Central Village 1 BR Town Plaza,Entire condominium,Entire home/apt,12/23/17,2017-12-23,1-7-18,2018-01-07,50.11594901,-122.9563566,22361121,123938806
ab-23412462,"Cascade Lodge, Whistler, CAN, 1-bedroom Z #1",Condominium,Entire home/apt,2/22/18,2018-02-22,5-24-19,2019-05-24,50.11777,-122.95704,23412462,10981379
ab-23412493,"Cascade Lodge, Whistler, CAN, 1-bedroom ND #1",Condominium,Entire home/apt,2/23/18,2018-02-23,5-22-19,2019-05-22,50.11763,-122.95644,23412493,10981379
ab-19177746,The Main Street Loft: Hot Tub + Parking,Loft,Entire home/apt,6/6/17,2017-06-06,5-21-19,2019-05-21,50.11767,-122.95836,19177746,4213878
ab-22361350,Locals House - steps to creekside gondola,Shared room in house,Shared room,12/23/17,2017-12-23,2-18-18,2018-02-18,50.09381349,-122.9942993,22361350,90515111
ab-22361449,Cozy Mountain View Studio in Whistler Village,Room in aparthotel,Private room,12/23/17,2017-12-23,5-21-19,2019-05-21,50.11783,-122.95646,22361449,1356898
ab-22361665,Whistler Village Condo,Entire condominium,Entire home/apt,12/23/17,2017-12-23,1-1-18,2018-01-01,50.11888254,-122.9599151,22361665,7810393
ab-22367540,Cozy 1 bedroom Creekside Condo,Condominium,Entire home/apt,12/23/17,2017-12-23,5-21-19,2019-05-21,50.09287,-122.99352,22367540,143881324
ab-22374422,Whistler Condo in Village and Fantastic Amenities,Resort,Entire home/apt,12/23/17,2017-12-23,5-23-19,2019-05-23,50.11703,-122.94623,22374422,90217421
ab-22375192,"Mountainside Lodge, 1-bedroom deluxe",Resort,Entire home/apt,12/25/17,2017-12-25,5-24-19,2019-05-24,50.11547,-122.95425,22375192,163609630
ab-22378084,Stylish Whistler Studio - Walk to Lifts,Condominium,Entire home/apt,12/23/17,2017-12-23,5-24-19,2019-05-24,50.09745,-122.98948,22378084,163638041
ab-25027827,1 bedroom with loft,Loft,Entire home/apt,5/14/18,2018-05-14,3-20-19,2019-03-20,50.09264,-122.99329,25027827,36117396
ab-22378738,Benchland Townhouse 2 large private rooms,Townhouse,Private room,12/23/17,2017-12-23,7-14-18,2018-07-14,50.1203403,-122.938752,22378738,17083291
ab-22379278,Prvt room-locals house. steps to creekside gondola,Private room in house,Private room,12/23/17,2017-12-23,3-3-18,2018-03-03,50.09396708,-122.9955297,22379278,90515111
ab-22384380,Whistler 3 bedroom Townhome - Creekside,Townhouse,Entire home/apt,1/5/18,2018-01-05,5-23-19,2019-05-23,50.10189,-122.98609,22384380,88590378
ab-25916630,FANTASTIC VILLAGE LOCATION (POOL & HOT TUB),Condominium,Entire home/apt,6/16/18,2018-06-16,5-25-19,2019-05-25,50.1198,-122.95919,25916630,56673392
ab-22391398,"Large 2 bedroom. hot tub, parking, laundry",Entire chalet,Entire home/apt,12/25/17,2017-12-25,2-17-18,2018-02-17,50.12013459,-122.9590118,22391398,45372719
ab-22597480,At Whistler CREEKSIDE GONDOLA!,Condominium,Entire home/apt,1/22/18,2018-01-22,5-24-19,2019-05-24,50.09331,-122.99155,22597480,166208989
ab-22599831,Whistler Cascade Lodge Presidents weekend,Resort,Entire home/apt,1/8/18,2018-01-08,5-21-19,2019-05-21,50.11603,-122.95866,22599831,8440595
ab-22599838,Whistler Cascade Lodge Book 5nights get 2 FREE!,Condominium,Entire home/apt,1/8/18,2018-01-08,5-23-19,2019-05-23,50.11651,-122.95712,22599838,8440595
ab-22599846,Whistler Cascade Lodge Presidents week Nice,Entire timeshare,Entire home/apt,1/8/18,2018-01-08,1-20-18,2018-01-20,50.11648703,-122.9566368,22599846,8440595
ab-27494038,Whistler Log Home - Walking Distance To Village,House,Entire home/apt,8/4/18,2018-08-04,9-22-18,2018-09-22,50.1230292,-122.9658154,27494038,56769012
ab-22402712,In the Heart of Whistler Village,Entire condominium,Entire home/apt,12/27/17,2017-12-27,12-27-17,2017-12-27,50.11437725,-122.9559374,22402712,83547759
ab-23417403,5 Bedroom family home,House,Entire home/apt,3/8/18,2018-03-08,12-20-18,2018-12-20,50.12800139,-122.9656286,23417403,56416833
ab-22403097,In the Heart of Whistler Village,Entire townhouse,Entire home/apt,12/27/17,2017-12-27,12-27-17,2017-12-27,50.11640318,-122.9585312,22403097,83547759
ab-22409273,Luxurious 1 BR stay in Whistler! Best deal in town,Condominium,Entire home/apt,12/25/17,2017-12-25,5-23-19,2019-05-23,50.11721,-122.94555,22409273,5510458
ab-25936391,"Bright & Spacious, 2 Beds Sleeps 7 Blueberry Hills",Condominium,Entire home/apt,6/14/18,2018-06-14,5-24-19,2019-05-24,50.11168,-122.97094,25936391,8520466
ab-22599965,Whistler Cascade Lodge  Book 4nights get 3 FREE!,Condominium,Entire home/apt,1/8/18,2018-01-08,5-23-19,2019-05-23,50.11814,-122.95742,22599965,8440595
ab-22600366,Whistler 2BR w/Den Sleeps8 2Nights FREE!!,Condominium,Entire home/apt,1/8/18,2018-01-08,5-21-19,2019-05-21,50.09149,-122.99574,22600366,8440595
ab-22600367,Whistler 2BR  Loft Presidents week 7th night free!,Entire timeshare,Entire home/apt,1/8/18,2018-01-08,1-20-18,2018-01-20,50.09157742,-122.9960853,22600367,8440595
ab-22410752,Updated Central 3Bd apartment w PRIVATE Hot Tub!,Apartment,Entire home/apt,12/25/17,2017-12-25,5-21-19,2019-05-21,50.12063,-122.95579,22410752,7784624
ab-22601004,Heart of village with hot tub & views,Condominium,Entire home/apt,1/12/18,2018-01-12,5-20-19,2019-05-20,50.1159,-122.95736,22601004,68581273
ab-22602738,Seasons Townhouse at Whistler,Townhouse,Entire home/apt,1/8/18,2018-01-08,5-25-19,2019-05-25,50.08825,-122.99915,22602738,166286322
ab-22422026,Unit 30 Valhalla,Townhouse,Entire home/apt,12/27/17,2017-12-27,5-21-19,2019-05-21,50.12004,-122.9594,22422026,164186327
ab-23433607,Luxury Chalet-amazing place,House,Entire home/apt,2/23/18,2018-02-23,5-24-19,2019-05-24,50.09619,-122.98429,23433607,174785826
ab-26741109,Spacious and conveniently located Townhouse in quiet area directly across from the Village,Townhouse,Entire home/apt,7/10/18,2018-07-10,5-21-19,2019-05-21,50.12245,-122.95937,26741109,196624542
ab-22617352,Townhouse in Whistler - Perfect for Families,Place,Entire home/apt,1/12/18,2018-01-12,3-19-19,2019-03-19,50.08701,-122.99757,22617352,166479666
ab-22441218,FABULOUS FITZ WALK (4BD/3.5B) executive townhouse,Townhouse,Entire home/apt,1/15/18,2018-01-15,5-23-19,2019-05-23,50.12681,-122.95359,22441218,56673392
ab-29263483,"NEW listing 100 Yards to the Creekside Gondola, 1 bedroom condo facing private courtyard with Pool",Condominium,Entire home/apt,10/22/18,2018-10-22,5-21-19,2019-05-21,50.09492,-122.98985,29263483,196624542
ab-30328042,Aspens - Sara's Ski Condo,Condominium,Entire home/apt,12/24/18,2018-12-24,5-24-19,2019-05-24,50.11511,-122.94482,30328042,161390166
ab-30328499,Ski Journey - 2 Bedroom ski-in ski-out condo,Apartment,Entire home/apt,12/27/18,2018-12-27,5-21-19,2019-05-21,50.1156,-122.9446,30328499,161390166
ab-22618312,The Cache - Boutique Mountain Enclave at Creekside,Apartment,Entire home/apt,1/12/18,2018-01-12,5-24-19,2019-05-24,50.09575,-122.99467,22618312,9354023
ab-22454780,Heart Beat of Whistler Village - 302 WindWhistle,Apartment,Entire home/apt,2/23/18,2018-02-23,5-23-19,2019-05-23,50.11369,-122.95609,22454780,160907324
ab-28311059,"Great Location 2BR, 2 BA. Ski Access Nearby.",Townhouse,Entire home/apt,9/10/18,2018-09-10,5-24-19,2019-05-24,50.1175,-122.94085,28311059,96453221
ab-22462854,Pauline's Place!  Make me an offer!,Condominium,Entire home/apt,12/30/17,2017-12-30,5-21-19,2019-05-21,50.12071,-122.95992,22462854,41501331
ab-28311426,Blueberry Hill 2bd/2ba+Free parking@Blackcomb base,Condominium,Entire home/apt,9/17/18,2018-09-17,4-30-19,2019-04-30,50.11301,-122.96952,28311426,78840967
ab-25941696,Whistler Village- Fantastic Views - Free Parking,Serviced apartment,Entire home/apt,6/13/18,2018-06-13,5-22-19,2019-05-22,50.1178,-122.95468,25941696,42856656
ab-22463842,"True Ski-in Ski-out, 1 Bed Top Floor ""The Aspens""",Entire condominium,Entire home/apt,12/30/17,2017-12-30,1-5-18,2018-01-05,50.11577072,-122.9443293,22463842,123938806
ab-23438866,"Best Price , Great Location",,,,#VALUE!,,#VALUE!,,,,
"Cosy Village Studio""",Condominium,Entire home/apt,2/24/18,5-23-19,#VALUE!,Canada,#VALUE!,-122.95925,,1024137,
ab-22626569,Whistler Condo,Condominium,Entire home/apt,1/12/18,2018-01-12,5-3-18,2018-05-03,50.12097826,-122.9596499,22626569,33971053
ab-28313057,Brand New Luxury Whistler Chalet,Chalet,Entire home/apt,10/31/18,2018-10-31,5-21-19,2019-05-21,50.12284,-122.94737,28313057,213809452
ab-22465745,Emerald Cottage,Cabin,Entire home/apt,1/9/18,2018-01-09,5-12-19,2019-05-12,50.16274,-122.92719,22465745,18685344
ab-27509646,Whistler Creekside Sundance Resort,Condominium,Entire home/apt,8/6/18,2018-08-06,5-21-19,2019-05-21,50.09023,-122.99477,27509646,27477423
ab-25054512,Brock House,Chalet,Entire home/apt,6/29/18,2018-06-29,8-10-18,2018-08-10,50.1431435,-122.9692468,25054512,159362431
ab-28319881,"Newly renovated best location 3bd 2bath, Sunpath",Townhouse,Entire home/apt,9/10/18,2018-09-10,5-21-19,2019-05-21,50.11637,-122.95926,28319881,50698162
ab-28321409,Ski-in Ski-out Townhome with private hot tub,Townhouse,Entire home/apt,9/10/18,2018-09-10,5-24-19,2019-05-24,50.11429,-122.93877,28321409,202916710
ab-22632812,Spacious and Convenient Whistler Apartment,Bungalow,Entire home/apt,1/12/18,2018-01-12,5-23-19,2019-05-23,50.11785,-122.94623,22632812,52178961
ab-22632834,Centrally-located spacious apartment in Whistler,Resort,Entire home/apt,1/12/18,2018-01-12,5-24-19,2019-05-24,50.11792,-122.94731,22632834,52178961
ab-25946969,2 Bedroom Suite-Whistler Vacation Club Twin Peaks,Condominium,Entire home/apt,6/13/18,2018-06-13,5-24-19,2019-05-24,50.11966,-122.95928,25946969,20915159
ab-28334656,Luxury Montebello townhome,Townhouse,Entire home/apt,9/8/18,2018-09-08,5-21-19,2019-05-21,50.12539,-122.95634,28334656,202916710
ab-30345572,1 bedroom and Loft! village centre,Room in boutique hotel,Private room,12/4/18,2018-12-04,5-23-19,2019-05-23,50.1134,-122.95528,30345572,116425127
ab-30347325,"Creekside:  Spectacular Views, 400m to Lift!",Townhouse,Entire home/apt,12/17/18,2018-12-17,5-21-19,2019-05-21,50.09181,-122.99455,30347325,227861166
ab-27523135,Whistler Condominium on quiet Blackcomb Benchlands,Condominium,Entire home/apt,8/6/18,2018-08-06,5-22-19,2019-05-22,50.12354,-122.93451,27523135,207572173
ab-27523570,"RENOVATED Village location, PRIVATE corner unit with MOUNTAIN VIEW",Condominium,Entire home/apt,8/6/18,2018-08-06,11-3-18,2018-11-03,50.11749686,-122.9539847,27523570,196624542
ab-27523571,Charming VILLAGE Location. MOUNTAIN VIEWS + More!,Condominium,Entire home/apt,8/6/18,2018-08-06,4-8-19,2019-04-08,50.11585,-122.95655,27523571,196624542
ab-27523643,The Fairmont Chateau Whistler,Resort,Private room,8/6/18,2018-08-06,5-21-19,2019-05-21,50.11793,-122.94615,27523643,17064463
ab-23454487,1 Bedroom Whistler Village Suite Hot Tub +Parking!,Serviced apartment,Entire home/apt,3/8/18,2018-03-08,5-23-19,2019-05-23,50.1159,-122.9565,23454487,317618
ab-27524021,REMODELED Beautiful + Spacious Family sized home in BLUEBERRY HILLS. Minutes to Village,Condominium,Entire home/apt,8/6/18,2018-08-06,5-21-19,2019-05-21,50.11177,-122.97111,27524021,196624542
ab-24231074,Huntingford Lodge,Villa,Entire home/apt,3/25/19,2019-03-25,5-24-19,2019-05-24,50.08562,-122.99103,24231074,18700501
ab-25950514,Marketplace Lodge by Creel Concepts,Apartment,Entire home/apt,6/13/18,2018-06-13,5-24-19,2019-05-24,50.11924,-122.95837,25950514,86180465
ab-24231714,Whistler Slopeside,Villa,Entire home/apt,3/25/19,2019-03-25,5-24-19,2019-05-24,50.1111,-122.95067,24231714,187952134
ab-28339109,"Budget-Friendly, Comfy Condo with Free Parking!",Apartment,Entire home/apt,9/10/18,2018-09-10,9-29-18,2018-09-29,50.097129,-122.9887399,28339109,158823097
ab-25074682,Marquise One bedroom,Condominium,Entire home/apt,5/16/18,2018-05-16,5-24-19,2019-05-24,50.11604,-122.94288,25074682,155028292
ab-29285877,Whistler Sundance by WorldMark,Condominium,Entire home/apt,11/20/18,2018-11-20,5-21-19,2019-05-21,50.09155,-122.99611,29285877,58796689
ab-25075440,"Whistler fun, easy, convenient, comfortable",Condominium,Entire home/apt,5/22/18,2018-05-22,5-24-19,2019-05-24,50.11906,-122.9605,25075440,7479389
ab-25077034,"5 Bedroom Chalet with Media Room, Private Hot Tub",Chalet,Entire home/apt,5/16/18,2018-05-16,5-20-19,2019-05-20,50.11217,-122.97026,25077034,96453221
ab-23463976,2BR suite at Whistler gondola (daily maid),Resort,Entire home/apt,3/4/18,2018-03-04,5-24-19,2019-05-24,50.11212,-122.95517,23463976,30922095
ab-26756258,Large Luxury Suite in Whistler,House,Entire home/apt,7/11/18,2018-07-11,7-28-18,2018-07-28,50.08449734,-123.0232157,26756258,136644839
ab-27532371,The Elkwood,Townhouse,Entire home/apt,9/29/18,2018-09-29,5-22-19,2019-05-22,50.12114,-122.93785,27532371,7040253
ab-25080757,4 bedroom townhome on the Fairmont Golf Course,Townhouse,Entire home/apt,5/16/18,2018-05-16,5-20-19,2019-05-20,50.12068,-122.93987,25080757,96453221
ab-25081142,"Modern 2+Den, steps away from ski out on Blackcomb",Townhouse,Entire home/apt,5/16/18,2018-05-16,5-22-19,2019-05-22,50.11499,-122.94045,25081142,96453221
ab-28353049,Whistler Village 4-bedroom townhome,Townhouse,Entire home/apt,9/10/18,2018-09-10,5-21-19,2019-05-21,50.12189,-122.95858,28353049,202916710
ab-23466722,128 steps to the new gondola on Blackcomb,Condominium,Entire home/apt,3/10/18,2018-03-10,5-23-19,2019-05-23,50.11565,-122.94746,23466722,66231751
ab-23466927,1 Bedroom in Village for 4 - Hot Tub Pool Parking,Serviced apartment,Entire home/apt,3/8/18,2018-03-08,5-24-19,2019-05-24,50.11765,-122.95727,23466927,317618
ab-28356112,One Beedroom apartment just renovated,Apartment,Entire home/apt,9/25/18,2018-09-25,5-24-19,2019-05-24,50.10043,-122.98997,28356112,214097827
ab-30353704,Sanctuary in the heart of Whistler Village,Condominium,Entire home/apt,12/11/18,2018-12-11,5-23-19,2019-05-23,50.11608,-122.9542,30353704,4292086
ab-30354325,Renovated 2BD 2BA @ Twin Peaks in Whistler Village,Apartment,Entire home/apt,12/11/18,2018-12-11,5-23-19,2019-05-23,50.11944,-122.95916,30354325,12743554
ab-28361159,Great value condo in Whistler village centre,Apartment,Entire home/apt,9/10/18,2018-09-10,5-20-19,2019-05-20,50.11697,-122.95543,28361159,202916710
ab-25086205,Seasons at Whistler.  Spacious townhouse -sleeps 8,Condominium,Entire home/apt,5/16/18,2018-05-16,5-21-19,2019-05-21,50.08721,-122.99757,25086205,189642159
ab-22651187,"Whiski Jack Creekside,  2-BR, Sleeps 6, Kitchen",Serviced apartment,Entire home/apt,1/13/18,2018-01-13,5-23-19,2019-05-23,50.09703,-122.98667,22651187,27042710
ab-27552663,"Wolf's Den Creekside, steps from the gondola",Condominium,Entire home/apt,8/8/18,2018-08-08,5-21-19,2019-05-21,50.09295,-122.99294,27552663,7317725
ab-22656069,Whistler Blueberry Hill Condo,Entire condominium,Entire home/apt,1/18/18,2018-01-18,2-8-18,2018-02-08,50.1139118,-122.9713391,22656069,45003722
ab-29310035,Good for 2 families/hot tub/sauna/steps to village,House,Entire home/apt,10/18/18,2018-10-18,3-4-19,2019-03-04,50.12232,-122.96348,29310035,3884355
ab-30375323,BEST Pool near base of Blackcomb! Sleeps 6,Apartment,Entire home/apt,12/11/18,2018-12-11,5-21-19,2019-05-21,50.11415,-122.94512,30375323,7784624
ab-22666107,Whistler Cascade Lodge Prime weekends Holidays,Condominium,Entire home/apt,1/12/18,2018-01-12,5-20-19,2019-05-20,50.11591,-122.95799,22666107,8440595
ab-22666111,Whistler Cascade Lodge Prime Short stays!,Resort,Entire home/apt,1/12/18,2018-01-12,5-21-19,2019-05-21,50.11679,-122.9572,22666111,8440595
ab-25978115,Loft w/ private bath + closeup view of Mtns,Chalet,Private room,4/22/19,2019-04-22,4-25-19,2019-04-25,50.12114,-122.96035,25978115,1845130
ab-23482481,HEART OF WHISTLER VILLAGE - Stoney Creek Sunpath,Townhouse,Entire home/apt,3/8/18,2018-03-08,5-21-19,2019-05-21,50.118,-122.95808,23482481,91404059
ab-28382680,3 bedroom village townhome with private hot tub,Townhouse,Entire home/apt,9/10/18,2018-09-10,5-20-19,2019-05-20,50.12003,-122.95933,28382680,202916710
ab-23483219,Retro modern whistler village studio,Loft,Entire home/apt,3/8/18,2018-03-08,5-22-19,2019-05-22,50.11682,-122.95646,23483219,9820301
ab-22672650,VC0402 Whistler Village Centre By Elevate (1-Bed),Condominium,Entire home/apt,1/13/18,2018-01-13,5-23-19,2019-05-23,50.11624,-122.95341,22672650,3749031
ab-22673036,VC0601 Whistler Village Centre By Elevate (1-Bed),Condominium,Entire home/apt,1/13/18,2018-01-13,5-23-19,2019-05-23,50.11593,-122.95362,22673036,3749031
ab-22673168,VC3307 Whistler Village Centre By Elevate (Studio),Condominium,Entire home/apt,1/13/18,2018-01-13,5-22-19,2019-05-22,50.11481,-122.95332,22673168,3749031
ab-22673313,VC3308 Whistler Village Centre By Elevate (Studio),Condominium,Entire home/apt,1/13/18,2018-01-13,5-22-19,2019-05-22,50.11451,-122.9532,22673313,3749031
ab-22673491,VC4404 Whistler Village Centre By Elevate (Studio),Condominium,Entire home/apt,1/13/18,2018-01-13,5-22-19,2019-05-22,50.11643,-122.95336,22673491,3749031
ab-22674112,1 Bedrm Village Marketplace; walk to village lifts,Entire apartment,Entire home/apt,1/12/18,2018-01-12,1-12-18,2018-01-12,50.11833049,-122.959587,22674112,128469919
ab-25107534,Whistler Village-Great location-Free Parking,Condominium,Entire home/apt,5/16/18,2018-05-16,5-24-19,2019-05-24,50.12172,-122.95535,25107534,49821771
ab-22677334,Whistler Creekside Triplex  -  Private Hot Tub,Townhouse,Entire home/apt,12/31/18,2018-12-31,5-21-19,2019-05-21,50.09867,-122.98879,22677334,4848299
ab-30398198,Xmas in Whistler !  Deal!,Room in boutique hotel,Private room,12/11/18,2018-12-11,5-21-19,2019-05-21,50.11502,-122.9546,30398198,116425127
ab-25110087,MAY Private bedroom 15mins walk from the village,House,Private room,5/16/18,2018-05-16,4-25-19,2019-04-25,50.1265,-122.96616,25110087,39202710
ab-30398369,Renovated Studio in Village,Room in boutique hotel,Private room,12/11/18,2018-12-11,5-21-19,2019-05-21,50.11443,-122.95544,30398369,116425127
ab-27575181,Whistler Guest Suite,Guest suite,Entire home/apt,8/9/18,2018-08-09,8-9-18,2018-08-09,50.1453264,-122.9696861,27575181,159362431
ab-29334359,"Spacious, Modern 2BR - heart of Whistler Village",Condominium,Entire home/apt,11/5/18,2018-11-05,5-21-19,2019-05-21,50.11784,-122.95566,29334359,220988767
ab-28399172,Two 2-bed ski-in ski-out Whistler townhomes,Townhouse,Entire home/apt,9/10/18,2018-09-10,5-24-19,2019-05-24,50.1167,-122.94155,28399172,202916710
ab-32757424,Lovely Whistler Creekside Home,Chalet,Entire home/apt,5/20/19,2019-05-20,5-24-19,2019-05-24,50.09907,-122.98856,32757424,58906987
ab-26804372,âœ©âœ«Corner penthouse; next to lift; great views! âœ©âœ«,Condominium,Entire home/apt,7/12/18,2018-07-12,5-24-19,2019-05-24,50.09665,-122.99217,26804372,201474081
ab-26805072,Alta Vista Getaway,Chalet,Entire home/apt,7/12/18,2018-07-12,5-24-19,2019-05-24,50.10900307,-122.9752434,26805072,201549170
ab-29337268,Charming Ski in/out Apartment,Condominium,Entire home/apt,10/29/18,2018-10-29,2-19-19,2019-02-19,50.11795213,-122.9476716,29337268,168916184
ab-29337488,Perfect Ski in/out Condo,Condominium,Entire home/apt,10/29/18,2018-10-29,2-19-19,2019-02-19,50.11802824,-122.9468726,29337488,168916184
ab-29337667,Peaceful and short walk to the Village,Townhouse,Entire home/apt,10/29/18,2018-10-29,5-23-19,2019-05-23,50.1247,-122.95658,29337667,168916184
ab-29337908,Cozy Townhome steps away from Village,Townhouse,Entire home/apt,10/29/18,2018-10-29,2-17-19,2019-02-17,50.12424,-122.95645,29337908,168916184
ab-28405483,Brand New 1 Bdrm Modern Creekside - 5 Star Review,Apartment,Entire home/apt,9/10/18,2018-09-10,5-21-19,2019-05-21,50.09939,-122.99134,28405483,8107418
ab-28405958,Summer Dates available!,Apartment,Entire home/apt,9/10/18,2018-09-10,5-22-19,2019-05-22,50.11687,-122.94752,28405958,41371263
ab-23506571,"Comfy Room, Fantastic Ski-In/Ski-Out Location",Condominium,Private room,3/3/18,2018-03-03,6-30-18,2018-06-30,50.11630435,-122.9437617,23506571,35145092
ab-23506623,Village North 1-bedroom Prime Location Retreat,Condominium,Entire home/apt,3/10/18,2018-03-10,5-21-19,2019-05-21,50.12202,-122.95753,23506623,173513490
ab-29338394,Amazing and Quiet 4 bedrooms at Lower Whistler Mtn,Townhouse,Entire home/apt,10/18/18,2018-10-18,5-23-19,2019-05-23,50.1113,-122.95844,29338394,168916184
ab-23508510,"Modern Creekside Studio A, hot tub, walk to lifts",Apartment,Entire home/apt,3/4/18,2018-03-04,5-22-19,2019-05-22,50.09527,-122.99386,23508510,57220927
ab-30403809,Charming Creekside getaway,Townhouse,Entire home/apt,12/31/18,2018-12-31,5-21-19,2019-05-21,50.09858,-122.98795,30403809,228297710
ab-25115116,Whistler Village Gorgeous Studio Condo,Apartment,Entire home/apt,5/16/18,2018-05-16,7-29-18,2018-07-29,50.11905785,-122.9572637,25115116,158823097
ab-22688149,The Wolf Den - Ideal for Tesla owners,Chalet,Entire home/apt,1/13/18,2018-01-13,5-23-19,2019-05-23,50.1555,-122.93157,22688149,25139122
ab-22688402,Ski-in/ski-out Cabin by Whistler Village & Trails,Chalet,Entire home/apt,1/12/18,2018-01-12,5-24-19,2019-05-24,50.1121,-122.95063,22688402,6641619
ab-30406351,*PRICE REDUCED FOR CHRISTMAS*,Chalet,Entire home/apt,12/11/18,2018-12-11,12-29-18,2018-12-29,50.15990374,-122.9294914,30406351,228316110
ab-33915273,Stunning views - Village Luxury! BRAND NEW A/C!,Serviced apartment,Entire home/apt,4/29/19,2019-04-29,5-22-19,2019-05-22,50.11895,-122.95633,33915273,42856656
ab-28410523,Treetop Bear's Den Creekside-steps from gondola!,Condominium,Entire home/apt,9/18/18,2018-09-18,5-24-19,2019-05-24,50.09427,-122.99099,28410523,212477157
ab-30415502,Glacier's Reach 27 w/ Hot Tub,Apartment,Entire home/apt,12/31/18,2018-12-31,5-21-19,2019-05-21,50.12146,-122.95774,30415502,22619214
ab-26009234,2BR Condo at Valhalla in Whistler Village North,Condominium,Entire home/apt,6/14/18,2018-06-14,12-9-18,2018-12-09,50.12019533,-122.9567961,26009234,26650418
ab-30420434,"Stoney Creek Northstar 32 - Renovated, ground floor condo in Whistler Village",Condominium,Entire home/apt,12/11/18,2018-12-11,5-21-19,2019-05-21,50.12014,-122.95768,30420434,98488722
ab-30420991,Luxury 4BR Chalet w/Pool & Hot Tub in Kadenwood,Chalet,Entire home/apt,12/6/18,2018-12-06,5-24-19,2019-05-24,50.08788,-122.9866,30420991,96453221
ab-30421762,"Sleeps 10, Newly Renovated, Steps to Golf Course!",Condominium,Entire home/apt,12/28/18,2018-12-28,5-23-19,2019-05-23,50.11147,-122.96802,30421762,81486161
ab-25133937,Marquise One Bedroom,Condominium,Entire home/apt,5/22/18,2018-05-22,5-22-19,2019-05-22,50.11579,-122.94384,25133937,155028292
ab-26015490,Whistler WM Sundance 1BR /2BD for 4,Condominium,Entire home/apt,6/15/18,2018-06-15,5-22-19,2019-05-22,50.09236,-122.99425,26015490,3334196
ab-26817746,Amazing Whistler Village Cabin Hot Tub 7 Beds,House,Entire home/apt,7/14/18,2018-07-14,8-7-18,2018-08-07,50.12404952,-122.9637669,26817746,201677863
ab-23523928,Southside Cozy Room,Apartment,Private room,3/4/18,2018-03-04,5-24-19,2019-05-24,50.09377,-122.99267,23523928,87318507
ab-23524248,Southside Private Room,Hostel,Private room,3/4/18,2018-03-04,5-20-19,2019-05-20,50.09357,-122.99305,23524248,87318507
ab-29359190,Whistler - Cascade Lodge,Condominium,Entire home/apt,10/29/18,2018-10-29,5-23-19,2019-05-23,50.11607,-122.95901,29359190,221181818
ab-29359690,"NEW Mountain Star Ski in/Ski out, Private Hot Tub",Townhouse,Entire home/apt,11/5/18,2018-11-05,5-24-19,2019-05-24,50.11533,-122.94063,29359690,8520466
ab-27586159,Private bedroom in Central Whistler Vill location,Condominium,Private room,8/9/18,2018-08-09,5-24-19,2019-05-24,50.1203,-122.95567,27586159,38431029
ab-22701115,Whistler Villg 1 bdrm; Modern Luxury!,Condominium,Entire home/apt,1/12/18,2018-01-12,5-23-19,2019-05-23,50.11812,-122.95807,22701115,167391966
ab-27595700,rt dfdf,House,Entire home/apt,8/20/18,2018-08-20,9-15-18,2018-09-15,50.11476913,-122.9606012,27595700,208221612
ab-32785501,"Aspens: 2-BR, Sleep 6, Full Kitchen",Condominium,Entire home/apt,3/11/19,2019-03-11,5-21-19,2019-05-21,50.11623,-122.94558,32785501,27042710
ab-30441931,"Ski in/ski out, hot tub, pool.",Condominium,Entire home/apt,12/17/18,2018-12-17,5-21-19,2019-05-21,50.09433,-122.98999,30441931,2364453
ab-32789707,The Creek Retreat at Gondola Village,Villa,Entire home/apt,3/18/19,2019-03-18,5-21-19,2019-05-21,50.0934,-122.99231,32789707,23973685
ab-30443399,Lagoons 98 w/ Hot Tub,Villa,Entire home/apt,12/31/18,2018-12-31,5-24-19,2019-05-24,50.11924,-122.95913,30443399,22619214
ab-30443484,Sunpath 28  Location!,Villa,Entire home/apt,12/31/18,2018-12-31,5-20-19,2019-05-20,50.11767,-122.95983,30443484,22619214
ab-24307933,PRIVATE HOT TUB - Townhome 2 Bed + 2Bath,Townhouse,Entire home/apt,5/18/18,2018-05-18,5-24-19,2019-05-24,50.12087,-122.95601,24307933,18163235
ab-28432320,"Gorgeous & Gourmet - Spacious, central home for 10",House,Entire home/apt,9/12/18,2018-09-12,5-22-19,2019-05-22,50.12886,-122.96599,28432320,119340960
ab-30449825,Deluxe Queen Suite with Free Parking in Whistler,Condominium,Entire home/apt,12/3/18,2018-12-03,12-9-18,2018-12-09,50.11245309,-122.9585316,30449825,122773552
ab-29384278,"3 Bedroom Whistler condo, Dec 17 to 24",Serviced apartment,Entire home/apt,10/22/18,2018-10-22,12-11-18,2018-12-11,50.09062297,-122.9955976,29384278,17876150
ab-28433236,"Hotel Room at Glacier Lodge by ResortQuest in Whistler, BC",Room in boutique hotel,Private room,9/12/18,2018-09-12,5-23-19,2019-05-23,50.11658,-122.94834,28433236,151701730
ab-28433710,Cozy Ski-In Hotel Room Right on Whistler's Free Shuttle Route!,Room in boutique hotel,Private room,9/12/18,2018-09-12,5-21-19,2019-05-21,50.11623,-122.94226,28433710,151701730
ab-28434067,3 Bedroom #35 at Stoney Creek Sunpath by ResortQuest,Condominium,Entire home/apt,9/12/18,2018-09-12,5-22-19,2019-05-22,50.1169,-122.96165,28434067,151701730
ab-28434086,"3 Bedroom Suite #42 at Stoney Creek Sunpath by ResortQuest, Whistler",Condominium,Entire home/apt,9/12/18,2018-09-12,5-22-19,2019-05-22,50.11824,-122.96175,28434086,151701730
ab-28434369,"Condo for 8 with a Full Kitchen, Fireplace, and PRIVATE HOT TUB!",Condominium,Entire home/apt,9/12/18,2018-09-12,5-21-19,2019-05-21,50.1201,-122.96044,28434369,151701730
ab-28434430,Deluxe Suite 5-minute's Walk from the Gondola | Gym + Hot Tub! Access!,Condominium,Entire home/apt,9/12/18,2018-09-12,5-23-19,2019-05-23,50.11523,-122.95405,28434430,151701730
ab-24310884,Whistler LUXURY Vacation Villa,Condominium,Entire home/apt,4/18/18,2018-04-18,5-22-19,2019-05-22,50.1154,-122.95846,24310884,145697935
ab-28435246,Whistler condo with a private hot tub.,Condominium,Entire home/apt,9/12/18,2018-09-12,5-21-19,2019-05-21,50.12041,-122.95665,28435246,165846228
ab-31553775,Perfect Gateway in the Village - private hot tub,Townhouse,Entire home/apt,1/28/19,2019-01-28,5-23-19,2019-05-23,50.11262,-122.94953,31553775,168916184
ab-25162793,"Whistler, CanadÃ¡",Room in hotel,Private room,5/22/18,2018-05-22,5-31-18,2018-05-31,50.1126928,-122.9567518,25162793,132834484
ab-30464078,Cascade Lodge 5 Star Condo,Condominium,Entire home/apt,12/11/18,2018-12-11,5-25-19,2019-05-25,50.1177,-122.95929,30464078,15445077
ab-29397702,Ë¯Studio Condo Murphy Bed Upper Village Tranquility,Apartment,Entire home/apt,11/7/18,2018-11-07,5-23-19,2019-05-23,50.11749,-122.94613,29397702,17197633
ab-29412392,On The Slope: Ski-in/Ski-out+Modern+Hot Tub,Condominium,Entire home/apt,12/23/18,2018-12-23,5-23-19,2019-05-23,50.11493,-122.94424,29412392,114371452
ab-24327917,Modern-Clean-Spacious 1 bedroom+ Murphy+Sofa Bed,Condominium,Entire home/apt,4/11/18,2018-04-11,9-16-18,2018-09-16,50.11593742,-122.9479097,24327917,1024137
ab-23528918,"Modern Creekside Suite B, hot tub, walk to lifts",Apartment,Entire home/apt,3/4/18,2018-03-04,5-21-19,2019-05-21,50.0951,-122.99387,23528918,57220927
ab-26032398,Rare 2 bed 2 bath w/ private hot tub in Village,Apartment,Entire home/apt,6/16/18,2018-06-16,5-22-19,2019-05-22,50.11468,-122.9569,26032398,96453221
ab-23529398,"5 Minute Walk to Creekside Gondola, Shops & Trails",Loft,Entire home/apt,3/4/18,2018-03-04,5-21-19,2019-05-21,50.09314,-122.9942,23529398,1777858
ab-28438167,1bdrm Whistler Cascade Lodge,Serviced apartment,Entire home/apt,9/12/18,2018-09-12,4-9-19,2019-04-09,50.11617,-122.95784,28438167,172516713
ab-29418227,Luxury 7 Bedroom Chalet,Chalet,Entire home/apt,10/29/18,2018-10-29,5-21-19,2019-05-21,50.09667,-122.98035,29418227,154856752
ab-29418356,"Slopeside 4BR on Whistler, Ski Access, Hot Tub",Townhouse,Entire home/apt,2/25/19,2019-02-25,5-23-19,2019-05-23,50.09436,-122.97916,29418356,96453221
ab-26840907,Ski In Ski Out Apartment w/ Pool & Hot Tub by Harmony Whistler,Apartment,Entire home/apt,7/18/18,2018-07-18,5-23-19,2019-05-23,50.11811,-122.94257,26840907,35393628
ab-26840909,Amazing Location w/ PRIVATE Hot Tub by Harmony Whistler,Townhouse,Entire home/apt,7/21/18,2018-07-21,5-24-19,2019-05-24,50.12137,-122.95577,26840909,35393628
ab-30469708,"Whistler Village North, Montebello, Luxury 4 Bdrm",Townhouse,Entire home/apt,12/5/18,2018-12-05,5-21-19,2019-05-21,50.12444,-122.95669,30469708,3066309
ab-28440781,Whistler Condominium,Condominium,Entire home/apt,9/12/18,2018-09-12,10-2-18,2018-10-02,50.11828216,-122.9587741,28440781,25777071
ab-27611843,"Prime location, 2Br/2Ba, with private HotTub & BBQ",Condominium,Entire home/apt,8/11/18,2018-08-11,5-23-19,2019-05-23,50.11958,-122.9581,27611843,174775428
ab-29421865,"COZY 1BR Home w/ Bike Storage, Pool & HTub, Pets!",Condominium,Entire home/apt,10/29/18,2018-10-29,5-24-19,2019-05-24,50.11675,-122.9462,29421865,11568255
ab-23538137,Lovely 2 Bedroom Lost Lake Lodge Condo Set in the Pines,Condominium,Entire home/apt,3/4/18,2018-03-04,5-22-19,2019-05-22,50.12139,-122.93535,23538137,173513490
ab-31589203,Two Bedroom Apartment in Whistler Village,Serviced apartment,Entire home/apt,1/28/19,2019-01-28,5-22-19,2019-05-22,50.12055,-122.9591,31589203,236792974
ab-22715464,Whistler one bedroom - great quick overnight pick,Condominium,Private room,1/14/18,2018-01-14,5-23-19,2019-05-23,50.09608,-122.98166,22715464,11423475
ab-22715573,"Tyndall Stone Lodge: 2-BR, Sleeps 6, Full Kitchen",Serviced apartment,Entire home/apt,1/22/18,2018-01-22,5-24-19,2019-05-24,50.11924,-122.95516,22715573,27042710
ab-27625076,ACROSS FROM SKI LIFTS/1 BR/HOTTUB/POOL/GAS FIREPL,Condominium,Entire home/apt,8/11/18,2018-08-11,5-21-19,2019-05-21,50.09417,-122.992,27625076,77336927
ab-22718275,Max's Classic Studio,Apartment,Entire home/apt,1/22/18,2018-01-22,5-21-19,2019-05-21,50.09484,-122.99521,22718275,87318507
ab-22718433,Max's Classic Room,Apartment,Entire home/apt,1/22/18,2018-01-22,5-23-19,2019-05-23,50.09674,-122.99547,22718433,87318507
ab-22720904,"Cute Studio in Whistler, BC with Parking",Apartment,Entire home/apt,1/14/18,2018-01-14,3-26-18,2018-03-26,50.09820591,-122.9887951,22720904,129501721
ab-29433694,Two Bedroom with Ski Access on Whistler,Townhouse,Entire home/apt,11/20/18,2018-11-20,5-24-19,2019-05-24,50.09715,-122.98049,29433694,96453221
ab-29433732,Spectacular views of Whistler Valley at Bluffs,Townhouse,Entire home/apt,10/29/18,2018-10-29,2-17-19,2019-02-17,50.09323,-122.97949,29433732,168916184
ab-29434829,Four Bedroom at Nicklaus North Golf Course,Townhouse,Entire home/apt,3/24/19,2019-03-24,4-12-19,2019-04-12,50.14458,-122.94625,29434829,96453221
ab-29434834,Stunning Ski in/out 4 bedrooms in Whistler,House,Entire home/apt,10/22/18,2018-10-22,2-17-19,2019-02-17,50.11156561,-122.947891,29434834,168916184
ab-25189370,whistling whistler getaway,Chalet,Entire home/apt,5/23/18,2018-05-23,6-2-18,2018-06-02,50.14665227,-122.9648142,25189370,190321583
ab-31600521,Lake Placid Ski in/out 2 Bedroom,Apartment,Entire home/apt,1/28/19,2019-01-28,3-7-19,2019-03-07,50.09343,-122.99004,31600521,7784624
ab-23538183,3-Bedroom Luxurious Town Home with Central Whistler Location,Townhouse,Entire home/apt,6/8/18,2018-06-08,5-23-19,2019-05-23,50.12318,-122.95737,23538183,173513490
ab-23538195,Whistler Village North 3-Bedroom Den Town Home with Hot Tub,Townhouse,Entire home/apt,3/10/18,2018-03-10,5-21-19,2019-05-21,50.12475,-122.95571,23538195,173513490
ab-23538204,3-Bedroom Central Village North Location with Hot Tub,Townhouse,Entire home/apt,3/17/18,2018-03-17,5-21-19,2019-05-21,50.12566,-122.95482,23538204,173513490
ab-31600755,Creekside studio - walk to gondola,Condominium,Entire home/apt,2/25/19,2019-02-25,5-23-19,2019-05-23,50.09854,-122.98965,31600755,129190996
ab-29435367,3BR in Benchlands w/Hot Tub,Townhouse,Entire home/apt,3/18/19,2019-03-18,5-21-19,2019-05-21,50.12264,-122.93442,29435367,96453221
ab-29436100,"Luxury Townhome near Whistler Village, Hot Tub.",Townhouse,Entire home/apt,11/26/18,2018-11-26,5-24-19,2019-05-24,50.12667,-122.95517,29436100,96453221
ab-29436164,Two Bedroom Townhome near Lost Lake,Townhouse,Entire home/apt,3/18/19,2019-03-18,5-21-19,2019-05-21,50.11995,-122.93907,29436164,96453221
ab-23540407,Spacious Studio with Full Kitchen and on Free Shuttle Route to Ski,Condominium,Entire home/apt,4/11/18,2018-04-11,5-24-19,2019-05-24,50.12352,-122.93607,23540407,173513490
ab-29436886,Cozy 2 Bedroom steps away from ski-in/ski-out,Apartment,Entire home/apt,3/18/19,2019-03-18,5-21-19,2019-05-21,50.11436,-122.94134,29436886,96453221
ab-29437060,2 BR Ski-in/Ski-out Townhome on Blackcomb,Townhouse,Entire home/apt,11/26/18,2018-11-26,5-23-19,2019-05-23,50.11508,-122.94088,29437060,96453221
ab-23541734,"Mountain Retreat with Hot Tub with 3-beds, 3-baths",Townhouse,Entire home/apt,3/24/18,2018-03-24,5-23-19,2019-05-23,50.12473,-122.9555,23541734,173513490
ab-29437372,Cascade Deluxe Studio Unit 222,Apartment,Entire home/apt,10/29/18,2018-10-29,5-24-19,2019-05-24,50.11575,-122.95907,29437372,134284463
ab-22729086,Cozy Cabin With Fireplace Nestled in the Forest,Cabin,Entire home/apt,1/23/18,2018-01-23,5-24-19,2019-05-24,50.15875,-122.93438,22729086,112751244
ab-30483346,STAIRWAY TO SNOW HEAVEN 2.0,Condominium,Entire home/apt,12/31/18,2018-12-31,5-21-19,2019-05-21,50.09216,-122.99245,30483346,21233369
ab-23544211,"Style, tranquility, location...you can have it all",Townhouse,Entire home/apt,3/4/18,2018-03-04,5-24-19,2019-05-24,50.11967,-122.95818,23544211,92691614
ab-25205243,Glacier Lodge 326,Serviced apartment,Entire home/apt,5/22/18,2018-05-22,5-20-19,2019-05-20,50.11703,-122.94594,25205243,190443674
ab-28463748,Oasis at Lagoons,Condominium,Entire home/apt,9/12/18,2018-09-12,3-29-19,2019-03-29,50.12203,-122.95446,28463748,36117396
ab-25205851,Marquise One Bedroom,Condominium,Entire home/apt,5/22/18,2018-05-22,5-22-19,2019-05-22,50.11761,-122.94392,25205851,155028292
ab-25206115,Marquise Two Bedroom,Condominium,Entire home/apt,5/21/18,2018-05-21,5-24-19,2019-05-24,50.11712,-122.94289,25206115,155028292
ab-34018909,Gorgeous studio at Blackcomb base!,Condominium,Entire home/apt,4/29/19,2019-04-29,5-22-19,2019-05-22,50.1182,-122.94668,34018909,5616625
ab-25206525,Marquise Two Bedroom,Condominium,Entire home/apt,5/21/18,2018-05-21,5-21-19,2019-05-21,50.11728,-122.94233,25206525,155028292
ab-25206933,Marquise Two bed plus loft,Condominium,Entire home/apt,5/21/18,2018-05-21,5-24-19,2019-05-24,50.11554,-122.94236,25206933,155028292
ab-25207649,Marquise One Bedroom,Condominium,Entire home/apt,5/22/18,2018-05-22,5-23-19,2019-05-23,50.11678,-122.94417,25207649,155028292
ab-25207993,Marquise Two Bed Plus Loft,Condominium,Entire home/apt,5/21/18,2018-05-21,5-22-19,2019-05-22,50.11604,-122.94276,25207993,155028292
ab-25208258,Wildwood Lodge Two Bed plus Loft,Condominium,Entire home/apt,5/21/18,2018-05-21,5-24-19,2019-05-24,50.11594,-122.94279,25208258,155028292
ab-25208639,Wildwood Lodge Two Bed plus Loft,Condominium,Entire home/apt,5/21/18,2018-05-21,6-30-18,2018-06-30,50.1173353,-122.9413698,25208639,155028292
ab-25209594,"LUXURY: 2BA/BA, True Ski-in/Ski-out, HotTub&Pool",Condominium,Entire home/apt,5/22/18,2018-05-22,5-22-19,2019-05-22,50.11621,-122.94343,25209594,190476641
ab-31623906,Perfect ski in/out location w/ private hot tub,Townhouse,Entire home/apt,1/28/19,2019-01-28,2-18-19,2019-02-18,50.11513,-122.94332,31623906,168916184
ab-29442719,The Perfect Home for the Holidays!,House,Entire home/apt,12/17/18,2018-12-17,2-17-19,2019-02-17,50.10255,-122.98433,29442719,136644839
ab-28469078,!Perfect room to stay!Perfect location in Village!,Condominium,Private room,9/12/18,2018-09-12,5-24-19,2019-05-24,50.11947,-122.95924,28469078,64945842
ab-23564471,Sunny and Spacious Home with Large Private Deck,House,Entire home/apt,3/19/18,2018-03-19,4-22-18,2018-04-22,50.12067746,-122.9387361,23564471,3415624
ab-23564777,Summit Lodge Boutique Hotel,Room in boutique hotel,Private room,3/3/18,2018-03-03,7-16-18,2018-07-16,50.11946516,-122.9568429,23564777,176083753
ab-27649339,"SPACIOUS 3BR: 5m to Village- Pool, Hot Tub & BBQ",Townhouse,Entire home/apt,8/11/18,2018-08-11,5-24-19,2019-05-24,50.09761,-122.98024,27649339,11568255
ab-23565380,Foxglove 8,House,Entire home/apt,8/18/18,2018-08-18,3-28-19,2019-03-28,50.11624,-122.94176,23565380,148269423
ab-31628619,Spacious Slopeside 3 BR Penthouse. Stunning Views!,Condominium,Entire home/apt,1/28/19,2019-01-28,5-23-19,2019-05-23,50.11445,-122.94461,31628619,237131781
ab-23566186,"Blackcomb Greens: 2BR/2BA ""Majestic Nature Suite""",Townhouse,Entire home/apt,3/12/18,2018-03-12,5-24-19,2019-05-24,50.12192,-122.93799,23566186,93046875
ab-23566581,1 Bedroom Cascade Lodge Suite for 4 - Free Parking,Serviced apartment,Entire home/apt,3/7/18,2018-03-07,5-22-19,2019-05-22,50.11707,-122.95691,23566581,317618
ab-26059592,1 Bedroom - 0229 Lake Placid Lodge By WVC,Condominium,Entire home/apt,6/16/18,2018-06-16,5-22-19,2019-05-22,50.09292,-122.9919,26059592,184836557
ab-26059992,1 Bedroom - 0315 Lake Placid By WVC,Condominium,Entire home/apt,6/21/18,2018-06-21,5-22-19,2019-05-22,50.09479,-122.99105,26059992,184836557
ab-23567243,Holiday Season Getaway,House,Entire home/apt,3/3/18,2018-03-03,5-24-19,2019-05-24,50.12592,-122.96431,23567243,1024137
ab-23567614,Luxurious Montebello Whistler Executive Townhome,Townhouse,Entire home/apt,3/10/18,2018-03-10,5-22-19,2019-05-22,50.12372,-122.95623,23567614,176131858
ab-29457345,"3BD, Treeline, Ski Home, Shared Hot Tub",Townhouse,Entire home/apt,10/28/18,2018-10-28,5-23-19,2019-05-23,50.12096,-122.93322,29457345,96453221
ab-29457507,"2BR on Whistler, Stunning Views",Apartment,Entire home/apt,3/25/19,2019-03-25,5-22-19,2019-05-22,50.09223,-122.97981,29457507,96453221
ab-32849327,Steps to both Whistler Blackcomb gondolas!!,Apartment,Entire home/apt,3/7/19,2019-03-07,5-22-19,2019-05-22,50.11342,-122.95472,32849327,1459138
ab-29457760,"3BR Exposed Log Home, Ski Access, Private Hot Tub",Townhouse,Entire home/apt,3/25/19,2019-03-25,5-22-19,2019-05-22,50.09409,-122.97986,29457760,96453221
ab-29458293,"4BR Luxury Townhome, Private Hot-Tub",Townhouse,Entire home/apt,11/5/18,2018-11-05,5-25-19,2019-05-25,50.12722,-122.95384,29458293,96453221
ab-22744900,Valhalla Whistler Village Townhouse,Entire townhouse,Entire home/apt,1/22/18,2018-01-22,1-31-18,2018-01-31,50.12034768,-122.9593848,22744900,1356898
ab-26878586,Large Luxury Suite in Whistler,Guest suite,Entire home/apt,5/13/19,2019-05-13,5-21-19,2019-05-21,50.10281,-122.98567,26878586,136644839
ab-29459109,"3BR on Chateau Golf Course, in Benchlands",Apartment,Entire home/apt,3/11/19,2019-03-11,5-21-19,2019-05-21,50.12159,-122.9412,29459109,96453221
ab-29460081,"Upscale 3BR w/ Easy Shuttle to Village, Skiing",Townhouse,Entire home/apt,12/3/18,2018-12-03,5-24-19,2019-05-24,50.12165,-122.9387,29460081,96453221
ab-22747305,The Meadow -Boutique Mountain Enclave at Creekside,Condominium,Entire home/apt,7/4/18,2018-07-04,5-21-19,2019-05-21,50.09524,-122.99564,22747305,9354023
ab-22747400,"Best location,  2 bed 2 bath condo",Condominium,Entire home/apt,9/24/18,2018-09-24,5-23-19,2019-05-23,50.11495,-122.95064,22747400,167969931
ab-30510780,"Stylish 3 Bed, 3 Bath, Sleeps 4-6, Ski Home!",Townhouse,Entire home/apt,12/17/18,2018-12-17,5-24-19,2019-05-24,50.11968,-122.93713,30510780,8520466
ab-29460785,"Embarc Whistler: 1-BR, Sleep 4, Full Kitchen",Condominium,Entire home/apt,10/29/18,2018-10-29,5-23-19,2019-05-23,50.11848,-122.94638,29460785,27042710
ab-29461145,3BR Ski-in/Ski-out on Blackcomb,Apartment,Entire home/apt,3/25/19,2019-03-25,5-22-19,2019-05-22,50.11463,-122.94,29461145,96453221
ab-29461629,4BR Taluswood Townhome w/Private Hot Tub,Townhouse,Entire home/apt,11/20/18,2018-11-20,5-23-19,2019-05-23,50.09607,-122.97907,29461629,96453221
ab-31643227,The 'Marquise' Blackcomb - 1 Bedroom,Condominium,Entire home/apt,1/27/19,2019-01-27,5-24-19,2019-05-24,50.11747,-122.94413,31643227,62549425
ab-30511714,Christmas In Whistler - Steps to the Lifts,Condominium,Entire home/apt,12/17/18,2018-12-17,5-24-19,2019-05-24,50.09284,-122.99192,30511714,7810393
ab-31645672,NOTHING COMPARES! JUST CLICK TO SEE WHY!,Condominium,Entire home/apt,2/25/19,2019-02-25,5-23-19,2019-05-23,50.1139,-122.96865,31645672,237260170
ab-24371851,Twin Peaks Two Bedroom Apartment 101,Condominium,Entire home/apt,4/14/18,2018-04-14,4-14-18,2018-04-14,50.12056825,-122.9581753,24371851,183918618
ab-24372265,Twin Peaks Two Bedroom Apartment 102,Apartment,Entire home/apt,4/14/18,2018-04-14,4-14-18,2018-04-14,50.12142144,-122.9592398,24372265,183918618
ab-24372444,Twin Peaks Two Bedroom Apartment 103,Apartment,Entire home/apt,4/14/18,2018-04-14,4-14-18,2018-04-14,50.12072258,-122.9580407,24372444,183918618
ab-24372543,Market Pavilion Studio on Main St: Hot Tub+Parking,Apartment,Entire home/apt,5/14/18,2018-05-14,5-20-19,2019-05-20,50.11793,-122.95863,24372543,154627753
ab-24372649,Twin Peaks Two Bedroom Apartment 105,Apartment,Entire home/apt,4/14/18,2018-04-14,4-14-18,2018-04-14,50.12073536,-122.9594047,24372649,183918618
ab-30526276,Blackcomb 2Bd+Den SKI-in-SKI-out!,Apartment,Entire home/apt,12/17/18,2018-12-17,2-23-19,2019-02-23,50.11491,-122.94286,30526276,7784624
ab-32870396,2 Bedroom/steps to Ski Lift/Hot tub/Sauna/Pool/Gym,Condominium,Entire home/apt,3/18/19,2019-03-18,4-5-19,2019-04-05,50.09679,-122.98804,32870396,4941438
ab-24372803,Twin Peaks Two Bedroom Apartment 106,Apartment,Entire home/apt,4/14/18,2018-04-14,4-14-18,2018-04-14,50.12004327,-122.9579564,24372803,183918618
ab-24372898,Twin Peaks Two Bedroom Apartment 107,Apartment,Entire home/apt,4/14/18,2018-04-14,4-14-18,2018-04-14,50.12121907,-122.9592827,24372898,183918618
ab-24373090,Twin Peaks Two Bedroom Apartment 108,Apartment,Entire home/apt,4/14/18,2018-04-14,4-14-18,2018-04-14,50.11961209,-122.9595429,24373090,183918618
ab-24373509,Twin Peaks Two Bedroom Apartment 109,Apartment,Entire home/apt,4/14/18,2018-04-14,4-14-18,2018-04-14,50.11959314,-122.9575028,24373509,183918618
ab-24373752,Twin Peaks Two Bedroom Apartment 110,Apartment,Entire home/apt,4/14/18,2018-04-14,4-14-18,2018-04-14,50.12078146,-122.9587075,24373752,183918618
ab-24373871,Twin Peaks Two Bedroom Apartment 201,Apartment,Entire home/apt,4/14/18,2018-04-14,4-14-18,2018-04-14,50.12085425,-122.9573454,24373871,183918618
ab-24373963,Twin Peaks Two Bedroom Apartment 202,Apartment,Entire home/apt,4/14/18,2018-04-14,4-14-18,2018-04-14,50.11962357,-122.9577269,24373963,183918618
ab-24374110,Twin Peaks Two Bedroom Apartment 203,Apartment,Entire home/apt,4/14/18,2018-04-14,4-14-18,2018-04-14,50.12056177,-122.9577669,24374110,183918618
ab-32872006,"Whistler private bedroom private bath, hot tub",Condominium,Entire home/apt,3/18/19,2019-03-18,3-18-19,2019-03-18,50.11871,-122.95864,32872006,56356467
ab-25228874,Valhalla Two Bedroom,Townhouse,Entire home/apt,5/22/18,2018-05-22,5-22-19,2019-05-22,50.1174,-122.94366,25228874,155028292
ab-25229233,Wildwood Two Bedroom,Condominium,Entire home/apt,5/21/18,2018-05-21,5-23-19,2019-05-23,50.11717,-122.94227,25229233,155028292
ab-25229961,Wildwood One Bed plus Loft,Condominium,Entire home/apt,5/21/18,2018-05-21,4-28-19,2019-04-28,50.11853,-122.94144,25229961,155028292
ab-25230296,Wildwood One Bedroom,Condominium,Entire home/apt,5/23/18,2018-05-23,5-21-19,2019-05-21,50.11869,-122.94186,25230296,155028292
ab-25230702,Woodrun Lodge Two Bedroom True Ski in/Ski out,Condominium,Entire home/apt,5/22/18,2018-05-22,5-22-19,2019-05-22,50.1142,-122.94378,25230702,155028292
ab-25231189,Marquise One Bedroom,Condominium,Entire home/apt,5/22/18,2018-05-22,5-22-19,2019-05-22,50.11564,-122.94439,25231189,155028292
ab-24375477,"2 BED NORTHSTAR TOWNHOUSE, LARGE POOL & HOT TUB",Condominium,Entire home/apt,5/5/18,2018-05-05,5-24-19,2019-05-24,50.11911,-122.96064,24375477,68581273
ab-29479297,Renovated 2 bedroom Creekside Townhouse,Townhouse,Entire home/apt,11/5/18,2018-11-05,5-24-19,2019-05-24,50.09771,-122.98712,29479297,153388448
ab-29479997,Central Village Studio with Great Amenities,Condominium,Entire home/apt,11/5/18,2018-11-05,5-21-19,2019-05-21,50.11917,-122.9569,29479997,169906583
ab-29480002,Large 2 Bedroom Whistler Village,Condominium,Entire home/apt,11/5/18,2018-11-05,5-20-19,2019-05-20,50.11934,-122.95943,29480002,169906583
ab-29480027,Corner-Unit 2 Bedroom Ski-in/Ski-out,Condominium,Entire home/apt,11/5/18,2018-11-05,5-23-19,2019-05-23,50.11948,-122.94228,29480027,169906583
ab-24375482,Northstar Two Bedroom 100,Apartment,Entire home/apt,4/14/18,2018-04-14,4-14-18,2018-04-14,50.12074638,-122.9572814,24375482,183918618
ab-29483541,Cascade 311 by Elevate Vacations,Condominium,Entire home/apt,11/5/18,2018-11-05,5-20-19,2019-05-20,50.1175,-122.95951,29483541,134284463
ab-29484341,"Village Studio with Hot Tub, Pool, Gym",Condominium,Entire home/apt,11/5/18,2018-11-05,5-24-19,2019-05-24,50.11746,-122.958,29484341,169906583
ab-29484344,Cascade 325 by Elevate Vacations,Condominium,Entire home/apt,11/5/18,2018-11-05,5-23-19,2019-05-23,50.11715,-122.95894,29484344,134284463
ab-24378933,Quiet Creekside Hideaway,Condominium,Entire home/apt,5/23/18,2018-05-23,5-21-19,2019-05-21,50.09726,-122.99027,24378933,49591711
ab-24379477,Whistler Creekside Getaway,Townhouse,Private room,4/13/18,2018-04-13,4-23-18,2018-04-23,50.09462677,-122.9915209,24379477,53838781
ab-29486451,"Luxury Ski in/out, Steps to heated pool & hot tub",Condominium,Entire home/apt,11/5/18,2018-11-05,5-22-19,2019-05-22,50.09434,-122.98977,29486451,97819804
ab-29487399,1BR+den Ski-in/out on Blackcomb w/Pool & Hot-Tub,Condominium,Entire home/apt,3/18/19,2019-03-18,5-21-19,2019-05-21,50.11432,-122.94379,29487399,96453221
ab-29487559,"Cute and Cozy 1BR, Close to Everything!",Townhouse,Entire home/apt,11/5/18,2018-11-05,5-24-19,2019-05-24,50.12074,-122.95371,29487559,96453221
ab-27672970,Whistler Sundance WM Resort  2BR  for 6,Serviced apartment,Entire home/apt,8/14/18,2018-08-14,5-24-19,2019-05-24,50.09176,-122.9952,27672970,3334196
ab-32886909,"2BR, Ski-in/out with Pool and Hot tub on Blackcomb",Condominium,Entire home/apt,3/18/19,2019-03-18,5-21-19,2019-05-21,50.11557,-122.94497,32886909,96453221
ab-29487802,"True Ski-in/Ski-out 2BR+Den, w/Pool & Hot-Tub",Apartment,Entire home/apt,1/7/19,2019-01-07,5-22-19,2019-05-22,50.11441,-122.94435,29487802,96453221
ab-29488255,"Updated 4BR, Hot Tub, Walk to Village and Slopes",Townhouse,Entire home/apt,12/10/18,2018-12-10,5-22-19,2019-05-22,50.10858,-122.95967,29488255,96453221
ab-29488437,"Remodelled 3 Bed 3 Bath, 10 steps to the slopes",Apartment,Entire home/apt,3/25/19,2019-03-25,5-22-19,2019-05-22,50.11521,-122.94145,29488437,96453221
ab-32890282,"2BR+Den Ski-In/Out in Woodrun Lodge, Blackcomb",Condominium,Entire home/apt,3/18/19,2019-03-18,5-21-19,2019-05-21,50.11626,-122.94379,32890282,96453221
ab-29488635,Bright 3BR w/Ski-in/out and Hot-Tub on Blackcomb,Townhouse,Entire home/apt,11/5/18,2018-11-05,5-24-19,2019-05-24,50.11585,-122.9414,29488635,96453221
ab-29489101,Spacious 4BR w/Hot-Tub Close to Village,Townhouse,Entire home/apt,3/17/19,2019-03-17,5-24-19,2019-05-24,50.1094,-122.95894,29489101,96453221
ab-29489248,"Impressive 4BR, 4.5BA Townhome, Private Hot-Tub",Townhouse,Entire home/apt,11/26/18,2018-11-26,5-23-19,2019-05-23,50.14437,-122.94509,29489248,96453221
ab-29489262,Cascade 613 by Elevate Vacations,Apartment,Entire home/apt,11/5/18,2018-11-05,5-23-19,2019-05-23,50.11581,-122.95807,29489262,134284463
ab-24389329,Twin Peaks Two Bedroom Apartment 103,Room in aparthotel,Private room,4/14/18,2018-04-14,5-22-19,2019-05-22,50.12106,-122.95877,24389329,183918618
ab-24389429,Twin Peaks Two Bedroom Apartment 106,Apartment,Entire home/apt,4/14/18,2018-04-14,5-25-19,2019-05-25,50.12013,-122.95959,24389429,183918618
ab-24389446,Twin Peaks Two Bedroom Apartment 105,Serviced apartment,Entire home/apt,4/14/18,2018-04-14,5-21-19,2019-05-21,50.11938,-122.95928,24389446,183918618
ab-24390432,Twin Peaks Two Bedroom Apartment 304,Apartment,Entire home/apt,4/14/18,2018-04-14,5-21-19,2019-05-21,50.12107,-122.95949,24390432,183918618
ab-29489944,Cascade Studio Unit 414,Condominium,Entire home/apt,11/5/18,2018-11-05,5-24-19,2019-05-24,50.11761,-122.95966,29489944,134284463
ab-24391648,Northstar 2 bedroom,Condominium,Entire home/apt,4/14/18,2018-04-14,5-21-19,2019-05-21,50.1201,-122.95898,24391648,22619214
ab-22765397,2Br/2BaTownhouse steps to Olympic Plaza in village,Townhouse,Entire home/apt,2/5/18,2018-02-05,5-21-19,2019-05-21,50.11994,-122.95418,22765397,168150947
ab-28498225,EMBARC Whistler,Condominium,Private room,9/17/18,2018-09-17,5-25-19,2019-05-25,50.11907,-122.94635,28498225,86131
ab-34060046,Whistler Tyndall Stone Lodge 2bdrm unit,Apartment,Entire home/apt,4/29/19,2019-04-29,5-22-19,2019-05-22,50.11979,-122.95629,34060046,149568032
ab-22766105,"Beautifully Renovated 2 bed, Fantastic Location!",Townhouse,Entire home/apt,2/2/18,2018-02-02,5-24-19,2019-05-24,50.11956,-122.94187,22766105,8520466
ab-22766395,Executive Chalet steps from the village,Chalet,Entire home/apt,1/18/18,2018-01-18,5-24-19,2019-05-24,50.12156,-122.96237,22766395,168157350
ab-24392785,Twin Peaks Two Bedroom Apartment 209,Apartment,Entire home/apt,4/14/18,2018-04-14,5-21-19,2019-05-21,50.11961,-122.95953,24392785,183918618
ab-24392821,Twin Peaks Two Bedroom Apartment 301,Apartment,Entire home/apt,4/14/18,2018-04-14,5-22-19,2019-05-22,50.11945,-122.95758,24392821,183918618
ab-24392846,Twin Peaks Two Bedroom Apartment 302,Apartment,Entire home/apt,4/14/18,2018-04-14,5-23-19,2019-05-23,50.11938,-122.9575,24392846,183918618
ab-24392864,Twin Peaks Two Bedroom Apartment 207,Apartment,Entire home/apt,4/14/18,2018-04-14,5-21-19,2019-05-21,50.1199,-122.95952,24392864,183918618
ab-24392879,Twin Peaks Two Bedroom Apartment 303,Serviced apartment,Entire home/apt,4/14/18,2018-04-14,5-24-19,2019-05-24,50.12119,-122.95746,24392879,183918618
ab-22767815,Furnished Chalet Ski-in/Ski-out Whistler,Entire chalet,Entire home/apt,1/18/18,2018-01-18,1-30-18,2018-01-30,50.1231489,-122.9487894,22767815,161597997
ab-22767915,Whistler Blueberry Hill private room and en-suite,Condominium,Private room,2/5/18,2018-02-05,5-24-19,2019-05-24,50.11293,-122.96961,22767915,45003722
ab-22767945,Cute Studio in the Heart of Whistler Village,Apartment,Entire home/apt,1/22/18,2018-01-22,5-23-19,2019-05-23,50.11853,-122.95794,22767945,168172973
ab-22768249,In the heart of Whistler. Pool & Hot Tub! Sleeps 6,Condominium,Entire home/apt,2/5/18,2018-02-05,5-22-19,2019-05-22,50.12071,-122.958,22768249,31405430
ab-22768555,Beautiful Whistler Home - 3 bedroom,House,Entire home/apt,12/24/18,2018-12-24,5-13-19,2019-05-13,50.09421,-122.99351,22768555,130846695
ab-24392897,Twin Peaks Two Bedroom Apartment 310,Condominium,Entire home/apt,4/14/18,2018-04-14,5-22-19,2019-05-22,50.12162,-122.95761,24392897,183918618
ab-24392908,Twin Peaks Two Bedroom Apartment 208,Apartment,Entire home/apt,4/14/18,2018-04-14,5-23-19,2019-05-23,50.12133,-122.95932,24392908,183918618
ab-24392919,Twin Peaks Two Bedroom Apartment 307,Apartment,Entire home/apt,4/14/18,2018-04-14,5-21-19,2019-05-21,50.11995,-122.95909,24392919,183918618
ab-24392932,Twin Peaks Two Bedroom Apartment 309,Apartment,Entire home/apt,4/14/18,2018-04-14,5-21-19,2019-05-21,50.11939,-122.95731,24392932,183918618
ab-24392953,Twin Peaks Two Bedroom Apartment 305,Apartment,Entire home/apt,4/14/18,2018-04-14,5-25-19,2019-05-25,50.12013,-122.9591,24392953,183918618
ab-24392964,Twin Peaks Two Bedroom Apartment 306,Apartment,Entire home/apt,4/14/18,2018-04-14,5-22-19,2019-05-22,50.11993,-122.95917,24392964,183918618
ab-24392974,Twin Peaks Two Bedroom Apartment 308,Apartment,Entire home/apt,4/14/18,2018-04-14,5-21-19,2019-05-21,50.12001,-122.95802,24392974,183918618
ab-24392994,Northstar Two Bedroom 100,Apartment,Entire home/apt,4/14/18,2018-04-14,4-8-19,2019-04-08,50.12116,-122.95742,24392994,183918618
ab-24393001,Twin Peaks Two Bedroom Apartment 210,Apartment,Entire home/apt,4/14/18,2018-04-14,5-21-19,2019-05-21,50.12135,-122.95743,24393001,183918618
ab-22774736,Creekside Townhouse,Condominium,Entire home/apt,1/22/18,2018-01-22,5-21-19,2019-05-21,50.09323,-122.99316,22774736,81121117
ab-32895971,â„ï¸Couples' Paradise - Hot Tub |Free Parking |Views,Condominium,Entire home/apt,3/13/19,2019-03-13,5-24-19,2019-05-24,50.12013,-122.95716,32895971,74354856
ab-31675275,Beautiful 4 bedroom Whistler home hot tub BBQ,Chalet,Entire home/apt,1/28/19,2019-01-28,5-23-19,2019-05-23,50.09031,-123.00024,31675275,13232844
ab-34062193,Designer Mountain Retreat with Incredible Views,Condominium,Entire home/apt,4/25/19,2019-04-25,5-22-19,2019-05-22,50.11159,-122.96702,34062193,2242691
ab-34062718,Stunning Chalet Style Townhouse W/ Private Hot Tub,Townhouse,Entire home/apt,4/27/19,2019-04-27,5-20-19,2019-05-20,50.12443,-122.95785,34062718,208713754
ab-32906984,"True Ski-In/Out, Modern 2BR unit, Pool & Hot Tub",Condominium,Entire home/apt,3/18/19,2019-03-18,5-21-19,2019-05-21,50.11599,-122.94487,32906984,96453221
ab-31689997,Best ski in/out-private hot tub-Walk Everywhere,Townhouse,Entire home/apt,1/27/19,2019-01-27,5-23-19,2019-05-23,50.11238,-122.95043,31689997,168916184
ab-27698562,Alpine Reflections - Walk to lifts Creekside,Apartment,Entire home/apt,9/12/18,2018-09-12,5-20-19,2019-05-20,50.09833,-122.98898,27698562,200882696
ab-24410479,Heart of the Village! Spacious 2 BR- Sleeps 6!,Condominium,Entire home/apt,4/16/18,2018-04-16,5-24-19,2019-05-24,50.11949,-122.95657,24410479,97819804
ab-29514558,Charming Beauty in Whistler Village,Townhouse,Entire home/apt,11/5/18,2018-11-05,5-23-19,2019-05-23,50.12039,-122.95754,29514558,208713754
ab-32918054,"Prime Ironman Location-Training, Family & Friends",Townhouse,Entire home/apt,5/4/19,2019-05-04,5-24-19,2019-05-24,50.09109,-123.00022,32918054,131659192
ab-23598237,GLACIER LODGE,Apartment,Entire home/apt,3/6/18,2018-03-06,5-24-19,2019-05-24,50.11792,-122.94594,23598237,109370709
ab-29515826,"Exquisite 2Br/3Ba Townhouse - HotTub, Free parking",Townhouse,Entire home/apt,11/5/18,2018-11-05,5-23-19,2019-05-23,50.11987,-122.9586,29515826,211563067
ab-29517344,Ski in Ski out: 2 bedroom (1 bedroom plus loft),Apartment,Entire home/apt,11/5/18,2018-11-05,5-23-19,2019-05-23,50.11788,-122.9461,29517344,95781035
ab-31694054,Whistler Village Cascade Lodge Near Gondola,Serviced apartment,Entire home/apt,1/28/19,2019-01-28,3-13-19,2019-03-13,50.11601,-122.95778,31694054,30307256
ab-34074263,Amazing Golf Course Views,Townhouse,Entire home/apt,5/6/19,2019-05-06,5-21-19,2019-05-21,50.12015,-122.94028,34074263,27342618
ab-29519047,Deluxe 4 Bedroom Plus Media Room and hot tub - 38,Townhouse,Entire home/apt,11/5/18,2018-11-05,5-22-19,2019-05-22,50.12513,-122.95502,29519047,95781035
ab-24412157,Deluxe 4 Bedroom Plus Media Room and hot tub - 32,Townhouse,Entire home/apt,4/16/18,2018-04-16,3-31-19,2019-03-31,50.12715,-122.95396,24412157,95781035
ab-27704421,Base Camp Whistler,Condominium,Private room,8/14/18,2018-08-14,12-16-18,2018-12-16,50.10134639,-122.9904349,27704421,61976105
ab-26949181,"The Hideout-Short walk to Gondola, newly renovated",Condominium,Entire home/apt,7/18/18,2018-07-18,5-24-19,2019-05-24,50.09444,-122.9935,26949181,40340388
ab-30540407,Cheeky Creek Inn,Apartment,Entire home/apt,12/24/18,2018-12-24,5-24-19,2019-05-24,50.09746,-122.99175,30540407,116480687
ab-29523546,Cascade Lodge - Beautiful One Bedroom Suite  226,Serviced apartment,Entire home/apt,11/5/18,2018-11-05,5-23-19,2019-05-23,50.11768,-122.95788,29523546,222320314
ab-29523559,Spacious One Bedroom Suite 406,Serviced apartment,Entire home/apt,11/5/18,2018-11-05,5-22-19,2019-05-22,50.11626,-122.95781,29523559,222320314
ab-29523581,Spacious One Bedroom Suite - 412,Serviced apartment,Entire home/apt,11/5/18,2018-11-05,5-21-19,2019-05-21,50.11576,-122.95842,29523581,222320314
ab-29523597,Beautiful One Bedroom Suite - 416,Serviced apartment,Entire home/apt,11/5/18,2018-11-05,5-21-19,2019-05-21,50.11656,-122.95889,29523597,222320314
ab-29523605,Large spacious one bedroom suite - 506,Serviced apartment,Entire home/apt,11/5/18,2018-11-05,5-23-19,2019-05-23,50.1174,-122.95978,29523605,222320314
ab-29523613,Spacious one bedroom suite in Whistler - 532,Apartment,Entire home/apt,11/5/18,2018-11-05,5-24-19,2019-05-24,50.11747,-122.95815,29523613,222320314
ab-29523629,Spacious Two Bedroom Apartment in Whistler - 530,Serviced apartment,Entire home/apt,11/5/18,2018-11-05,5-23-19,2019-05-23,50.11722,-122.95756,29523629,222320314
ab-29523649,Top Floor Two Bedroom Suite in Whistler - 630,Serviced apartment,Entire home/apt,11/5/18,2018-11-05,5-23-19,2019-05-23,50.11776,-122.95757,29523649,222320314
ab-30542626,"Think Whistler - Central Village Square, 1 parking",Serviced apartment,Entire home/apt,12/5/18,2018-12-05,5-21-19,2019-05-21,50.11319,-122.95468,30542626,42856656
ab-25259929,Cozy Creekside Condo - Lifts 5 min walk,Townhouse,Entire home/apt,5/23/18,2018-05-23,5-20-19,2019-05-20,50.09265,-122.99104,25259929,27857322
ab-29533510,"Best Location! 2B/2B, Pool, Private Hot Tub!",Townhouse,Entire home/apt,11/5/18,2018-11-05,5-24-19,2019-05-24,50.12012,-122.95743,29533510,1024137
ab-23614074,"Crankworx week, 2BR Tyndall Stone Lodge",Condominium,Entire home/apt,3/7/18,2018-03-07,5-23-19,2019-05-23,50.11854,-122.95606,23614074,347859
ab-31712095,Whistler Upper Village Exec Condo *sleeps 4*,Apartment,Entire home/apt,1/27/19,2019-01-27,5-20-19,2019-05-20,50.11714,-122.94261,31712095,144009834
ab-31712775,Spacious Modern Family Friendly Whistler Home,House,Entire home/apt,2/4/19,2019-02-04,4-3-19,2019-04-03,50.15659,-122.9314,31712775,34754315
ab-28519166,Ski to the door!True SI/SO Luxury 2BrTH-Private HT,Townhouse,Entire home/apt,9/17/18,2018-09-17,5-24-19,2019-05-24,50.11543,-122.94339,28519166,215254144
ab-32941319,"LUXURY Ski-in,Ski-out Whistler Chalet.",Cabin,Entire home/apt,3/13/19,2019-03-13,5-23-19,2019-05-23,50.1113,-122.95015,32941319,62155678
ab-30556404,Aspens Lodge 128 Ski IN/OUT,Apartment,Entire home/apt,12/17/18,2018-12-17,5-21-19,2019-05-21,50.11552,-122.9454,30556404,22619214
ab-30556411,Aspens Lodge 310 Ski IN/OUT,Apartment,Entire home/apt,12/17/18,2018-12-17,5-24-19,2019-05-24,50.11521,-122.94381,30556411,22619214
ab-30556661,Glacier Lodge 249 Ski IN/OUT,Apartment,Entire home/apt,12/17/18,2018-12-17,12-20-18,2018-12-20,50.11747467,-122.9466516,30556661,22619214
ab-30556686,Glacier's Reach 27 w/ Hot Tub,Apartment,Entire home/apt,12/17/18,2018-12-17,12-20-18,2018-12-20,50.12145143,-122.958004,30556686,22619214
ab-30556734,Lagoons 37 Mountain View,Villa,Entire home/apt,12/17/18,2018-12-17,12-20-18,2018-12-20,50.11912766,-122.9590375,30556734,22619214
ab-30556737,Lagoons 98 w/ Hot Tub,Villa,Entire home/apt,12/17/18,2018-12-17,12-20-18,2018-12-20,50.11807545,-122.9606016,30556737,22619214
ab-30556780,Northstar 121 Renovated!,Villa,Entire home/apt,12/17/18,2018-12-17,5-21-19,2019-05-21,50.11931,-122.95881,30556780,22619214
ab-30556793,Rainbow Lodge 5 Village,Apartment,Entire home/apt,12/17/18,2018-12-17,5-22-19,2019-05-22,50.11416,-122.956,30556793,22619214
ab-30556840,Sunpath 12  Location!,Villa,Entire home/apt,12/17/18,2018-12-17,12-20-18,2018-12-20,50.1192378,-122.9589399,30556840,22619214
ab-30556861,Sunpath 28  Location!,Villa,Entire home/apt,12/17/18,2018-12-17,12-20-18,2018-12-20,50.11793298,-122.9591542,30556861,22619214
ab-28521636,"Large 2 Bedroom/2 Bath, Ski In/Out Access, Hot Tub",Condominium,Entire home/apt,11/5/18,2018-11-05,5-22-19,2019-05-22,50.11672,-122.94212,28521636,5625927
ab-30556919,Sunpath 38  Location!,Villa,Entire home/apt,12/17/18,2018-12-17,5-23-19,2019-05-23,50.11846,-122.959,30556919,22619214
ab-30556937,Sunpath 46  Location!,Villa,Entire home/apt,12/17/18,2018-12-17,12-20-18,2018-12-20,50.11830236,-122.9598172,30556937,22619214
ab-30556966,Sunpath 7  Location!,Villa,Entire home/apt,12/17/18,2018-12-17,12-20-18,2018-12-20,50.11829713,-122.9598311,30556966,22619214
ab-30556980,Sunpath 49  Location!,Villa,Entire home/apt,12/17/18,2018-12-17,12-20-18,2018-12-20,50.11806205,-122.9602298,30556980,22619214
ab-30557603,Exclusive Blackcomb Greens 3BR Whistler home,Condominium,Entire home/apt,12/12/18,2018-12-12,12-31-18,2018-12-31,50.1213578,-122.9375349,30557603,78715445
ab-31713490,Whistler-Sundance  2 Bedroom plus Loft,Resort,Private room,3/18/19,2019-03-18,5-21-19,2019-05-21,50.09214,-122.99538,31713490,195414088
ab-34089411,"Luxury 4 Bdrm, 3.5 Bath, Private Hot Tub, BBQ, A/C",Townhouse,Entire home/apt,5/13/19,2019-05-13,5-21-19,2019-05-21,50.1257,-122.95536,34089411,31816895
ab-25264112,Newly renovated 1 Bdr townhouse,Townhouse,Entire home/apt,5/23/18,2018-05-23,5-23-19,2019-05-23,50.12084,-122.95542,25264112,190202074
ab-30558653,WHISTLER APARTMENT,Serviced apartment,Entire home/apt,12/17/18,2018-12-17,5-24-19,2019-05-24,50.11949,-122.94006,30558653,181891244
ab-30558943,"Embarc Whistler - Pool, Hot Tub, Steam Room & more",Resort,Private room,12/8/18,2018-12-08,4-5-19,2019-04-05,50.1188,-122.94439,30558943,149106199
ab-28524696,Rustic Whistler Retreat at the Woods,Townhouse,Entire home/apt,9/17/18,2018-09-17,5-23-19,2019-05-23,50.12123,-122.93731,28524696,134104057
ab-24428871,Deluxe 4 Bedroom plus Media Room and hot tub! (35),Townhouse,Entire home/apt,4/16/18,2018-04-16,5-23-19,2019-05-23,50.12541,-122.95501,24428871,95781035
ab-29541865,"Whistler Cascade Lodge-1BR-4 Max, Whistler Village",Apartment,Entire home/apt,11/5/18,2018-11-05,1-7-19,2019-01-07,50.11721433,-122.9579538,29541865,39843949
ab-28527436,Glacierâ€™s Reach one bedroom condo,Condominium,Entire home/apt,9/17/18,2018-09-17,5-24-19,2019-05-24,50.12194,-122.9572,28527436,211919103
ab-29542311,Whistler Village Inn 352,Apartment,Entire home/apt,11/5/18,2018-11-05,11-5-18,2018-11-05,50.11444006,-122.9525665,29542311,83547759
ab-34096361,Full apartment in top resort of Whistler,Apartment,Entire home/apt,4/25/19,2019-04-25,5-22-19,2019-05-22,50.11832,-122.94503,34096361,75045214
ab-23625710,LAKE HOUSE Private Bedroom Shared Home,Chalet,Private room,3/8/18,2018-03-08,5-22-19,2019-05-22,50.15372,-122.93031,23625710,176776929
ab-29547267,"NEW Marketplace Lodge 1 bedroom, free parking",Condominium,Entire home/apt,11/5/18,2018-11-05,5-23-19,2019-05-23,50.1205,-122.95669,29547267,1024137
ab-25286994,2BR Condo Whiski Jack at Creekside,Condominium,Entire home/apt,5/23/18,2018-05-23,9-30-18,2018-09-30,50.09823915,-122.986631,25286994,26650418
ab-24441875,Peak Dreams - Whistler Creekside Studio,Apartment,Entire home/apt,4/18/18,2018-04-18,5-23-19,2019-05-23,50.09816,-122.9899,24441875,46346765
ab-29562254,New listing -Special Pricing,,,,#VALUE!,,#VALUE!,,,,
" 2 bedroom Northstar""",Condominium,Entire home/apt,12/17/18,5-22-19,#VALUE!,Canada,#VALUE!,-122.95924,,1024137,
ab-28542862,Whistler Rustic Creekside Chalet,Chalet,Entire home/apt,9/23/18,2018-09-23,5-23-19,2019-05-23,50.09393,-122.9916,28542862,1275079
ab-29564543,Luxurious large and spacious 5-star home! Perfect Whistler escape with Private hot tub,House,Entire home/apt,11/5/18,2018-11-05,5-20-19,2019-05-20,50.13881,-122.95747,29564543,196624542
ab-29564544,RENO Complete Mar 11th 2019....Stunning large townhouse in Village North location. Private hot tub.,Townhouse,Entire home/apt,11/5/18,2018-11-05,5-24-19,2019-05-24,50.12033,-122.95921,29564544,196624542
ab-24448186,Luxury 'Kadenwood' 5BR home w/ private hot tub & ski trail!,Chalet,Entire home/apt,4/18/18,2018-04-18,9-18-18,2018-09-18,50.08740699,-122.9846069,24448186,35393628
ab-23632076,Whistler bed in semi-private room,Condominium,Shared room,3/7/18,2018-03-07,4-16-18,2018-04-16,50.11841661,-122.9584032,23632076,11423475
ab-26107946,The Whistler House,Vacation home,Entire home/apt,4/22/19,2019-04-22,5-24-19,2019-05-24,50.1576,-122.93251,26107946,169197402
ab-30569683,Value Studio Suite close to Lifts w/ Free Parking,Apartment,Entire home/apt,12/17/18,2018-12-17,3-26-19,2019-03-26,50.09858,-122.99015,30569683,158823097
ab-30569850,Whistler Getaway!,Apartment,Entire home/apt,12/8/18,2018-12-08,5-23-19,2019-05-23,50.11381,-122.95584,30569850,229335850
ab-26988063,Four Seasons Resort Premier King Room,Room in hotel,Private room,7/18/18,2018-07-18,7-24-18,2018-07-24,50.11980686,-122.9439846,26988063,187260926
ab-26989569,Spacious Home in Fantastic Village LocationÂ by Harmony Whistler,Townhouse,Entire home/apt,7/28/18,2018-07-28,5-20-19,2019-05-20,50.11975,-122.96012,26989569,35393628
ab-31719246,"3 Bedroom apt, 5 minute walk to Creekside gondola",Condominium,Entire home/apt,2/4/19,2019-02-04,5-24-19,2019-05-24,50.09599,-122.99195,31719246,51689517
ab-29575160,Whistler Retreat,House,Entire home/apt,10/28/18,2018-10-28,12-25-18,2018-12-25,50.12602351,-122.9699783,29575160,19104271
ab-29578553,One bedroom condo in Whistler Village!,Serviced apartment,Entire home/apt,11/5/18,2018-11-05,5-21-19,2019-05-21,50.11812,-122.9575,29578553,108219335
ab-30570957,Woodrun 2bd Ski in Ski out / heated pool & hot tub,Apartment,Entire home/apt,12/17/18,2018-12-17,1-1-19,2019-01-01,50.11584899,-122.9430532,30570957,7784624
ab-30571543,Think Whistler - Quiet Creekside Oasis!,Serviced apartment,Entire home/apt,12/17/18,2018-12-17,5-24-19,2019-05-24,50.09248,-122.99268,30571543,42856656
ab-30584775,True Ski in/out Whistler Condo,Condominium,Entire home/apt,12/17/18,2018-12-17,5-24-19,2019-05-24,50.11635,-122.94434,30584775,79503521
ab-29592442,Aurora Lodge: Queen Bedroom 1,House,Private room,10/27/18,2018-10-27,11-23-18,2018-11-23,50.10657117,-122.9700688,29592442,23354084
ab-22848021,"The Woods 1 bedroom, sleeps 4, close to village, slope and lake",Condominium,Entire home/apt,2/10/18,2018-02-10,5-23-19,2019-05-23,50.12151,-122.93799,22848021,148269423
ab-32983456,"Marketplace Lodge: Five Star reno just completed Mar 2019 - best Village location, mountain view!",Condominium,Entire home/apt,3/25/19,2019-03-25,5-22-19,2019-05-22,50.11985,-122.95572,32983456,196624542
ab-29593540,Aurora Lodge - Twin Bedroom,House,Private room,10/27/18,2018-10-27,11-20-18,2018-11-20,50.10612486,-122.9699886,29593540,23354084
ab-32986766,Accommodation by Creekside Gondola,Condominium,Entire home/apt,3/25/19,2019-03-25,3-29-19,2019-03-29,50.09363,-122.99377,32986766,26415530
ab-29597490,Fantastic SKI IN/OUT 2 Bed 2 Bath condo - sleeps 6,Condominium,Entire home/apt,11/5/18,2018-11-05,5-21-19,2019-05-21,50.11577,-122.94527,29597490,84821274
ab-22849533,"Summer by the lake, 2 bedroom Whistler townhouse",Townhouse,Entire home/apt,4/10/18,2018-04-10,4-10-18,2018-04-10,50.1047018,-122.982798,22849533,3388486
ab-30591107,"*VILLAGE LOFT - 2 bdrm, 5 min from Gondola*",Townhouse,Entire home/apt,12/31/18,2018-12-31,5-24-19,2019-05-24,50.09288,-122.99313,30591107,4103604
ab-26129269,"Modern 2BR, 2BA townhome, Blackcomb. Free shuttle.",Townhouse,Entire home/apt,6/20/18,2018-06-20,5-23-19,2019-05-23,50.11763,-122.94243,26129269,96453221
ab-29613357,Whistler Creekside townhouse,Townhouse,Entire home/apt,11/20/18,2018-11-20,5-23-19,2019-05-23,50.09455,-122.99187,29613357,88998426
ab-29616458,"Eat, Sleep, Ski - Steps to the Ski Lift",Condominium,Entire home/apt,11/14/18,2018-11-14,5-22-19,2019-05-22,50.09357,-122.99198,29616458,46346765
ab-26131110,3BR at The Whistler at Snowbird,Condominium,Entire home/apt,6/20/18,2018-06-20,4-2-19,2019-04-02,50.11889,-122.94082,26131110,26650418
ab-31739998,Stylish Mountain Getaway - Epic View & Location,Condominium,Entire home/apt,2/4/19,2019-02-04,5-23-19,2019-05-23,50.11898,-122.95645,31739998,238062328
ab-25318769,Breathtaking views on Whistler/Blackcomb mountains,Condominium,Entire home/apt,5/24/18,2018-05-24,5-24-19,2019-05-24,50.11329,-122.96852,25318769,191226765
ab-34151265,Elegant Wood Furnished Lodge by Harmony Whistler,Condominium,Entire home/apt,5/6/19,2019-05-06,5-21-19,2019-05-21,50.1174,-122.94298,34151265,35393628
ab-29627867,3BR + Hot Tub Ski-in/Out on Whistler,Townhouse,Entire home/apt,3/13/19,2019-03-13,5-23-19,2019-05-23,50.11079,-122.94959,29627867,96453221
ab-23664053,"SNOWBIRD / WHISKI JACK , WHISTLER, BC",Resort,Private room,3/10/18,2018-03-10,10-12-18,2018-10-12,50.12168696,-122.9603923,23664053,176841143
ab-25320573,Cozy Village Condo,Condominium,Entire home/apt,5/24/18,2018-05-24,2-15-19,2019-02-15,50.11923844,-122.9588325,25320573,27857322
ab-28585910,"Luxury Whistler Duplex 4 Br+Loft, Walk to Lift",Chalet,Entire home/apt,9/20/18,2018-09-20,5-22-19,2019-05-22,50.09954,-122.98773,28585910,153162848
ab-29628300,4BR Exposed Log Beam Chalet in Blueberry Estates,Chalet,Entire home/apt,3/16/19,2019-03-16,5-22-19,2019-05-22,50.11772,-122.97287,29628300,96453221
ab-29628517,"2BR + Private Hot-Tub on Blackcomb, Ski-Access",Townhouse,Entire home/apt,11/26/18,2018-11-26,5-22-19,2019-05-22,50.11412,-122.94055,29628517,96453221
ab-25323475,Spacious Home w/ Large Private BBQ Deck by Harmony Whistler,Townhouse,Entire home/apt,6/8/18,2018-06-08,5-23-19,2019-05-23,50.12053,-122.93936,25323475,35393628
ab-25323476,Ski In Ski OutÂ Apartment w/ Pool & Hot Tub Access by Harmony Whistler,Condominium,Entire home/apt,6/29/18,2018-06-29,5-23-19,2019-05-23,50.11494,-122.94393,25323476,35393628
ab-25323596,Whistler Home,Chalet,Entire home/apt,6/5/18,2018-06-05,5-21-19,2019-05-21,50.14783,-122.96774,25323596,11399567
ab-25324180,Marks 1 Bdrm + Loft Townhouse - Walk to the lifts!,Townhouse,Entire home/apt,6/29/18,2018-06-29,5-21-19,2019-05-21,50.09326,-122.99066,25324180,165525903
ab-33013453,Amazing Ski-in/Ski-out 3 Bedroom with Slope-side Views,Condominium,Entire home/apt,3/25/19,2019-03-25,5-22-19,2019-05-22,50.11741,-122.94888,33013453,95781035
ab-24471363,1 Bedroom - 0102 Lake Placid By WVC,Condominium,Entire home/apt,4/20/18,2018-04-20,2-10-19,2019-02-10,50.09472128,-122.9915729,24471363,184836557
ab-24472055,1 Bedroom - 0103 Lake Placid By WVC,Condominium,Entire home/apt,4/20/18,2018-04-20,5-24-19,2019-05-24,50.09476,-122.99027,24472055,184836557
ab-24472331,1 Bedroom - 0108 Lake Placid By WVC,Condominium,Entire home/apt,4/20/18,2018-04-20,5-21-19,2019-05-21,50.09286,-122.9897,24472331,184836557
ab-26138266,Whistler Shared Retreat  2,Townhouse,Private room,6/21/18,2018-06-21,9-14-18,2018-09-14,50.11749982,-122.9608706,26138266,2005783
ab-23667233,Stylish Suite Steps from World-Class Golf & Biking,Condominium,Entire home/apt,3/10/18,2018-03-10,5-23-19,2019-05-23,50.1169,-122.94671,23667233,2688068
ab-29632192,3BR on Chateau Whistler Golf Course,Townhouse,Entire home/apt,11/20/18,2018-11-20,5-24-19,2019-05-24,50.1201,-122.93884,29632192,96453221
ab-29632307,Reno'd 2BR in Heart of Village w/Private Hot-Tub,Condominium,Entire home/apt,11/20/18,2018-11-20,5-21-19,2019-05-21,50.11417,-122.95746,29632307,96453221
ab-22869024,Emerald Estates Mountain Getaway Suite,Guest suite,Entire home/apt,2/7/18,2018-02-07,4-26-19,2019-04-26,50.15958,-122.93424,22869024,169197402
ab-22870105,1 Bedroom at the Cascade Lodge Whistler Village,Serviced apartment,Entire home/apt,2/9/18,2018-02-09,7-31-18,2018-07-31,50.11584753,-122.9590727,22870105,26902942
ab-27754886,Whistler Sundance WM Luxurious 2BR PLUS for 8,Condominium,Entire home/apt,8/15/18,2018-08-15,5-24-19,2019-05-24,50.09182,-122.99546,27754886,3334196
ab-27755286,Whistler Sundance WM Luxurious 2BR loft for 8,Condominium,Entire home/apt,8/15/18,2018-08-15,5-24-19,2019-05-24,50.09233,-122.99408,27755286,3334196
ab-23668205,2Bd 2ba Condo great location Whistler/Blackcomb!,Condominium,Entire home/apt,3/10/18,2018-03-10,5-22-19,2019-05-22,50.11864,-122.94685,23668205,14250784
ab-26139188,Whistler Shared Retreat  3,Townhouse,Private room,6/21/18,2018-06-21,9-16-18,2018-09-16,50.11802638,-122.9617193,26139188,2005783
ab-23669177,Loft: Centre of Village w/ Sauna & Mountains Views,Apartment,Entire home/apt,10/8/18,2018-10-08,5-24-19,2019-05-24,50.11406,-122.95713,23669177,6641619
ab-29632601,"Bright, 2BR + Private Hot-Tub in Whistler VIllage",Condominium,Entire home/apt,11/20/18,2018-11-20,5-23-19,2019-05-23,50.11417,-122.95745,29632601,96453221
ab-28600055,"Mountainside Lodge: 1-BR Loft, Kitchen, Sleeps 6",Condominium,Entire home/apt,10/1/18,2018-10-01,5-24-19,2019-05-24,50.11534,-122.95446,28600055,27042710
ab-26153430,Spacious & Sunny. Whistler's Best Summer Location,Condominium,Entire home/apt,6/21/18,2018-06-21,5-24-19,2019-05-24,50.12068,-122.96065,26153430,92691614
ab-29635993,Whistler 3 Bedroom Log Home,Chalet,Entire home/apt,11/14/18,2018-11-14,5-21-19,2019-05-21,50.14737,-122.96534,29635993,36240239
ab-27759276,Zen Mountain Getaway in Whistler,Condominium,Entire home/apt,8/18/18,2018-08-18,5-23-19,2019-05-23,50.11591,-122.9585,27759276,136645242
ab-26159944,Cozy and rustic village location! Walk easily to lifts and everything Whistler has to offer!,Condominium,Entire home/apt,6/22/18,2018-06-22,5-22-19,2019-05-22,50.11802,-122.95428,26159944,196624542
ab-26159948,Full RENOVATION July 2017- Beautiful modern townhouse plus PRIVATE HOT TUB; BE THE FIRST TO SEE,Townhouse,Entire home/apt,6/21/18,2018-06-21,4-4-19,2019-04-04,50.11969,-122.95859,26159948,196624542
ab-26159949,TOP FLOOR with MOUNTAIN Views; HEART of Whistler! Great Value + Location,Condominium,Entire home/apt,6/22/18,2018-06-22,5-22-19,2019-05-22,50.11712,-122.95615,26159949,196624542
ab-26159951,TOP FLOOR at Base of BLACKCOMB with LOFT Bedroom; Superb Location,Condominium,Entire home/apt,6/20/18,2018-06-20,5-24-19,2019-05-24,50.1165,-122.94714,26159951,196624542
ab-26159953,Newly UPDATED TOP FLOOR with LOFT - Base of BLACKCOMB Mountain; SUPERB Location,Condominium,Entire home/apt,6/20/18,2018-06-20,5-22-19,2019-05-22,50.11804,-122.9463,26159953,196624542
ab-26159954,BRAND new  RENO throughout completing  DECEMBER 2018 Family size Condo at base of BLACKCOMB;,Condominium,Entire home/apt,6/20/18,2018-06-20,5-24-19,2019-05-24,50.11776,-122.94711,26159954,196624542
ab-26159956,Perfect VILLAGE Location! Best Value + Steps away from everything you need,Condominium,Entire home/apt,6/22/18,2018-06-22,5-22-19,2019-05-22,50.11849,-122.95511,26159956,196624542
ab-26159957,Heart of Whistler! Cozy winter getaway within walking distance to lifts and everything in between!,Condominium,Entire home/apt,6/22/18,2018-06-22,5-22-19,2019-05-22,50.118,-122.95515,26159957,196624542
ab-26159958,"SUPERB Location in MARKETPLACE,WHISTLER VILLAGE. FULLY RENOVATED UNIT;Great Value",Condominium,Entire home/apt,6/21/18,2018-06-21,5-22-19,2019-05-22,50.12023,-122.95768,26159958,196624542
ab-26159959,BRAND NEW RENO  Dec 2018 VILLAGE NORTH. Private + Cozy Unit steps away from EVERYTHING you need.,Townhouse,Entire home/apt,6/20/18,2018-06-20,5-23-19,2019-05-23,50.12183,-122.95684,26159959,196624542
ab-26159960,UPPER FLOOR + CORNER UNIT Townhome with PRIVATE HOT TUB; North Village Location,Townhouse,Entire home/apt,6/21/18,2018-06-21,9-2-18,2018-09-02,50.12093736,-122.9573652,26159960,196624542
ab-26159962,"FAMILY SIZE Garden Terrance Condo, Updated and located in BEAUTIFUL Blueberry Hills",Condominium,Entire home/apt,6/21/18,2018-06-21,5-22-19,2019-05-22,50.11361,-122.97063,26159962,196624542
ab-26159964,"Double unit, EXECUTIVE HOTEL suite plus adjoining STUDIO SUITE at the base of BLACKCOMB.",Condominium,Entire home/apt,6/22/18,2018-06-22,8-31-18,2018-08-31,50.11840131,-122.9477094,26159964,196624542
ab-26159966,Heart of the village + easy walk to lifts! Mountain-chic Bear Lodge condo,Condominium,Entire home/apt,6/22/18,2018-06-22,5-22-19,2019-05-22,50.11746,-122.95419,26159966,196624542
ab-26159968,Glacier Lodge Studio Suite that sleeps 3,Condominium,Entire home/apt,6/20/18,2018-06-20,9-2-18,2018-09-02,50.11687346,-122.9456652,26159968,196624542
ab-26159969,NEW LISTING : Beautiful Hotel Room suite at Glacier Lodge,Apartment,Entire home/apt,6/22/18,2018-06-22,8-31-18,2018-08-31,50.11796596,-122.9476615,26159969,196624542
ab-26159970,MOUNTAIN VIEWS in SPACIOUS Family Home with PRIVATE HOT TUB. SKI IN/SKI OUT,Townhouse,Entire home/apt,6/20/18,2018-06-20,5-21-19,2019-05-21,50.11516,-122.94025,26159970,196624542
ab-26159971,Fully REMODELED top Floor unit with LOFT- Base of BLACKCOMB MOUNTAIN,Condominium,Entire home/apt,6/22/18,2018-06-22,5-23-19,2019-05-23,50.11694,-122.94849,26159971,196624542
ab-26159975,Family sized Townhome! BEAUTIFUL Mountain Views,Townhouse,Entire home/apt,6/21/18,2018-06-21,5-21-19,2019-05-21,50.1122,-122.96942,26159975,196624542
ab-26159976,Fully RENOVATED 5 Star Accommodations. Beautiful + Spacious; Superb Location. Central AC just added!,Condominium,Entire home/apt,6/20/18,2018-06-20,5-22-19,2019-05-22,50.11597,-122.94644,26159976,196624542
ab-26159977,Beautiful MOUNTAIN Side Property. SKI IN/SKI OUT Condo. Perfect Whistler Getaway,Condominium,Entire home/apt,6/20/18,2018-06-20,5-21-19,2019-05-21,50.11712,-122.94094,26159977,196624542
ab-26159978,BEAUTIFUL Family sized Townhome! Newly Furnished + MOUNTAIN Views,Townhouse,Entire home/apt,6/21/18,2018-06-21,8-31-18,2018-08-31,50.11368994,-122.9679726,26159978,196624542
ab-26159980,Spacious + Bright Townhome. NEWLY Furnished + Renovated; Perfect for Winter or Summer,Townhouse,Entire home/apt,6/20/18,2018-06-20,5-22-19,2019-05-22,50.12235,-122.93524,26159980,196624542
ab-26159983,Beautiful Spacious Family Town home. NEWLY FURNISHED + UPDATED with CHRISTMAS CHARM THROUGHOUT,Townhouse,Entire home/apt,6/21/18,2018-06-21,5-21-19,2019-05-21,50.12017,-122.96057,26159983,196624542
ab-26159986,Cozy Whistler getaway home with courtyard views + a pool! Heated outdoor pool and hot tub,Condominium,Entire home/apt,6/21/18,2018-06-21,5-21-19,2019-05-21,50.09518,-122.99072,26159986,196624542
ab-24490835,"Delux Whistler Village, Mountainside Suite",Condominium,Entire home/apt,4/18/18,2018-04-18,5-21-19,2019-05-21,50.1135,-122.9535,24490835,9188291
ab-26159987,Beautiful ski in/ski out property with mountain views! Cozy winter escape,Condominium,Entire home/apt,6/20/18,2018-06-20,5-23-19,2019-05-23,50.11542,-122.94572,26159987,196624542
ab-26159988,CORNER UNIT across the street from the Village; Heated Pool + Hot Tub! Great Family Spot,Townhouse,Entire home/apt,6/21/18,2018-06-21,8-31-18,2018-08-31,50.11919463,-122.9588236,26159988,196624542
ab-26159990,BASE of BLACKCOMB! Updated Furnishing;Rustic Mountain Charm. Perfect Whistler Getaway!,Condominium,Entire home/apt,6/20/18,2018-06-20,5-22-19,2019-05-22,50.1162,-122.94639,26159990,196624542
ab-26159991,JUST re painted...SPACIOUS + BRIGHT unit. PERFECT for a Whistler Getaway; SKI IN/SKI OUT,Townhouse,Entire home/apt,6/20/18,2018-06-20,5-20-19,2019-05-20,50.11454,-122.94148,26159991,196624542
ab-26159992,Renovated and updated VILLAGE Location;steps away to ANYTHING you need,Condominium,Entire home/apt,6/20/18,2018-06-20,5-22-19,2019-05-22,50.11378,-122.95759,26159992,196624542
ab-26159993,Beautiful + Charming SKI IN/SKI OUT. Private carport + Quiet Location,Townhouse,Entire home/apt,6/20/18,2018-06-20,5-23-19,2019-05-23,50.11639,-122.94314,26159993,196624542
ab-26159996,PENTHOUSE SUITE with LOFT. Mountain Side Property with SKI IN/SKI OUT Convienence,Condominium,Entire home/apt,6/20/18,2018-06-20,5-23-19,2019-05-23,50.11618,-122.94257,26159996,196624542
ab-26160000,Located in the HEART OF WHISTLER. Spacious Condo with Village Stroll + MOUNTAIN Views,Condominium,Entire home/apt,6/22/18,2018-06-22,5-22-19,2019-05-22,50.1178,-122.95591,26160000,196624542
ab-26160001,CHARMING CREEKSIDE CONDO; Rustic Mountain Charm open concept close to LIFTS!,Condominium,Entire home/apt,6/21/18,2018-06-21,5-22-19,2019-05-22,50.09444,-122.99438,26160001,196624542
ab-26160003,"CREEKSIDE LOCATION; easy WALK to the Gondola. Charming townhouse with private entrance, deck and BBQ",Townhouse,Entire home/apt,6/21/18,2018-06-21,5-20-19,2019-05-20,50.09372,-122.99364,26160003,196624542
ab-26160004,Amazing MOUNTAIN View & SKI IN/SKI OUT location. Perfect FAMILY Sized Townhome,Townhouse,Entire home/apt,6/20/18,2018-06-20,5-23-19,2019-05-23,50.09409,-122.98062,26160004,196624542
ab-26160006,Charming and cozy Whistler Village studio in PERFECT location. Walking distance to lifts,Condominium,Entire home/apt,6/21/18,2018-06-21,5-24-19,2019-05-24,50.11728,-122.95855,26160006,196624542
ab-26160007,UPPER VILLAGE with HEATED floors. Perfect sized property for a Family!,Townhouse,Entire home/apt,6/20/18,2018-06-20,5-22-19,2019-05-22,50.12157,-122.94003,26160007,196624542
ab-26160010,Newly RENOVATED + UPDATED Townhome. True Mountain Retreat- QUIET + PRIVATE,Townhouse,Entire home/apt,6/20/18,2018-06-20,5-22-19,2019-05-22,50.12314,-122.93754,26160010,196624542
ab-26160013,UPPER VILLAGE NEWLY REMODELED June 2018 - Beautifully furnished spacious for the whole Family,Townhouse,Entire home/apt,6/20/18,2018-06-20,9-2-18,2018-09-02,50.11949125,-122.9391181,26160013,196624542
